खप्तड गोल्डकप : हिमालयन शेर्पा अन्तिम चारमा	काठमाडौं । सुरेश कुमाल र पिस्टन मुटाम्बाको गोलमा हिमालयन शेर्पाले सोमबार आयोजक सुदूरपश्चिम–११ स्पोर्ट्स क्लबलाई २–१ ले हराउँदै मुख्यमन्त्री सुदूरपश्चिम खप्तड गोल्डकपको सेमिफाइनलमा स्थान बनाउन सफल भ...	https://l.hamropatro.com/r/https://baahrakhari.com/news-details/343588	sports	L
नारी दिवसमा महिलाले झापा गोल्डकप नि:शुल्क हेर्न पाउने	नारी दिवसको अवसरमा पाँचौ झापा गोल्डकप अन्तर्गत मंगलबारको खेलमा नारीहरूले नि:शुल्क खेल हेर्न पाउने भएका छन् । आयोजकले सोमबार एक विज्ञप्ती जारी गर्दै ११२औं अन्तर्राष्ट्रिय श्रमिक महिला दिवसको अवसरमा ...	https://l.hamropatro.com/r/https://ratopati.com/story/225097/2022/3/7/jhapa-gold-cup	sports	L
हिमालयन शेर्पा खप्तड गोल्डकपको अन्तिम चारमा, साबिक विजेता सुदूरपश्चिम ११ पराजित	कैलालीः हिमालयन शेर्पा क्लब पाँचौँ खप्तड गोल्डकप फुटबल प्रतियोगिताको सेमिफाइनलमा प्रवेश गरेको छ। आयोजक तथा साबिक विजेता सुदूरपश्चिम ११ स्पोर्टस क्लबलाई २–१ गोल अन्तरले हराउँदै हिमालयन शेर्पा अन्तिम...	https://l.hamropatro.com/r/https://pahilopost.com/content/20220307201512.html	sports	L
धनगढी एफसीले नयाँ खेलाडी चयनका लागि ट्यालेन्ट हन्ट गर्ने	काठमाडौं । फ्रेन्चाइज फुटबल लिग नेपाल सुपर लिग (एनएसएल) क्लब धनगढी एफसीले नयाँ खेलाडीहरूको खोजीका लागि फागुन २५ गतेदेखि ट्यालेन्ट हन्ट आयोजना गर्ने भएको छ। धनगढी बोराडाँडीस्थित फाप्ला मैदानमा बिहान...	https://l.hamropatro.com/r/https://www.nepalviews.com/2022/03/07/45714/	sports	L
हिमालयन शेर्पा खप्तड गोल्ड कपकाे अन्तिम चारमा	काठमाण्डाै – शहीद स्मारक 'ए' डिभिजन क्लब हिमालयन शेर्पा पाँचौँ मुख्यमन्त्री सुदुरपश्चिम खप्तड गोल्ड कप फुटबल प्रतियोगिताको सेमिफाइनलमा प्रवेश गरेको छ । धनगढी रङ्गशालामा आज साेमवार भएको खेलमा आयोजक ...	https://l.hamropatro.com/r/https://ujyaaloonline.com/story/66147/2022/3/7/Himalayan-enter-in-a-semi-of-Khaptad-gold-cup	sports	L
झापा गोल्डकप : सातदोबाटो सेमिफाइनलमा 	विराटनगर । अन्तिम १० मिनेटमा भएको गोलमा सातदोबाटो युथ क्लबले सोमबार सशस्त्र प्रहरी बल (एपीएफ) क्लबलाई २–१ ले हराउँदै झापा गोल्डकपको सेमिफाइनलमा स्थान बनाउन सफल भएको छ ।  झापाको बिर्तामोडस्थित डोमा...	https://l.hamropatro.com/r/https://baahrakhari.com/news-details/343582	sports	L
अभ्यास खेलमा नेपालले श्रीलंका नेभीलाई १११ रनले हरायो	काठमाडौँ — अभ्यास खेलका लागि श्रीलंका भ्रमणमा रहेको नेपालले सोमबार श्रीलंका नेभीलाई १ सय ११ रनले पराजित गरेको छ ।  पहिलो अभ्यास खेलअन्तर्गत नेपालले प्रस्तुत गरेको २१५ रनको लक्ष्य पछ्याएको श्रीलंका...	https://l.hamropatro.com/r/https://ekantipur.com/sports/2022/03/07/164666103471693671.html	sports	L
मछिन्द्रका कप्तान सुजललाई पुत्रीलाभ	सोमबार, फागुन २३, २०७८ काठमाडौं (हाम्रो खेलकुद)– राष्ट्रिय फुटबल टोलीका सदस्य सुजल श्रेष्ठलाई पुत्रीलाभ भएको छ । मछिन्द्र फुटबल क्लबका कप्तान समेत रहेका सुजलकी श्रीमती सलिका चन्दले मेडिसिटी अस्पत...	https://l.hamropatro.com/r/https://www.hamrokhelkud.com/football/106411.html	sports	L
सातदोबाटो झापा गोल्डकपकाे सेमिफाइनलमा	सातदोवाटो युथ क्लब झापा गोल्डकप फुटबल प्रतियोगिताको सेमिफाइनलमा प्रवेश गरेको छ । सातदोबाटोले  एपीएफ क्लबलाई २-१ गोल अन्तरले पराजित गर्दै अन्तिम चारमा प्रवेश गरेको हो ।   वी डिभिजनबाट ए डिभिजनमा वढ...	https://l.hamropatro.com/r/https://www.neplays.com/archives/128437	sports	L
रोमाञ्चक जित निकाल्दै हिमालयन सेमिफाइनलमा	हिमालयन शेर्पा पाँचौँ संस्करणको मुख्यमन्त्री सुदूरपश्चिम खप्तड गोल्डकपको सेमिफाइनल प्रवेश गरेको छ । हिमालयनले धनगढी रंगशालामा सोमबार भएको खेलमा आयोजक तथा साविक विजेता सुदुरपश्चिम–११ लाई २–१ ले हरा...	https://l.hamropatro.com/r/https://farakdhar.com/story/77571	sports	L
एनएसएलका लागि धनगढीले ट्यालेन्ट हन्ट गर्ने	२३ फागुन, काठमाडौं । साविक उपविजेता धनगढी एफसीले दोस्रो संस्करणको नेपाल सुपर लिग (एनएसएल) फुटबलका लागि २५ फागुनमा ट्यालेन्ट हन्ट प्रतियोगिता आयोजना गरेको छ । नेपाल स्पोर्ट्स एण्ड इभेन्ट म्यानेजमेन...	https://l.hamropatro.com/r/https://www.onlinekhabar.com/2022/03/1090401	sports	L
झापा गोल्डकप : एपीएफलाई पराजित गर्दै सातदोबाटो सेमिफाइनलमा	ललितपुरे क्लब सातदोबाटो युथ, बिर्तामोडमा जारी पाँचौ संस्करणको झापा गोल्डकप फुटबलको सेमिफाइनलमा प्रवेश गरेको छ । पहिलो क्‍वार्टरफाइनलमा सोमबार सशस्त्र प्रहरीको एपीएफलाई २–१ गोल अन्तरले पराजित गर्दै...	https://l.hamropatro.com/r/https://kendrabindu.com/sports/86312-1646656657.html	sports	L
झापा गोल्डकपः सातदोबाटो सेमिफाइनलमा	विभागीय टोली एपिएफ फुटबल क्लबलाई हराउँदै सातदोबाटो युथ क्लब पाँचौँ संस्करणको झापा गोल्डकपको सेमिफाइनलमा प्रवेश गरेको छ । सातदोबाटोले सोमबारको खेलमा २–१ को रोमाञ्चक जित हात पारेको हो । सातदोबाटोको ...	https://l.hamropatro.com/r/https://farakdhar.com/story/77568	sports	L
स्याङ्जाको सिरुवारीमा पुरुष भलिबल प्रतियोगिता शुरू	दशौं शिरशुभा/गम्भीरसिंह गुरुङ स्मृति पुरुष भलिबल प्रतियोगिता सोमवारदेखि स्याङ्जाको सिरुवारीमा शुरू भएको छ । पहिलो दिन दरौ खोला युवा क्लब, आँधी खोला र राङ खोलाले विजयी शुरूआत गरे । दरौ खोलाले माझकट...	https://l.hamropatro.com/r/https://lokaantar.com/story/174831/2022/3/7/current-affairs/volleyball	sports	L
एपिएफलाई हराउँदै सातदोबाटो सेमिफाइनलमा	सातदोबाटो युथ क्लब झापामा जारी पाँचौं संस्करणको ‘झापा गोल्ड कप’ को सेमिफाइनलमा प्रवेश गरेको छ।  विभागीय टोली एपिएफ फुटबल क्लबलाई २–१ को गोल अन्तरले हराउँदै सातदोबाटो अन्तिम चारमा प्रवेश गरेको हो। ...	https://l.hamropatro.com/r/https://www.setopati.com/sports/football/264005	sports	L
सातदोबाटो झापा गोल्डकपको सेमिफाइनलमा	सातदोबाटो युथ क्लब पाँचौँ संस्करणको झापा गोल्ड कपको सेमिफाइनलमा प्रवेश गरेको छ। एपिएफ फुटबल क्लबलाई २–१  गोल अन्तरले पराजित गर्दै सातदोबाटोले सेमिफाइनलको यात्रा तय गरेको हो । बिर्तामोडस्थित डोमाला...	https://l.hamropatro.com/r/https://www.setopati.com/sports/football/264001	sports	L
शेर्पा खप्तड गोल्डकपको सेमिफाइनलमा	हिमालयन शेर्पा क्लव धनगढीमा जारी खप्तड गोल्डकपको सेमिफाइनलमा प्रवेश गरेको छ । घरेलुु टिम सुदुरपश्चिम ११ लाई दुई एकले हराउँदै शेर्पाले अन्तिम चारमा स्थान बनायो ।  धनगढी रंगशालामा घरेलु दशकमाझ सुदुर...	https://l.hamropatro.com/r/https://www.neplays.com/archives/128433	sports	L
राष्ट्रिय फेन्सिङ : नेपाली सेना टिम च्याम्पियन	नेपाली सेनाको त्रिभुवन आर्मी क्लब प्रथम बीर गणेशमान सिंह राष्ट्रिय फेन्सिङ प्रतियोगितामा टिम च्याम्पियन बन्न सफल भएको छ। सेनाले ६ स्वर्ण, २ रजत र ६ कास्य पदकका साथ टिम च्यामिपयन बनेको हो। दोश्रो ए...	https://l.hamropatro.com/r/https://www.setopati.com/sports/sports-activity/264000	sports	L
केल्मी एनएफजेएफ स्पाेर्ट्स अवार्डकाे सह-प्रायाेजक	एनएसजेएफ पल्सर स्पोर्ट्स अवार्डका लागि आयोजक नेपाल खेलकुद पत्रकार मञ्चले कामारु ट्रेडिङ प्रालिसँग सहप्रायोजन सम्झौतालाई निरन्तरता दिएको छ । सहप्रायोजनका लागि मञ्चका अध्यक्ष दुर्गानाथ सुवेदी (देवेन...	https://l.hamropatro.com/r/https://farakdhar.com/story/77562	sports	L
एनएसजेएफ अवार्डमा केल्मीको साथ निरन्तर	सोमबार, फागुन २३, २०७८ काठमाडौं (हाम्रो खेलकुद) – खेलकुद क्षेत्रको प्रतिष्ठित अवार्ड ‘एनएसजेएफ–पल्सर स्पोर्ट्स अवार्ड २०७७’ दशक अवार्डका लागि आयोजक नेपाल खेलकुद पत्रकार मञ्चले केल्मीसँग सहप्रायोजन...	https://l.hamropatro.com/r/https://www.hamrokhelkud.com/others/nsjf-pulsar-sports-award/106402.html	sports	L
गिरिजाप्रसाद कोइराला स्मृति हक्की प्रतियोगिता चैत ८ गतेदेखि	मोरङ– गिरिजाप्रसाद कोइराला स्मृति राष्ट्रिय पुरुष हक्की प्रतियोगिताको तेस्रो संस्करण विराटनगरमा हुने भएको छ। विराटनगरस्थित शहिद मैदानमा आउँदो चैत ८ गतेदेखि १२ गतेसम्म प्रतियोगिता आयोजना हुने प्रति...	https://l.hamropatro.com/r/https://deshsanchar.com/2022/03/07/621608/	sports	L
महिला लिग : अर्थोप्लास्ट र ललितपुरबीच सम्झौता	सोमबार, फागुन २३, २०७८ काठमाडौं (हाम्रो खेलकुद) – राष्ट्रिय महिला लिगका लागि ललितपुर महानगरपालिका महिला फुटबल टिम र अर्थोप्लास्ट रिह्याबिलिटेसन सेन्टरबीच सम्झौता भएको छ । ललितपुर उपमेयर कप राष्ट्...	https://l.hamropatro.com/r/https://www.hamrokhelkud.com/football/106398.html	sports	L
पहिलाे अभ्यास खेलमा नेपाल विजयी	श्रीलंका भ्रमणमा रहेको नेपाली क्रिकेट टाेलीले पहिलो एकदिवसीय अभ्यास खेलमा श्रीलंका नेभी स्पाेर्ट्स क्लबलाई  १११ रनले पराजित गरेको छ । २१५ रनको लक्ष्य पछ्याएकाे श्रीलंका नेभी २८.५ ओभरमा अलआउट हुँदै ...	https://l.hamropatro.com/r/https://farakdhar.com/story/77554	sports	L
नेपालले श्रीलङ्का नेभीलाई १ सय ११ रनले हरायाे	काठमाण्डाै – पहिलो अभ्यास खेलमा नेपाली राष्ट्रिय क्रिकेट टोलीले श्रीलङ्का नेभीलाई एक सय ११ रनले हराएको छ । कोलम्बोमा नेपालले दिएको दुई सय १५ रनको लक्ष्य पछ्याएको श्रीलङ्का नेभी २८ ओभर पाँच बलमा एक ...	https://l.hamropatro.com/r/https://ujyaaloonline.com/story/66134/2022/3/7/Nepal-beat-Sri-Lanka-Navy-by-111-runs	sports	L
नेपालले श्रीलंका नेभीलाई फराकिलो अन्तरले हरायो	न्युज अफ नेपाल, काठमाडौं । अभ्यासका लागि श्रीलंका भ्रमणमा रहेको नेपाली राष्ट्रिय क्रिकेट टोलीले पहिलो अभ्यास खेलमा श्रीलंका नेभीलाई १११ रनले पराजित गरेको छ । सोमबार नेपालले दिएको २१५ रनको लक्ष्य प...	https://l.hamropatro.com/r/https://www.newsofnepal.com/2022/03/07/479456/	sports	L
युक्रेन-रुस युद्धः चेचन्यादेखि एलेप्पो अनि युक्रेनसम्म प्रतिरोधको सामना गर्ने पुटिनको रणनीति	मैले यो लेखिरहँदा किएभको केन्द्र र यसका धेरै उपनगरहरू अछुतै छन्। साइरन र चेतावनीहरू भने बारम्बार आइरहन्छन्। यहाँका हरेक व्यक्तिलाई थाहा छ- यो अवस्थामा जुनसुकै बेला परिवर्तन हुनसक्छ। त्यस्तो परिवर्...	https://l.hamropatro.com/r/https://www.bbc.com/nepali/news-60643742?xtor=AL-73-[partner]-[hamro.patro]-[headline]-[nepali]-[bizdev]-[isapi]	popular	L
११ वर्षीय बालिकालाई पनि ‘विष’ खुवाएर किन गरे परिवारका सबै सदस्यले आत्महत्या प्रयास ?	काठमाडौं । ‘सुसाइड’ नोट लखेर आत्महत्याको प्रयास गर्ने काठमाडौंमा एकै परिवारका पाँचजनाबारे प्रहरी अनुसन्धान जारी छ । पाँचमध्ये एकजनाको मृत्यु भएको छ । चारजनाको अचेत अवस्थामा स्वयम्भूस्थित मनमोहन मेम...	https://l.hamropatro.com/r/https://baahrakhari.com/news-details/343622	popular	L
युक्रेन-रुस युद्धः रुसको चेतावनीअनुसार तेलको मूल्य कति पुग्न सक्छ	पश्चिमा देशहरूले रुसी तेलमाथि प्रतिबन्ध लगाए तेलको मूल्यमा व्यापक वृद्धि हुने मस्कोले चेतावनी दिएको छ। अन्तर्राष्ट्रिय बजारमा प्रतिब्यारल तेलको मूल्य तीन सय डलरसम्म पुग्न सक्ने उसको चेतावनी छ। प्...	https://l.hamropatro.com/r/https://www.bbc.com/nepali/news-60657087?xtor=AL-73-[partner]-[hamro.patro]-[headline]-[nepali]-[bizdev]-[isapi]	popular	L
ललितपुरमा एकै परिवारका ५ जनाको मृत्यु हुनुको कारण के हो ?	ललितपुरको कोन्ज्योसोम गाउँपालिका–४ स्थित नल्लुमा २ दिनअघि शिशुको जन्म भएपछि स्याङ्तान परिवारमा खुसी छाएको थियो तर त्यो खुसी लामो समयसम्म टिक्न सकेन । स्याङ्तान परिवारमा खुसी छर्ने शिशु र खुसी मनाउ...	https://l.hamropatro.com/r/https://lokaantar.com/story/174855/2022/3/8/press/death	popular	L
भक्तपुरमा अर्धनग्न अवस्थामा मृत भेटिएकी महिला गर्थिन् मजदुरी, पहिचान खुल्यो	काठमाडौं । भक्तपुरमा मृतावस्थामा फेलापरेकी महिलाको पहिचान खुलेको छ । गए राति चाँगुनारायण नगरपालिका–७, बागरेस्थित तरकारी खेती हुँदै आएको जग्गामा टिनको कच्ची टहराभित्र महिलाको शव फेलापरेको थियो । मृ...	https://l.hamropatro.com/r/https://baahrakhari.com/news-details/343624	popular	L
माओवादी केन्द्र र नेकपा (एकीकृत समाजवादी) ले मन्त्रीहरु परिवर्तन गर्दै, को-को हट्दैछन् ?	काठमाडौं, २४ फागुन । नेकपा (माओवादी केन्द्र) र नेकपा (एकीकृत समाजवादी) ले पार्टीबाट सरकारमा सहभागी केही मन्त्रीहरुलाई फिर्ता बोलाउने तयारी गरेका छन् । प्रधानमन्त्री शेरबहादुर देउवासँगको छलफल र सहमत...	https://l.hamropatro.com/r/https://www.reportersnepal.com/2022/03/657717	popular	L
युक्रेनले यी शर्त मानेमा रुसले तत्काल रोक्नेछ युद्ध	रुसले युद्ध रोक्नका लागि युक्रेनका अगाडि चारवटा शर्त राखेको छ ।  पहिलो, युक्रेनले तत्कालै सैन्य कारवाही रोक्नुपर्छ । दोस्रो, युक्रेनले संविधन संशोधन गरेर आफूलाई कुनै पनि गठबन्धनमा रहन दिनुहुँदैन ...	https://l.hamropatro.com/r/https://lokaantar.com/story/174915/2022/3/8/international/ukraine-invasion	popular	L
रुसले यसरी अप्ठ्यारोमा पारिरहेको छ युक्रेनी सेनालाई	युक्रेनमाथि रुसले आक्रमण गरेको १३औं दिनमा आइपुग्दा युक्रेनी सेनामाथि रुसी सेना हावी हुँदै गएको छ ।  डोनबास क्षेत्रको डोनेत्स्क र लुहान्स्कमा युक्रेनी सेनालाई रुसी सेनाले घेराबन्दी गरेर च्यापेको छ ...	https://l.hamropatro.com/r/https://lokaantar.com/story/174899/2022/3/8/international/russia-ukraine	popular	L
