युक्रेनसँग रुसका 'पूरा गर्नै नसकिने' माग, दुई देशबीच तेस्रो चरणको वार्ता हुँदै	मस्को । रुसी फौजले सोमबार आफूले युद्ध विराम गर्ने र मानवीय उद्धार मार्गहरू खोलिदिने बताउँदै युक्रेनका सहरहरूका आवासीय क्षेत्रहरूमा व्यापक बमबारी र रकेट प्रहार कार्यलाई निरन्तरता दिइरहेको छ । रुस र ...	https://l.hamropatro.com/r/https://baahrakhari.com/news-details/343602	popular	L
छोरी, ज्वाइँ अटाउँदा चित्रबहादुरहरु अटेनन्	२२ फागुन, काठमाडौं । नेकपा माओवादी केन्द्रको केन्द्रीय समितिको सोमबारको बैठकमा अध्यक्ष पुष्पकमल दाहाल प्रचण्डले केन्द्रीय सदस्यका लागि ९७ जनाको नाम प्रस्ताव गरे । उनले पढेको सूचीको ३२ औं नम्बरमा छो...	https://l.hamropatro.com/r/https://www.onlinekhabar.com/2022/03/1090467	popular	L
काठमाडौंको रामकोटमा एकै परिवारका ५ जना बेहोस भेटिए, एक जनाको मृत्यु	काठमाडौं : काठमाडौंको नागार्जुन नगरपालिकास्थित रामकोटमा एकै परिवारका ५ जना बेहोस अवस्थामा भेटिएका छन्। तीमध्ये एक जनाको मृत्यु भएको महानगरीय प्रहरी परिसर काठमाडौंका एसएसपी सुदिप गिरीले जानकारी दिए।...	https://l.hamropatro.com/r/https://annapurnapost.com/news/197940	popular	L
केन्द्रीय सदस्य चयनले माओवादीमा असन्तुष्टि, नेताहरुले छाड्न थाले पार्टी	अध्यक्ष पुष्पकमल दाहालले केन्द्रीय समितिमा गरेको मनोनयनलाई लिएर माओवादी केन्द्रमा तीव्र असन्तुष्टि देखिएको छ।  अध्यक्ष प्रचण्डले आफ्नो परिवारका सदस्य र निकटहरुलाई प्राथमकिता दिएर केन्द्रीय सदस्य  ...	https://l.hamropatro.com/r/https://nepalkhabar.com/politics/122920-2022-3-7-22-16-31	popular	L
प्रचण्डको पेलानमा केन्द्रीय सदस्य, एकलौटी निर्णयमा निरीह	नेकपा माओवादी केन्द्रमा अध्यक्ष पुष्पकमल दाहाल प्रचण्ड पार्टीमा कतिसम्म हावी छन् भन्ने दृष्टान्त सोमबार सम्पन्न केन्द्रीय समिति बैठकका निर्णयहरु हेरे पुग्छ । मूलतः एमसीसीबारे लिइएको निर्णयपछि पार्ट...	https://l.hamropatro.com/r/https://lokaantar.com/story/174851/2022/3/7/main-news/round-up-	popular	L
ललितपुरमा एकै परिवारका ५ जनाको मृत्यु हुनुको कारण के हो ?	ललितपुरको कोन्ज्योसोम गाउँपालिका–४ स्थित नल्लुमा २ दिनअघि शिशुको जन्म भएपछि स्याङ्तान परिवारमा खुसी छाएको थियो तर त्यो खुसी लामो समयसम्म टिक्न सकेन । स्याङ्तान परिवारमा खुसी छर्ने शिशु र खुसी मनाउ...	https://l.hamropatro.com/r/https://lokaantar.com/story/174855/2022/3/8/press/death	popular	L
फलफूल हाम्रो शरीरका लागि पौष्टिक तत्त्व, कुन समयमा के खाने ?	फलफूल हाम्रो शरीरका लागि पौष्टिक तत्त्वका गजब स्रोत हुन् । हामीले नियमित फलफूल खाने गर्नुपर्छ । फलफूल जतिखेर खाएपनि हुन्छ भन्ने हामीलाई लाग्छ र कुसमयमा खाँदा स्वास्थ्यलाई राम्रो गर्दैन । फलफूल खान...	https://l.hamropatro.com/r/https://lokaantar.com/story/121921/2022/3/7/lifestyle/fruit-time	popular	L
ललितपुर घटनाः २ दिनको बच्चा लिएर अस्पतालबाट फर्केकै रात परिवारै सखाप	ललितपुरको कोन्ज्योसोम गाउँपालिका ४ नल्लुको एउटा घरको ढोका बिहानको ७ बजेसम्म पनि खुलेन। यो टोलमा ५/६ वटा मात्रै घर छन्। काइँली स्याङ्तानको घर बन्द भएको सोमबार बिहान छिमेकीले देखे। दुई वटा झ्याल र ए...	https://l.hamropatro.com/r/https://nepalkhabar.com/society/122917-2022-3-7-21-50-31	popular	L
लन मस्कको चुनौती– टीभीमै रेडियोधर्मी विकीरण भएको स्थानको खाना खाइदिन्छु	न्युयोर्क । विश्वकै धनी अर्बपति एलन मस्कले युरोपलाई अहिले निष्क्रिय अवस्थामा रहेका आणविक ऊर्जा भट्टीहरू फेरि सञ्चालनमा ल्याएर थप ऊर्जा उत्पादन गर्न आह्वान गरेका छन् ।  यसबारे मानिसहरूले रेडियोधर्म...	https://l.hamropatro.com/r/https://baahrakhari.com/news-details/343598	popular	L
काठमाडौंमा एकैपरिवारका पाँच जना बेहोस अवस्थामा भेटिए, एकको मृत्यु	२३ फागुन, काठमाडौं । काठमाडौंको नागर्जुन नगरपालिका–६, रामकोटमा एकै परिवारका ५ जना बेहोस अवस्थामा फेला परेका छन् । तीमध्ये एक जनाको मृत्यु भएको पुष्टि भएको महानगरीय प्रहरी परिसर, काठमाडौंका प्रमुख ...	https://l.hamropatro.com/r/https://www.onlinekhabar.com/2022/03/1090475	popular	L
फरक मत राख्‍ने श्रेष्ठ र पोखरेल बने इन्चार्ज (सूचीसहित)	काठमाडौं: नेकपा माओवादी केन्द्रले स्थानीय निर्वाचन लक्षित गरेर चुनावी कमाण्डर तोकेको छ। काठमाडौंको राष्ट्रिय सभा गृहमा बसेको केन्द्रीय कमिटी बैठकले प्रदेशसहित विशेष क्षेत्रमा कमान्डर तोकेको हो। ब...	https://l.hamropatro.com/r/https://annapurnapost.com/news/197928	popular	L
बैंक खाता खोल्नासाथ एनआईसी एसियामा ८४ लाखको बीमा, १ खाताले ४ जनालाई सुविधा	सामान्यतया बैंकहरूमा खाता खोलेपछि बैंकहरूले खातावालालाई मात्र बीमा फाइदा उपलब्ध गराउछन् भन्ने आम सर्वसाधारणको बुझाइ छ।  तर, सर्वसाधारणको त्यो बुझाइलाई एनआईसी एसियाले गलत प्रमाणित गर्दै आफ्नो बैंकम...	https://l.hamropatro.com/r/https://nepalkhabar.com/bank-finance/122886-2022-3-7-21-38-59	popular	L
चीनले भन्यो– रुससँगको मित्रता चट्टानजस्तै बलियो छ 	बेइजिङ । चीनले रुससँगको आफ्नो सम्बन्ध चट्टानजस्तै बलियो अवस्थामा रहेको बताएको छ । चिनियाँ विदेशमन्त्री वाङ यीले आफूहरूबीच सहकार्यको सम्भावना पनि विस्तृत रहेको बताएका छन् ।  दुई देशबीचको सहकार्य दु...	https://l.hamropatro.com/r/https://baahrakhari.com/news-details/343596	popular	L
'विवाह गर्छु' भनी नाबालिकलाई करणी गरेको लागेका चिनियाँ नागरिक पुर्पक्षका लागि थुनामा	पोखरा । नाबालिकलाई जबरजस्ती करणी गरेको आरोपमा एजना चिनियाँ नागरिकलाई जिल्ला अदालत कास्कीले पुर्पक्षका लागि थुनामा पठाएको छ । ३३ वर्षका चिनियाँ नागरिक ली झियुआनले विवाह गर्छु भनी १८ वर्षीय नाबालिकल...	https://l.hamropatro.com/r/https://baahrakhari.com/news-details/343595	popular	L
कांग्रेस महामन्त्रीद्वयको भूमिका किन फरक ?	फागुन २३, काठमाण्डौ । नेपाली कांग्रेसका महामन्त्री गगन थापा र विश्वप्रकाश शर्मामा धेरै समानता छन् । प्रस्ट विचार राख्न सक्ने कौशल छ, वाककलामा निपूर्ण छन् । थापा र शर्मा १४ औँ महाधिवेशनबाट समान कार्...	https://l.hamropatro.com/r/https://www.reportersnepal.com/2022/03/657290	popular	L
यसरी बन्छ पर्फ्युम, ह्वेलको बान्तादेखि भेडाको रौंसम्म प्रयोग !	काठमाडौं — पर्फ्युम बनाउनका लागि फूल वा सुगन्धित बोटबिरुवाहरूको मात्र प्रयोग हुन्छ भन्ने ठान्नुहुन्छ भने तपाईं गलत हुनुहुन्छ । तपाईंलाई छक्क लाग्ला तर आकर्षक पर्फ्युमका लागि अचम्मका कुराहरू प्रयोग ...	https://l.hamropatro.com/r/https://lokaantar.com/story/40268/2022/3/7/lifestyle/health-tips-	popular	L
रामवृक्ष यादवको शालिकबारे यस्तो छ माओवादीको निर्णय	नेकपा माओवादी केन्द्रले रामवृक्ष यादवको शालिकसम्बन्धी विवादमा निर्णय गरेको छ । सोमबार सम्पन्न माओवादीको केन्द्रीय समिति बैठकले यसअघि यादवको शालिक भएको स्थानमै सहिद पार्क बनाएर उनको शालिक स्थापना गर...	https://l.hamropatro.com/r/https://ratopati.com/story/225125/2022/3/7/maoist	popular	L
नागार्जुनको रामकोटमा एकै परिवारका पाँचमध्ये एक मृत फेला, चार गम्भीर	काठमाडौंको नागार्जुन नगरपालिका-६ नम्बर रामकोट डाँडापौवाको एक घरमा एक जना व्यक्ति मृत फेला परेका छन्। त्यो घरका अन्य चार जना गम्भीर अवस्थामा फेला परेका छन्। प्रहरीका अनुसार सोमबार राति सो घरमा रहे...	https://l.hamropatro.com/r/https://www.setopati.com/social/264021	popular	L
केन्द्रीय नेताकै विरोधपछि प्रचण्ड छोरी-ज्वाइँको नाम सूचीबाट काटियो	काठमाडौं: नेकपा माओवादी केन्द्रका अध्यक्ष पुष्पकमल दाहाल 'प्रचण्ड'ले सोमबार केन्द्रीय कमिटी बैठकमा ९७ जना केन्द्रीय सदस्यको सूची प्रस्ताव गरे। उक्त सूचीमा उनले आफ्नै छोरी र ज्वाइँको नामसमेत समावेश ...	https://l.hamropatro.com/r/https://annapurnapost.com/news/197934	popular	L
काठमाडौंको रामकोटमा एकै परिवारका ५ जना मृत फेला	काठमाडौंको नागार्जुन नगरपालिका स्थित रामकोटमा एकै परिवारका ५ जना मृत अवस्थामा भेटिएका छन् । परिवारका ५ जना मृत अवस्थामा भेटिएको महानगरीय प्रहरी परिसर काठमाडौंका एसएसपी सुदिप गिरीले रातोपाटीलाई बताए...	https://l.hamropatro.com/r/https://ratopati.com/story/225124/2022/3/7/death	popular	L
माधव नेपालको प्रतिवेदन- एमसीसी अनुमोदन नगरेको भए पार्टीको अस्तित्व समाप्त हुन्थ्यो	काठमाडौं- नेकपा (एकीकृत समाजवादी)को केन्द्रीय कमिटीको तेस्रो बैठक बुधबारदेखि सुरु हुँदैछ। बैठकमा अध्यक्ष माधवकुमार नेपालले राजनीतिक प्रतिवेदन पेस गर्दैछन्। सोमबार बसेको पार्टीको पोलिटब्यूरोको प्रथ...	https://l.hamropatro.com/r/https://nepallive.com/story/274768	popular	L
थप इन्धन किन्न नसक्ने अवस्थामा आयल निगम	अन्तर्राष्ट्रिय बजारमा कच्चा तेलको मूल्य नयाँ रेकर्ड कायम गरेर १ सय ३० डलर प्रतिब्यारल पुगेको छ। युक्रेन र रुसबीचको युद्धका कारण अन्तर्राष्ट्रिय बजारमा कच्चा तेलको मूल्य बढेर १४ वर्षयताकै उच्च बिन्...	https://l.hamropatro.com/r/https://ratopati.com/story/225130/2022/3/8/oil-corporation-	popular	L
प्रधानमन्त्रीलाई ब्रिफिङ : अर्थतन्त्र दबाबमा छ, आर्थिक वृद्धिको लक्ष्य भेटिन्न	२३ फागुन, काठमाडौं । अर्थतन्त्रका सूचकमा देखिएको शिथिलता कारण अर्थमन्त्री जनार्दन शर्मामाथि प्रश्न उठिरहेका बेला प्रधानमन्त्री शेरबहादुर देउवाले पनि चासो देखाएका छन् । उनले सोमबार बिहान बालुवाटारमा...	https://l.hamropatro.com/r/https://www.onlinekhabar.com/2022/03/1090466	popular	L
रुसले जारी गर्‍यो अमैत्रीपूर्ण देशहरूको सूची	रुसले अमैत्रीपूर्ण मुलुकहरूको सूची जारी गरेको छ ।  सूचीमा अमेरिका, युरोपेली संघका सदस्यहरू, बेलायत, युक्रेन र जापान लगायतका देश परेका छन् ।   	https://l.hamropatro.com/r/https://lokaantar.com/story/174816/2022/3/7/international/russian-list	popular	L
युक्रेन-रुस युद्धः रुसको चेतावनीअनुसार तेलको मूल्य कति पुग्न सक्छ	पश्चिमा देशहरूले रुसी तेलमाथि प्रतिबन्ध लगाए तेलको मूल्यमा व्यापक वृद्धि हुने मस्कोले चेतावनी दिएको छ। अन्तर्राष्ट्रिय बजारमा प्रतिब्यारल तेलको मूल्य तीन सय डलरसम्म पुग्न सक्ने उसको चेतावनी छ। प्...	https://l.hamropatro.com/r/https://www.bbc.com/nepali/news-60657087?xtor=AL-73-[partner]-[hamro.patro]-[headline]-[nepali]-[bizdev]-[isapi]	popular	L
युक्रेन युद्धको असर : तेलको भाउ १४ वर्षयताकै उच्च, प्रति ब्यारेल १३९ डलर पुग्यो	बीबीसी । तेलको भाउ २००८ पछिकै सबैभन्दा उच्च विन्दुमा पुगेको छ । अमेरिकासहित यसका मित्रराष्ट्रहरूले रुसी आपूर्तिमा प्रतिबन्ध लगाउनेबारे छलफल गरेसँगै तेलको मूल्य १४ वर्षकै उचाइमा पुगेको हो । त्यस्तै ...	https://l.hamropatro.com/r/https://baahrakhari.com/news-details/343597	popular	L
काठमाडौंको रामकोटमा एकै परिवारका ५ जनाद्वारा विष सेवन	काठमाडौंको रामकोटमा एकै परिवारका ५ जनाले विष सेवन गरेका छन् । नागार्जुन नगरपालिकास्थित रामकोटमा सोमबार साँझ एकै परिवारका ५ जनाले विष सेवन गरेको प्रहरीले जनाएको छ ।  उनीहरुको बिरामी अवस्थामा स्वयम्...	https://l.hamropatro.com/r/https://lokaantar.com/story/174850/2022/3/7/main-news/poison-	popular	L
अमेरिकी राष्ट्रपति बाइडेनले फ्रान्स, जर्मनी र बेलायतका नेतासँग छलफल गर्ने	अमेरिकाका राष्ट्रपति जो बाइडेनले प्रमुख तीन देशका नेताहरूसँग सोमबार छलफल गर्ने भएका छन् । उनले फ्रान्स, जर्मनी र बेलायतका शीर्ष नेताहरूसँग भिडियो कुराकानी गर्ने अमेरिकी राष्ट्रपतिको कार्यालय ह्वाइट...	https://l.hamropatro.com/r/https://ratopati.com/story/225106/2022/3/7/joe-biden	popular	L
बैंकमा निक्षेप संकलन बढ्यो, कर्जा प्रवाह सहज हुँदै	आर्थिक वर्ष शुरू भएयता लगातार रूपमा भइरहेको लगानीयोग्य पुँजीको अभाव अर्थात् तरलताको समस्या समाधान हुने संकेत देखिन थालेको छ । फागुनको तेस्रो हप्तामा आएर वाणिज्य बैंकहरूमा निक्षेप संकलन बढेपछि तरलत...	https://l.hamropatro.com/r/https://lokaantar.com/story/174853/2022/3/7/press/bank	popular	L
काठमाडौंमा ५ जनाद्वारा सामूहिक विष सेवन : १ जनाको मृत्यु, ४ जना बोल्न नसक्ने अवस्थामा	काठमाडौंको नागार्जुन नगरपालिका–६ डाडापौवामा ५ जनाले सामूहिक विष सेवन गरेका छन्, जसमध्ये १ जनाको मृत्यु भइसकेको छ । स्थानीय उद्धवराज पुरीको २ तल्ले पक्की घरको दोस्रो तलामा फ्ल्याट भाडामा लिई बस्ने ...	https://l.hamropatro.com/r/https://lokaantar.com/story/174863/2022/3/8/current-affairs/poison	popular	L
देउवाले चुनावी तालमेल गर्न नमाने प्रचण्डले के गर्लान् ?	काठमाडौं, २३ फागुन । नेकपा माओवादी केन्द्रका अध्यक्ष पुष्पकमल दाहाल प्रचण्ड चुनावमा पार्टीलाई एक्लै होम्ने पक्षमा छैनन् । उनले चुनावी तालमेलका लागि कार्यदल बनाउने निर्णय गराएबाट पनि यो प्रष्ट हुन्छ...	https://l.hamropatro.com/r/https://www.reportersnepal.com/2022/03/657270	popular	L
रुसमा टिकटकको सेवा खुम्चियो, नेटफ्लिक्स पूर्ण रूपमा बन्द	मस्को । रुसले युक्रेनमा आक्रमण गरेकै कारण विश्वकै लोकप्रिय भिडियो सेरिङ एप टिकटकले रुसमा आफ्नो सेवा कटौती गरेको छ । अर्को चर्चित स्ट्रिमिङ कम्पनी नेटफ्ल्क्सिले सेवा पूर्ण रूपमा बन्द गरेको छ । रुसल...	https://l.hamropatro.com/r/https://baahrakhari.com/news-details/343599	popular	L
