फेसबुकमा कुन कुन भिडिओ हेर्नुभयो ? यस्तो छ थाहा पाउने तरिका	काठमाडौं । सामाजिक सञ्जाल फेसबुकका अनेक फिचरमध्ये भिडिओ शेयरिङ पनि एक हो । यसको माध्यमबाट हामी फेसबुकमा भिडिओ अपलोड गर्न सक्छौं । हाल फेसबुकमा ६० मिनेटभन्दा छोटो भिडिओ मात्र अपलोड गर्न सकिन्छ । कह...	https://l.hamropatro.com/r/https://www.techpana.com/2022/120684/	technology	L
रुसमा टिकटक भिडिओ बनाउन र लाइभमा बस्न प्रतिबन्ध, नेटफ्लिक्स पनि नचल्ने	काठमाडौं । रुस-युक्रेन युद्धले सूचना प्रविधिको बजारमा पनि तरङ्ग आइरहेको छ । हालसम्मको अवस्थालाई हेर्ने हो भने नाम चलेका सामाजिक सञ्जाल र प्रविधि कम्पनीहरु रुसविरुद्ध उभिएका छन् । हालै भिडिओ शेयरिङ...	https://l.hamropatro.com/r/https://www.techpana.com/2022/120677/	technology	L
पठाउनेलाई थाहै नदिइकन यसरी पढ्नुस् ह्वाट्सएप मेसेज	संसारमा सर्वाधिक लोकप्रिय मेसेजिङ एपको रुपमा रहेको ह्वाट्सएपले प्रयोगकर्ताका लागि निरन्तर नयाँ नयाँ फिचरहरू थप गर्ने गर्दछ । तर ह्वाट्सएपमा पहिलेदेखि नै यस्ता कतिपय गज्जबका फिचर छन् जसका बारेमा निक...	https://l.hamropatro.com/r/https://www.onlinekhabar.com/2022/03/1090221	technology	L
नेपाली स्टार्टअप कम्पनी डकसुमोले जुटायो ४३ करोडको ‘सीड फण्ड’, सयौंलाई रोजगारी दिने	काठमाडौं । डकुमेन्ट एआई स्टार्टअप कम्पनी डकसुमोले सीड फण्ड (बीउ पूँजी) को रुपमा ३५ लाख डलर (करिब ४३ करोड १९ लाख लाख रुपैयाँ) जुटाएको छ । वित्तीय सेवा प्रदान गर्ने कम्पनीहरुको काममा अटोमेसनको सेवा ...	https://l.hamropatro.com/r/https://www.techpana.com/2022/120668/	technology	L
गण्डकी प्रदेशमा पनि इम्बोस्ड नम्बर प्लेट जडान सुरु	पोखरा । गण्डकी प्रदेशमा पनि सवारी साधानमा इम्बोस्ड नम्बर प्लेट जडानको काम सुरु भएको छ । सबै किसिमका सवारीसाधनमा इम्बोस्ड नम्बर प्लेट अनिवार्य गर्दै जाने योजनाअनुसार गण्डकीमा पनि यो प्रणाली कार्यान्...	https://l.hamropatro.com/r/https://www.techpana.com/2022/120664/	technology	L
वन प्लस नर्ड सीई २ फाइभजी नेपालमा सार्वजनिक	काठमाडौं । चिनियाँ मोबाइल कम्पनी वनप्लसले नेपाली बजारमा वनप्लसको नयाँ सिरिज सार्वजनिक गरेको छ । सामाजिक सञ्जाल फेसबुकबाट वनप्लसले वन प्लस नर्ड २ फाइभजी फोन नेपाली बजारमा सार्वजनिक भएको जानकारी दिए...	https://l.hamropatro.com/r/https://www.techpana.com/2022/120648/	technology	L
ओटीटी एपमाथि सरकारी अङ्कुश, अब १ करोड तिरेर लाइसेन्स लिनुपर्ने	काठमाडौं । सरकारले राष्ट्रिय प्रसारण नियमावली संशोधन गर्दै ओभर दि टप (ओटीटी) सेवालाई नियमनको दायरामा ल्याएको छ । यससँगै अब नेपालमा ओटीटी र भिडिओ अन डिमान्ड (भीओडी) सेवा सञ्चालनका लागि इजाजतपत्र लिन...	https://l.hamropatro.com/r/https://www.techpana.com/2022/120631/	technology	L
अब युट्युब च्यानल सञ्चालनका लागि इजाजत लिनुपर्ने, केके छ व्यवस्था ? 	काठमाडौँ / अब युट्युब च्यानल सञ्चालनका लागि इजाजत लिनुपर्ने भएको छ । सरकारले युट्युब च्यानल र इन्टरनेटको माध्यमबाट हुने अन्य प्रशारणका लागि इजाजतपत्र लिनुपर्ने व्यवस्था गरेको हो ।  सञ्चार तथा सूचन...	https://l.hamropatro.com/r/https://arthadabali.com/2022/03/07/21805	technology	L
एप्पलका कर्मचारीहरु किन लुकेर एन्ड्रोइड फोन चलाउँदै छन् ?	वासिङटन । आइफोन निर्माता कम्पनी एप्पल स्टोरका कर्मचारीहरुले आफ्ना ‘बोस’ बाट लुकेर कुरा गर्न एन्ड्रोइड फोनको प्रयोग गरिरहेका छन् । अमेरिकाभरका अधिकांश एप्पल स्टोरका कर्मचारीहरुले आफूहरुबीचको कुराकान...	https://l.hamropatro.com/r/https://baahrakhari.com/news-details/343489	technology	L
'युट्युब च्यानल'सहितका अनलाइन टीभी अब दर्ता हुनुपर्ने (नियमावलीसहित)	काठमाडौं । सरकारले अनलाइन टेलिभिजन (युट्युबसहितका डिजिटल माध्यम)बाट हुने प्रसारणका लागि इजाजतपत्र लिनुपर्ने व्यवस्था गरेको छ । सञ्चार तथा सूचना प्रविधि मन्त्रालयले राष्ट्रिय प्रसारण नियमावलीमा १९औँ...	https://l.hamropatro.com/r/https://baahrakhari.com/news-details/343481	technology	L
अनलाइन टिभीका लागि ५ लाख शुल्क राख्दै सरकारले ल्यायाे प्रशारण नियमावली	काठमाडौं- सरकारले अनलाइन टिभीले पनि इजाजतपत्र लिनुपर्ने गरी राष्ट्रिय प्रशारण नियमावलीमा संशोधन गरेको छ। सञ्चार तथा सूचना प्रविधि मन्त्रालयले राष्ट्रिय प्रसारण (एघारौं संसोधन) नियमावली २०७८ जारी ग...	https://l.hamropatro.com/r/https://nepallive.com/story/274667	technology	L
अब अनलाइन टिभीको इजाजत लिन पाँच लाख 	काठमाडौं, फागुन २२ : सरकारले इन्टरनेटमार्फत सञ्चालन हुने टेलिभिजन सेवा सञ्चालन गर्न इजाजतपत्र लिनुपर्ने व्यवस्था गरेको छ ।  सञ्चार तथा सूचना प्रविधि मन्त्रालयले राष्ट्रिय प्रशारण नियमावलीको एघारौं...	https://l.hamropatro.com/r/https://kathmandupress.com/news/59694	technology	L
अनलाईन टेलिभिजनसहित ओटीटी प्लेटफार्म नियमन गर्न कानूनी व्यवस्था , युट्युब पनि दर्ता हुनु पर्ने	फागुन २२, काठमाडौं । सरकारले  मिडिया/भिडियो स्ट्रिमिङ, भीओडी, अनलाइन टिभी,  सञ्चालन गर्न सूचना तथा प्रशारण विभागबाट अनुमति लिनुपर्ने कानूनी व्यवस्था गरेको छ । सरकारले राष्ट्रिय प्रसारण नियमावली २०...	https://l.hamropatro.com/r/https://abhiyandaily.com/newscategory-detail/404131	technology	L
अब 'युट्युब च्यानल' पनि दर्ता हुनुपर्ने (नियमावलीसहित)	काठमाण्डाै – सरकारले युट्युब च्यानलसहित इन्टरनेटको माध्यमबाट हुने प्रसारणका लागि इजाजतपत्र लिनुपर्ने गरी राष्ट्रिय प्रसारण नियमावलीमा संशोधन गरेको छ । सञ्चार तथा सूचना प्रविधि मन्त्रालयले राष्ट्रि...	https://l.hamropatro.com/r/https://ujyaaloonline.com/story/66094/2022/3/6/Youtube-channel-also-in-a-law-regulations	technology	L
नेटफ्लिक्स, अमेजन प्राइम जस्ता ओटीटी प्लेटफर्मले अब अनुमति लिनुपर्ने (नियमावलीसहित)	अब नेटफ्लिक्स, अमजेन प्राइम, सोनी लिभ, हट स्टार जस्ता ओभर दी टप (ओटीटी) प्लेटफर्मले नेपालमा सेवा सञ्चालन गर्न अनुमति लिनुपर्ने भएको छ । सञ्चार तथा सूचना प्रविधि मन्त्रालयले राष्ट्रिय प्रशारण नियमाव...	https://l.hamropatro.com/r/https://ictsamachar.com/news-details/10436/2022-03-06	technology	L
युट्युबमार्फत सामग्री प्रकाशन गर्न ५ लाख रुपैयाँ तिरेर दर्ता गर्नुपर्ने प्रावधान!	काठमाडौँ- युट्युब च्यानलसहित इन्टरनेटको माध्यमबाट हुने प्रशारणका लागि समेत इजाजतपत्र लिनुपर्ने व्यवस्था सरकारले गरेको छ। सञ्चार तथा सूचना प्रविधि मन्त्रालयले राष्ट्रिय प्रशारण नियमावलीमा एघारौं सं...	https://l.hamropatro.com/r/https://deshsanchar.com/2022/03/06/621393/	technology	L
अब अनलाइन टिभी संचालन गर्न अनुमति लिनुपर्ने, ५ लाख शुल्क	सरकारले इन्टरनेटमार्फत संचालन हुने अनलाइन टिभीले अनुमति लिनुपर्ने व्यवस्था गरेको छ।  सञ्चार तथा सूचना प्रविधि मन्त्रालयले राष्ट्रिय प्रशारण नियमावलीमा एघारौं संशोधन गर्दै यस्तो व्यवस्था गरेको हो। स...	https://l.hamropatro.com/r/https://nayapatrikadaily.com/feed-detail.php?nid=81946	technology	L
एमसीसीलाई बिगार्न हैन विकासमा जोड्न बहस गरौं – डीबी सुनार [भिडियोसहित]	म अर्थशास्त्रको विद्यार्थी त होइन । तर पनि कुनै पनि देशको विकास गर्नका लागि पुँजीको जोहो गर्न चार वटा पिल्लर आवश्यक छ भनिन्छ । एउटा आन्तरिक राजस्व, दोस्रो परम्परागत दातृ निकाय, तेस्रो निजीको पुँजी ...	https://l.hamropatro.com/r/https://hamrakura.com/news-details/118889/2022-03-08	economics	L
नियमित उडानपछि कोरिया जाने श्रमिक बढ्ने	रोजगार अनुमति प्रणाली (ईपीएस) अन्तर्गत माघको दोस्रो हप्ता रोकिएका सहित सोमबार १ सय ७४ नेपाली कोरिया प्रवेश गरेका छन् । पूर्वनिर्धारित उडान तालिका अनुसार २ सय ३६ नेपाली जाने गरी तयारी भए पनि कोरिया...	https://l.hamropatro.com/r/https://www.karobardaily.com/news/177151	economics	L
आज बैंक तथा वित्तिय संस्था र नेप्से बन्द	आज फागुन २४ गते मंगलबार बैकिङ सेवा बन्द हुने भएको छ। ११२ औं अन्तर्राष्ट्रिय महिला दिवसमा सार्वजनिक विदा भएकाले मंगलबार बैंक तथा वित्तीय संस्था बन्द रहने नेपाल राष्ट्र बैंकका प्रवक्ता गुणाकर भट्टले...	https://l.hamropatro.com/r/https://www.setopati.com/kinmel/banking/264029	economics	L
तरकारीमध्ये अदुवाको निर्यात सबैभन्दा धेरै, तर किसान पाउँदैनन् उचित मूल्य	काठमाडौं– नेपालमा उत्पादन हुने तरकारी वा तरकारीजन्य मसलामध्ये सबैभन्दा बढी अदुवाको निर्यात हुन्छ। तर, अदुवा किसानले उचित मूल्य पाउने गरेका छैनन्।  पछिल्लो साढे पाँच वर्षमा नेपालबाट दुई अर्ब ६४ करो...	https://l.hamropatro.com/r/https://nepallive.com/story/274367	economics	L
अर्थमन्त्री, योजना आयोगका उपाध्यक्ष र गभर्नरसँग प्रधानमन्त्रीको छलफल	प्रधानमन्त्री शेरबहादुर देउवाले मुलुकको अर्थतन्त्रका बारेमा अर्थमन्त्री जनार्दन शर्मा, राष्ट्रिय योजना आयोगका उपाध्यक्ष डा. विश्वनाथ पौडेल तथा नेपाल राष्ट्र बैंकका गभर्नर महाप्रसाद अधिकारीलगायतसँग ...	https://l.hamropatro.com/r/https://nayapatrikadaily.com/feed-detail.php?nid=82026	economics	L
घाटा न्यूनीकरण गर्दै निगम : पम्पको कमिसन घट्यो, कर्मचारीको पोसाक खर्च हट्यो	नेपाल आयल निगमले विश्व बजारमा मूल्य निरन्तर उकालो लागिरहेको पेट्रोलियम पदार्थ बिक्रीबाट बेहोरिरहेको घाटा न्यूनीकरण गर्ने नीति लिएको छ । पेट्रोलियम पदार्थ बिक्रीबाट हुने बढ्दो घाटा न्यूनीकरण गर्न नि...	https://l.hamropatro.com/r/https://ratopati.com/story/225139/2022/3/8/nepal-oil-corporation-	economics	L
आज कति पुग्यो डलरको भाउ ? हेर्नुहोस् विदेशी मुद्राको विनिमयदर	मंगलबार डलरको भाउ ११२ रुपैयाँ ८४ पैसा पुगेको छ । अघिल्लो दिन डलर खरिददर १२१ रुपैयाँ ५६ पैसा तथा विक्रीदर १२२ रुपैयाँ १६ पैसा थियो ।  आइतबार भने बढेर खरिददर ११२ रुपैयाँ ८४ पैसा र बिक्रीदर १२३ रुपैया...	https://l.hamropatro.com/r/https://ratopati.com/story/225136/2022/3/8/forex-	economics	L
कस्तो छ नेपाल एयरलाइन्सको साउदी उडान तयारी?	नेपाल वायुसेवा निगम (नेपाल एयरलाइन्स) ले साउदी अरेबियाका लागि नियमित उडान अनुमति पाएको छ। साउदीको जनरल अथोरिटी अफ सिभिल एभिएसन (जिएसिए) ले यही फागुन २२ गते निगमलाई औपचारिक रूपमा उडान अनुमति प्रदान ...	https://l.hamropatro.com/r/https://www.setopati.com/kinmel/others/264020	economics	L
आज अन्तर्राष्ट्रिय महिला दिवसको सार्वजनिक विदा, सेयर कारोबार पनि नहुने	आज मंगलबार सेयर कारोबार बन्द हुने भएको छ । अन्तर्राष्ट्रिय महिला दिवसको अवसरमा परेको सार्वजनिक विदाका कारण सेयर कारोबार नहुने भएको हो ।  फागुन २४ गते सार्वजनिक विदा दिने भनेर नेपाल राजपत्र खण्ड ६९०...	https://l.hamropatro.com/r/https://arthasansar.com/news/37391	economics	L
उकालो लाग्दै अमेरिकी डलर : यस्तो छ विदेशी मुद्राको विनिमय दर	काठमाडौँ – नेपाल राष्ट्र बैंकले मंगलबारका लागि विदेशी मुद्राको विनिमय दर तोकेको छ। विस्तारै अमेरिकी डलर उकालो लागेको छ । राष्ट्र बैठका अनुसार अमेरिकी एक डलरको खरिद दर १२२ रुपैयाँ ८४पैसा र बिक्रीदर ...	https://l.hamropatro.com/r/https://www.khabarhub.com/2022/08/358731/	economics	L
भाग्यमानी ७७ हजार ४ सयले सेयर पाउने, एकैदिनमा ७ अर्बले बढ्यो निक्षेप	आज फागुन २३ गते, साेमबार दिनभरका प्रमुख आर्थिक समाचारहरू तल उल्लेख गरिएकाे छ । १. हिमालयन रिइन्स्योरेन्सले कमायो १२ करोड ४७ लाख नाफा, २९ करोड ९९ लाख बिमा शुल्क आर्जन   हिमालयन रिइन्स्योरेन्स कम्प...	https://l.hamropatro.com/r/https://arthasansar.com/news/37380	economics	L
भीमदत्तमा खानेपानी आयोजनाका लागि ऋण लगानी सम्झौता	महेन्द्रनगर (अस) । कञ्चनपुरको भीमदत्त नगरपालिकामा बृहत् खानेपानी आयोजना निर्माण गरिने भएको छ । भीमदत्त नगरपालिका–६ र ७ का स्थानीय बासिन्दाका लागि ‘पूर्णागिरि शहरी खानेपानी उपभोक्ता तथा सरसफाइ आयोजन...	https://l.hamropatro.com/r/https://abhiyandaily.com/newscategory-detail/404203	economics	L
बहुक्षेत्रीय पोषण कार्यक्रममा ९१ लाख लगानी	पर्वत (अस) । संघीय मामिला तथा सामान्य प्रशासन मन्त्रालयको सहयोगमा पर्वत र म्याग्दीमा बहुक्षेत्रीय पोषण कार्यक्रम सञ्चालन हुने भएको छ । बहुक्षेत्रीय पोषणको आंशिक प्याकेज अन्तर्गत यी दुई जिल्लामा चाल...	https://l.hamropatro.com/r/https://abhiyandaily.com/newscategory-detail/404199	economics	L
चैत १ देखि मेलम्ची आयोजनाका सबै काम बन्द गर्ने चेतावनी	सिन्धुपाल्चोक (अस) । हेलम्बु–मेलम्ची बाढीपहिरो पीडितले आफ्ना ६ बुँदे माग एक साताभित्र सम्बोधन नगरे चैत १ गतेदेखि मेलम्ची खानेपानी आयोजनाका सबै काम बन्द गराउने चेतावनी दिएका छन् । सोमवार मेलम्ची खान...	https://l.hamropatro.com/r/https://abhiyandaily.com/newscategory-detail/404196	economics	L
बैंकमा निक्षेप संकलन बढ्यो, कर्जा प्रवाह सहज हुँदै	आर्थिक वर्ष शुरू भएयता लगातार रूपमा भइरहेको लगानीयोग्य पुँजीको अभाव अर्थात् तरलताको समस्या समाधान हुने संकेत देखिन थालेको छ । फागुनको तेस्रो हप्तामा आएर वाणिज्य बैंकहरूमा निक्षेप संकलन बढेपछि तरलत...	https://l.hamropatro.com/r/https://lokaantar.com/story/174853/2022/3/7/press/bank	economics	L
बोर्डलाई आफ्नो कार्यकालमा नयाँ उचाइमा पु-याउँछु: अध्यक्ष हमाल	काठमाडौं । नेपाल धितोपत्र बोर्डका अध्यक्ष रमेशकुमार हमालले बोर्ड नीति नियम कार्यान्वयनमा गम्भीर भएर लाग्ने बताएका छन् । यसअघि भएका कानुनसमेत कार्यान्वयन नहुँदा सेयर बजारमा एक किसिमको मनपरितन्त्र जस...	https://l.hamropatro.com/r/https://rajdhanidaily.com/id/57718/	economics	L
