गाडीमा प्रयोग हुने ‘एन्टी लक ब्रेकिङ सिस्टम’ प्रविधि के हो र यसले कसरी काम गर्छ ?	काठमाडौं । नेपालमा पनि पछिल्लो समय विद्युतीय कार प्रतिको आकर्षण बढ्दै गएको छ । महँगिँदै गएको पेट्रोलियम पदार्थमा हुने खर्च जोगाउन, कर छुट, बढ्दो ब्याट्री रेन्ज आदिका कारणले गर्दा अहिले पेट्रोल र डि...	https://l.hamropatro.com/r/https://www.techpana.com/2022/120450/	technology	L
टिकटकमा १० मिनेटको भिडियो बनाउन मिल्ने, युट्युबसँग प्रतिस्पर्धाको लक्ष्य	काठमाडौँ — टिकटकमा अब १० मिनेट लामो भिडियो अपलोड गर्न सकिने भएको छ । आफ्ना प्रयोगकर्तालाई सिर्जना र मनोरञ्जनमा थप समय प्रदान गर्न भिडियोको अवधि बढाइएको टिकटकले जनाएको छ । चिनियाँ टेक जायन्ट, टिकटक...	https://l.hamropatro.com/r/https://ekantipur.com/business/2022/03/03/16462800071166389.html	technology	L
नेपालका टप ५ अनलाइन गेमर, जसले युट्युबबाटै मासिक लाखौँ कमाउँछन्	काठमाडौं । अनलाइनका माध्यमहरू सूचना सञ्चारको माध्यम मात्र होइनन्, आम्दानीका स्रोत पनि हुन् । यो कुरा तपाईँले अहिलेको युवा पिँढीबाट देख्न सक्नुहुन्छ ।  पछिल्लो समय नेपालमा अनलाइन गेमको क्रेज निकै ब...	https://l.hamropatro.com/r/https://www.techpana.com/2022/120447/	technology	L
माईपे डिजिटल वालेट प्रयोग गर्दा एक लाखको दुर्घटना बीमा	काठमाडौं । डिजिटल वालेट कम्पनी माईपेले प्रयोगकर्ताका लागि आकर्षक अफर सार्वजनिक गरेको छ । कम्पनीले वालेट प्रयोग गर्ने प्रयोगकर्तालाई एक लाख रुपैयाँको दुर्घटना बीमा सुविधा दिने भएको हो ।   यो सुविधा...	https://l.hamropatro.com/r/https://www.techpana.com/2022/120444/	technology	L
भिसा र मास्टर कार्डबाट समेत अलग्गियो रुस	काठमाडौं । कार्ड भुक्तानी सेवा प्रदायक भिसा र मास्टरकार्डले रुसलाई आफ्नो नेटवर्कबाट हटाएका छन् । चीन बाहेक विश्वको ९० प्रतिशत डेबिट तथा क्रेडिट कार्डमा यिनै दुई नेटवर्क प्रयोग हुँदै आएका छन् । रुसम...	https://l.hamropatro.com/r/https://www.techpana.com/2022/120441/	technology	L
साना कम्पनी र स्टार्टअपलाई समेत शेयर बजार खुला गर्न अर्थमन्त्रीको निर्देशन	काठमाडौं । अर्थमन्त्री जनार्दन शर्माले साना कम्पनी तथा स्टार्टअपलाई समेत पूँजी बजारमा प्रवेश गर्ने बाटो खुला गर्न निर्देशन दिएका छन् । अर्थ मन्त्रालयले लगानीकर्ता समान स्तरका नहुने कुरा मध्यनजर गर्...	https://l.hamropatro.com/r/https://www.techpana.com/2022/120439/	technology	L
फेसबुकको नयाँ प्राइभेसी सेन्टर के हो र कसरी प्रयोग गर्ने ? 	काठमाडौं । वर्षौँदेखि फेसबुकले प्रयोगकर्ताको गोपनीयतालाई कम प्राथमिकता दिएको भन्दै ठूलाठूला समाचार हेडलाइन बनिरहे । त्यसैलाई सम्बोधन गर्न फेसबुकले प्रयोगकर्तासामू फेसबुकले प्राइभेसी पोलिसी प्रस्तुत...	https://l.hamropatro.com/r/https://www.techpana.com/2022/120437/	technology	L
काठमाडौंमा आएर पढ्ने विद्यार्थीलाई अनुदानमा इन्डक्सन चुलो बाँडिदै, यसरी दिनुहोस् आवेदन	काठमाडौं । सरकारले बाहिरी जिल्लाबाट आएर काठमाडौंमा अध्ययन गर्ने विद्यार्थीलाई विद्युतीय चुलो (इन्डक्सन चुलो) वितरण गर्ने भएको छ । ऊर्जा, जलस्रोत तथा सिंचाई मन्त्रालयले विद्यार्थीलाई स्तरीकरण गरेर न...	https://l.hamropatro.com/r/https://www.techpana.com/2022/120434/	technology	L
प्ले स्टोरबाट हट्यो एपहरू अपडेट भएको अन्तिम मिति हेर्ने सुविधा 	काठमाडौं । प्ले स्टोरमा रहेका एपहरूको विषयमा विस्तृत जानकारीमा प्रयोगकर्तालाई पहुँच दिने वा नदिने भन्ने विषयमा गुगल दुबिधामा रहेको संकेत प्राप्त भइरहन्छ । एकातर्फ कम्पनीले एन्ड्रोइड ओएसका लागि आवश्...	https://l.hamropatro.com/r/https://www.techpana.com/2022/120429/	technology	L
‘आइएमई पे’ बाट काट्दा यती एयरलाइन्सको टिकट निःशुल्क	‘आइएमई पे’ले यती एयरलाइन्ससँगको समन्वयमा नयाँ अफर ल्याएको छ । आइएमई पे एपका प्रयोगकर्ताले फागुन १२ देखि २ महिनासम्म एयरलाइन्सको टिकट आइएमई पे एपमार्फत खरिद गर्दा लक्की ड्रबाट नेपालका विभिन्न गन्तव्...	https://l.hamropatro.com/r/https://ratopati.com/story/224123/2022/3/2/ime-pay-yeti-airline-agreement	technology	L
‘Biggest green deal since Paris’: UN to approve plastic treaty roadmap	The United Nations is set to approve a plan to create the world’s first ever global plastic pollution treaty on Wednesday, describing it as the most significant green deal since the 2015 Paris clim...	https://l.hamropatro.com/r/https://kathmandupost.com/world/2022/03/02/biggest-green-deal-since-paris-un-to-approve-plastic-treaty-roadmap	technology	L
नयाँ स्मार्टफोन खरिद गर्दा फाइभजीलाई कत्तिको प्राथमिकतामा राख्ने ? थाहा पाइराख्नुहोस् यी कुरा	काठमाडौं । २०१७ को फेब्रुअरीमा बार्सिलोनामा भएको मोबाइल वर्ल्ड कङ्ग्रेसमा चिनिया कम्पनी जेडटीईले विश्वकै पहिलो फाइभजी स्मार्टफोन सार्वजनिक गरेको थियो । जसको नाम गिगाबाइट फोन राखिएको थियो । यो फोनक...	https://l.hamropatro.com/r/https://www.techpana.com/2022/120426/	technology	L
दराजले हरेक साता आईएमई पे डे मनाउने, अनलाइन किनमेलमा १० प्रतिशतसम्मको छुट पाइने	काठमाडौं । नेपालको सबैभन्दा ठूलो अनलाइन बजार दराजले हरेक आइतबार आईएमई पे डे सुरु गरेको छ । यससँगै प्रयोगकर्ताले आइएमई पे डिजिटल वालेटमार्फत दराजमा भुक्तानी गर्दा हरेक आइतबार १० प्रतिशत अर्थात् अधिक...	https://l.hamropatro.com/r/https://www.techpana.com/2022/120423/	technology	L
ब्रिटिश कलेजमा आयोजना हुने ‘हल्ट प्राइज’को तयारी सुरु	काठमाडौं । यस वर्षको ‘हल्ट प्राइज’ को नयाँ संस्करण ब्रिटिश कलेजमा आयोजना हुने भएको छ । जसका लागि तयारी सुरु भएको आयोजकले जनाएको छ । यो कार्यक्रम हल्ट इन्टरनेसनल बिजनेस स्कुल र संयुक्त राष्ट्रसंघले ...	https://l.hamropatro.com/r/https://www.onlinekhabar.com/2022/03/1087928	technology	L
अशनीर ग्रोभरमाथि भारतपेको पैसा हिनामिनाको आरोप, श्रीमति बर्खास्तीपछि दिए राजीनामा	काठमाडौं । भारतको लोकप्रिय डिजिटल वालेट भारतपेका सहसंस्थापक अशनीर ग्रोभर र उनको परिवारले कम्पनीको पैसा हिनामिना गरेको कुरा बाहिरिएको छ । बुधबार एक विज्ञप्ति जारी गर्दै भारतपेले कम्पनीको बोर्डले गरे...	https://l.hamropatro.com/r/https://www.techpana.com/2022/120420/	technology	L
आफ्नो फेसबुकको स्क्रिनशट कसैले लिन नसकोस् भन्ने चाहनुहुन्छ ? यसो गर्नुहोस्	काठमाडौं । तपाईँ हामी सधैँजसो सामाजिक सञ्जालमा सक्रिय भइरहेकै हुन्छौं । कतिपयका लागि त सामाजिक सञ्जाल बिहानीसँगै दिनको सुरुवात र राति सुत्नु अघिको नित्यकर्म नै बनिरहेको हुन्छ । हामीले चलाइरहेका सा...	https://l.hamropatro.com/r/https://www.techpana.com/2022/120415/	technology	L
तालिम लिन्छन्, उपयोग गर्दैनन्	अछाम — अछामको मंगलसेन नगरपालिका–५ का सिद्ध भाटले हाउस वायरिङसम्बन्धी तीनमहिने तालिम ६ वर्षअघि लिएका हुन् । त्यसपछि ३ महिनाकै कम्प्युटर मर्मतसम्बन्धी तालिम लिए । ससाना तालिमहरू पनि धेरै लिए । तर त्य...	https://l.hamropatro.com/r/https://ekantipur.com/pradesh-7/2022/03/02/164619738399053480.html	technology	L
पेट्रोलियम पदार्थमा उपभोक्तालाई थरी थरीका कर, के–मा कति ?	भारतीय आयल निगम (आईओसी)ले पेट्रोल प्रतिलिटर ९० रुपैयाँ ९४ पैसामा दिन्छ। तर, नेपाल आयल निगमले बिहीबार मध्यरातदेखि पुनः भाउ बढाएर १ सय ५० रुपैयाँ पुर्याएको छ। तापनि, निगम भन्छ, 'प्रतिलिटर १६ रुपैयाँ...	https://l.hamropatro.com/r/https://lokaantar.com/story/174416/2022/3/4/press/petrol-	economics	L
आगामी १५ दिनमा साढे दुई अर्ब घाटा हुने आयल नियमको प्रक्षेपण	काठमाडौं : पेट्रोलियम पदार्थको मूल्य बढे पनि आगामी १५ दिनमा करिब दुई अर्ब ५० करोड रुपैयाँ घाटा हुने निगमले प्रक्षेपण गरेको छ। चालू आर्थिक वर्षको फागुन महिनासम्म करिब २८ अर्ब रुपैयाँ नोक्सानी हुने अ...	https://l.hamropatro.com/r/https://thahakhabar.com/news/147237	economics	L
पर्यटक टहलिने फेवा किनारमा मिनी रेष्टुरेन्ट, महानगर चटपट व्यवसायी धपाउनै व्यस्त	पोखरा : फेवा किनारमा आउने पर्यटकलाई सहज बनाउन महानगरले फुटपाथ स्तरोन्नति गरेको थियो। अघिल्लो वर्षमात्र महानगरले हल्लनचोकदेखि खहरेबिचमा पर्ने फुटपाथको स्तरोन्नति गरेको हो। महानगरले ताल किनारको स्वर...	https://l.hamropatro.com/r/https://pahilopost.com/content/20220303140947.html	economics	L
योजना आयोगले तोक्यो आगामी आवको बजेट सिलिङ	राष्ट्रिय योजना आयोगले आगामी आर्थिक वर्ष २०७९-०८० का लागि बजेट सिलिङ निर्धारण गरेको छ । आयोगले बजेटको सिलिङ तोकेर अर्थ मन्त्रालयलाई पत्राचार गरेको हो । स्रोतका अनुसार योजना आयोगले १८ खर्बबराबरको ब...	https://l.hamropatro.com/r/https://www.karobardaily.com/news/176704	economics	L
दसैँ–तिहारमा दिने बिदा थपियो 	आगामी वर्षका लागि सरकारले नौ दिन चाडपर्व बिदा बढाएको छ । गृह मन्त्रालयको प्रस्तावअनुसार सोमबार बसेको मन्त्रिपरिषद् बैठकले ०७९ मा दसैँ–तिहारको बिदासमेत लम्ब्याएर नौ दिन बढाएको हो ।  आगामी वर्ष दसैँ...	https://l.hamropatro.com/r/https://nayapatrikadaily.com/feed-detail.php?nid=81760	economics	L
९३ रुपैयाँमा किनेको पेट्रोल १५० मा बेच्दा पनि १६ रुपैयाँ घाटा	काठमाडौँ — पेट्रोलियम पदार्थको मूल्य इतिहासकै उच्च भएको छ । नेपाल आयल निगमले बिहीबार राति १२ बजेदेखि लागू हुने गरी पेट्रोल, डिजेल र मट्टीतेलमा ५/५ रुपैयाँ बढाएको छ । अब पेट्रोल प्रतिलिटर १ सय ५०, ड...	https://l.hamropatro.com/r/https://ekantipur.com/business/2022/03/04/164635544044835925.html	economics	L
फेबु्रअरीमा २० हजार पर्यटक	सन् २०२२ को दोस्रो महिना फेब्रुअरीमा करिब २० हजार पर्यटकले नेपाल भ्रमण गरेका छन् । नेपाल पर्यटन बोर्डका अनुसार यस महिनामा हवाई मार्ग हुँदै १९ हजार ७ सय ६६ पर्यटक नेपाल भित्रिएका हुन् । फेब्रुअरीमा...	https://l.hamropatro.com/r/https://www.karobardaily.com/news/176698	economics	L
पेट्रोलको मूल्य १५० रुपैयाँ पुग्यो, डिजलको र मट्टितेलमा पनि ५ रुपैयाँ नै बढ्यो	आजदेखि पेट्रोलियम पदार्थ थप महँगो भएको छ  । नेपाल आयल निगम (एनओसी)ले  गएराति १२ बजेदेखि लागू हुने गरी पेट्रोलियम पदार्थको मूल्य बृद्धि गरेको हो । निगमले पेट्रोल, डिजेल र मट्टितेलमा प्रतिलिटर ५-५ रु...	https://l.hamropatro.com/r/https://lokaantar.com/story/174400/2022/3/4/consumers/petrol-	economics	L
विमानस्थल बन्ने हल्लाले जग्गाको मूल्य पाँच गुणाले वृद्धि, तर बनेन विमानस्थल	काभ्रे। बनेपाको नागीडाँडामा विमानस्थल निर्माणको अत्तोपत्तो नभए पनि  भएको छ । त्रिभुवन अन्तर्राष्ट्रिय विमानस्थलको आन्तरिक विमानस्थलमा चाप बढेपछि काभ्रेको बनेपा नगरपालिका–११ स्थित नागीडाँडामा विमानस...	https://l.hamropatro.com/r/https://www.news24nepal.tv/2022/03/04/861010	economics	L
विद्यार्थी विदेशिँदा अर्थतन्त्रमा परेको प्रभाव	वर्षेनि ठूलो संख्यामा युवाहरू उच्च शिक्षाका लागि विदेशिने गरेको पाइन्छ । खासगरी स्वदेशमा रोजगारी नभएका कारण उनीहरू विदेशिनु परेको मात्र छैन, उच्च शिक्षा अध्ययनका लागि पनि उनीहरू विदेशिने क्रम बढ्दो...	https://l.hamropatro.com/r/https://abhiyandaily.com/newscategory-detail/404030	economics	L
बजेटका लागि निजीक्षेत्रको सुझाव बुझ्दै अर्थ मन्त्रालय	वीरगञ्ज । सरकार आगामी आर्थिक वर्ष (आव) २०७९/८० को बजेटको तयारीमा जुटेको छ । अर्थ मन्त्रालयले बजेटबारे निजीक्षेत्रका राय सुझाव संकलन तीव्र पारेको छ । अर्थ मन्त्रालय अन्तर्गतको राजस्व परामर्श समितिल...	https://l.hamropatro.com/r/https://abhiyandaily.com/newscategory-detail/404021	economics	L
यसरी बन्दैछ बञ्चरेडाँडामा अवस्थित ल्याण्डफिल साडट (फोटो फिचर)	काठमाडौं: धादिङ र नुवाकोटको सीमाना बञ्चरेडाँडामा निर्माण भइरहेको ल्याण्डफिल साडटको निर्माण अन्तिम चरणमा पुगेको छ। सहरी विकास मन्त्रालयले एक महिनभित्रै ल्याण्डफिल साइट सञ्चाल गर्ने तयारी गरेको छ। स...	https://l.hamropatro.com/r/https://annapurnapost.com/news/197642	economics	L
आर्थिक वर्ष २०७९/८० मा शिक्षा बजेट बढाउने प्रधानमन्त्रीकाे आश्वासन	काठमाडौँ–  शिक्षा, विज्ञान तथा प्रविधिमन्त्री देवेन्द्र पौडेल शिक्षा क्षेत्रको बजेट बढाउने लविङमा लागेका छन्  ।	https://l.hamropatro.com/r/https://www.khabarhub.com/2022/03/356864/	economics	L
पेट्रोल र डिजेलको मूल्य प्रतिलिटर ५–५ रुपैयाँ वृद्धि, निगम कर्मचारीको लुगा धुने भत्ता खारेज, व्यवसायीको कमिसन पनि कटौती	अन्तर्राष्ट्रिय बजारमा बढ्दै गएको कच्चा तेलको मूल्यलाई कारण देखाउँदै नेपाल आयल निगम लिमिटेडले नेपाली बजारमा पनि पेट्रोलियम पदार्थको मूल्यवृद्धि गरेको छ । निगमले पेट्रोल, डिजेल र मट्टितेलमा समान ५–५...	https://l.hamropatro.com/r/https://nayapatrikadaily.com/feed-detail.php?nid=81759	economics	L
फेरि बढ्यो पेट्रोलियम पदार्थको मूल्य (कसको कति ?)	काठमाडौं, १९ फागुन । पेट्रोलियम पदार्थको मूल्य फेरि बढेको छ। आज (बिहीबार) बसेको नेपाल आयल निगम सञ्चालक समितिको बैठकले डिजल, पेट्रोल र मट्टितेलको मूल्य प्रतिलिटर ५ रुपैयाँले बढाएको छ । अन्तर्राष्ट्...	https://l.hamropatro.com/r/https://www.reportersnepal.com/2022/03/655795	economics	L
१५० पुग्यो पेट्रोलको भाउ, डिजेल र मट्टीतेलको प्रतिलिटर १३३	काठमाडौं : नेपाल आयल निगमले पेट्रोलको मूल्य बढाएको छ। निगमले आज (बिहीबार) मध्यरातदेखि लागू हुने गरी पेट्रोल, डिजेल र मट्टितेलको मूल्य बढाएको छ।  निगमले जारी गरेको नयाँ मूल्य सूचीअनुसार पेट्रोलको म...	https://l.hamropatro.com/r/https://thahakhabar.com/news/147235	economics	L
