पाकिस्तानमा झण्डै १५ लाख ११ हजारमा कोरोना पुष्टि हुँदा १४ लाख ४५ हजार बढि संक्रमणमुक्त, मृत्यु कति ?	0
आफ्नै भोगाईले पेडियाट्रिक नर्सिङ रोजेकी सृजना भोमी	1
नेपाल र दक्षिण अफ्रिकाबीच द्विपक्षीय साझेदारीमा हस्ताक्षर	2
युक्रेन युद्ध: भारतीय डाक्टर जो युक्रेनमा ज्यागुआर र प्यान्थरसँग फसेका छन्	0
आयोग उपाध्यक्ष पौडेलले वडास्तरको योजना संघमा सारे	1
चीन सरकारको द्वैध चरित्र: एकातिर चरम दमन, अर्कोतिर आश्वासन	0
न्युकासल युनाइटेडमाथि चेल्सीको जित	1
बैंकिङ कुसरका फरार प्रतिवादी पक्राउ	1
टिभिएस रेडर १२५ले पायो 'इन्डियन मोटरसाइकल अफ द इयर'को उपाधि	2
२५ वर्ष पुगिन् जाह्रवी	1
एपीएफ क्लबलाई अग्नि ग्रुपको बधाई	1
डीएभीद्वारा शिक्षा क्षेत्रमा समर्पित महिला सम्मानित	2
कोभिड - १९ उच्च सङ्क्रमित भएका ९ देशहरू कुन कुन हुन् ? हेर्नुस् सूचीसहित 	0
चर्च ब्वाइज युनाइटेडको मेडिकल पार्टनरमा अर्थोप्लाष्ट रिह्याब सेन्टर	2
रुसी विदेशमन्त्रीले युक्रेनी समकक्षीसँग बिहीबार भेटवार्ता गर्ने	2
पानी कसरी, कुन बेला पिउने गरेमा शरीर स्वस्थ रहन्छ ?	2
उपेन्द्र यादवको अधिकार कटौती	0
चित्रमा समाजबाट हराउँदै गएका सामाग्रीहरू (फोटोफिचर)	1
पिएसजीको नेइमार मिशन फेल !	0
एभर्टनमाथि टोटनह्यामको शानदार जित	2
मेयर कप क्रिकेट : थालिगडा र देहिमाडौँ विजयी	2
टोटनह्यामलाई पराजित गर्दै मिडल्सब्रोग एफए कपको क्वार्टरफाइनलमा	2
प्रतिनिधिसभाको बैठक बस्दै, यस्तो छ सम्भावित कार्यसूची 	1
रुपन्देही सुपर लिगमा शंकरनगर विजयी	1
नेपाललाई खेलकुदबाट चिनाउने पाँच महिला खेलाडी	2
आज दिनभरका आर्थिक गतिविधि हेर्नुहोस् (भिडियोसहित)	1
भिजिट भिषामा सरकारको नयाँ व्यवस्था: क-कसले जान पाउँछन् उक्त भिषामा ?	1
प्रचण्ड सुर्खेत पुगेकै बेला माओवादी कर्णालीका प्रमुख सचेतकले त्यागे पार्टी, सभामुखलाई बुझाए राजीनामा	0
खाने तेल अनावश्यक मौज्दात नराख्न उपभोक्तालाई संघको आग्रह 	2
सृष्टिको ‘राधा’ र अदितीको 'बाबरी' आगामी भदौमा रिलिज हुने	1
रुसी सैनिक युक्रेनको अर्को आणविक संयन्त्रतर्फ बढ्दैछ : राष्ट्रसंघमा अमेरिकी राजदूत	0
चौधरी ग्रुपले उद्योगका कामदार कर्मचारीको गर्‍यो नि : शुल्क स्वास्थ्य परीक्षण	2
५ देखि १२ वर्षका बालबालिकाका लागि यसै महिना काेराेना खाेप ल्याइन्छ : मन्त्री खतिवडा	2
गलत नियतले सुपारी आयात खुलाइयो : संसदीय समिति	0
अब ह्वाट्सएपमा एकजनालाई भन्दा बढी म्यासेज फर्वाड गर्न नमिल्ने	1
निफमा ३८ देशका ८९ फिल्म	0
सोभियत संघबाट टुक्रिएका देशमा सैन्य केन्द्र नराख्न रूसको चेतावनी	0
५० बढी विद्यालयमा बेलायती आईटी कोर्ष ‘डिजी स्कुल’	1
खानेपानीलाई २ अर्ब सहयोग	2
खलनायकले जितेको समय र सलैजो	1
कस्तो छ अहिले हलमा चलिरहेको 'लप्पन छप्पन-२'?	1
सुनकोशीको सुख्खा क्षेत्रमा ४८ करोडको लागतमा खानेपानी पुर्‍याइँदै	2
भिसा नेटवर्कका प्रयोगकर्ताले अब फोनपेको क्युआर स्क्यान गरी भुक्तानी गर्न सक्ने	2
विनोद चौधरीको आत्मकथा मंगोलियन भाषामा	1
अब २ हजारमै भ्रूणमा वंशाणुगत रोगबारे जानकारी पाउन सकिने, राष्ट्रिय जनस्वास्थ्य प्रयोगशालामा परीक्षण सुरु	2
आमाको दबाबमा गोबिन्दाले तोडेका थिए निलमसँग सम्बन्ध, नायिकाले विवाह टुटेपछि दोस्रो पटक बसाएकी थिइन् घर	0
एनएसएलका कारण विवादमा घरेलु फुटबल, एन्फा मूकदर्शक	0
एक लाख डाउनलोडसँगै “फाइनान्सियल नोटिसेस” एप नयाँ स्वरुपमा, के–के छन् नयाँ सुविधाहरु ?	1
एमसीसी अनुमोदन प्रस्ताव कानुनसम्मत नभएको ओलीको दाबी गलत, आफैंले भनेका थिए– यही प्रस्ताव अघि बढाऔं	1
आर्मीले चाैथाे पटक झापा गाेल्ड कपकाे उपाधि जित्याे, झापा–११ पाँचाैँ पटक उपविजेता बन्याे	2
अमेरिकाले गलत सूचना फैलाइरहेको छ : चीन	0
चीनसँगको व्यापार– ल्हासामा सुन छ, कान मेरो बुच्चै !	0
बायोपिक फिल्मको तयारीमा थिए शेन वार्न	0
पेट्रोलियम पदार्थमा उपभोक्तालाई थरी थरीका कर, के–मा कति ?	0
सुजुकी नारायणीले ल्यायो ‘मेगा होली एक्सचेन्ज अफर’	2
मिल्टन इन्टरनेशन कलेजले मनायो विश्व सामाजिक कार्य दिवस	2
गण्डकी प्रदेश सभाको नवौं अधिवेशन सुरु	2
कार्यसम्पादन मूल्याङ्कनमा महानगरभन्दा गाउँपालिका अगाडि (हेर्नुस् ७५३ वटै तहको विवरण)	2
वेब एपलाई सुरक्षित राख्न ह्वाट्सएपले ल्यायो निःशुल्क ब्राउजर एक्सटेन्सन	2
बाथरूमकाे सरसफाइले देखाउँछ घरको सुन्दरता	2
दोस्रो जितसँगै झापा फाइनलमा	2
‘चिसो एस्ट्रे’बाट सृष्टि श्रेष्ठको फिल्मी क्षेत्रमा होला त ‘पुनर्जन्म’?	1
बिमा कम्पनीहरुले लगानीकर्तालाई यसरी बनाउँदैछन् झन् खुशी	2
नारायणकाजी र विप्लवबीच भेटवार्ता	1
ऋचा शर्माको फिल्म ‘कौसीद’ आगामी जेठ २७ मा रिलिज हुने	1
पाकिस्तानमा भएको पीएटीएस प्रतियोगितामा स्वर्ण जितेका सैनिकहरूलाई सम्मान	2
ड्राइभर बिरामी परेपछि साहु आफैंले हाँकेका थिए संखुवासभामा दुर्घटना भएको बस	0
बजारमा खानेतेलको कृत्रिम अभाव	0
फेरि आक्रमण नहोला भनेर कसरी विश्वास गर्ने ?	0
महालक्ष्मी विकास बैंकका अध्यक्ष राजेश उपाध्यायले लिए सपथ	1
कुन निर्वाचनमा कस्ता रङका मतपत्र थिए ? रापस चुनावदेखि स्थानीय तहसम्मका तस्बिरसहित	1
आम्ची उपचार विधिलाई मान्यता दिए परम्परागत ज्ञान र जैविक विविधता संरक्षण हुने	2
वार्षिकोत्सवको अवसरमा प्रदेश १ मा सेञ्चुरी बैंकद्वारा विविध सामाजिक कार्यको आयोजना	2
सलमान खान र फरहान मेरा क्रस हुन् : अभिनेत्री दिव्या दत्त	1
निजामती कर्मचारी युनियनको उम्मेदवारी घोषणा	1
रामका बाबुको नाम नेमी थियो : ओली	1
स्थानीय चुनावको चर्चामा युवाहरूको विशेष आकर्षण	2
फिल्म रिलिजका लागि जुर्मुराउँदै निर्माता	1
काश्मिरमा चिता हेलिकोप्टर दुर्घटना	0
कांग्रेस धनुषाको सभापति पदमा पुनः निर्वाचन हुने	1
‘गंगुबाई काठियावाडी’पछि आलियाले बलिउडमा राज गर्लिन् ?	1
युक्रेनमा रुसी हमलापछि ताइवानका ‘रिजर्भ सैनिक’लाई तालिम	0
इन्टरकाे सानदार जितमा मार्टिनेजकाे ह्याट्रिक	2
तेस्रो विश्वयुद्ध टार्न युक्रेनलाई मद्दत गर्न विदेशमन्त्रीको माग	0
म्यान्चेस्टर डर्बीः सिटीसँग युनाइटेडको लज्जास्पद हार	0
ग्रीन भेन्चर्सको शेयर रजिष्ट्रार लक्ष्मी क्यापिटल, सर्वसाधारणको लागि शेयर निष्काशन गर्ने	2
रुसी सेना पसेपछि चार लाख युक्रेनी घर छाडेर रोमानिया छिरे	0
रुसमा रहेको युक्रेनको दूतावासबाट झण्डा हटाइयो	0
युक्रेनको पक्षमा मत दिँदा नेपाल अमेरिकी खेमामा गयो भन्न मिल्दैनः अर्जुनबहादुर थापा (अन्तर्वार्ता)	1
गृहमन्त्रीलाई भेटेर महिला सांसदहरुले भने- पल शाह बलात्कार प्रकरणमा पीडितमाथि बढी प्रहार भयो	0
‘आप’को विजय र नेपालमा विकल्पको जिज्ञासा	1
इराकमा रहेको गोप्य इजरायली अड्डामा प्रहार गरेको इरानको दाबी	0
साइबर आक्रमणबाट जापानमा टोयोटाको कार उत्पादन उत्पादन ठप्प	0
नेपाली धावक नारायणले कुवेतमा जिते उपाधी	2
राणाकालीन अभिलेखलाई दुरुस्त पारिँदै	2
यसकारण चाहन्छन् देउवा चुनावी गठबन्धन	1
गिरिजाप्रसाद कोइराला स्मृति हक्की प्रतियोगिता चैत ८ गतेदेखि	2
म्याग्दीको केराखेतीमा गवारोको समस्या, किसान चिन्तित 	0
प्रेममा रहेको सुहानाको संकेत, अनमोल भन्छन्- आज्ञा साथी मात्र 	1
विविध सिर्जनामा पोखिए कलाकार	1
वरिष्ठ रुसी सञ्चारकर्मी भन्छिन्– आफ्नै देशसँग लाज लागिरहेको छ, युक्रेनसँग घुँडा टेकेर माफी चाहन्छु	0
रुसी आक्रमणमा न्युयोर्क टाइम्सका पत्रकारको निधन	0
काठमाडौँ उपत्यकामा अध्ययनरत दुर्गमका विद्यार्थीलाई निःशुल्क इन्डक्सन चुलो	2
पाँचपोखरी टी–२० जिल्लास्तरीय प्रतियोगिताको फाइनल आज हुँदै	1
गुगलको सहारामा ६ हजार ८३६ किलोमिटरको यात्रा	2
युक्रेनबाट पोल्याण्ड पुगेका नेपाली युवाको भारतद्वारा उद्धार	2
हाम्रोपात्रोमा २५ जना विद्यार्थीलाई हाम्रोपात्रोमा फेलोशिप, कोको भए छनौट ?	2
हिमाल पारीको गाउँले बने प्रदिप र दिया, ‘प्रकाश’को फस्टलुक सार्वजनिक	1
कस्तो छ वनस्पतिमा आधारित कोरोनाविरुद्धको पहिलो खोप ?	1
हामीले रुस सामु आत्मसमर्पण गरेका छैनौँ र गर्ने छैनौँ : युक्रेनी विदेशमन्त्री	0
नाम मात्रैको ढुङ्गेधारा (फोटोफिचर)	0
एकीकृत समाजवादीका १५ प्रस्ताव : भ्रष्टाचारीमाथि कारबाहीदेखि मल कारखानासम्म	1
के छ चिनियाँ विदेशमन्त्री वाङ नेपाल आउन लाग्नुको भित्री उद्देश्य ?	1
साना दल र मोर्चाले एमसीसीको विरोधमा थप आन्दोलन गर्ने	0
इंग्लिस प्रिमियर लिग : वेस्ट ह्यामविरुद्ध लिभरपुलको जीत	1
के हो ‘म्यान इन द मिडल अट्याक’, कसरी जोगिने ?	2
अनुहार सुन्दर बनाउने केही घरेलु उपाय	2
रविन तामाङको आवाजमा ‘चिसो एष्ट्रे’को शीर्ष गीत 	1
बेजोड विषय उठान गर्दागर्दै बहकिएका प्रकाश सपुत	0
नेपाल-भारत-बाङ्ग्लादेश बस यात्रा: ‘पाँच-छ महिना’मा सुरु हुनसक्ने	2
सांगीतिक क्षेत्रमा फर्किँदै नितेश जंग कुँवर	2
युक्रेनको समर्थनमा राजदूतहरु बौद्धमा भए भेला, दीप प्रज्वलन गर्दै युद्ध अन्त्यको कामना	2
सुन्ने क्षमता कम हुन नदिन यसरी गर्नुस् कानको सुरक्षा	2
प्रधानन्यायाधीश जबराविरुद्धको महाभियोग प्रस्ताव संसद्मा पेस गर्ने तयारी	0
पाँच विधामा सात नगरपालिका उत्कृष्ट	2
हजारौँ रुसी नागरिक देश छाड्दै, बौद्धिक पलायनले संकट निम्त्याउन सक्ने	0
सिक्किमको आरपी एफसीलाई पराजित गर्दै झापा-११ सेमिफाइनलमा	1
स्थानीय तहका तीन सय जनप्रतिनिधि बलात्कारदेखि भ्रष्टाचारसम्मका मुद्दा खेप्दै	0
युक्रेनले रुससँगकाे युद्ध जित्ने अमेरिकाकाे दावी	0
रुस–युक्रेन आक्रमण १२ औं दिनमा, नझुके नामनिशान मेटाइदिने  पुटिनको धम्की 	0
रुसको निशानामा अस्पताल, विद्यालय र आवासीय क्षेत्र	0
स्पेनिस ला लिगामा बार्सिलोना तेस्रो स्थानमा उक्लियो 	1
एमसीसी ल्यायौँ भन्दा पनि राजनीतिक धारणा बदलियाे	1
मिर्गौला दिवसमा मैत्रीपूर्ण फुटबल	2
नेत्रहीन क्रिकेटरको खेल कौशल (फोटो फिचर)	1
ध्रुवचन्द्रको ‘ह्याङ्गरमा झुण्डिएको आकाश’ विमोचन	1
स्वास्थ्य बेवास्ताका कारण ६० प्रतिशत मानसिक रोगी	0
आफ्नो फेसबुकको स्क्रिनशट कसैले लिन नसकोस् भन्ने चाहनुहुन्छ ? यसो गर्नुहोस्	1
नेपाली फिल्मको प्रचार गर्न बेल्जियमकी हिरोइन क्यारोलिन काठमाडौंमा	1
कांग्रेस धनुषाको नेतृत्व छान्न आज मतदान, सभापतिका लागि तीन जना मैदानमा	1
आगामी निर्वाचनपछि बन्ने सरकार समेत गठबन्धनकै हुनेछ : प्रधानमन्त्री देउवा	0
श्रीलंकाको प्रथम श्रेणी क्रिकेट खेल्ने टोलीविरुद्ध चार नेपाली ब्याट्सम्यानले बनाए अर्धसतक	2
‘मेरो लागि बजेट ठूलो हो, एउटा फिल्मलाई ५० दिनभन्दा बढी समय दिन सकिँदैन ’	1
एमाले निर्णायक, एमाले नै अस्पष्ट	1
पल शाह प्रकरणबारे बोले दीपकराज, भने - उनको आजको नियतिमा आफूलाई पनि दोषी देखिरहेको छु	0
अस्ट्रेलियामा बाढीका कारण ११ जनाको मृत्यु	0
नेविसंघ नेताले मागे जिम्मेवारी, टर्च बालेर खोज्नुपर्ने दिन आएको गुनासो	0
घिमिरेलाई गान्धी नोबेल पिस अवार्ड 	2
स्थानीय तह निर्वाचनमा उम्मेदवारलाई खर्चको ‘सिलिङ’	2
पल प्रकरण : प्रियंकाले भनिन् ‘पीडित हुँ भन्न ठूलै हिम्मत चाहिन्छ ?’	0
एमाले दैलेखको  अधिवेशन १ चैतमा	1
हेटौंडा सिमेन्टको महाप्रबन्धकका लागि १२ जनाको आवेदन (सूचीसहित)	1
लिभरपुलले सिटीसँगको अंक दूरी घटायो, यस्तो छ समग्र अवस्था	1
विनित कुमार बने प्राइम भलिबलको उत्कृष्ट खेलाडी	2
चकचके केटोका कारण उडिरहेको विमानमा हङ्गामा 	0
आत्मघाती गोलले बायर्न रोकियो	0
रुसी आक्रमणले युक्रेनमा पाँच दिनमै कम्तीमा २२७ सर्वसाधारणको मृत्यु	0
कार्यसम्पादन मूल्याङ्कनमा कञ्चनपुरका दुई नगरपालिका उत्कृष्ट	2
बस्ती जोगाउन ढुंगा हटाउँदै सेना	2
२२ वर्षदेखि तरकारी र फलफूल खाएकी छैनन् यी युवतीले	0
रुसले युद्धविराम कार्यान्वयन गरेन : युक्रेन	0
यस्ता छन् चना खानुका फाइदाहरु	2
टिकटकमा १० मिनेटको भिडियो बनाउन मिल्ने, युट्युबसँग प्रतिस्पर्धाको लक्ष्य	1
काठमाडौंमा लाखौ घरजग्गा एकैपटक विक्रीमा ! घट्ला त घरजग्गाको मूल्य ?	1
वाटफोर्डलाई हराउँदै आर्सनल शीर्ष चारमा उक्लियो	1
युक्रेनमा अर्का भारतीय विद्यार्थीको मृत्यु	0
पशुपतिमा अनलाइनबाटै पूजा गर्न सकिने, घर-घरमा प्रसाद डेलिभरी	2
