पाकिस्तानमा झण्डै १५ लाख ११ हजारमा कोरोना पुष्टि हुँदा १४ लाख ४५ हजार बढि संक्रमणमुक्त, मृत्यु कति ?	0
नेपालको मौसममा बंगलादेशको प्रणालीको प्रभाव	1
रिचार्ड कार्ड किन्दा सचेत हुन टेलिकमको आग्रह	1
युक्रेनमा 'नो फ्लाई जोन' लगाउने देश युद्धमा संलग्न मानिने पुटिनको चेतावनी	0
रुस र युक्रेनबीच चौथो चरणको वार्ता सुरु, दुवैतर्फका अडान कायमै	2
जिम गर्दागर्दै ढलेका समिकले कसरी पाए नयाँ जीवन ? (पढौँ सफल उपचारको कथा)	2
‘२ नम्बरी’मा धीरज, अनमोल वा सौगातमध्ये कसको होला ‘इन्ट्री’ ?	1
चिपसेट अभाव र रुस-युक्रेन युद्धले बढ्यो इन्टरनेट उपकरणको मूल्य, दबाबमा सेवा प्रदायक 	0
लिनक्स किन प्रयोग गर्ने ?	1
कोरोना संक्रमित बढ्दै गएपछि चीनको शेन्झेन सहरमा लकडाउन	0
पाकिस्तानको सिन्धमा धार्मिक अतिवादमा वृद्धि	0
महिला बुद्धिचाल प्रतियोगिता हुने	2
नक्कली ३ लाख रुपैयाँसहित एक किशोर पक्राउ	0
प्रदेश १ मा ब्राउन सुगर ओसारपसार डरलाग्दो	0
सिरी ‘ए’ मा युभेन्टसको कठिन जित	1
ग्लोबल आइएमई बैंकको मोबाइल एप ग्लोबल ‘स्मार्ट प्लस’बाट नेपाल आइडलमा भोटिङ गर्न सकिने	2
अब मार्खेज नै पात्र भएको पुस्तक पनि पढ्नुस्	1
सीता न्यौपानेका फ्यान : बाइकमा फलो गर्नेदेखि प्रेम प्रस्ताव राख्नेसम्म (भिडियो पनि)	1
चर्को नारा र अर्काको आलोचना गर्दा भोट पाइन्छ भन्ने मानसिकता नत्यागे काँग्रेसविनाको गठबन्धन बन्नसक्छ : तुलाधार	1
‘बढ्दो ब्याजले व्यवसाय संकटमा’	0
वामपन्थी नेता बर्माको निधन	0
लुम्बिनीमा अन्तर्राष्ट्रिय विमानस्थल सञ्चालनमा आउने भएपछि बढ्यो चहलपहल, धमाधम थपिँदै पाँचतारे होटल	2
चौदण्डीगढीमा भूमिहीनलाई जग्गाकाे निस्सा वितरण	2
मिर्गौला पत्थरी भएकाले के खाने, के नखाने?	1
इरानमा सिर्जनाले जितिन् रजत पदक	2
प्रेस चौतारी वाग्मती प्रदेश अध्यक्षमा सापकोटा, पदाधिकारीमा को-को ?	1
प्रजनन स्वास्थ्य महिलाको प्रमुख मानव अधिकार	2
बाहुबलीको तेस्रो संस्करण आउने ?	1
‘मेरो देश प्यारो नेपाल’ भन्दै रंगशालामै उत्रिए गायक प्रमोद खरेल (तस्बिरहरू)	2
तुलसीको पातका यी फाइदाहरू थाहा पाउँदा छक्क पर्नुहुनेछ	2
‘नेपालकाे जलविद्युतकाे बजारीकरण’ भन्ने नाराका साथ चैत १८ गतेदेखि 'हाइड्राे एक्स्पाे' हुने	2
सिटी र क्रिष्टल प्यालेस विजयी, टोटनहम मिडल्सब्रोसँग स्तब्ध	1
दुई वर्षपछि भारतको मुम्बई र बैंग्लोरमा उडानः पर्यटक बढ्ने अपेक्षा	2
विश्वभर कोरोनाले मृत्यु हुनेको संख्या ६० लाख नाघ्यो	0
कर्णाली नदीमा पुल नहुँदा नागरिकलाई सास्ती	0
जनतालाई मुस्कानसहितको सेवा दिन कर्मचारीलाई प्रधानमन्त्री देउवाको निर्देशन	2
पाँचपोखरी अपराजित रहँदै सेमिफाइनलमा	2
स्थानीय जनताको जीवनस्तर उकास्न एनआईशी एशियाको ‘सर्वश्रेष्ठ स्थानीय बचत तथा मुद्दती खाता’	2
गायिका स्मिताको लेखनमा ‘हराएको मुस्कान’	1
पल प्रकरणमा पीडितको गोपनीयताको सम्मान गर्न अनलाइन पत्रकार सङ्घको आग्रह	0
धुलिखेल अस्पतालमा बालिकाको मृत्यु, उपचारमा लापरबाही भएको आफन्तको आरोप	0
एउटा फेसबुक प्रेमको दु:खान्त कहानी- भद्रकालीमा विवाह, महिना दिनमै सिरहामा हत्या	0
चिवतनमा चैत ९ देखि १२ गतेसम्म कृषि कर्जा मेला सञ्चालन गरिने	2
पर्यटनको नेपाल बसाई बढाउन अर्थमन्त्रीको आग्रह, मन्त्रालयबिच समन्वयको अभावमा अर्थतन्त्रमा नकारात्मक प्रभाव	1
एआइजीमा गठबन्धन र आइजिपीको भागबन्डा : सुवेदी र लामा अटाएनन्, पन्तलाई चिट्ठा पर्‍यो	1
समाजवादीले सम्पूर्ण शक्ति निर्वाचनमा केन्द्रित गर्ने	1
श्रीलंका पुलिस क्लबमाथि नेपाल १४४ रनले विजयी 	2
महानायक राजेश हमालको काठमाडौंको मेयर हुने इच्छा !	1
१२–१३ चैतमा चिनियाँ विदेशमन्त्रीको नेपाल भ्रमण, शीर्ष नेतृत्वसँग भेट	2
श्रीमतीमाथि 'एसिड' हान्ने श्रीमान पक्राउ, अनुसन्धान गर्दै प्रहरी	0
नयाँ बजेटको तयारी : बढी बजेट पार्न तीव्र दौडधुप !	1
खाजामा अब फर्सी र सूर्यमुखीको बियाँ	2
स्थानीय चुनावका लागि कांग्रेसले खटायो नेता, को कहाँ? (सूची)	1
बेलायतमा शुक्रबारदेखि यात्रा प्रतिबन्ध पूर्ण रुपमा खुला	2
युक्रेनको खेरसन सहरमा नयाँ नियम- रूसी सैनिकलाई उक्साउन नपाइने	0
रुस युक्रेन युद्ध : किएभमा ३५ घण्टाका लागि कर्फ्यु	0
छडको भाउ बढेको बढ्यै, चार कोठे घर बनाउँदा कति लाग्छ खर्च?	0
आगलागीबाट जगदम्बा स्पिनिङ्ग मिल्समा ४ करोडको क्षति	0
रुसमा युद्धको विरोधमा प्रदर्शन गर्ने हजारौं पक्राउ	0
मृत्युको ठिक अगाडि मान्छेले के सोच्छ ?	0
'पूर्वाग्रह तोडौं' भन्‍ने नारासहित आज अन्तर्राष्ट्रिय नारी दिवस मनाइँदै	2
युक्रेनसँग रुसका 'पूरा गर्नै नसकिने' माग, दुई देशबीच तेस्रो चरणको वार्ता हुँदै	0
मंगलम वायर सेफ बजारमा	1
ग्यासमा भन्दा बिजुलीमा खाना पकाउँदा ४०० रूपैयाँ सस्तो, कसरी?	2
‘प्रकाश’को फर्ष्टलुक सार्वजनिक, रिलिज डेट भदौ १० 	1
मेक्सम र एलिनाको स्वरमा ‘यो माया मर्दैन’	1
नाबालिगसँग यौनसम्बन्ध स्थापित गर्नु अपराध : श्रृंखला खतिवडा	0
अष्ट्रेलिया आएको २ महिना नपुग्दै एक नेपाली विद्यार्थी मृत फेला	0
आजबाट सहिद  स्मारक ‘बी’ डिभिजन लिग	2
‘सुनाइ क्षमता कमजोर भएकामध्ये १८ प्रतिशतसँगमात्र श्रवणयन्त्र’	0
क्रिप्टोकरेन्सीको कारोबार हुने वेबसाइट र मोबाइल एप अब नेपालभित्र नचल्ने	0
इन्धनको कर घटाएर मूल्य समायोजन गर !	0
म्यानचेस्टर युनाईटेडलाई हराउँदै सिटीको शीर्ष स्थानमा ६ अंकको अग्रता	1
प्रगतिशिल इन्जिनियर समुहको जित सुनिश्चितः ई.डा.थापा (भिडियोसहित)	2
नेपाल र पपुवा न्युगिनीबीच एकदिवसीय क्रिकेट हुने	1
स्वास्थ्य सेवा सक्षम बनाउन एक पायला फाउन्डेसनसँग सहकार्य	2
निर्माता, वितरक र प्रदर्शकको मुहारमा खुसी फर्काएको ‘म यस्तो गीत गाउँछु २’	2
प्रचण्डलाई एमालेले सिध्याउनै पर्दैन, उनले चिनामै त्यस्तो भाग्य बोकेर आएका छन् – ओली	0
फेसबुकमा कुन कुन भिडिओ हेर्नुभयो ? यस्तो छ थाहा पाउने तरिका	1
अर्थमन्त्री, योजना आयोगका उपाध्यक्ष र गभर्नरसँग प्रधानमन्त्रीको छलफल	2
नेपाल-पाकिस्तान फ्रेन्डसिप क्रिकेट प्रतियोगिताको उद्घाटन	2
‘अन्तालिया डिप्लोमेसी फोरम’मा भाग लिन परराष्ट्र मन्त्री टर्की जाने	1
‘जेड’ रुसमा कसरी बन्यो युद्धको प्रतीक ?	0
‘नानो यूरिया’ (तरल) प्रयोग गर्दा दाना मलभन्दा प्रतिहेक्टर ८ हजार सस्तो पर्ने, नेपालमा आयात खुल्ला	2
‘मिस टिन युनिभर्स’मा नेपालको प्रतिनिधि श्रीयङ्का	1
नारी दिवसको अवसरमा काठमाडौँमा महिला बक्सिङ (फोटो फिचर)	2
रुपन्देही सुपर लिग  क्रिकेट प्रतियोगितामा तिलोत्तमाको जीत	1
आफ्नो मृत्युपछि पनि अरूलाई यसरी बचाउन सकिन्छ	0
उत्कृष्ट कार्यसम्पादनमा शुभकालिका गाउँपालिका अगाडि	2
३७६ कोरोना संक्रमित निको हुँदा ८८ जना मात्र संक्रमित	0
विकास सहायता, संविधान र मानवअधिकार	1
युद्धबाट भाग्दै गरेका आमा र सन्तानसहितका सर्वसाधारणको रुसले गर्‍यो मोटारबाट हत्या	0
माओवादी बैठक : हलमै सिनियरको विवाद हुँदा प्रचण्ड ‘ब्याक’	0
रुसमा फोन र चिपको व्यापारमा सामसुङको प्रतिबन्ध	0
अनि रुषाको फिल्म खेल्ने सपना पूरा भयो	2
युक्रेनी नागरिकलाई घरको ढोका खोलिदिन बेलायत सरकारको आग्रह	2
धितोपत्र बजारका नीतिनियम अब पुराना भए, समय सापेक्ष बनाउन तयारी सुरु	2
नयाँ कलाकारलाई स्टार बनायौँ, तर संस्कार दिएनौँ	1
महिला सशक्तीकरण, सहभागिता र समानताको मुद्दा महिलाको मात्र होइन : राष्ट्रपति	2
नेपाली बजारमा सार्वजनिक हुँदै ओप्पो ए७६ 	1
फलफूल हाम्रो शरीरका लागि पौष्टिक तत्त्व, कुन समयमा के खाने ?	2
खानेपानी आयोजनाका लागि नगर विकास कोषद्धारा ऋण प्रदान	2
संक्रमण दर घटे पनि जनस्वास्थ्य मापदण्ड भने अपनाउन आग्रह	0
कृषिमा अनुदान नभइ प्रोत्साहनको नीति लिन्छौः अर्थमन्त्री, बिनाधितो ५० लाख रुपैयाँ ऋणको व्यवस्था गर्न सुझाव	2
फोनमा स्टोरेज कम छ ? अब एन्ड्रोइडले दिने छ समाधान	1
जिमेलमा आउने ई-मेलका लागि यसरी सेट गर्नुहोस् अटोमेटिक रिप्लाई	1
जब डाक्टर जोहान लवरेन्सको नामबाट ९० लाखको चिट्ठा परेको मेसेज आयो....	0
कस्तो छ नेपाल एयरलाइन्सको साउदी उडान तयारी?	1
सानदार ढंगले चुनाव जितेर कांग्रेसले ५ वर्ष सरकार चलाउँछ : महामन्त्री थापा	1
पूर्वाञ्चल क्रिकेट क्लब फाइनलमा 	2
कानुनी समस्यामा परे पवनदीप र अरुणिता	0
‘बुद्धि बिग्रिएपछि कसको के लाग्छ ?’	0
राष्ट्रिय कलाश्री सम्मान–२०७८ साहित्यकार परशु प्रधानलाई प्रदान गरिने 	2
भिभोले उपभोक्तामैत्री प्राविधिक प्रवृत्तिको विकास कसरी गर्दैछ ? 	2
लालपूर्जाको आश देखाउँदै, सुकुम्बासीसँग रकम उठाउँदै	0
मानविकी संकायका डिनलाई खुलापत्र: शिक्षामा भाषाको अवरोध हटाइयोस्	1
आईपीएल : डु प्लेसिस आरसीबीको नयाँ कप्तान बन्ने, कोहलीको पनि सहमति	2
लैनचौर मैदान पुन:निर्माण सम्पन्न गरेको एनसेलको दाबी	1
१० खेलाडीमा सिमित एथ्लेटिको विजयी	2
देशको उत्पादनमूलक क्षेत्र खराब अवस्थामा : ओली	0
दाङमा औद्योगिक, पर्यटन तथा कृषि प्रदर्शनी सुरु	2
पाकिस्तानका प्रधानमन्त्री इमरान खानविरुद्ध अविश्वासको प्रस्ताव पेस	0
आमा बत्ती कातिरहनुभएको छ	1
रुसी आक्रमणबाट नागरिकलाई जोगाउन ६ स्थानमा निकासमार्ग पहिल्याउने युक्रेनको प्रयास	0
क्रिस्टल प्यालेससँग सिटीको  बराबरी	1
अमेरिकाले लगायो रूसी तेलमा प्रतिबन्ध, के असर पर्ला नेपाललाई?	0
५७ वर्ष लागे आमिर खान : गृहस्थीमा असफल, तर करिअरमा सफल अभिनेताका ४ किस्सा 	1
भ्रामक ट्वीट पहिचान गर्न ट्वीटरले ल्यायो ‘बर्डवाच’ फिचर	2
अब सबै एमसीसीको कार्यान्वयनमा अग्रसर हुनुपर्छ : सञ्चारमन्त्री कार्की	1
युक्रेनकाे खेअरसन कब्जा गरेकाे रुसकाे दाबी	0
नेपाल बंगलादेश बैंकलाई गाभ्न नबिललाई राष्ट्र बैंकको सैद्धान्तिक सहमति, ६ महिनाभित्र एकीकृत कारोबार भईसक्ने !	2
काँग्रेस भएर कम्युनिष्टलाई भोट हाल्न सकिन्दैन : संस्थापन इतर	1
रुस-युक्रेन विदेशमन्त्री वार्ता : युद्धविराम गराउन असफल	0
यो लाजको कुरा नभन्नू कसैलाई!	1
रुसमा युक्रेन युद्ध प्रभाव : बाबुआमा पुटिनको पक्षमा, छोराछोरी विपक्षमा	0
अब एक लिटर पेट्रोलको पर्ने भयो १५० रुपैयाँ	0
छिमेकी राष्ट्रहरु नेपालमाथि आक्रमण गर्न किन डराउथे?	2
मतदाता नामावलीमा दाबी विरोध आजदेखि	1
आइएमई जनरल इन्स्योरेन्सको हकप्रदमा आजदेखि आवेदन दिन सकिने, कसले दिने आवेदन ?	2
माईपे डिजिटल वालेट प्रयोग गर्दा एक लाखको दुर्घटना बीमा	2
दक्षिण अफ्रिका संसारको सबैभन्दा धेरै असमानता भएको देश	0
युक्रेन तथा रसियाका छिमेकी देशमा आठ हजार बढी नेपाली श्रमिक	0
बहराइनको प्रदर्शनीमा नेपालको हस्तकला सामाग्री र चिया	2
विप्लवसँग एकताको कुराकानी भएको छैन: नारायणकाजी श्रेष्ठ	1
पर्यटन उकास्न छुट प्याकेज	2
फिल्मको बाँकी छायांकनका लागि ढाका उड्यो ‘ए मेरो हजुर ४’ टिम	1
विमानस्थल बन्ने हल्लाले जग्गाको मूल्य पाँच गुणाले वृद्धि, तर बनेन विमानस्थल	0
तम्घासमा चैत २५ देखि गुल्मी महोत्सवको हुने	2
केजरीवाललाई शुभकामना दिँदै रवीन्द्र मिश्रले भने– नेपालमा बढी नै अपेक्षा गरियो कि ?	1
‘खाने तेलको मूल्य वृद्धि स्वाभाविक’ : विभाग	0
‘हेल्लो जिन्दगी’मा प्रवासी नेपालीको कथा	2
प्रेमिल गीतमा सजियो आइडल	1
९३ रुपैयाँमा किनेको पेट्रोल १५० मा बेच्दा पनि १६ रुपैयाँ घाटा	0
ठेकेदार भाग्ने डरले 'गोठालो' राखेरै हुन्छ सडक निर्माणको काम !	1
जापानबाट ७० स्वयंसेवकले रुसविरुद्ध लड्न युक्रेनलाई सघाउने 	0
क्रिमियालाई रुसबाट अलग्याएर युक्रेनको अङ्गको रुपमा देखाउन थाल्यो एप्पल म्याप्स	0
‘सर्ट ड्रेस’मा जान्हवी कपुरको ‘बोल्ड लुक्स’	1
जोन अब्राहम स्टारर फिल्म ‘अटैक’को ट्रेलर रिलिज	1
माओवादी केन्द्र : निर्वाचनअघि पदाधिकारी चयन संभव छ ?	1
‘महँगीले भान्सा चलाउन गाह्राे भइसक्याे, मूल्य वृद्धि नियन्त्रण गर्न सरकार प्रतिबद्ध छ’	0
भारतबाट महँगो बिजुली किन्दै नेपाल	0
युक्रेन र रुसबीच दोस्रो चरण वार्ता आज, खेरसन रुसी नियन्त्रणमा	2
हाँस्ने खेल्ने उमेरका युक्रेनी किशोरहरू रुसी फोजविरुद्ध लड्न तयार हुँदै	0
चीनमा बढेको कोरोनाका कारण चिनियाँ अर्बपतिलाई अर्बौको घाटा	0
बन्चरेडाँडा ल्यान्डफिल साइट निर्माणमा स्थानीयको अवरोध	0
