पाकिस्तानमा झण्डै १५ लाख ११ हजारमा कोरोना पुष्टि हुँदा १४ लाख ४५ हजार बढि संक्रमणमुक्त, मृत्यु कति ?	0
इशा गुप्ताको विन्दास फोटोशुट	1
गाउँको विकासका लागि छलफलमा जुटेका स्थानीयवासी	2
आगामी आर्थिक वर्षका लागि स्वास्थ्यले पायो ७४ अर्बको बजेट सिलिङ	2
भारतीय प्रधानमन्त्री नरेन्द्र मोदीले भेटे युक्रेनबाट फर्किएका विद्यार्थीलाई	2
सुकुमेलले गर्छ कब्जियतदेखि मुटुरोगसम्मलाई फाइदा	2
जेलेन्स्कीसँग सिधा कुरा पुटिनलाई मोदीको आग्रह	1
मुख्यमन्त्री शाहीद्वारा कर्णाली डेण्टल क्लिनिक उद्घाटन	1
क्रिकेटको नियम विश्वभर परिवर्तन, ब्याटरलाई घाटा	1
बागमती प्रदेश : ६ महिनाको अवधिमा बजेट खर्च १५ प्रतिशत मात्र	0
भित्ताभरि ‘यो महाअलच्छिना घर हो’ लेखेर किन गरियो सामूहिक आत्महत्याको प्रयास?	0
जापानी सहयोग हचुवामा राेके महासेठले	0
आफ्नै जग्गाको लालपुर्जा लिन ५७ वर्षको मिहिनेत !	0
जाह्नवीलाई डाक्टर बनाउन चाहान्थिन् श्रीदेवी	1
कलेजो खराब गराउने खानेकुरा	0
एप्पलका कर्मचारीहरु किन लुकेर एन्ड्रोइड फोन चलाउँदै छन् ?	1
कानुनी अड्चन संशोधनका लागि पहल गर्ने प्रतिबद्धता	2
शिक्षा र स्वास्थ्यको क्षेत्रमा धनी र गरिबका बीचमा हुने विभेदको अन्त्य हुनुपर्छ : उपराष्ट्रपति 	2
नेपालमा प्रत्येक वर्ष १५ सय औषधि प्राविधिक र पाँच सय फर्मासिस्ट उत्पादन : संघ	2
रूसले युक्रेनमाञि लगायो गम्भीर आरोप	0
अमेरिकी कम्पनीले काट्यो रुस जोड्ने इन्टरनेटको लाइन	0
ला लिगामा इल्चेमाथि बार्सिलोनाको पुनरागमन जित	1
विपद् व्यवस्थापनमा उत्कृष्ट आइडिया दिने १० जनालाई तालिम र लगानीको अवसर	2
न्यू डाँफेलाई जिल्ला लिगको उपाधि	2
कागजमै सीमित योजना, सरकारका योजना भत्ता झ्वाम	0
कञ्चनपुरमा विपन्न एकल महिलालाई बाख्रा वितरण	2
अदिती बुढाथोकीको इन्स्टाग्राममा ‘२ मिलियन’ फ्यान	1
कसैले म पीडित हुँ भन्दा जिम्मेवार समाजले उसकै चरित्रमाथि प्रश्न उठाउनुहुँदैन : प्रियंका कार्की	0
इटहरीमा २५ करोड लागतको कृषि बजार शिलान्यास	2
विश्व बजारमा कच्चा तेलको मूल्य १३ वर्षयताकै उच्च !	0
चार जनाले अर्धशतक बनाउँदा नेपालको सहज जित	2
प्ले स्टोरबाट हट्यो एपहरू अपडेट भएको अन्तिम मिति हेर्ने सुविधा 	1
बढ्यो निर्जीवन बीमा प्रिमियम	2
ओली सरकारको ३.५ वर्षको ७ प्रश्न	2
छोटो समयमै शौर्य सिमेन्ट लोकप्रिय ब्राण्ड बन्दै	2
एनसेल वुमन आइकन २०२१ तथा नेपालको पहिलो महिला कम्प्युटर इन्जिनियर : गुण केशरी प्रधान	2
इन्जिनियर्स एसोसिएसनको मतगणनामा ढिलाई, धाँधली हुन सक्ने आशंका	0
भूमिकालाई अमेरिकाले दियो साहसी महिलाको अवार्ड	2
वर्तमान गठबन्धन संविधानको रक्षा र समृद्धिको लक्ष्य पुरा गर्न : अर्थमन्त्री	1
आईसीसी विश्वकप लिग टूमा युएई विजयी 	1
भरतपुरमा २८ सय टन क्षमताको शीतभण्डार सोमबारबाट सञ्चालनमा आउने	2
काठमाडौं–धादिङ दुबैतर्फ संगसंगै काम	2
अमेरिकी राष्ट्रपति बाइडेनले फ्रान्स, जर्मनी र बेलायतका नेतासँग छलफल गर्ने	2
‘कलेजमा पहिलो ब्वाई हुनु दबाब थियो’	1
संस्थापन विभाजित हँदा मकवानपुर कांग्रेसमा इतर पक्ष हाबी	0
नियमित उडानपछि कोरिया जाने श्रमिक बढ्ने	1
ब्रह्मास्त्रकी इशा अर्थात् आलिया भट्ट	1
मिलान डर्वीको सेमिफाइनलको पहिलो लेग गोलरहित बराबरीमा टुंगियो	1
फिल्म ‘झुण्ड’मा अमिताभ बच्चनले लिए यस्तो कदम, निर्माता परे छक्क	1
भक्तपुरमा महिलामाथि ‘तेजाब’ प्रहार	0
वायु ऊर्जा आयोजना अलपत्र	0
प्रचण्ड भन्छन– अहिले पनि निर्णायक भूमिका हामी नै छौ	1
सेञ्चुरी बैंकले स्थापना दिवसको पूर्वसन्धामा दुई संस्थालाई दियो १ लाखसहित फर्निचर सामान	2
वैदेशिक रोजगारीमा जानेको संख्या ८५ प्रतिशतले घट्यो	1
पोखरा थन्डर्सको मार्की खेलाडी र प्रशिक्षकमा श्रेष्ठ र न्यौपानेलाई नै निरन्तरता	1
नागरिकताविहीनबाट धनुषाको ढल्केवरमा प्रदर्शन	0
ओलीको विश्लेषण : सरकारी पैसा आफन्तलाई बाँडे‍, अर्थतन्त्र बेहाल बनिसक्यो	0
जसपा बैठकः बहुपदीय अस्वीकार	1
आईफोनमा लुकेको एउटा यस्तो ‘ट्रिक’, जसको सहयोगमा नछोएरै खिच्न सकिन्छ फोटो	2
युक्रेनमा पालना भएन युद्धविराम	0
अनिवार्य पीसीआरको व्यवस्था हट्यो	2
विद्युतीय गाडीमा वायरलेस चार्जिङ परिक्षण गर्दै भोल्भो 	2
राष्ट्र बैंकले एक रुपैयाँ दरको सिक्का प्रचलनमा ल्याउने	1
पन्जाबमा आमआदमीको ऐतिहासिक जित  	2
‘कबड्डी ४’को गीत ‘केशरी’मा मिरुनालाई फकाउँदै सौगात	1
निर्वाचनमा केन्द्रबाट हुने गठबन्धन अस्वीकार्य : गुरुङ	0
शाहरुखको कमब्याक फिल्म ‘पठान’ को रिलिज मिति घोषणा	1
स्थानीय तहमा मातृभाषा : कतै उत्साह, कतै सकस	1
अन्तर्राष्ट्रिय साहसी महिलाको पुरस्कार भूमिका श्रेष्ठलाई	2
रातोपाटी ब्रिफिङ : चुनावी गठबन्धनको पक्षमा देउवा, ओलीलाई निर्वाचन आयोगको जवाफ	1
एकीकृत समाजवादीविरुद्धको मुद्दामा २० चैतदेखि अन्तिम सुनुवाइ	1
प्रतिनिधिसभा बैठकअघि कार्यव्यवस्था समितिको बैठक, महाअभियाेग सिफारिस समितिबारे छलफल हुने	1
चेल्सी विक्री गर्नबाट रुसी अर्बपति अब्रामोभिचमाथी बेलायत सरकारको रोक	0
घृणाको राजनीतिक गर्ने सोचको अन्त्य गर्न आवश्यक छ : गगन थापा	1
दुई वर्षपछि मलेसियाको रोजगारी सुचारु	2
सडकमा पाेखिए महिला हिंसाका वेदना	0
फेसबुकको नयाँ प्राइभेसी सेन्टर के हो र कसरी प्रयोग गर्ने ? 	1
औपचारिक रुपमा सुरु भयो ‘नेपालपे क्यूआर’, यस्ता छन् मुख्य विशेषता	2
नबिल बैंक र नेपाल बंगलादेश बैंक मर्ज हुँदै	2
‘सिंगो बुटवलः एक विद्यालय’ को अवधारणा असफलतातर्फ: न रङ्गरोगन, न बिदामै एकरूपता	0
अरूलाई उपदेश दिने, आफ्नो विगत बिर्सिने?	0
नेपाली खेलकुदमा नारी दिवस मनाइयो	2
लिभरपुलले सिटीसँगको अग्रता तीन अंकमा झार्यो	1
कागजरहित स्वास्थ्य सेवा: एक नमुना बयालपाटा अस्पताल  	2
विकासबारे ओली र अर्थमन्त्रीको दोहोरी, आरोप–प्रत्यारोप कायमै	1
एमसीसी कार्यान्वयन : रातमाटेका स्थानीयको जीविकोपार्जन कार्यक्रम अगाडि बढ्यो	1
नेपालमा क्रिप्टोकरेन्सी, बिटक्वाइन लगायत अन्य नेटवर्किङका वेवसाइट बन्द हुने	1
चीन : लकडाउनपछि यी कम्पनीहरूले काम रोके, दुई करोडभन्दा बढी मानिस क्वारेन्टाइनमा	0
संखुवासभा दुर्घटनाका घाइतेलाई उचित उपचारको प्रबन्ध गर्न प्रधानमन्त्रीको निर्देशन	1
छाला हेरचाह दिनचर्या किन महत्वपूर्ण छ? के समावेश गर्नुपर्छ?	1
अपि पावरलाई १ करोड भन्दा बढी कित्ता हकप्रद विक्री गर्न बोर्डको अनुमति	2
संशोधन होइन एमसिसीको व्याख्यात्मक घोषणा भनेको : महासचिव पोखरेल	1
रुस-युक्रेन युद्धमा परेर अभिनेता पाशाको निधन	0
इजरायल जाने प्रतीक्षामा रहेकाको उडानमा ढिलाइ	0
मङ्गलबार ‘सार्वजनिक हुँदै’ अहिलेसम्मकै सस्तो आईफोन, अरु के आउँदैछन् नयाँ ?	2
पञ्जाब चुनावी नतिजा : आम आदमी पार्टी विजयी	1
पाँच युवा खेलाडीले भारतमा विशेष प्रशिक्षण गर्ने	2
तीन सदस्यीय पार्टी मुख्यालय समिति अनुमाेदन हुँदै	1
‘अल रोड्स लिड नर्थ’ ले केलाउँछ नेपाल-चीन अन्तर्सम्बन्ध	1
नेपाल सुगर लिग सहिद स्मारक लिगको विकल्पको रूपमा ल्याइएको प्रतियोगिता होइन	1
क्यानडामा जन्मियो हरियो कुकुर	1
युक्रेनको राजधानीतर्फ अघि बढिरहेको रुसी सेनाको लस्कर कहिले पुग्ला किभमा?	0
शाखा सञ्जालमा अब्बल एनआइसी एशिया, गाउँ–गाउँमा पुर्‍याएको छ वित्तीय सुविधा	2
रुस-युक्रेन युद्ध : लुट्स र नीप्रो सहरमा पहिलो पटक आक्रमण	0
बीपीलाई लागेको राजद्रोहको मुद्दामाथि डकुमेन्ट्री निर्माण	1
पल–समीक्षा प्रकरणमा एलिना भन्छिन्– ढिलो होला तर सत्य लुक्ने छैन 	0
वित्तीय साक्षरताकाे अभावले बजार भाेलाटायल भयाे : रमेश कुमार हमाल	0
पर्सामा सञ्चालित कुखुरा फर्ममा भेटियो बर्डफ्लू	0
प्रिमियर लिगः सिटीसँग हार्‍यो युनाइटेड	1
निशा रावलको खुलासा - म बाइपोलर हुँ	2
सरकारी र निजी क्षेत्रबीच सहकार्य हुन सके राम्रो नतिजा आउँछः ढकाल	2
बीपीको पर्चा लेखनबाट जन्मिएका लेखक कृष्णविक्रम	1
चुनावमा तालमेल हुँदैन : कोइराला	1
एमसीसीको विरोधमा रहेका विप्लवलाई देउवाले भने–विरोधका कार्यक्रम शान्तिपूर्ण होस्	0
करेन्ट चाउचाउ अब नयाँ स्वादमा, चिजबल पनि उपलब्ध	2
युक्रेनमाथि रुसको हमलाका लागि अमेरिका जिम्मेवार : उत्तर कोरिया	0
युक्रेनी प्रयोगकर्ताको डेटा सुरक्षित छ : टेलिग्राम	2
सशस्त्र प्रहरी नै ब्राउन सुगर र्‍याकेटका नाइके, झापामा बसेर काठमाडौँ सप्लाई	0
अब अनलाइन टिभीको इजाजत लिन पाँच लाख 	0
बुक बिल्डिङबाट आइपीओ आउनुपर्छ : निर्देशिका ठीक छ, मात्र नियत खराब हुनु भएन	1
एनएसएल अक्सनमा सर्वाधिक मूल्य प्राप्त गर्ने १८ खेलाडी	2
नेपाली ध्वाजावाहक जहाजले साउदीका तीन शहरमा उडान पायो	2
ठूलो बनाउने नाममा धेरै गल्तीहरू भए, विगतको त्रुटि अब दोहोर्‍याउदिनँ : कमल थापा	0
उज्वेकिस्तानका राष्ट्रपति पाकिस्तान भ्रमणमा	1
एप्पल, गुगल, नाइकीसहित दर्जनौँ कम्पनीले रुससँगको 'सम्बन्ध तोडे'	0
बुढानिलकण्ठमा डिशहोम फाइबरनेटको सह–वितरण सोरुमको उद्घाटन	1
एउटा भालुका कारण सन् १९६२ मा झन्डै परमाणु युद्ध भएको थियो	0
महानगरपालिका र उपमहानगरपालिकामा तालमेलको तयारी	2
क्रिकेटमा काठमाडौं, ब्याटमिन्टनमा चितवन र धादिङलाई उपाधि	2
थप इन्धन किन्न नसक्ने अवस्थामा आयल निगम	0
युद्ध मैदानमा युक्रेनी जोडीको विवाह	0
त्रिविमा प्राध्यापकमै राजनीतिक ध्रुवीकरण : तीन संगठनले मागे त्रिवि पदाधिकारीको राजीनामा 	0
सातदाेबाटाेलाई ४–१ गाेलले हराउँदै आर्मी झापा गाेल्ड कपकाे फाइनलमा	2
पहिलो पटक नेपालमा कृषि कर्जा सम्मेलन हुने, कृषकलाई सहयोग पुग्ने विश्वास 	2
रुस र बेलारुसका राष्ट्रपति बीच शुक्रबार भेटवार्ता हुने	1
बिमस्टेकको पाँचौँ सम्मेलनमा सहभागी  हुन प्रधानमन्त्री देउवा श्रीलंका जाँदै	2
चम्किलो छालाका लागि नरिवलको तेल उत्तम	2
यातायात व्यवस्था कार्यालय रुम्जाटारमा सिभिल बैंकको नयॉ एक्सटेन्सन काउन्टर	2
माओवादी केन्द्रमा फुटको भय	0
बढ्यो गर्मी, यस्ता पहिरनमा ध्यान दिनुहोस्	0
म्याग्दीको रत्नेचौरमा धार्मिक महोत्सव सुरु : समृद्धिको मुख्य आधार पर्यटन– मुख्यमन्त्री पोखरेल	2
हतारमा निःशस्त्रीकरणले युक्रेनको दुःख बन्दै रुस	0
विप्लव बालुवाटारमा, प्रधानमन्त्रीले थाले छलफल	1
यूएई भ्रमणलाई सतप्रतिशत नतिजामा परिणत गर्ने लक्ष्यमा नेपाल	2
गोरखाको आरुघाटमा केएमसी र पिपुल्स डेन्टल कलेजको निःशुल्क स्वास्थ्य शिविर	2
रूसले लियो बदला, अमेरिकी राष्ट्रपति बाइडेनमाथि नै प्रतिबन्ध घोषणा	0
प्रहरीले अनुसन्धान सुरु गरेसँगै दमौलीबाट भागे कथित अभियन्ता र युट्युवर, आरोपी भेट्ने पातलिए	0
पेट्रोल अब लिटरकै १५० रुपैयाँ, कुनमा कति बढ्यो मूल्य?	0
मुलुकमा ६ महिना मात्रै वस्तु आयात धान्न सक्ने राष्ट्र बैंकसँग सञ्चिति	0
भिजिट भिसाका लागि गृहको १८ बुँदे निर्देशन,  खाडी मुलुक जान वार्षिक न्यूनतम ५ लाख करयोग्य आय हुनुपर्ने	0
श्रीमतीमाथि ‘एसिड’ प्रहार, श्रीमान् समातिए	0
आशीषको ह्याट्रिकमा चर्च ब्वाइजले टुसाललाई हरायो	1
बेष्ट फाइनान्सले लेखापरिक्षक नियुक्ती र पारिश्रमीक तोक्न बोलायो सधारण सभा, बुकक्लोज कहिले ?	1
दुबईमा मधेशी एकता समाजको ‘होली रङ्गोत्सव’	1
६ महिनापछि एकदिवसीय अन्तर्राष्ट्रिय क्रिकेट खेल्दै नेपाल	2
एमालेमा एकता छ, हामीमा छैन : देउवा 	0
शुक्रबारदेखि भृकुटीमण्डपमा सातौं ‘नेपाल बिल्डकन इन्टरनेशनल एक्स्पो २०२२’	2
बन्द भयो चर्चित एप ‘युट्युव भ्यान्स्ड’	0
रुसले युक्रेनमा जैविक हतियार प्रयोग गर्न सक्ने, बोल्यो ह्वाइट हाउस	0
अरू दलसँग तालमेल गर्ने कि नगर्ने चैत दोस्रो साता टुंगो लाग्छ: महामन्त्री शर्मा	1
दोस्रो अभ्यासमा नेपाल ८१ रनले विजयी	2
याक्थुङ युवा मञ्चको आयोजनामा 'लिम्बू महिलाहरुको सार्वजनिक उपस्थिति र अवस्था' विषयक अन्तरक्रिया सम्पन्न	1
अब युट्युब च्यानल सञ्चालनका लागि इजाजत लिनुपर्ने, केके छ व्यवस्था ? 	0
देउवाले चुनावी तालमेल गर्न नमाने प्रचण्डले के गर्लान् ?	1
धानमा दाना नलागेर पीडित बनेका किसानलाई तत्काल राहत दिन कृषक समूह महासंघको माग 	2
२ वर्षपछि मलेसियाबाट आउन थाल्यो नेपाली श्रमिकको माग	2
विश्वमै पहिलोपटक मर्दै गरेको मानिसको दिमागको क्रियाकलाप रेकर्डिङ	0
