पाकिस्तानमा झण्डै १५ लाख ११ हजारमा कोरोना पुष्टि हुँदा १४ लाख ४५ हजार बढि संक्रमणमुक्त, मृत्यु कति ?	0
एउटा कालो भालुका कारण जब पूरै विश्व भयानक विनाशको संघारमा पुग्यो	0
सानिमा बैंकका ग्राहकले खल्ती वालेटमा फण्ड लोड गर्न सक्ने	2
पेट्रोलियम पदार्थबाट चल्ने कारभन्दा विद्युतीय गाडी कम विश्वसनीय !	1
एकवर्षमै मिनि रंगशाला तयार	2
यी सेटिङ गर्नुहोस्, मोबाइलमा आनन्दले चल्छ गेम	2
स्थानीय तहका जनप्रतिनिधिलाई प्रधानमन्त्रीले भने– जनताको मन जित्ने काम गरेर देखाउनूस्	1
रुसले भन्यो- युक्रेनमा करिब ५०० रसियन सेना मारिए	0
देशभर थपिए १५८ संक्रमित, २ जनाको मृत्यु	0
सम्पूर्ण शक्ति स्थानीय तह निर्वाचन केन्द्रीत नेकपा (समाजवादी) को निर्णय	1
आकार लिँदैछ ‘रैथाने विश्वविद्यालय’ को सपना	2
यूक्रेनी आणविक केन्द्रमा ‘कारबाही रोक्न’ रूसलाई आईएईएको आग्रह	0
अनलाईन टेलिभिजनसहित ओटीटी प्लेटफार्म नियमन गर्न कानूनी व्यवस्था , युट्युब पनि दर्ता हुनु पर्ने	1
तियानमेन स्क्वायर आन्दोलनकारी चिनियाँको अमेरिकामा हत्या 	0
राष्ट्रिय महिला भलिबलको उपाधि न्यु डायमन्डलाई	2
मृत्युभन्दा ठ्याक्कै अगाडि मानिसले के सोच्छ ? वैज्ञानिकले यस्तो रेकर्ड गरे	0
सडकमा काम गर्ने मजदुरहरुलाई साइकल उपहार	2
टिकटक र फेसबुकमा आएका आफ्नाबारेको भ्रामक सूचनाबारे नेपाली सेनाको आपत्ति	0
बारा कांग्रेसको चुनाव : कोइराला र सिटौला पक्षको समर्थन राजेशरायलाई	1
टेकबहादुर र जर्ज प्रिन्सको गोलमा आर्मीको अग्रता	1
एमालेले चुनावी कार्ययोजना बनाउँदै, यस्ता छ मंगलबारदेखिका कार्यक्रम	1
प्रदुषण कम गर्न युराे–६ मापदण्डमा जानुपर्ने विज्ञहरुको सुझाव	1
गरिबीले गरायो सामूहिक विष सेवन	0
माओवादीले स्थानीय चुनावमा 'लोकप्रिय' उम्मेदवार उठाउने	2
जीवनको सबैभन्दा ठुलो गुरू 'अनुभव' 	2
नेपाली राष्ट्रिय क्रिकेट श्रीलंका प्रस्थान, ४ अभ्यास खेल खेल्ने	2
रुपवती शहर, आरुका फूलले ढकमक्क	2
टी-२० ब्याटिङमा नेपालका हरेक कीर्तिमान पछ्याइरहेका कुशल	2
अपी पावरलाई धितोपत्र बोर्डबाट हकप्रद शेयर निष्कासनको अनुमति, कति कित्ता जारी गर्दै ?	1
अमेरिकामा पेट्रोलको मूल्य ११ प्रतिशतले बढ्‍यो	0
काँग्रेसमा को कति बलियो (गणितसहित)	1
श्रीलंका नेभी नेपालसँग १११ रनले पराजित	2
यी हुन् ‘घरबाट काम’ गर्नुका फाइदा र हानी	1
कुलमानको काम सम्झँदै अभिनेत्री सुरक्षाले लेखिन्' ‘बादलहरू’	2
साउदीका परराष्ट्रमन्त्री साउद नेपाल भ्रमणमा, मृत्युदण्ड पाएका नेपालीलाई माफी दिन आग्रह गरिने	2
सुरक्षित खानेपानी वितरणमा रूपन्देहीको शंकरनगर उत्कृष्ट	2
संसारको पहिलो घटना : ६ महिनाको बच्चामा एकैपटक नयाँ मुटु र ‘इम्युन ग्ल्याण्ड’ प्रत्यारोपण	1
गुगल म्यापले ठेगाना गलत देखाइरहेको छ ? यसरी सच्याउनुहोस् 	2
गृहमन्त्री र प्रकाण्डबीच सहमति कार्यान्वयनबारे छलफल	1
रुसी आक्रमणका कारण केही मिनेटमै २ हजारभन्दा बढी नागरिक मारिएको युक्रेनको दाबी	0
महिला तथा बालबालिका सेवा केन्द्रमा पीडितहरूको पहुँच	2
मस्कले डिजिटल क्वाइन बिक्री नगर्ने घाेषणा गर्दा बढ्यो क्रिप्टोको मूल्य  	1
अर्थमन्त्रीको अभिव्यक्तिप्रति मोरङ व्यापार संघको आपत्ति	0
यो वर्ष पनि सर्वाधिक मूल्यवान टायर ब्रान्ड बन्यो मिसिलिन	2
मेयरविरुद्ध जातीय छुवाछुत गर्नेलाई दुई महिना कैद	0
नेपालसँग सीमा जोडिएका राज्यका दुई मुख्यमन्त्री: उत्तराखण्डमा सिंह पराजित, यूपीमा योगीको कीर्तिमानी जीत	1
भारतले चिनियाँ एपहरुमा प्रतिबन्ध लगाउनुको कारण यस्तो	0
नेसनल लाइफको बोनस सेयर पारित गर्न कहिले बस्दैछ साधारण सभा ?	1
युक्रेन रुस युद्धको १३ औं दिन : कस्तो छ पछिल्लो अवस्था ?	0
बढ्दो शहरीकरणले पशुपक्षीको बास हरायो	0
रुकुम पूर्वमा नेता छान्न एमालेलाई अझै सकस	1
‘एउटै पात्रबाट सम्पूर्ण प्रेम सम्भव छैन’	1
नोबेल मेडिकल कलेजका विद्यार्थीलाई पढ्ने वातावरण बनाऊ : शिक्षा समिति	1
महाशिवरात्रीमा पशुपतिमा सजाईएका सयपत्री फूल गुर्जो चियाको लागि संकलन (फोटोफिचर)	1
दशैँ बिदा लम्बियो,अरु के–के बिदा थपियो ?	1
गठबन्धनको चित्त नदुखाउनुहोस् : प्रधानमन्त्री देउवा	1
यी हुन् युवतीका लागि उत्कृष्ट पहिरन	2
पनौती सहरका १२ कथा- पढ्नुहोस् एकै ठाउँ	1
कोरोना संक्रमणले त्रस्त हङकङ : शव राख्ने ठाउँको अभाव	0
राप्रपा नेता गणेश शेरचनको निधन	0
श्रद्धाञ्जलि ट्वीटसँगै संसार छाडेका शताब्दी बलर	0
चिनियाँ मुखपत्रमा राष्ट्रपति भण्डारीको अन्तर्वार्ता : बीआरआई कार्यान्वयन नभएकोमा चिन्तित	0
पञ्जाबको नतिजामाथि केजरीवालले भने, ‘म आतंकवादी होइन, सच्चा सपूत हुँ भन्ने कुरा देशले बताइदिएको छ’	1
पुष्पा र दुर्गाबहादुरलाई धरान रनको उपाधि	1
फेदीखोलामा खेलकुद सप्ताह सुरु	2
युद्धकालमा साम्यवादी अभ्यास : ‘कम्युन घर’सँगै भत्किएको सपना	0
वसन्तपुर डबली खनेर झन्डा फहराउने योजना 'अहिलेलाई स्थगित'	0
एक्सन र ड्रामाले भरपूर जोन अब्राहम अभिनित ‘अट्याक’को ट्रेलर	1
सवारी दुर्घटनामा परी अमेरिकामा एक बर्षमा ४६ हजारको मृत्यु	0
रुसी सैनिकका उच्च कमाण्डर मारिएको युक्रेनको दाबी	0
माओवादीमा पदाधिकारी चयनै नगरि चुनावमा जाने प्रचण्डको तयारी	1
रूसी सेना विरुद्ध पोस्ट गर्न फेसबुकको अनुमति 	0
तस्करी गर्न सुपारी, केराउ अत्यधिक आयात	0
प्रकाश सपुतको पिर विरुद्ध माओवादीका चार सङ्गठन एकै ठाउँ, कारबाहीको माग	0
स्वास्थ्य शिविरबाट ४ हजार ७०० बालबालिका लाभान्वित	2
आरसिटीसँग श्री भगवती स्तब्ध	1
पुराना र अनावश्यक ई-मेल डिलिट गर्ने स्मार्ट तरिका	2
भोली सार्वजनिक बिदा, सेयर बजार बन्द हुने	1
को हुन् पुटिनकी ‘गोप्य छोरी’ जसले भर्खरै इन्स्टाग्राम डिलिट गरिन्	1
नयाँ मोबाइल किन्दै हुनुहुन्छ ? थाहा पाइराख्नुहोस् विश्वकै नम्बर वान चिपसेट 	2
विद्युत् नियमन आयोगमा अध्यक्ष र तीन सदस्यका लागि दरखास्त आह्वान	2
बस भाडा बढाउन यातायात व्यवसायीको चर्को दबाब	0
अन्तत: पश्चिमाद्वारा रुसको तेल र ग्याँसमाथि समेत प्रतिबन्ध	0
धितोपत्र बोर्डका अध्यक्षलाई अर्थमन्त्रीको निर्देशन–कतैबाट प्रभावित भएर काम नगर्नू	1
शिक्षामन्त्रीले भने, ‘विश्वविद्यालय आधुनिकीरण नहुँदासम्म उच्च शिक्षा सुधार हुँदैन’	0
एमसीसीबाट छुटेको राष्ट्रवादको तीर	0
क्यासिनो र सरकारबीच तनाव: किन कठिन बन्यो यस व्यवसायबाट राजस्व सङ्कलन?	0
विप्लवको सक्रियता बढ्योः माओवादी नेता प्रकाशसँग छलफल, झलनाथ खनाल र भीम रावल पनि भेट्ने	1
कवि केसीसहित ४ स्रष्टालाई पारिजात सम्मान प्रदान गरिने घोषणा	2
नेपाली राष्ट्रिय क्रिकेट टिमको शानदार जित, ४ खेलाडीले बनाए अर्धशतक	2
नेपाल बैंक लिमिटेडका कर्मचारी तथा ग्राहकलाई स्वास्थ्य सेवामा छुट	2
बुढीगण्डकी जलविद्युत आयोजनाको प्रमुख नियुक्त	1
एमाले रुकुमपूर्वको अध्यक्षमा ओली	1
केयूकेएलको शुल्क पनि अब  ई–सेवामार्फत भुक्तानी गर्न सकिने	2
युक्रेनका राष्ट्रपति भन्छन्- रुसविरुद्ध जंगल, मैदान र समुद्री किनारबाट आक्रमण जारी राख्छौं	0
पुष्पपरागद्वारा वर्ष सम्मान तथा पुरस्कारको घोषणा 	2
भोलि पूर्वराष्ट्रपति र डलर अर्बपति एकै ठाउँमा	1
युद्धग्रस्त क्षेत्रबाट भागेर आश्रय लिइरहेको स्थानमा रुसी सैनिकको आक्रमण, ३५ जनाको मृत्यु	0
महाभियोग लागेका प्रधानन्यायाधीश राणाले टुंग्याउन चाहेको एउटा मुद्दा	0
अभिनेत्री सोनाक्षीविरुद्ध पक्राउ पुर्जी जारी भएकै हो?	0
सोपान फर्मास्यूटिकल्सले बजारमा ल्यायो ६ प्रकारका औषधि	2
अमेरिकाको दाबी- युक्रेनमा अहिलेसम्म करिब ६ हजार रुसी सैनिकको मृत्यु	0
स्थानीय निर्वाचनमा ७९ दलले भाग लिन पाउने  	1
भार्डी चम्कदा लेस्टरको सहज जित	2
भूमिका श्रेष्ठ २०२२ को सहासिक महिला पुरस्कारबाट सम्मानित	2
‘कबड्डी ४’ को रिलिज मिति सर्‍यो, जेठ १३ मा प्रदर्शन हुने	1
एमसीसी’bout बैठकमै दाहालको आलोचना हुने	1
जलवायु परिवर्तनका असरप्रति सबै सचेत हुनु जरुरी छ : मन्त्री रेग्मी	2
रोग लुकाउँदा फैलँदै कुष्ठरोग	0
विजय र निशाको ‘पिपलु’ सार्वजनिक 	1
प्राविधिक समस्या समाधान नभएपछि सेयर कारोबार बन्द	0
‘रुसले चीनसँग सैन्य तथा आर्थिक सहयोग मागिरहेको छ’	0
उपत्यकामा विभिन्न स्थानबाट लागूऔषधसहित १० पक्राउ	0
अन्तर्राष्ट्रिय अदालत जानुपर्ने भयले प्रचण्डले एमसीसीमा सहमति जनाए : विजुक्छे	0
क्रिकेट खेल हेर्न नगरपालिकाले दियो २ दिन सार्वजनिक विदा	1
युवासम्म पुग्नै सकेन युवा परिषद्	0
गुलाबी छाला र कपालको चाया हटाउन यसरी प्रयोग गर्नुहोस् चुकन्दर	2
झापा गोल्डकप : झापाको सानदार जित	2
रुसमाथि थप प्रतिबन्ध लगाउन जेलेन्स्कीको आग्रह	0
प्रदेशसभा सदस्यसँग सहकार्य गर्दै कर्णालीका युवा	2
सैनिक सहचारीहरु नेपाली सेनाको मुख्यालयमा	1
भदौमा सौगात र सृष्टिको ‘द सिक्रेट अफ राधा’	1
सुरु भयो बाघ हेर्ने याम	1
एन्फाले पत्र काटे पनि एनएसएलको अक्सन नरोकिने !	1
आफ्नो मृत्युमा अर्कोलाई नयाँ जुनी	0
‘फास्ट एण्ड फ्युरियस’को दशौं शृंखलामा जेसन मोमोआ ‘भिलेन’ बन्ने	1
१५ लाखको लगानी, ५० करोडको व्यापार	2
नयाँ वर्षसँगै एमडीएमएस पूर्ण रुपमा लागू हुने, नेपालमा अवैध मोबाइलमाथि प्रतिबन्ध लाग्ने	2
युक्रेनकी प्रथम महिलाको खुलापत्र	0
युनिक नेपाल लघुवित्तले कसलाई नियुक्त गर्यो सेयर रजिष्ट्रार ?	1
एमाले सधैँ मधेसको पक्षमा छ : वरिष्ठ उपाध्यक्ष पोखरेल	1
लुम्बिनी अस्पतालको ५ अर्बको ठेक्कामा मिलेमतो, राज्यले डेढ अर्ब गुमाउने	0
पीएसजीलाई लिगमा १५ अंकको अग्रता 	2
युट्युब च्यानल नियमनको बाटो खुल्यो, नेटफ्लिक्स जस्ता सेवाले अनुमतिपत्र लिनुपर्ने	1
स्मार्ट टेलिकमको बक्यौता झन्डै ८ अर्ब पुग्यो, लाइसेन्स खारेज गर्न सोधियो स्पष्टीकरण	1
राम्रो निद्राका लागि मस्तिष्कलाई 'ट्रेन' गर्नु जरुरी, जान्नुहोस् विशेषज्ञका यी ३ सुझाव	1
पन्जाबमा आम आदमीलाई दुई तिहाइ बहुमत !	2
प्याब्सनको महाधिवेशन चैत ९ गतेदेखि हुने	1
बेहाल अवस्थामा तिर्खाएका ढुंगेधाराहरु	0
विदेश त घुम्न जाने मात्रै हो, काम त आफ्नै देशमा गर्नुपर्छः युवा उद्यमी खुशी पाठक (भिडिओसहित)	2
प्रोग्रेशिभ फाइनान्सको साधारण सभा पूनः आह्वान, बोनस र मर्जर सम्बन्धि प्रस्ताव पारित हुने	1
माओवादी कर्णाली प्रदेशको पदाधिकारी सर्वसम्मत, अध्यक्षमा विमला केसी	1
‘दुर्गममा बिमाको पहुँच वृद्धि गर्न बिमा शिक्षाको प्रचार आवश्यक’	2
माओवादी केन्द्र सङ्गठनलाई पूर्णता दिने तयारी, को बन्लान् महासचिव ?	1
कपिलवस्तुमा शान्ति समाजको २४औं राष्ट्रिय परिषद् बैठक प्रारम्भ	2
युक्रेनलाई निशस्त्र गरेरै छाड्छौँ: पुटिन	0
अवसर र लाभ उपलब्ध गराउने बहानामा कुनै गैर बैकिङ कारोबार नगर्न गृहमन्त्रालयको चेतावनी	1
तौल कम गर्न खानपानमा परिवर्तन गरेर मात्रै नहुने	1
गुराँस लाइफले विभिन्न पदमा माग्यो कर्मचारी, ७ दिनभित्र दिनुपर्ने आवेदन/कसरी ?	2
पाँचपोखरी टी-२० को फाइनल आज	1
ईसेवा वालेटबाट अब शुन्य शुल्कमा रेमिट्यान्स पठाउन सकिने	2
भिजिट भिसालाई व्यवस्थित गर्न अध्यागमन विभागलाई गृहको १८ बुँदे निर्देशन	2
हास्य अभिनेतृ पल्पसाको मिर्गौला प्रत्यारोपन सफल	2
कहिले पाउँछन् गाउँका सिंहदरवारले जनशक्ति?	0
खानेपानीका ४०० ट्याङकी किन सञ्चालनमा आएनन् ? मन्त्री चौधरीले बताए यस्तो कारण 	0
उत्तर कोरियाद्वारा व्यालेस्टिक क्षेप्यास्त्रको केही भाग परीक्षण 	0
साउथ सुपरस्टार प्रभाशलाई पछार्यो ‘द कश्मीर फाइल्स’ ले	1
सात महिनामा भित्रियो २७ अर्बको झन्डै ३९ क्विन्टल सुन	0
उद्योगीहरू भन्छन्– बैंकमा भएको अधिकांश पैसा आयातित बस्तुमा खर्च हुँदा आर्थिक संकट निम्तियो	0
यसरी पाएका थिए बेलायती महिलाले मताधिकार	2
कोभिड - १९ को दुई वर्षपछि विश्व चलायमान	0
अन्तर्राष्ट्रिय नारी दिवसमा ‘द ऐला लाउन्ज’द्वारा प्रेरणादायी महिला सम्मानित	2
इतिहास शिरोमणि बाबुराम आचार्यको १३५ औँ जन्मजयन्तीः किन भएनन् ३१ वर्षसम्म खरदारबाट बढुवा ?	1
कांग्रेस धनुषाको सभापतिमा कुनै उम्मेदवारले ल्याएनन् ५१ प्रतिशत, दोस्रो चरणमा मतदान हुँदै	1
विश्वकप लिग टूका लागि १६ सदस्यीय टोली घोषणा, सोमपाल र करण पनि समेटिए	2
एफए कप : मिडल्सब्रोसँग हारेर टोटनहम बाहिरियो	0
