गरिबीबाट मुक्ति पाउन काठमाडौंमा परिवारद्वारा सामूहिक आत्महत्याको प्रयास	गरिबीबाट मुक्ति पाउन राजधानी काठमाडौंमा बसोबास गर्ने एक परिवारका सबै सदस्यले सोमबार राति एकसाथ विष सेवन गरेर सामूहिक आत्महत्याको प्रयास गरे। तर एकैसाथ आत्महत्या गर्ने उनीहरूको प्रयास भने सफल हुन सक...	ratopati.com	८ घण्टा अघि	https://l.hamropatro.com/r/https://ratopati.com/story/225298/2022/3/9/suicide-	popular
युक्रेन-रुस युद्धः रुसको चेतावनीबीच पश्चिमा देशहरूद्वारा उसका तेल र ग्यासमा प्रतिबन्ध घोषणा	युक्रेनमाथि मस्कोको आक्रमणको विरोधमा आर्थिक प्रतिबन्धलाई बढाउँदै अमेरिका र ब्रिटेनले रुसी तेलमा प्रतिबन्ध लगाउँदै छन् भने युरोपेली सङ्घले रुसी ग्यासमा आफ्नो निर्भरता समाप्त गर्न गइरहेको छ। अमेरिकी...	bbc.com	८ घण्टा अघि	https://l.hamropatro.com/r/https://www.bbc.com/nepali/news-60672045?xtor=AL-73-[partner]-[hamro.patro]-[headline]-[nepali]-[bizdev]-[isapi]	popular
रामकोट घटना :  जसले आफूसँगै ११ वर्षीया छोरीलाई पनि विष पिलाए  !	काठमाडौंको नागार्जुन नगरपालिका–६ रामकोट स्थित डाँडापौवामा सोमबार राति विष पिएका ४ जनाको स्वयम्भु स्थित मनमोहन मेमोरियल अस्पतालमा उपचार हुँदै छ । ३३ वर्षका सुवर्णमान प्रधानको गए राति नै मृत्यु भयो ।...	ratopati.com	८ घण्टा अघि	https://l.hamropatro.com/r/https://ratopati.com/story/225306/2022/3/9/ramkot-suicide-	popular
युक्रेन युद्ध: भारतीय डाक्टर जो युक्रेनमा ज्यागुआर र प्यान्थरसँग फसेका छन्	एक साताभन्दा बढी समयदेखि युद्धग्रस्त युक्रेनस्थित आफ्नै घरको भूमिगत कोठामा एक भारतीय डाक्टर ठूला जङ्गली बिराला प्रजातिका आफ्ना पाल्तु जनावरहरू- ब्ल्याक प्यान्थर र ज्यागुआरसँगै फसेका छन्। गिरीकुमार...	bbc.com	७ घण्टा अघि	https://l.hamropatro.com/r/https://www.bbc.com/nepali/news-60647087?xtor=AL-73-[partner]-[hamro.patro]-[headline]-[nepali]-[bizdev]-[isapi]	popular
रुस-युक्रेन युद्धमा परेर अभिनेता पाशाको निधन	रुस र युक्रेनबीच युद्ध जारी छ । यो युद्धमा परेर एक युक्रेनी अभिनेता पाशा लीको निधन भएको छ । युक्रेनी सेनासँग आबद्ध पाशाले देशको सुरक्षाको क्रममा ज्यान गुमाएका हुन् । पाशा अग्रमोर्चामा रहेर सेनाको ...	ratopati.com	७ घण्टा अघि	https://l.hamropatro.com/r/https://ratopati.com/story/225311/2022/3/9/russia-ukrine-war	popular
उत्तर कोरियाले आणविक परीक्षण साइट मर्मत गरेको अमेरिकी स्याटेलाइटमा देखियो	उत्तर कोरियाले बन्द आणविक परीक्षण साइट मर्मत गर्न थालेको अमेरिकी स्याटेलाइट कम्पनी म्याक्सर टेक्नोलोजिले सार्वजनिक गरेका तस्बिरहरूमा देखिन्छ । उत्तर कोरियाली नेता किम जोङ उनले सम्पूर्ण आणविक परीक्ष...	ratopati.com	६ घण्टा अघि	https://l.hamropatro.com/r/https://ratopati.com/story/225327/2022/3/9/north-korea	popular
सिद्धबाबाले बलात्कार गरेका हुन् कि राजीखुशी ? आज सुनुवाइ हुँदै	धरानको चतराधाममा बस्ने सिद्धबाबा उर्फ कृष्णबहादुर गिरी विरुद्धको जबरजस्ती करणीको मुद्दामा उच्च अदालत विराटनगरले (आज) बुधबार सुनुवाइ गर्ने भएको छ ।  अदालतले आफ्नो वेबसाइटमा राखेको सूचना अनुसार ५ नम...	ratopati.com	७ घण्टा अघि	https://l.hamropatro.com/r/https://ratopati.com/story/225308/2022/3/9/siddha-baba-	popular
युक्रेन प्रवेश गर्ने रसियाली सैन्य गाडीमा किन पोतियो 'जेड' संकेत? 	युक्रेनमा अहिले ट्याङ्क तथा रसियाली सैन्य सवारीसाधनहरू दौडिनु सामान्य भइसकेको छ। १३ दिनअघिबाट रसियाले युक्रेनमा युद्ध सुरु गरेपछि यस्ता गाडी कीभ र अन्य युक्रेनी सहरहरू नजिकै घुमिरहेका देखिएका छन्। ...	pahilopost.com	७ घण्टा अघि	https://l.hamropatro.com/r/https://pahilopost.com/content/20220309071714.html	popular
युक्रेनका राष्ट्रपति भन्छन्- रुसविरुद्ध जंगल, मैदान र समुद्री किनारबाट आक्रमण जारी राख्छौं	२५ फागुन, काठमाडौं । युक्रेनका राष्ट्रपति भोलोदिमिर जेलेन्स्कीले रुसविरुद्ध जंगल, मैदान र समुद्री तटबाट आक्रमण जारी राख्ने बताएका छन् । बेलायतको तल्लो सदन (हाउस अफ कमन्स)मा सम्बोधन गर्दै जेलेन्स्क...	onlinekhabar.com	५ घण्टा अघि	https://l.hamropatro.com/r/https://www.onlinekhabar.com/2022/03/1090992	popular
रुस–युक्रेन युद्धको असर : नेपाली रुपैयाँ इतिहासमै कमजोर !	 नेपाली बजारमा अमेरिकी डलरको भाउ अहिलेसम्मकै महँगो भएको छ । नेपाल राष्ट्र बैंकले मंगलबारका लागि अमेरिकी मुद्रा (डलर)को बिक्रीदर १२३ दशमलव ४४ रुपैयाँ र खरिददर १२२ दशमलव ८४ रुपैयाँ निर्धारण गरेको थि...	lokaantar.com	६ घण्टा अघि	https://l.hamropatro.com/r/https://lokaantar.com/story/174984/2022/3/9/press/rupee-	popular
सिरियाली लडाकु भर्ना गर्दै रुस : अमेरिका	एक वरिष्ठ अमेरिकी सैन्य अधिकारीले रुसले युक्रेनमा लड्न सिरियाली लडाकुहरूलाई भर्ती गर्ने प्रयास गरिरहेको दबी गरेका छन्। 'रूसी राष्ट्रपतिले युक्रेनभित्रको युद्धको लागि अत्यन्त महत्त्वपूर्ण प्रतिबद्धत...	ratopati.com	७ घण्टा अघि	https://l.hamropatro.com/r/https://ratopati.com/story/225320/2022/3/9/america-	popular
अमेरिकासँग संवाद गर्न साउदी अरेबिया र युएईले किन गरे अस्वीकार?	Created with sketchtool. सम्बन्धित अमेरिकाले रुसी इन्धनमा लगायो प्रतिबन्ध, बेलायतले पनि रुसी इन्धन ‘फेज आउट’ गर्ने दुई ठूला तेल उत्पादक खाडी देश साउदी अरेबिया र संयुक्त अबर इमिरेट्स (युएई) का ने...	deshsanchar.com	५ घण्टा अघि	https://l.hamropatro.com/r/https://deshsanchar.com/2022/03/09/622136/	popular
किएभमा आक्रमण गर्न रुसी सेना तयार, लगभग सुरक्षित पारिसक्यो अन्य क्षेत्र	युक्रेनमा रुसी सैनिकहरूको कारवाहीका विषयमा जारी गरिएका नक्सा हेर्दा रुसले निर्णायक विजय पाउनै लागेको देखिएको छ ।  राजधानी किएभको उत्तरपूर्वी भागमा रुसी सेनाले दुईवटा पकेट एरिया तयार पारेको छ । त्य...	lokaantar.com	२ घण्टा अघि	https://l.hamropatro.com/r/https://lokaantar.com/story/175013/2022/3/9/international/ukraine-invasion	popular
चन्द्रागिरिमा बिरालोलाई थापेको पासोमा चितुवा परेपछि ...	चन्द्रागिरि नगरपालिका-१ दहचोक थापागाउँमा चितुवा फेला परेको छ। स्थानीय दलबहादुर बुढाले भाडामा लिई सञ्चालन गरेको कुखुराको खोरमा मंगलबार राति सवा १२ बजे चितुवा फेला परेको हो। बिरालोलाई थापेको पासोमा...	setopati.com	४ घण्टा अघि	https://l.hamropatro.com/r/https://www.setopati.com/social/264145	popular
पुटिनले युक्रेनको राजधानीलाई दुई दिनमा कब्जा गर्ने योजना बनाएका थिए : सीआईए प्रमुख	काठमाडौं- रुसी राष्ट्रपति भ्लादमिर पुटिनले युक्रेनको राजधानी किएभलाई दुई दिनमा कब्जा गर्ने योजना बनाएको अमेरिकी गुप्तचर निकाय सीआईएका प्रमुख विलियम बर्न्सले बताएका छन्। संसदीय सुनुवाइको क्रममा बोल...	nepallive.com	४ घण्टा अघि	https://l.hamropatro.com/r/https://nepallive.com/story/274854	popular
युक्रेन युद्धः रुस र चीनबीच कति ठूलो व्यापार छ, के प्रतिबन्ध सामना गर्न चीनले सघाउन सक्छ	रुसले युक्रेनमा आक्रमण गरेपछि उसलाई एक्लो पार्न अमेरिका, ईयू र ब्रिटेनले जस्तै प्रतिबन्धहरू लागु गर्नका निम्ति अस्ट्रेलियाले चीनलाई आग्रह गरेको छ। प्रधानमन्त्री स्कट मरिसनले रुसबाट थप गहुँ किन्न च...	bbc.com	२ घण्टा अघि	https://l.hamropatro.com/r/https://www.bbc.com/nepali/news-60658935?xtor=AL-73-[partner]-[hamro.patro]-[headline]-[nepali]-[bizdev]-[isapi]	popular
युक्रेनलाई लडाकू विमान दिने सवालमा अमेरिका र पोल्यान्डबीच मतभिन्नता	पोल्यान्डले आफ्नो मिग–२९ लडाकू विमान अमेरिकालाई दिने अनि अमेरिकाले त्यो विमान युक्रेनलाई दिने भनी राखेको प्रस्तावलाई अमेरिकाले लत्याएको छ ।  अमेरिकाको रक्षा मन्त्रालय पेन्टागनका प्रेस सचिव जोन कर्...	lokaantar.com	३ घण्टा अघि	https://l.hamropatro.com/r/https://lokaantar.com/story/175008/2022/3/9/international/weapons-to-Ukraine	popular
मेयरलाई पार्टी प्रवेश गराउन रंगेली आउँदै ओली	२५ फागुन, विराटनगर । नेकपा (एमाले)का अध्यक्ष केपी शर्मा ओली आज मोरङको रंगेलीमा आउँदैछन् । रंगेली नगरपालिकाका मेयर दिलीप बगडियालाई पार्टी प्रवेश गराउनका लागि आज दिउँसो अध्यक्ष ओली रंगेली आउन लागेका ...	onlinekhabar.com	५ घण्टा अघि	https://l.hamropatro.com/r/https://www.onlinekhabar.com/2022/03/1091010	popular
गठबन्धनको चित्त नदुखाउनुहोस् : प्रधानमन्त्री देउवा	काठमाडौं : प्रधानमन्त्री शेरबहादुर देउवाले सत्ता गठबन्धन र प्रतिपक्षी दलका नेताहरूको चित्त दुख्ने खालका अभिव्यक्ति नदिन पार्टीका शिर्ष नेताहरूलाई निर्देशन दिएका छन्। स्थानीय तह चुनावसम्बन्धी अभियान...	annapurnapost.com	८ घण्टा अघि	https://l.hamropatro.com/r/https://annapurnapost.com/news/198009	popular
पुटिनलाई चुनौती दिँदै जेलेन्स्कीले खुलाए आफ्नो ‘लोकेसन’	काठमाडौं । युक्रेनका राष्ट्रपति भोलोदिमिर जेलेन्स्कीले आफू कुनै पनि हालतमा किभ छाडेर अन्यत्र नजाने प्रतिज्ञा गरेका छन् । सामाजिक सञ्जालमार्फत एक अभिव्यक्ति सार्वजनिक गर्दै जेलेन्स्किीले यस्तो प्रति...	baahrakhari.com	५९ मिनेट अघि	https://l.hamropatro.com/r/https://baahrakhari.com/news-details/343721	popular
जो १५ दिन बाइक चलाएर काठमाडौंदेखि भारतको कन्याकुमारी पुगेर फर्के (भिडिओ)	नेपालको संघीय राजधानी काठमाडौंदेखि भारतको कन्याकुमारीसम्म बाइक यात्रा। दिनमा कहिले लगातार ८ घन्टा, कहिले १६ घन्टासम्म बाइक चलाएरै। काठमाडौंदेखि भैरहवा—उराइ—इन्दोर—पुने—गोवा—म्यांग्लोर—क्यालकट—एर्न...	setopati.com	८ घण्टा अघि	https://l.hamropatro.com/r/https://www.setopati.com/multimedia/264115	popular
पाकिस्तानका प्रधानमन्त्री इमरान खानविरुद्ध अविश्वासको प्रस्ताव पेस	२५ फागुन, काठमाडौं । पाकिस्तानका प्रधानमन्त्री इमरान खानविरुद्ध अविश्वासको प्रस्ताव पेस भएको छ । विपक्षी दलहरुको गठबन्धन पाकिस्तान डेमोक्रेटिक मुभमेन्ट (पीडीएम)ले प्रधानमन्त्री खानविरुद्ध अविश्वास ...	onlinekhabar.com	६ घण्टा अघि	https://l.hamropatro.com/r/https://www.onlinekhabar.com/2022/03/1090979	popular
ऋण तिर्न नसकेपछि विष सेवन	काठमाडौं । सोमबार साँझ नागार्जुन नगरपालिका–६, डाडापौवामा एकै परिवारका पाँच जनाले विष सेवन गरे । विष सेवन गर्नेमध्येका एक जनाको मृत्यु भएको छ भने चार जनाको अवस्था गम्भीर छ । प्रहरीले घटनाको अनुसन्धा...	rajdhanidaily.com	६ घण्टा अघि	https://l.hamropatro.com/r/https://rajdhanidaily.com/id/57801/	popular
चीन भन्छ– रुससँगको मित्रता चट्टान सरह बलियो 	बेइजिङ । रुससँग चीनको मित्रता चट्टान सरह बलियो अवस्थामा रहेको चिनियाँ विदेश मन्त्री वाङ यिले बताएका छन् । यससँगै उनले आफूहरुबीच सहकारिताको सम्भाव्यता पनि विस्तृत रहेको उल्लेख गरेका छन् ।  दुई देशब...	baahrakhari.com	६ घण्टा अघि	https://l.hamropatro.com/r/https://baahrakhari.com/news-details/343697	popular
संसारभरी पुनः बढिरहेको छ कोरोना संक्रमण, चौथो लहरबारे कस्तो छ विज्ञको धारणा ?	संसारभरी कोरोना संक्रमितको संख्यामा पुनः वृद्धि देखिन थालेको छ । पछिल्लो २४ घण्टामा संसारभरी कोरोनाभाइरसका १६.०३ लाख संक्रमित भेटिएका छन् । यतिमात्रै होइन ८ मार्चमा ६,८१८ जनाले आफ्नो ज्यान गुमाएका ...	ratopati.com	१ घण्टा अघि	https://l.hamropatro.com/r/https://ratopati.com/story/225395/2022/3/9/no-fourth-wave-of-coronavirus-will-occur-in-india-says-virologist-t	popular
रुसविरुद्ध जंगल, मैदान र समुद्री किनारामासमेत लड्न तयार छौँ : जेलेन्स्की	युक्रेनका राष्ट्रपति भोलोदिमिर जेलेन्स्कीले आफ्नो देशले रुसविरुद्धको लडाइ नछोड्ने बताएका छन् । बेलायतको संसद हाउस अफ कमन्सलाई सम्बोधन गर्दै जेलेन्स्कीले युद्ध अन्त्य नहुने बेलासम्म युक्रेन रुसविरुद...	ratopati.com	७ घण्टा अघि	https://l.hamropatro.com/r/https://ratopati.com/story/225314/2022/3/9/volodymyr-jelensky-	popular
युक्रेन तथा रसियाका छिमेकी देशमा आठ हजार बढी नेपाली श्रमिक	फाइल तस्विर युक्रेन तथा रसियाका छिमेकी श्रम गन्तव्यमा आठ हजारभन्दा बढी श्रमिक कार्यरत रहेको पाइएको छ। युक्रेन र रसिया युद्ध बढ्दै गए सो क्षेत्र वरपर रहेका आधा दर्जन देशमा कार्यरत आठ हजारभन्दा बढी ...	ratopati.com	८ घण्टा अघि	https://l.hamropatro.com/r/https://ratopati.com/story/225299/2022/3/9/nepali-	popular
इमरान खानविरुद्ध अविश्वासको प्रस्ताव	पाकिस्तानका विपक्षी दलहरूले इमरान सरकारविरुद्ध अविश्वासको प्रस्ताव पेश गरेका छन् । अविश्वासको प्रस्ताव ल्याउनमा विपक्षी दलहरूको गठबन्धन पाकिस्तान डेमोक्रेटिक मुभमेन्ट (पीडीएम)को महत्वपूर्ण भूमिका र...	ratopati.com	७ घण्टा अघि	https://l.hamropatro.com/r/https://ratopati.com/story/225318/2022/3/9/imran-khan-	popular
चुनाव चिन्ह प्रयोग गर्न नदिने निर्वाचन आयोगको निर्णयप्रति सीके राउतको असन्तुष्टि	जनमत पार्टीका अध्यक्ष डा. सिके राउतले  साना दललाई दिइसकेको निर्वाचन चिन्ह प्रयोग गर्न नदिने निर्वाचन आयोगको निर्णयप्रति असन्तुष्टि जनाएका छन् ।  उनले बुधवार ट्वीटरमा एक ट्वीट गर्दै डा. राउतले यस्त...	lokaantar.com	४ घण्टा अघि	https://l.hamropatro.com/r/https://lokaantar.com/story/175001/2022/3/9/politics/ck-raut-	popular
भूमि आयोगले माग्यो ठूलो संख्यामा कर्मचारी, कसरी दिने आवेदन ? [सूचनासहित]	राष्ट्रिय भूमि आयोगले विभिन्न २ पदमा १ सय ९९ जना कर्मचारी माग गरेको छ । आयोगले सर्भेक्षक र अमिन पदमा करारमा काम गर्नका लागि सो संख्यामा कर्मचारी माग गरेको हो ।  इच्छुक उम्मेदवारहरूले ७ दिन भित्रम...	lokaantar.com	६ घण्टा अघि	https://l.hamropatro.com/r/https://lokaantar.com/story/174992/2022/3/9/government_job_vacancy/bhumi-aayog-	popular
