थप १ सय ९४ जनामा सङ्क्रमण पुष्टि	देशभर थप १ सय ९४ जनामा कोरोनाभाइरसको सङ्क्रमण पुष्टि भएको छ । ६ हजार ३९४ जनाको कोरोना परीक्षण गर्दा पीसीआर विधिबाट ७४ तथा एन्टिजेन विधिबाट १२० जनामा सङ्क्रमण पुष्टि भएको स्वास्थ्य तथा जनसङ्ख्या मन्...	ratopati.com	१८ घण्टा अघि	https://l.hamropatro.com/r/https://ratopati.com/story/225243/2022/3/8/corona-update-	health
थप १९४ जनामा कोरोना संक्रमण, ३४८ जना निको	काठमाडौँ — नेपालमा २४ घण्टामा ६ हजार ३९४ परीक्षण हुँदा १९४ जनामा कोरोना संक्रमण देखिएको छ । स्वास्थ्य तथा जनसंख्या मन्त्रालयले मंगलबार दिएको जानकारीअनुसार देशभर ३ हजार ६३८ पीसीआर परीक्षणमा ७४ र २ ह...	ekantipur.com	१८ घण्टा अघि	https://l.hamropatro.com/r/https://ekantipur.com/news/2022/03/08/164673535765039703.html	health
२४ घण्टामा थपिए १९४ संक्रमित, एक जनाको मृत्यु	पछिल्लो २४ घण्टामा १९४ जनामा संक्रमण पुष्टि भएको छ ।  स्वास्थ्य तथा जनसंख्या मन्त्रालयका अनुसार ६ हजार ३९४ नमूना परीक्षणमध्ये ७४ पीसीआर र १२० जनामा एन्टिजेन पोजिटिभ देखिएको हो ।  यस्तै पछिल्लो २४...	lokaantar.com	१८ घण्टा अघि	https://l.hamropatro.com/r/https://lokaantar.com/story/174924/2022/3/8/main-news/corona-update-	health
११२ औं अन्तराष्ट्रिय महिला दिवसका अवसरमा हिमालपारि गुञ्जियो महिला आवाज	जोमसोम : ११२ औं अन्तराष्ट्रिय महिला दिवसका अवसरमा मंगलबार हिमालपारी मुस्ताङमा महिला आवाज गुञ्जिएको छ। पुरुष जस्तै समान पहुँच र अधिकार नेपाली महिलाहरुले पनि पाउनुपर्ने भन्दै  मुस्ताङका महिलाहरुले वि...	annapurnapost.com	१९ घण्टा अघि	https://l.hamropatro.com/r/https://annapurnapost.com/news/197983	health
कामकाजी महिलाका लागि ७ स्वास्थ्य टिप्स	–मानसिक र शारीरिक रूपमा खट्नुपर्ने भएकाले क्याल्सियम र आइरन पाइने खाना प्रशस्त खाने।  –झोल खाना र सलाद बढी खाँदा दिनभरि ताजा महसुस गरिन्छ । –चिल्लो, पिरो र मसलादार खाना कम खाने ।  –चिया र कफी कम...	swasthyakhabar.com	१९ घण्टा अघि	https://l.hamropatro.com/r/https://swasthyakhabar.com/story/45169	health
विदेश त घुम्न जाने मात्रै हो, काम त आफ्नै देशमा गर्नुपर्छः युवा उद्यमी खुशी पाठक (भिडिओसहित)	काठमाडौं, २४ फागुन । आज ११२ औं अन्तर्राष्ट्रिय नारी दिवस हो । विभिन्न कार्यक्रमको आयोजना गरी नेपालमा पनि यो दिवस मनाइदै छ । पुरुष मात्र घर बाहिर काममा हिड्ने हाम्रो पुरानो मान्यतालाई अहिलेका महिलाह...	reportersnepal.com	२० घण्टा अघि	https://l.hamropatro.com/r/https://www.reportersnepal.com/2022/03/657647	health
Samsung Galaxy S22 Ultra Impressions: Finally a New Note!	Things I Like Premium Design 120Hz AMOLED panel Good Battery S Pen support Upgraded main camera Potential Weakness Thermals Sustained Peak Performance Samsung has launched the Samsung S22 ...	techlekh.com	२० घण्टा अघि	https://l.hamropatro.com/r/https://techlekh.com/samsung-s22-ultra-impressions/	health
महिला निर्देशकका ११ राम्रा नेपाली छोटा फिल्म, हेर्नुहोस् युट्युबमा	नेपाली समाजभित्रका विभिन्न समुदायले घरेलु हिंसा, सामाजिक हिंसा, प्राकृतिक प्रकोप, आर्थिक समस्या, द्वन्द्वदेखि प्राकृतिक प्रकोपसम्मका समस्यालाई आ-आफ्नै हिसाबले भोग्दै आएका छन्। यस्ता तमाम समस्याले ...	setopati.com	२० घण्टा अघि	https://l.hamropatro.com/r/https://www.setopati.com/art/art-activity/264071	health
कोरोना महामारीले बालिका थप जोखिममा: युनिसेफ	कोभिड-१९ को महामारीले बालिकालाई थप जोखिममा पारेको युनिसेफले जनाएको छ। अन्तर्राष्ट्रिय महिला दिवसको अवसरमा युनिसेफकी कार्यकारी निर्देशक क्याथरिन रसेलले वक्तव्य जारी गरी कोडिभ-१९ का कारण विद्यालय बन...	himalkhabar.com	२१ घण्टा अघि	https://l.hamropatro.com/r/https://www.himalkhabar.com/news/128726	health
'कार चढेर मकै खान आउनेले ५ रुपैयाँमा मोलमोलाइ गर्छन्'	काठमाडौँ — ६८ वर्षीया मिठू रिजाल १६ वर्षदेखि काठमाडौंको बानेश्वर-बत्तीसपुतली सडकखण्डमा मकै पोलेर गुजारा चलाउँदै आएकी छिन् । तीनकुने र कालीमाटीबाट मकैका घोगा ल्याएर उनले सडकछेउमै बेच्दै आएकी छन् । ...	ekantipur.com	२२ घण्टा अघि	https://l.hamropatro.com/r/https://ekantipur.com/feature/2022/03/08/164666362818921632.html	health
मलेसिया जाने कामदारको मेडिकल शुल्क वृद्धि	नेपालबाट वैदेशिक रोजगारीको लागि मलेसिया जाने कामदारको मेडिकल शुल्क वृद्धि भएको छ । अब कामदारले मेडिकल परीक्षणबापत ७ हजार ६६४ रुपैयाँ तिर्नुपर्ने नेपालस्थित मलेसिया राजदूतावासले विज्ञप्ति जारी गर्दै...	farakdhar.com	२२ घण्टा अघि	https://l.hamropatro.com/r/https://farakdhar.com/story/77608	health
श्रमिक महिला दिवसको औचित्य	विश्वमा पुँजीवादको उदयपछि ठूला–ठूला उद्योग, कलकारखाना खुल्न थाले । त्यहाँ ठूलो मात्रामा मजदुरको आवश्यकता पर्न थाल्यो । त्यो समयमा महिलाहरू चुलोचौकामा सीमित भई घरभित्रको दास जीवन बिताइरहेका थिए । उद...	ratopati.com	२३ घण्टा अघि	https://l.hamropatro.com/r/https://ratopati.com/story/225184/2022/3/8/kalpana-dhamala-	health
विपन्न बालबालिकालाई आर्थिक सहयोग	डोटी । वागेश्वरी असल शासन कल्ब बास नेपालले डोटीका चार जना असहाय तथा विपन्न बालबालिकालाई आर्थिक सहयोग गरेको छ । आमाबुबा नभएका परिवारको आर्थिक अवस्था कमजोर भएका तथा पठनपाठनमा समस्यामा परेका बालबालिक...	newsofnepal.com	२३ घण्टा अघि	https://l.hamropatro.com/r/https://www.newsofnepal.com/2022/03/08/479625/	health
Spotify and Discord are back online after outages linked to Google Cloud!!!	Discord said a new issue caused a failure of its API after restarting its streaming service to remedy one issue, which they were still investigating as of roughly 30 minutes ago. The Spotify Statu...	ictsamachar.com	३२ मिनेट अघि	https://l.hamropatro.com/r/https://ictsamachar.com/news-details/10466/2022-03-09	technology
Komaki EV scooters in Nepal: Is the new brand prepared for a tough race?	Komaki EV, an Indian brand has officially released two models of its electric scooters in Nepal. Unity Trading Concern Pvt Ltd, the official distributor of the brand for Nepal, has made the scoote...	english.onlinekhabar.com	४५ मिनेट अघि	https://l.hamropatro.com/r/https://english.onlinekhabar.com/komaki-ev-scooters-nepal.html	technology
स्थानीय निर्वाचन : किन प्रयोगमा आउन सकेन विद्युतीय भोटिङ मसिन ?	काठमाडाैं । स्थानीय तह निर्वाचन, २०७९ मा कागजको मतपत्रमै मतदान हुने भएको छ । आयोगले विद्युतीय मतदान उपकरण (इलेक्ट्रोनिक भोटिङ मेसिन–ईभीएम) प्रयोगका लागि सम्भाव्य अध्ययन गरे पनि स्थानीय निर्वाचनमा प...	techpana.com	२ घण्टा अघि	https://l.hamropatro.com/r/https://www.techpana.com/2022/120870/	technology
TWITTER: Twitter to launch a Tor service for more secure and private tweeting!!!	Twitter is creating a Tor onion service, which will optimize the site for the privacy-protecting and censorship-avoiding network. Alec Muffett, a software programmer, shared the news on Twitter tod...	ictsamachar.com	२ घण्टा अघि	https://l.hamropatro.com/r/https://ictsamachar.com/news-details/10465/2022-03-09	technology
OnePlus Nord CE 2 5G Launched in Nepal: An Affordable All-Rounder Phone	OnePlus has recently launched its mid-range smartphone, OnePlus Nord CE 2. This smartphone is a combination of style and brings MediaTek Dimensity 9OO, an in-display fingerprint sensor, 65W fast ch...	techsathi.com	२ घण्टा अघि	https://l.hamropatro.com/r/https://techsathi.com/oneplus-nord-ce-2-price-in-nepal	technology
Universal Pension Scheme: Step towards inclusive welfare society	Bangladesh is currently enjoying the benefit of demographic dividend, which is accelerating the achievement of developed nation vision by 2041. By the time the country will achieve this status bas...	english.khabarhub.com	२ घण्टा अघि	https://l.hamropatro.com/r/https://english.khabarhub.com/2022/09/240683/	technology
Gyre Rider app goes public, features Gyre Pink that allows female users to call female riders	Gyre, a ride-sharing app, has gone public. The Gyre app was made public by hosting a program on the occasion of Women's Day on 8th of March, 2022. The Gyre app can be used to book taxis and motorcy...	ictsamachar.com	३ घण्टा अघि	https://l.hamropatro.com/r/https://ictsamachar.com/news-details/10464/2022-03-09	technology
युट्युबलाई नियमन कि अभिव्यक्ति स्वतन्त्रतामाथि डन्डा?	काठमाडौं– सरकारले इन्टरनेटको माध्यमबाट प्रसारण हुने 'अनलाइन टेलिभिजन'का लागि इजाजतपत्र अनिवार्य गरेको छ। सञ्चार तथा सूचना प्रविधि मन्त्रालयले राष्ट्रिय प्रसारण नियमावली २०४९ मा एघारौं संशोधन गर्दै ...	nepallive.com	१३ घण्टा अघि	https://l.hamropatro.com/r/https://nepallive.com/story/274825	technology
प्रविधिमार्फत समाज परिवर्तन गर्दैै महिलाहरु	२४ फागुन, काठमाडौं । सूचना प्रविधिले विश्वभर फड्को मारिरहँदा नेपाली महिलाले पनि आफूलाई यस क्षेत्रमा सफल मात्र होइन, अब्बल नै साबित गरिरहेका छन् । चाहे त्यो बैंक, वित्तीय क्षेत्रमा होस् वा सफ्टवेयर ...	onlinekhabar.com	१४ घण्टा अघि	https://l.hamropatro.com/r/https://www.onlinekhabar.com/2022/03/1090922	technology
Coal India chairman wants its operations to be net zero in 3-4 years	India has more than 170 coal-fired power stations, which together account for nearly three-quarters of electricity generation in the world’s third-biggest emitter of greenhouse gases after China an...	kathmandupost.com	१५ घण्टा अघि	https://l.hamropatro.com/r/https://kathmandupost.com/world/2022/03/08/coal-india-chairman-wants-its-operations-to-be-net-zero-in-3-4-years	technology
इन्फर्मेटिक्स कलेजले मनायो १२ औं वार्षिकोत्सव	इन्फर्मेटिक्स कलेज पोखराले आफ्नो १२औं वार्षिकोत्सव विभिन्न कार्यक्रम गरी मनाएको छ। उत्कृष्ट नतिजा र व्यवसायिक शिक्षा दिँदै आएको यो कलेजका विद्यार्थीले १२औं वार्षिकोत्सव एक भव्य समारोहबीच मनाएका हुन...	setopati.com	१५ घण्टा अघि	https://l.hamropatro.com/r/https://www.setopati.com/kinmel/others/264108	technology
एनएफटी बेचेर १२ वर्षे बालक बने १२ करोडको मालिक	काठमाडौं । एनएफटी अर्थात् नन-फन्जिबल टोकनबारे तपाईंलाई पक्कै थाहा होला । पछिल्लो समय विश्व बजारमा एनएफटीले तहल्का मच्चाइरहेको छ । यो प्रविधिलाई डिजिटल चित्रकारिता र कला क्षेत्रमा एउटा आमूल परिवर्तन...	techpana.com	१६ घण्टा अघि	https://l.hamropatro.com/r/https://www.techpana.com/2022/120838/	technology
ईसेवा वालेटबाट अब शुन्य शुल्कमा रेमिट्यान्स पठाउन सकिने	काठमाडौं । ईसेवा मनी ट्रान्सफरको रेमिट्यान्स सेवा प्रयोग गर्दै आएका ग्राहकले अब ईसेवा वालेटबाट शुन्य शुल्कमा रेमिट्यान्स पठाउन सक्ने भएका छन् । यो सुविधाका लागि एफवान सफ्ट ग्रुप अन्तर्गतका यी दुई ...	techpana.com	१८ घण्टा अघि	https://l.hamropatro.com/r/https://www.techpana.com/2022/120835/	technology
रूसमा आईफोन बिक्री बन्द गर्दा दैनिक ३७ करोड गुमाउँदै एप्पल	काठमाडौं । एप्पलले रुसमा आईफोन बिक्री बन्द गर्ने निर्णय गरेको छ । यो निर्णयले कम्पनीलाई दैनिक ३७ करोडभन्दा बढी नोक्सान हुने एक अध्ययनले देखाएको छ । फोनका लागि कभर बनाउने कम्पनी ‘बुर्गा’ ले गरेको ए...	techpana.com	१८ घण्टा अघि	https://l.hamropatro.com/r/https://www.techpana.com/2022/120830/	technology
पब्जी मोबाइल र पब्जी न्यू स्टेटमा के छ फरक ?	गणेश सुवेदी /- काठमाडौं । अहिले मोबाइलका लागि धेरै ब्याटल रोयल गेम आइसकेका छन् । पब्जी, फ्री फायर, सीओडी यसका केही उदाहरण हुन् । ब्याटल रोयल गेममध्ये पब्जी मोबाइल सबैभन्दा चलेको गेम हो । २०१८ मा...	techpana.com	१९ घण्टा अघि	https://l.hamropatro.com/r/https://www.techpana.com/2022/120827/	technology
एनसेल वुमन आइकन २०२१ तथा नेपालको पहिलो महिला कम्प्युटर इन्जिनियर : गुण केशरी प्रधान	गुणकेशरी प्रधान मानन्धर नेपालको पहिलो महिला कम्प्युटर इन्जिनियर हुन् । नेपालको आईटी क्षेत्रमा ३५ वर्ष लामो योगदान गरेकी प्रधानसँग नेपाल टेलिकम र सरकारी संस्थामा मात्रै करिब ३१ वर्ष काम गरेको अनुभव ...	ictsamachar.com	१९ घण्टा अघि	https://l.hamropatro.com/r/https://ictsamachar.com/news-details/10459/2022-03-08	technology
आजको गुगल डुडल हेर्नुभयो ? नारी दिवसको यसरी हुँदैछ ‘सेलिब्रेसन’	काठमाडौं । आज मार्च ८, अर्थात् अन्तर्राष्ट्रिय नारी दिवस । नारीहरूले विभिन्न क्षेत्रमा दिएको योगदानलाई सम्बोधन गर्दै गुगलले नारी दिवस विशेष गुगल डुडल सार्वजनिक गरेको छ । डुडल आर्ट डाइरेक्टर थोका म...	techpana.com	१९ घण्टा अघि	https://l.hamropatro.com/r/https://www.techpana.com/2022/120808/	technology
'ह्याकर' ऐश्वर्या	ऐश्वर्या केसीलाई सानैदेखि कम्प्युटर मन पर्थ्यो। चलाउन नआए पनि अनेकौं किताब हेर्दै सिक्न खोज्थिन्। कक्षा ६ मा स्कुलले नै कम्प्युटर विषय पढाउन थालेपछि उनलाई यसबारे झनै चासो बढ्न थाल्यो। बिस्तारै उनक...	setopati.com	२० घण्टा अघि	https://l.hamropatro.com/r/https://www.setopati.com/social/264072	technology
अब सामसङका सस्ता फोनमा पनि चार्जर नआउने	काठमाडौं । सामसङले अब आफ्ना सस्ता फोनमा पनि चार्जर नदिने भएको छ । केही समय अगाडि मात्र एप्पलले आईफोन १२ खरिद गर्दा चार्जर निःशुल्क नदिने निर्णय गर्दा सामसङले एप्पललाई व्यङ्ग्य गरेको थियो । तर त्यस...	techpana.com	२१ घण्टा अघि	https://l.hamropatro.com/r/https://www.techpana.com/2022/120801/	technology
NEPALPAY Instant is Live in connectIPS: Facilitates Interoperable Transfers & Settlements in Real-Time  	Ever wondered if you can send money from one digital wallet to another digital wallet? It is soon being possible in Nepal. NCHL has introduced the NEPALPAY Instant feature to enable this function ...	techsathi.com	२१ घण्टा अघि	https://l.hamropatro.com/r/https://techsathi.com/nepalpay-instant	technology
महिलाले महिला नै रोज्न मिल्ने राइड शेयरिङ एप बजारमा	काठमाडौं । महिला प्रयोगकर्ताले महिला राइडर र महिला राइडरले महिला प्रयोगकर्ता नै रोज्न मिल्ने गरी बजारमा नयाँ राइड शेयरिङ एप ‘जायर’ थपिएको छ । अन्तर्राष्ट्रिय महिला दिवसको अवसर पारी आजदेखि सञ्चालनम...	techpana.com	२२ घण्टा अघि	https://l.hamropatro.com/r/https://www.techpana.com/2022/120783/	technology
अन्तर्राष्ट्रिय इन्टरनेट नेटवर्कबाट आफैं बाहिरिँदै रूस	काठमाडौं । आउँदो शुक्रबारदेखि अन्तर्राष्ट्रिय इन्टरनेटबाट रूस बाहिरिने भएको छ । युक्रेन र रूसबीच जारी पछिल्लो अवस्थाका कारण विभिन्न अन्तर्राष्ट्रिय ब्रोडब्यान्ड सेवा प्रदायक रूसबाट बाहिरिएका छन् । ...	techpana.com	२२ घण्टा अघि	https://l.hamropatro.com/r/https://www.techpana.com/2022/120786/	technology
एक लाख बढीले डाउनलोड गरे फाइनान्सियल नोटिसेस एप, थपिए नयाँ फिचर	फाइनान्सियल नोटिसेसको एन्ड्रोइड एप्स डाउनलोडको संख्या एक लाख नाघेसँगै एप्सलाई पूर्णरूपमा नयाँ प्रविधि (फल्टर) मा अद्यावधिक गरिएको छ । अद्यावधिकसँगै एप्समा नयाँ फिचरहरु उपलब्ध भएको छ । बैंक तथा वित...	ictsamachar.com	२२ घण्टा अघि	https://l.hamropatro.com/r/https://ictsamachar.com/news-details/10455/2022-03-08	technology
