रुस युक्रेन युद्धका कारण यसरी बढ्दैछ क्रिप्टोकरेन्सीको महत्त्व	काठमाडौं । युक्रेन र रुसबीच जारी युद्धका कारण अहिले विश्वभरको माहोल गर्माएको छ । सँगसँगै यसै युद्धका कारण विश्व युद्धको खतरा समेत बढ्दै गएको छ । यसैबीच क्रिप्टोकरेन्सीले भने आफ्नो आवश्यकता र महत्व...	techpana.com	८ घण्टा अघि	https://l.hamropatro.com/r/https://www.techpana.com/2022/120495/	technology
२१ घण्टासम्म ब्याट्री टिक्ने सामसङ ग्यालेक्सी बुक २ प्रो ल्यापटप सार्वजनिक, यस्ता छन् अन्य फिचर	काठमाडौं । सामसङ ग्यालेक्सी बुक २ प्रो ल्यापटप सार्वजनिक काठमाडौं । सामसङले आफ्नो फ्ल्यागशिप ल्यापटप लाइनअप सार्वजनिक गरेको छ । कम्पनीले एस पेन सहित ग्यालेक्सी बुक टु प्रो ३६० तथा फाइभजीका साथ ग्या...	techpana.com	१८ घण्टा अघि	https://l.hamropatro.com/r/https://www.techpana.com/2022/120490/	technology
नाबालिगको पक्षमा प्रियङ्का : पीडित हुँ भन्दा प्रश्न उठाउनु ठिक हैन	काठमाडौँ : नयिका प्रियङ्का कार्कीले नाबालिगले 'म पीडित हुँ' भन्दा, उनको चरित्र माथि नै प्रश्न चिन्ह उठाउनु एउटा जिम्मेदार समाजको काम हुनै नसक्ने बताएकी छिन।	ukeraa.com	१९ घण्टा अघि	https://l.hamropatro.com/r/https://www.ukeraa.com/news/2022/03/03/15663	technology
नयाँ मोबाइल किन्दै हुनुहुन्छ ? थाहा पाइराख्नुहोस् विश्वकै नम्बर वान चिपसेट 	काठमाडौं । कुनै पनि स्मार्टफोनका लागि चिपसेटले निकै अहम् भूमिका राख्ने गर्छ । जुन स्मार्टफोनमा जति राम्रो चिपसेट हुन्छ, उक्त स्मार्टफोनलाई त्यति नै राम्रो मानिन्छ । एकताका मोबाइल चिपसेटको विश्वमा ...	techpana.com	२१ घण्टा अघि	https://l.hamropatro.com/r/https://www.techpana.com/2022/120484/	technology
आईफोनमा लुकेको एउटा यस्तो ‘ट्रिक’, जसको सहयोगमा नछोएरै खिच्न सकिन्छ फोटो	काठमाडौं । आईफोनमा नछोएरै फोटो खिच्ने ‘ट्रिक’ काठमाडौं । यदि तपाईँ आईफोन प्रयोगकर्ता हो भने त्यसमा अनेकौँ ट्रिकहरू पाउनु हुनेछ । तर आज हामी तपाईँलाई अलि भिन्न किसिमको ट्रिकको बारेमा बताउँदै छौँ । ...	techpana.com	२१ घण्टा अघि	https://l.hamropatro.com/r/https://www.techpana.com/2022/120481/	technology
आगामी ६ वर्षमा मोबाइल डेटाको खपत तीन गुणाले बढ्ने	काठमाडौं । पछिल्लो समय बढ्दो मोबाइल प्रयोग र भिडियोको खपतले आगामी ६ वर्षमा मोबाइल डेटाको प्रयोग तीन गुणाले बढ्ने अध्ययनले देखाएको छ । ग्लोवल सिस्टम फर मोबाइल कम्युनिकेशन(जीएसएमए) ले भर्खरैमात्र ‘मो...	techpana.com	२२ घण्टा अघि	https://l.hamropatro.com/r/https://www.techpana.com/2022/120478/	technology
म्याग्दीमा ११ जलविद्युत् आयोजना बन्दै	म्याग्दी — नेपाल दूरसञ्चार प्राधिकरणका कर्मचारीको दिर्घकालिन सेवा–सुविधाका कुराहरू समेटिएको पत्र चैतको पहिलो हप्ताभित्रमा स्विकृतिका लागि सञ्चार तथा सूचना प्रविधि मन्त्रालयमा पठाउन बिहीबार कर्मचारी...	ekantipur.com	२२ घण्टा अघि	https://l.hamropatro.com/r/https://ekantipur.com/business/2022/03/03/164630845591732676.html	technology
अब पोडकास्टका लागि ट्वीटरमा छुट्टै ट्याब	काठमाडौं । माइक्रो ब्लगिङ ट्वीटरले पोडकास्टका लागि छुट्टै ट्याब उपलब्ध गराउने भएको छ । त्यसका लागि हाल ट्वीटरले काम गरिरहेको जनाइएको छ । रिसर्चर जेन म्यान्चु वाङले ट्वीटरमा स्क्रिनसट पोस्ट गर्दै ट...	techpana.com	२३ घण्टा अघि	https://l.hamropatro.com/r/https://www.techpana.com/2022/120475/	technology
भ्वाइस मेसेज बीचैमा रोकेर पुनः रेकर्ड गर्न सकिने फिचर ल्याउँदै ह्वाट्सएप	काठमाडौं । विश्वमा धेरै प्रयोग हुने इन्स्ट्यान्ट मेसेजिङ एपमध्येमा ह्वाट्सएप एउटा हो । जसका प्रयोगकर्ता दुई अर्ब भन्दा बढी रहेका छन् । १८० भन्दा बढी देशमा प्रयोग हुँदै आएको यो एप व्यवसायिक प्रयोजन...	techpana.com	२४ घण्टा अघि	https://l.hamropatro.com/r/https://www.techpana.com/2022/120469/	technology
मंगलबार एप्पलको ‘पीक पर्फर्मेन्स’ इभेन्ट, यस्ता छन् सम्भावित प्रडक्ट	काठमाडौं । एप्पलले सन् २०२२ को पहिलो कार्यक्रम ‘पिक पर्फर्मेन्स’ आउँदो मंगलबार अर्थात मार्च ८ मा  आयोजना गर्ने भएको छ । कम्पनीले बिहीबार आउँदो कार्यक्रम बारे जानकारी दिएको हो । कार्यक्रम एप्पलको क...	techpana.com	१ दिन अघि	https://l.hamropatro.com/r/https://www.techpana.com/2022/120459/	technology
NepalFlix: A Video Streaming Platform and Youtube Channel Run by Bongo Studios	Do you enjoy streaming videos and watching entertaining films online? If yes, then NepalFlix could be your one-stop destination for all Nepalese video content. They are soon bringing you the latest...	techsathi.com	१ दिन अघि	https://l.hamropatro.com/r/https://techsathi.com/nepalflix-a-video-streaming-platform	technology
पूरा भयो टेलिकमको फाइभजी अध्ययन, पहिलो चरणमा काठमाडौंमा परीक्षण हुँदै	काठमाडौं । नेपाल टेलिकमले मोबाइलको नयाँ प्रविधि फाइभजी परीक्षणका लागि आवश्यक अध्ययन सम्पन्न गरेको छ । चालु आर्थिक वर्ष २०७८/७९ भित्रै फाइभजी परीक्षण सुरु गर्ने तयारीका साथ कम्पनीले आवश्यक अध्ययन सम...	techpana.com	१ दिन अघि	https://l.hamropatro.com/r/https://www.techpana.com/2022/120457/	technology
जबरजस्ती उसलाई आफ्नो बनाउन चाहिनँ	सधैंजसो साइलेन्टमा रहने फोन त्यो दिन राख्न भुलेको रहेछु। करिव दिउँसो साढे एक बजेतिर सुतेर ब्यँझिएको थिएँ मोबाइलले टुङ्ग घन्टी बजायो। घन्टी म्यासेन्जरमा आउनेवाला म्यासेजको थियो। झ्याप्पै मोबाइल खोल...	setopati.com	१ दिन अघि	https://l.hamropatro.com/r/https://www.setopati.com/literature/263653	technology
फिडको भिडियोहरुमा अटोमेटिक क्याप्सनको फिचर ल्याउँदै इन्स्टाग्राम	इन्स्टाग्रामले आफ्नो फिडको भिडियोहरुमा अटोमेटिक क्याप्सनको फिचर ल्याएको छ । टिकटकमा रहेको फिचर अब इन्स्टाग्रामले पनि सार्वजनिक गरेको छ । यो फिचरलाई अटो क्याप्सन भनिन्छ । यो फिचर क्रियटरहरुका लागि...	ictsamachar.com	१ दिन अघि	https://l.hamropatro.com/r/https://ictsamachar.com/news-details/10402/2022-03-03	technology
गाडीमा प्रयोग हुने ‘एन्टी लक ब्रेकिङ सिस्टम’ प्रविधि के हो र यसले कसरी काम गर्छ ?	काठमाडौं । नेपालमा पनि पछिल्लो समय विद्युतीय कार प्रतिको आकर्षण बढ्दै गएको छ । महँगिँदै गएको पेट्रोलियम पदार्थमा हुने खर्च जोगाउन, कर छुट, बढ्दो ब्याट्री रेन्ज आदिका कारणले गर्दा अहिले पेट्रोल र डि...	techpana.com	१ दिन अघि	https://l.hamropatro.com/r/https://www.techpana.com/2022/120450/	technology
टिकटकमा १० मिनेटको भिडियो बनाउन मिल्ने, युट्युबसँग प्रतिस्पर्धाको लक्ष्य	काठमाडौँ — टिकटकमा अब १० मिनेट लामो भिडियो अपलोड गर्न सकिने भएको छ । आफ्ना प्रयोगकर्तालाई सिर्जना र मनोरञ्जनमा थप समय प्रदान गर्न भिडियोको अवधि बढाइएको टिकटकले जनाएको छ । चिनियाँ टेक जायन्ट, टिकटक...	ekantipur.com	१ दिन अघि	https://l.hamropatro.com/r/https://ekantipur.com/business/2022/03/03/16462800071166389.html	technology
Ripple Nova – a Powerful Gaming Laptop with Powerful Specs (2022)	Ripple Nova is a powerful gaming laptop. Ripple launched a new gaming laptop Nova that includes the intel 12th generation 12500H processor. The GPU of this device is NVIDIA RTX 3050Ti. Ripple Nova ...	techsathi.com	१ दिन अघि	https://l.hamropatro.com/r/https://techsathi.com/ripple-nova-gaming-laptop-with-ample-specification	technology
नेपालका टप ५ अनलाइन गेमर, जसले युट्युबबाटै मासिक लाखौँ कमाउँछन्	काठमाडौं । अनलाइनका माध्यमहरू सूचना सञ्चारको माध्यम मात्र होइनन्, आम्दानीका स्रोत पनि हुन् । यो कुरा तपाईँले अहिलेको युवा पिँढीबाट देख्न सक्नुहुन्छ ।  पछिल्लो समय नेपालमा अनलाइन गेमको क्रेज निकै ब...	techpana.com	१ दिन अघि	https://l.hamropatro.com/r/https://www.techpana.com/2022/120447/	technology
माईपे डिजिटल वालेट प्रयोग गर्दा एक लाखको दुर्घटना बीमा	काठमाडौं । डिजिटल वालेट कम्पनी माईपेले प्रयोगकर्ताका लागि आकर्षक अफर सार्वजनिक गरेको छ । कम्पनीले वालेट प्रयोग गर्ने प्रयोगकर्तालाई एक लाख रुपैयाँको दुर्घटना बीमा सुविधा दिने भएको हो ।   यो सुविधा...	techpana.com	१ दिन अघि	https://l.hamropatro.com/r/https://www.techpana.com/2022/120444/	technology
भिसा र मास्टर कार्डबाट समेत अलग्गियो रुस	काठमाडौं । कार्ड भुक्तानी सेवा प्रदायक भिसा र मास्टरकार्डले रुसलाई आफ्नो नेटवर्कबाट हटाएका छन् । चीन बाहेक विश्वको ९० प्रतिशत डेबिट तथा क्रेडिट कार्डमा यिनै दुई नेटवर्क प्रयोग हुँदै आएका छन् । रुसम...	techpana.com	१ दिन अघि	https://l.hamropatro.com/r/https://www.techpana.com/2022/120441/	technology
‘सरकार ! के गरेर खाम ’	बागलुङ । ‘सर्टिफिकेट छ डिग्री पासको न त गासको न टुङ्गो बासको मैले के गरेर खाम देशमै भोकै बसम् की खाडीतिर पसम् की सरकार ! लौन निधो पाम….’ (पुरुष) शैक्षिक प्रमाणपत्र धितो राखेर ऋण झिक्न गएका यु...	dcnepal.com	८ मिनेट अघि	https://l.hamropatro.com/r/https://www.dcnepal.com/2022/03/336079/	economics
इन्धनको मूल्य वृद्धि फिर्ता नलिएमा आफुखुसी भाडा बढाउने  यातायात व्यवसायीको चेतावनी	काठमाडौं- नेपाल आयल निगमले हप्तैपिछे इन्धनको मूल्य बढाउन थालेपछि यातायात व्यवसायी आक्रोशित बनेका छन ।  आज (शुक्रबार)देखि लागू हुने गरी निगमले पेट्रोल, डिजेल, मट्टितेलमा ५ रुपैयाँ मूल्य वृद्धि गरेपछ...	ajakoartha.com	१० मिनेट अघि	http://l.hamropatro.com/r/http://ajakoartha.com/story/68880	economics
नेशनल लाइफको शेयरमूल्य समायोजन, कति पुग्यो समायोजनपछिको मूल्य ?	काठमाडौं- नेपाल स्टक एक्सचेञ्ज (नेप्से) ले नेशनल लाइफ इन्स्योरेन्सको शेयरमूल्य समायोजन गरेको छ । कम्पनीले साधारण सभा तथा लाभांश प्रयोजनको लागि बुक क्लोज गरेसँगै नेप्सेले शेयरमूल्य समायोजन गरी नयाँ ...	ajakoartha.com	१० मिनेट अघि	http://l.hamropatro.com/r/http://ajakoartha.com/story/68881	economics
करिडोरमा बनेन ट्रान्सपोर्ट नगर	बारा- पथलैया—वीरगन्ज औद्योगिक करिडोरमा व्यवस्थित ढुवानीका लागि सरकारले ट्रान्सपोर्ट नगर नबनाएपछि कलकारखाना, उद्योगी र व्यापारी मारमा परेका छन् । असुरक्षित र अस्तव्यस्त बनेको ढुवानी प्रणालीलाई व्य...	karobardaily.com	१७ मिनेट अघि	https://l.hamropatro.com/r/https://www.karobardaily.com/news/176818	economics
भारतमा कोरोनाभाइरसबाट थप छ हजार सङ्क्रमित	नयाँ दिल्ली । भारतमा कोरोना भाइरसबाट थप छ हजार सङ्क्रमित भएका छन् । पछिल्लो केही समयदेखि दैनिक सङ्क्रमितहरुको सङ्ख्या निरन्तर ओरालो लागिरहेकाले शुक्रबारको विवरण पनि अघिल्लो दिनको तुलनामा कम देखिएक...	kharibot.com	२० मिनेट अघि	https://l.hamropatro.com/r/https://kharibot.com/news-details/100830/2022-03-04	economics
नेपाल आयल निगम घाटामा, तर कर्मचारीलाई भत्तैभत्ता !	काठमाडौं । महिना दिन नपुग्दै पेट्रोलियम पदार्थको मूल्यवृद्धि गर्ने नेपाल आयल निगमका कर्मचारीलाई विभिन्न शीर्षकमा भत्तैभत्ता दिइँदै आएको भेटिएको छ । निगमका कर्मचारीहरुले यातायात भत्तादेखि पोशाक संर...	news24nepal.tv	२३ मिनेट अघि	https://l.hamropatro.com/r/https://www.news24nepal.tv/2022/03/04/861187	economics
अर्थतन्त्र जोगाइरहेका रेमिटान्सदाता नेपालीलाई आईपीओ जारी गर्दा १० प्रतिशत आरक्षण !	काठमाडौं । एक जना व्यवसायीले रेमिटान्स बढाउन सर्वसाधारणका लागि जारी गरिने पब्लिक कम्पनीहरुको प्राथमिक शेयर (आईपीओ)को १० प्रतिशत आरक्षण विदेशमा रहेका नेपालीहरुका लागि गरिनुपर्ने धारणा अघि सारेका छन्...	corporatenepal.com	२३ मिनेट अघि	https://l.hamropatro.com/r/https://www.corporatenepal.com/news/detail/216935	economics
जुम्ला कोरोना संक्रमणमुक्त, देशभरको टेष्ट पोजिटीभिटी दर १.४१ प्रतिशतमा झर्‍यो 	काठमाडौं  । जुम्ला जिल्ला कोभिड १९ को संक्रमणबाट मुक्त भएको छ ।  शून्य सक्रिय संक्रमित भएसँगै यो जिल्ला संक्रमणमुक्त भएको हो । त्यस्तै पछिल्लो चौबीस घण्टाको टेष्ट पोजिटिभिटी दर १.४१ प्रतिशत रहेको ...	baahrakhari.com	२५ मिनेट अघि	https://l.hamropatro.com/r/https://baahrakhari.com/news-details/343282	economics
बजारको चिरफार: के नेप्से बटम लाग्ने तरखरमा हो ?	अर्थसंसार डट कमबाट साप्ताहिक रुपमा प्रसारण हुने कार्यक्रम बजारको चिरफारको ९ औं एपिसोडमा हामीले सेयर बजारलाई प्रभावित पार्न सक्ने समसामयिक घटनाहरुको विश्लेषण गरेका छौं। अर्थमन्त्री जनार्दन शर्माले ग...	arthasansar.com	२६ मिनेट अघि	https://l.hamropatro.com/r/https://arthasansar.com/news/37294	economics
कर्णालीमा योगदानमा आधारित सामाजिक सुरक्षा कोषमा न्यून सहभागिता	कर्णाली प्रदेशमा योगदानमा आधारित सामाजिक सुरक्षा कोषमा रोजगारदाता र श्रमिकहरूको न्यून सहभागिता रहेको देखिएकाे छ । देशभरका सातवटा प्रदेशको तुलनामा कर्णाली प्रदेशबाट कोषमा न्यून सहभागिता भएको हो । क...	farakdhar.com	२७ मिनेट अघि	https://l.hamropatro.com/r/https://farakdhar.com/story/77255	economics
नेपालमा नयाँ विद्युतीय गाडीको विकल्प हुनसक्छ 'रेट्रोफिटिङ'	काठमाडौँ — विद्युतीय सवारीसाधनले विश्वमा नयाँ तरंग ल्याउन थालिसकेको छ । यसबाट नेपाल पनि अछुतो छैन । विशेष गरी नवीकरणीय उर्जा जलविद्युत्‌को प्रचुर सम्भावना रहेको हाम्रो जस्तो देशमा यो प्रविधि बरदान ...	ekantipur.com	२७ मिनेट अघि	https://l.hamropatro.com/r/https://ekantipur.com/bibidha/2022/03/04/164638615992582213.html	economics
सीडीएससीले बढी सेवा शुल्क नलिएको सीईओको आचार्य दाबी	काठमाडौं - सीडीएससीका प्रमुख कार्यकारी अधिकृत (सीईओ) पूर्णप्रसाद आचार्यले आफूहरुले सेवाग्राहीबाट बढी सेवा शुल्क नलिएको दाबी गरेका छन्। नेपाल आर्थिक पत्रकार संघ (नाफिज) आज आयोजना गरेको पुँजीबजार रि...	ajakoartha.com	२७ मिनेट अघि	http://l.hamropatro.com/r/http://ajakoartha.com/story/68879	economics
बाँसको व्यापार	रुपनीबाट बाँस लिएर सदरमुकाम राजविराजतर्फ जाँदै बाँस व्यापारी । एक घना बाँसको रु ४०० पर्ने गरेको छ । तस्बिर : रासस	ajakoartha.com	४२ मिनेट अघि	http://l.hamropatro.com/r/http://ajakoartha.com/story/68878	economics
