युक्रेनका राष्ट्रपति जेलेन्स्कीको बिलौना– नो फ्लाई जोन नभए लडाकू विमान त देओ	युक्रेनका राष्ट्रपति भोलोदीमीर जेलेन्सकीले पश्चिमी सैन्य संगठन नेटोलाई युक्रेनको आकाशमा नो फ्लाई जोन घोषणा गर्न पुनः आह्वान गरेका छन् ।  बिहीवार उनले सम्बोधन गर्दै भने, ‘तिमीहरूलाई अझै कति समय चाह...	lokaantar.com	२ घण्टा अघि	https://l.hamropatro.com/r/https://lokaantar.com/story/174472/2022/3/4/international/zelensky	international
पुटिनलाई गिरफ्तार गर्नेलाई रुसी व्यवसायीले १० लाख डलर पुरस्कार दिने 	मस्को । एक रुसी व्यवसायीले रुसका राष्ट्रपति भ्लादिमिर पुटिनलाई पक्राउ गर्ने ‘अफिसर’लाई पुरस्कारस्वरूप १० लाख अमेरिकी डलर प्रदान गर्ने घोषणा गरेका छन् । त्यस्तो घोषणा गर्ने रुसका नागरिक एलेक्स कोना...	baahrakhari.com	३ घण्टा अघि	https://l.hamropatro.com/r/https://baahrakhari.com/news-details/343267	international
गालीगलौज गरेको भन्दै रेखा थापाले दिइन् युट्युबरविरूद्ध साइबर ब्युरोमा निवेदन	नायिका रेखा थापाले आफूलाई युट्युबमा तथानाम गालीगलौज गरेको भन्दै एक युट्युबरविरूद्ध प्रहरीमा निवेदन दिएकी छन्। 'उहाँको निवेदन आएको छ', नेपाल प्रहरीको साइबर ब्युरोका एसएसपी नबिन्द अर्यालले सेतोपाटीस...	setopati.com	२३ मिनेट अघि	https://l.hamropatro.com/r/https://www.setopati.com/social/263738	entertainment
साथी र सहकर्मीजस्ता मदनकृष्ण श्रेष्ठका बाबु–छोरी	भनिन्छ, आमानजिक छोरा र बाबुनजिक छोरी हुन्छन् भनेर । यो वाक्यांश सबै आमा–छोरा र बाबु छोरीमा लागु हुँदैन । तर, दिग्गज कलाकार मदनकृष्ण श्रेष्ठ र उनकी छोरी गायिका तथा निर्देशिका सराना श्रेष्ठको हकमा भ...	baahrakhari.com	४२ मिनेट अघि	https://l.hamropatro.com/r/https://baahrakhari.com/news-details/343277	entertainment
सलमान-कटरिनाको 'टाइगर-३' अप्रिल २१ मा रिलिज हुने	एजेन्सीः सलमान खान र कटरिना कैफ अभिनित बलिउड चलचित्र 'टाइगर-३'को प्रदर्शन मिति सार्वजनिक भएको छ। चलचित्र सन् २०२३ को अप्रिल २१ मा रिलिज हुने भएको छ। 	ukeraa.com	४४ मिनेट अघि	https://l.hamropatro.com/r/https://www.ukeraa.com/news/2022/03/04/15688	entertainment
हिरासतमा भेट्न पुगेकी पुजालाई के भने पल शाहले ?	काठमाडौं । चलचित्र ‘म यस्तो गीत गाउँछु २’ को प्रिमियरयता नायिका पुजा शर्मा लगातार चर्चा र गसिपमा छिन् । पललाई बचाउन विभिन्न अन्तर्वार्तामा ‘बच्कना’ अभिव्यक्ति दिँदा उनको ट्रोल पनि भइरहेको छ । चलचि...	nepalpress.com	५१ मिनेट अघि	https://l.hamropatro.com/r/https://www.nepalpress.com/2022/03/04/162147/	entertainment
१३ सीट क्षमताको क्यानेडियन ‘मुुभी थियटर’ विश्वकै सानो	१३ सीट क्षमताको क्यानडाको ओन्टारियो ‘मुुभी थियटर’ लाई गिनिज वर्ल्ड रेकर्ड बुकले विश्वकै सानो भएको प्रमाणित गरेको छ । स्ट्राटफोर्डमा रहेको सानो सिनेमा हलले २०२१ को अक्टोबरमा फिल्म देखाउन सुरु गरेको ...	ratopati.com	१ घण्टा अघि	https://l.hamropatro.com/r/https://ratopati.com/story/224465/2022/3/4/movie-hall	entertainment
हल्ट प्राइज एसएमसीको मिनी एक्सीलेरेटर बिजनेश क्यानभास मोडेल सेसन सम्पन्न	हल्ट प्राइज सरस्वती बहुमुखी कलेज (एसएमसी) ले आयोजना गरेको मिनी एक्सीलेरेटर बिजनेश क्यानभास मोडेलको सेसन सफलतापूर्वक समापन गरेको छ । दुई घण्टाको कार्यक्रममा ५० जना सहभागी भएका थिए । कार्यक्रममा पोख...	ictsamachar.com	२ घण्टा अघि	https://l.hamropatro.com/r/https://ictsamachar.com/news-details/10409/2022-03-04	entertainment
यस्तो छ मण्डला थिएटरको नयाँ भवन (तस्बिरहरू)	मण्डला थिएटरले अब नयाँ भवनमा नाटक मञ्चन गर्ने भएको छ। बिहीबार थापागाउँमा एक कार्यक्रम गरी नाटकघरले आफ्नो नयाँ भवनको औपचारिक उद्घाटन गरेको हो। १२ वर्षअघि स्थापना भएको मण्डलाको नयाँ भवनको उद्घाटन उ...	setopati.com	२ घण्टा अघि	https://l.hamropatro.com/r/https://www.setopati.com/art/ranga-manch/263728	entertainment
फ्यानले गरे शाहरुखलाई प्रश्न- लालसिंह चड्डा हेर्नु भयो ?	कोरोनाभाइरसको महामारीका कारण मनोरञ्जन क्षेत्रले निकै कठिनाइ व्यहोर्नुपर्‍यो । सुरुमै बन्द हुने र सबैभन्दा पछि खुल्ने क्षेत्र नै मनोरञ्जन भयाे । यद्यपि यो वर्ष र आउँदा वर्ष ठूला फिल्महरू प्रदर्शनमा ...	farakdhar.com	२ घण्टा अघि	https://l.hamropatro.com/r/https://farakdhar.com/story/77238	entertainment
आदित्य नारायणकी छोरीको जन्म : भने, ‘श्वेताका लागि मेरो सम्मान दोब्बर भयो’	भारतीय गायक आदित्य नारायण र श्वेता अग्रवाल छोरीका बुवा–आमा बनेका छन् । श्वेताले २४ फेब्रुअरीमा मुम्बईको एक अस्पतालमा छोरी जन्माएकी हुन् । बुवा बनेपछि आदित्यले आफू असाध्यै खुसी भएको र छोरी नै जन्मिन...	ratopati.com	२ घण्टा अघि	https://l.hamropatro.com/r/https://ratopati.com/story/224445/2022/3/4/aditya-narayan-shweta-agarwal-baby-girl	entertainment
म सिक्वेलका लागि जहाँ पनि हाम फाल्ने मान्छे होइन : परेश रावल	२० फागुन, काठमाडौं । अभिनेता परेश रावल ४० वर्षपछि गुजराती चलचित्र ‘डिअर फादर’मा दोहोरो भूमिकामा देखिने भएका छन् । रावलले दैनिक भास्करसँगको कुराकानीमा यसबारे बताएका हुन् । ‘डिअर फादर’ उनको नाटकमा आध...	onlinekhabar.com	३ घण्टा अघि	https://l.hamropatro.com/r/https://www.onlinekhabar.com/2022/03/1088888	entertainment
काठमाडौं ट्रिएनाले : कलामा समकालीन साझा समस्याको उठान	काठमाडौँ — आदिम थलो, संस्कृति, ज्ञान, शिल्प र सभ्यतालाई भुल्दै गएको समाजको निरन्तरता विश्वको साझा कठिनाइ बन्दै गएको छ । तिनै विश्व समुदायको समस्या कलामार्फत उठान गर्दै समानान्तर रूपमा अगाडि बढाउन ए...	ekantipur.com	३ घण्टा अघि	https://l.hamropatro.com/r/https://ekantipur.com/Art/2022/03/04/164637798712694756.html	entertainment
पल शाह प्रकरणपछि ‘म यस्तो गीत गाउँछु २’ ले एक हप्तामा उठायो ५ करोड	काठमाडौं । साढे दुई करोड लागत रहेको म यस्तो गीत गाउँछु २ ले रिलिज भएको एक हप्तामै पाँच करोडको व्यापार गरेको दाबी गरिएको छ । फिल्मकी निर्माता एवं नायिक पूजा शर्माले एक हप्तामा नै फिल्मले ४ करोड ९५ ल...	nepalwatch.com	३ घण्टा अघि	https://l.hamropatro.com/r/https://www.nepalwatch.com/2022/03/04/8578/	entertainment
समिक्षा र सुभाषको नयाँ गीत ‘बजाई देउ’ सार्वजनिक	‘कुरा काट्ने मान्छेले कार्टुन’ बोलको चर्चित गीत दिएका गायक सुभाष पुरीको नयाँ गीत ‘बजाई देउ’ सार्वजनिक भएको छ । गायक पुरीकै शब्द रहेको गीत गायनमा पुरीलाई गायिका समिक्षा अधिकारीले साथ दिएकी छन् । बा...	ratopati.com	३ घण्टा अघि	https://l.hamropatro.com/r/https://ratopati.com/story/224434/2022/3/4/music-video	entertainment
संगम थापाको लोकगीत ‘सेतो सेतो कमेरो’ सार्वजनिक	काठमाडौं, फागुन २० : गायक संगम थापा र गायिका प्रतिमा अर्याल सेतो सेतो कमेरो बोलको गीति लोक भिडियो सार्वजनिक भएको छ। भिडियोमा अभिनय निरज श्रेष्ठ, अनु पराजुली र जीवन कार्कीको रहेको छ। गीतमा शब्द गाय...	kathmandupress.com	३ घण्टा अघि	https://l.hamropatro.com/r/https://kathmandupress.com/news/59473	entertainment
‘म यस्तो गीत गाउँछु २’ रिलिजमा सुदर्शनले भोगेको नमिठो पल	लामो समयपछि नेपाली सिनेमा घरमा दर्शक फर्काउने चलचित्र बन्यो ‘म यस्तो गीत गाउँछु २’। अभिनेत्री पूजा शर्मासँग निर्माणमा सहयात्रा गर्दै सुदर्शन थापाले निर्देशन गरेको यो चलचित्रले कोरोनाका कारण प्रदर्श...	nepalkhabar.com	४ घण्टा अघि	https://l.hamropatro.com/r/https://nepalkhabar.com/entertainment/122567-2022-3-4-11-46-33	entertainment
‘लप्पन छप्पन २’ आजबाट प्रदर्शनमा	काठमाडौं– शुक्रबारबाट नेपालभर ‘लप्पन छप्पन २’ फिल्म प्रदर्शन भएको छ। मुकुन्द भट्टको निर्देशनमा बनेको फिल्म आजबाट देशभर प्रदर्शनमा आएको हो।  फिल्म्मा राजनीति र द्वन्द्वको कथालाई देखाइएको छ। नेपाली ...	nepallive.com	४ घण्टा अघि	https://l.hamropatro.com/r/https://nepallive.com/story/274457	entertainment
पल शाह प्रकरणमा भट्टराईले भने, ‘न्याय प्रभावित नहोस्’	काठमाडौं । पूर्वप्रधानमन्त्री डा. बाबुराम भट्टराईले न्यायिक फैसला सबैले मान्नुपर्ने बताएका छन् । पल शाह प्रकरणबारे टिप्पणी गर्दै सामाजिक सञ्जाल ट्वीटरमा उक्त उनले उक्त कुरा भनेका हुन् । भट्टराईले ...	lokpath.com	४ घण्टा अघि	https://l.hamropatro.com/r/https://www.lokpath.com/story/505710	entertainment
पीडित हुँ भन्न पनि ठूलै हिम्मत बोक्नुपर्ने समाजको विडम्बना : प्रियंका कार्की	२० फागुन, काठमाडौं । अभिनेत्री प्रियंका कार्कीले समाजमा पीडितले ‘पीडित हुँ’ भन्न पनि ठूलै हिम्मत बोकेर आउनुपर्ने अवस्था आउनु दुःखद् भएको बताएकी छन् । पल शाह प्रकरणबारे टिप्पणी गर्दै उनले एक नाबालि...	onlinekhabar.com	४ घण्टा अघि	https://l.hamropatro.com/r/https://www.onlinekhabar.com/2022/03/1088816	entertainment
पाँच दर्जन हलबाट चलचित्र लप्पन छप्पन २	काठमाडौं । यस अघि कोरोनाका कारण प्रदर्शनी मिति तय भएर पनि रोकिएको नेपाली चलचित्र लप्पन छप्पन २ शुक्रबारबाट देशका पाँच दर्जन भन्दा बढी सिनेमा हलबाट रिलिज हुने भएको छ । यो चलचित्रलाई मुकुन्ट भट्टले न...	rajdhanidaily.com	५ घण्टा अघि	https://l.hamropatro.com/r/https://rajdhanidaily.com/id/57496/	entertainment
चलचित्र थर्ड आई हेरेर १०६ जनाले गरे आँखा दान	काठमाडौं । बिहिबार नारायणघाटको जल्मा सिनेमा हलमा चलचित्र ‘थर्ड आई’ हेरेर १०६ जनाले आँखा दान गरेका छन् । मृत्युपछि आफ्नो आँखा दृष्टी बिहिन ब्यक्तिलाई दिनको लागि उनीहरुले अहिले नै आँखा दान गरेका हुन्...	rajdhanidaily.com	५ घण्टा अघि	https://l.hamropatro.com/r/https://rajdhanidaily.com/id/57494/	entertainment
बक्स अफिसमा ‘म यस्तो गीत गाउँछु २’ : क्यूएफएक्स चेनबाट मात्रै ८२ लाख ‘कलेक्सन’	२० फागुन, काठमाडौं । पल शाह प्रकरणको प्रभाव ‘म यस्तो गीत गाउँछु २’को बक्स अफिस कलेक्सनमा देखिएको छ । निर्माण कम्पनीले पल र पूजा शर्मा स्टारर फिल्मले पहिलो साता ४ करोड ९५ लाख रुपैयाँ ग्रस कमाइ गरेको...	onlinekhabar.com	५ घण्टा अघि	https://l.hamropatro.com/r/https://www.onlinekhabar.com/2022/03/1088807	entertainment
आजदेखि नेपाली बक्स अफिसमा ‘लप्पनछप्पन २’ र ‘ब्याटम्यान’	२० फागुन, काठमाडौं । शुक्रबारदेखि दुई नयाँ फिल्म प्रदर्शनमा आएका छन् । नेपालको ग्याङस्टर ड्रामा ‘लप्पनछप्पन २’ र हलिउडको प्रतीक्षित सुपरहिरो फिल्म ‘द ब्याटम्यान’ प्रदर्शनमा आएका हुन् । मुकुन्द भट्...	onlinekhabar.com	५ घण्टा अघि	https://l.hamropatro.com/r/https://www.onlinekhabar.com/2022/03/1088802	entertainment
फ्राइडे रिलिज : 'द ब्याटम्यान' सँग भिड्दै सौगात अभिनीत 'लप्पन छप्पन २'	काठमाडौं: यो साता फ्राइडे रिलिजमा एक नेपाली र एक हलिउड फिल्म प्रदर्शनमा आएका छन्। नेपाली फिल्म ‘लप्पन छप्पन २’ ले हलिउड फिल्म ‘द ब्याटम्यान’ सँग नेपाली बक्सअफिसमा प्रतिस्पर्धा गर्नेछ। मुकुन्द भट्ट...	pahilopost.com	५ घण्टा अघि	https://l.hamropatro.com/r/https://pahilopost.com/content/20220304101322.html	entertainment
सान फ्रान्सिस्कोमा योमरी मयजुको नेपाली संस्कृति प्रवद्र्धन र प्रचार प्रसार कार्यक्रम	सान फ्रान्सिस्को। क्यालिफोर्नियाको सान फ्रान्सिस्को शहरमा रहेको यति रेस्टोरेन्टको आयोजनामा योमरी मयजुले सांस्कृतिक प्रस्तुति गरिएको छ। भव्य रुपमा आयोजना गरिएको कार्यक्रममा गैरआवासीय नेपाली अमेरिकीक...	dcnepal.com	५ घण्टा अघि	https://l.hamropatro.com/r/https://www.dcnepal.com/2022/03/335970/	entertainment
पीडितको चरित्रमाथि प्रश्न उठाउन जायज छैनः प्रियंका कार्की	196 Shares काठमाडौं। पछिल्लो केही समययता नेपालमा पल–समिक्षा प्रकरणले ठूलो बहस खडा गरिदिएको छ। नायक पल शाहले आफूलाई विवाह गर्ने प्रलोभन देखाएर शारिरीक सम्बन्ध गाँसेको र अहिले विवाह गर्न नमानेको भ...	dainikonline.com	६ घण्टा अघि	https://l.hamropatro.com/r/https://www.dainikonline.com/story/192599/2022/03/04/	entertainment
‘रिल’मा नायक, ‘रियल’मा नालायक !	काठमाडौं। केही सातायता नायक पल शाह ‘लाइम लाइट’मा छन्। मूलतः म्युजिक भिडियोका ‘सुपर स्टार’ पलको चर्चा कुनै उत्कृष्ट चलचित्रका नायकका रुपमा भइरहेको चाहिँ होइन। न त उनले कुनै ओस्कार पुरस्कार नै पाएका ...	khabarhub.com	६ घण्टा अघि	https://l.hamropatro.com/r/https://www.khabarhub.com/2022/04/356980/	entertainment
नयाँ मण्डलामा नयाँ नाटक	काठमाडौँ — मण्डला थिएटरले नवनिर्मित आफ्नै भवनमा नयाँ नाटक मञ्चन गरेको छ । काठमाडौं थापागाउँस्थित मण्डलाको नवनिर्मित भवन उद्घाटनकै अवसरमा बिहीबार नयाँ नाटक ‘रोगन’ मञ्चन गरेको हो । नयाँ भवनलाई उपराष्...	ekantipur.com	६ घण्टा अघि	https://l.hamropatro.com/r/https://ekantipur.com/Art/2022/03/04/164636930565589862.html	entertainment
पलविरुद्ध गैँडाकोटमा परेको उजुरीमा के गर्दै छ प्रहरी ?	काठमाडौं । एक नाबालिग गायिकामाथि बलात्कारको आरोप लागेका नेपाली चलचित्रका नायक पल शाहमाथि प्रहरी अनुसन्धान जारी छ । पलविरुद्ध जिल्ला प्रहरी कार्यालय तनहुँ र गैँडाकोटमा जबर्जस्ती करणी (बलात्कार) गरेक...	baahrakhari.com	६ घण्टा अघि	https://l.hamropatro.com/r/https://baahrakhari.com/news-details/343254	entertainment
गीतकार सुरेश आचार्यको गीति एब्लम ‘रमाउदै आयौ’ सार्वजनिक	काठमाडौं, फागुन २० । गीतकार सुरेश आचार्यद्धारा रचित ‘रमाउदै आयौ’ गीति एल्बम सार्वजनिक भएको छ। किरण कृयसन युट्युव च्यानलमार्फत गीतको अडियो–भिडियो बजारमा सार्वजनिक भएको हो । मेल र फिमेल दुबै भर्सनमा...	reportersnepal.com	६ घण्टा अघि	https://l.hamropatro.com/r/https://www.reportersnepal.com/2022/03/655842	entertainment
जब विवाहित पुरूषलाई सोधिन्छ- एक्लै बस्ने कि श्रीमतीसँग?	महिनावारीका कुरा- दोस्रो शृंखला सम्पादकीय नोट: 'महिनावारीका कुरा' को पहिलो शृंखला २०७६ जेठदेखि २०७७ चैतसम्म प्रकाशन भयो। पहिलो शृंखलामा हामीले सिनेमा, संगीत, खेल लगायत समाजका विभिन्न क्षेत्रमा कार...	setopati.com	६ घण्टा अघि	https://l.hamropatro.com/r/https://www.setopati.com/social/263663	entertainment
