अमेरिकाले लगायो रूसी तेलमा प्रतिबन्ध, के असर पर्ला नेपाललाई?	अमेरिकाले रूसबाट आयात हुने कच्चा तेल, प्राकृतिक ग्यास, कोइला लगायत सबै किसिमका इन्धनमा प्रतिबन्ध लगाएको छ। अमेरिकी राष्ट्रपति जो बाइडेनले नेपाली समयअनुसार मंगलबार राति सवा १० बजे यस्तो घोषणा गरेका...	setopati.com	११ घण्टा अघि	https://l.hamropatro.com/r/https://www.setopati.com/kinmel/business/264122	popular
गरिबीबाट मुक्ति पाउन काठमाडौंमा परिवारद्वारा सामूहिक आत्महत्याको प्रयास	गरिबीबाट मुक्ति पाउन राजधानी काठमाडौंमा बसोबास गर्ने एक परिवारका सबै सदस्यले सोमबार राति एकसाथ विष सेवन गरेर सामूहिक आत्महत्याको प्रयास गरे। तर एकैसाथ आत्महत्या गर्ने उनीहरूको प्रयास भने सफल हुन सक...	ratopati.com	५ घण्टा अघि	https://l.hamropatro.com/r/https://ratopati.com/story/225298/2022/3/9/suicide-	popular
पृथ्वीको चुम्बकीय ध्रुव क्यानडाबाट तीव्र गतिमा साइबेरियातर्फ जाँदै	टोरोन्टो । अनुसन्धानकर्ताहरूले केही वर्षयता पृथ्वीको चुम्बकीय ध्रुव क्यानडाबाट तीव्र गतिमा साइबेरियातर्फ सरिरहेको बताएका छन् । उनीहरूले पृथ्वीको बाह्य भागमा रहेका पग्लिएको फलामको दुईवटा विशाल पिण्ड...	baahrakhari.com	१२ घण्टा अघि	https://l.hamropatro.com/r/https://baahrakhari.com/news-details/343687	popular
हजारौँ रुसी नागरिक देश छाड्दै, बौद्धिक पलायनले संकट निम्त्याउन सक्ने	मस्को । अर्थशास्त्रीहरूले रुसमाथि पश्चिमा देशले लगाएको प्रतिबन्धका कारण धेरै शिक्षित मध्यम वर्गीय रुसी नागरिक मुलुक छाड्ने सम्भावना रहेको अनुमान गरेका छन् । उनीहरूले दिर्घकालीन रूपमा मुलुक छाड्दा र...	baahrakhari.com	१२ घण्टा अघि	https://l.hamropatro.com/r/https://baahrakhari.com/news-details/343685	popular
युक्रेन-रुस युद्धः रुसको चेतावनीबीच पश्चिमा देशहरूद्वारा उसका तेल र ग्यासमा प्रतिबन्ध घोषणा	युक्रेनमाथि मस्कोको आक्रमणको विरोधमा आर्थिक प्रतिबन्धलाई बढाउँदै अमेरिका र ब्रिटेनले रुसी तेलमा प्रतिबन्ध लगाउँदै छन् भने युरोपेली सङ्घले रुसी ग्यासमा आफ्नो निर्भरता समाप्त गर्न गइरहेको छ। अमेरिकी...	bbc.com	४ घण्टा अघि	https://l.hamropatro.com/r/https://www.bbc.com/nepali/news-60672045?xtor=AL-73-[partner]-[hamro.patro]-[headline]-[nepali]-[bizdev]-[isapi]	popular
रामकोट घटना :  जसले आफूसँगै ११ वर्षीया छोरीलाई पनि विष पिलाए  !	काठमाडौंको नागार्जुन नगरपालिका–६ रामकोट स्थित डाँडापौवामा सोमबार राति विष पिएका ४ जनाको स्वयम्भु स्थित मनमोहन मेमोरियल अस्पतालमा उपचार हुँदै छ । ३३ वर्षका सुवर्णमान प्रधानको गए राति नै मृत्यु भयो ।...	ratopati.com	४ घण्टा अघि	https://l.hamropatro.com/r/https://ratopati.com/story/225306/2022/3/9/ramkot-suicide-	popular
रुस-युक्रेन युद्धमा परेर अभिनेता पाशाको निधन	रुस र युक्रेनबीच युद्ध जारी छ । यो युद्धमा परेर एक युक्रेनी अभिनेता पाशा लीको निधन भएको छ । युक्रेनी सेनासँग आबद्ध पाशाले देशको सुरक्षाको क्रममा ज्यान गुमाएका हुन् । पाशा अग्रमोर्चामा रहेर सेनाको ...	ratopati.com	४ घण्टा अघि	https://l.hamropatro.com/r/https://ratopati.com/story/225311/2022/3/9/russia-ukrine-war	popular
युक्रेन युद्ध: भारतीय डाक्टर जो युक्रेनमा ज्यागुआर र प्यान्थरसँग फसेका छन्	एक साताभन्दा बढी समयदेखि युद्धग्रस्त युक्रेनस्थित आफ्नै घरको भूमिगत कोठामा एक भारतीय डाक्टर ठूला जङ्गली बिराला प्रजातिका आफ्ना पाल्तु जनावरहरू- ब्ल्याक प्यान्थर र ज्यागुआरसँगै फसेका छन्। गिरीकुमार...	bbc.com	३ घण्टा अघि	https://l.hamropatro.com/r/https://www.bbc.com/nepali/news-60647087?xtor=AL-73-[partner]-[hamro.patro]-[headline]-[nepali]-[bizdev]-[isapi]	popular
भित्ताभरि ‘यो महाअलच्छिना घर हो’ लेखेर किन गरियो सामूहिक आत्महत्याको प्रयास?	काठमाडौं– प्रहरी कन्ट्रोलको १०० नम्बरमा सोमबार राति साढे ९ बजेतिर एउटा फोन आयो- 'रामकोटमा एउटा घरको परिवारका सबै सदस्य अर्धचेत अवस्थामा ढलिरहेको देखिन्छ।' लगत्तै उक्त सूचना महानगरीय प्रहरी वृत्त स...	nepallive.com	१३ घण्टा अघि	https://l.hamropatro.com/r/https://nepallive.com/story/274831	popular
सिद्धबाबाले बलात्कार गरेका हुन् कि राजीखुशी ? आज सुनुवाइ हुँदै	धरानको चतराधाममा बस्ने सिद्धबाबा उर्फ कृष्णबहादुर गिरी विरुद्धको जबरजस्ती करणीको मुद्दामा उच्च अदालत विराटनगरले (आज) बुधबार सुनुवाइ गर्ने भएको छ ।  अदालतले आफ्नो वेबसाइटमा राखेको सूचना अनुसार ५ नम...	ratopati.com	४ घण्टा अघि	https://l.hamropatro.com/r/https://ratopati.com/story/225308/2022/3/9/siddha-baba-	popular
युक्रेन प्रवेश गर्ने रसियाली सैन्य गाडीमा किन पोतियो 'जेड' संकेत? 	युक्रेनमा अहिले ट्याङ्क तथा रसियाली सैन्य सवारीसाधनहरू दौडिनु सामान्य भइसकेको छ। १३ दिनअघिबाट रसियाले युक्रेनमा युद्ध सुरु गरेपछि यस्ता गाडी कीभ र अन्य युक्रेनी सहरहरू नजिकै घुमिरहेका देखिएका छन्। ...	pahilopost.com	३ घण्टा अघि	https://l.hamropatro.com/r/https://pahilopost.com/content/20220309071714.html	popular
उत्तर कोरियाले आणविक परीक्षण साइट मर्मत गरेको अमेरिकी स्याटेलाइटमा देखियो	उत्तर कोरियाले बन्द आणविक परीक्षण साइट मर्मत गर्न थालेको अमेरिकी स्याटेलाइट कम्पनी म्याक्सर टेक्नोलोजिले सार्वजनिक गरेका तस्बिरहरूमा देखिन्छ । उत्तर कोरियाली नेता किम जोङ उनले सम्पूर्ण आणविक परीक्ष...	ratopati.com	२ घण्टा अघि	https://l.hamropatro.com/r/https://ratopati.com/story/225327/2022/3/9/north-korea	popular
सिरियाली लडाकु भर्ना गर्दै रुस : अमेरिका	एक वरिष्ठ अमेरिकी सैन्य अधिकारीले रुसले युक्रेनमा लड्न सिरियाली लडाकुहरूलाई भर्ती गर्ने प्रयास गरिरहेको दबी गरेका छन्। 'रूसी राष्ट्रपतिले युक्रेनभित्रको युद्धको लागि अत्यन्त महत्त्वपूर्ण प्रतिबद्धत...	ratopati.com	३ घण्टा अघि	https://l.hamropatro.com/r/https://ratopati.com/story/225320/2022/3/9/america-	popular
रुस–युक्रेन युद्धको असर : नेपाली रुपैयाँ इतिहासमै कमजोर !	 नेपाली बजारमा अमेरिकी डलरको भाउ अहिलेसम्मकै महँगो भएको छ । नेपाल राष्ट्र बैंकले मंगलबारका लागि अमेरिकी मुद्रा (डलर)को बिक्रीदर १२३ दशमलव ४४ रुपैयाँ र खरिददर १२२ दशमलव ८४ रुपैयाँ निर्धारण गरेको थि...	lokaantar.com	२ घण्टा अघि	https://l.hamropatro.com/r/https://lokaantar.com/story/174984/2022/3/9/press/rupee-	popular
जो १५ दिन बाइक चलाएर काठमाडौंदेखि भारतको कन्याकुमारी पुगेर फर्के (भिडिओ)	नेपालको संघीय राजधानी काठमाडौंदेखि भारतको कन्याकुमारीसम्म बाइक यात्रा। दिनमा कहिले लगातार ८ घन्टा, कहिले १६ घन्टासम्म बाइक चलाएरै। काठमाडौंदेखि भैरहवा—उराइ—इन्दोर—पुने—गोवा—म्यांग्लोर—क्यालकट—एर्न...	setopati.com	४ घण्टा अघि	https://l.hamropatro.com/r/https://www.setopati.com/multimedia/264115	popular
युक्रेन तथा रसियाका छिमेकी देशमा आठ हजार बढी नेपाली श्रमिक	फाइल तस्विर युक्रेन तथा रसियाका छिमेकी श्रम गन्तव्यमा आठ हजारभन्दा बढी श्रमिक कार्यरत रहेको पाइएको छ। युक्रेन र रसिया युद्ध बढ्दै गए सो क्षेत्र वरपर रहेका आधा दर्जन देशमा कार्यरत आठ हजारभन्दा बढी ...	ratopati.com	४ घण्टा अघि	https://l.hamropatro.com/r/https://ratopati.com/story/225299/2022/3/9/nepali-	popular
गठबन्धनको चित्त नदुखाउनुहोस् : प्रधानमन्त्री देउवा	काठमाडौं : प्रधानमन्त्री शेरबहादुर देउवाले सत्ता गठबन्धन र प्रतिपक्षी दलका नेताहरूको चित्त दुख्ने खालका अभिव्यक्ति नदिन पार्टीका शिर्ष नेताहरूलाई निर्देशन दिएका छन्। स्थानीय तह चुनावसम्बन्धी अभियान...	annapurnapost.com	४ घण्टा अघि	https://l.hamropatro.com/r/https://annapurnapost.com/news/198009	popular
युक्रेनका राष्ट्रपति भन्छन्- रुसविरुद्ध जंगल, मैदान र समुद्री किनारबाट आक्रमण जारी राख्छौं	२५ फागुन, काठमाडौं । युक्रेनका राष्ट्रपति भोलोदिमिर जेलेन्स्कीले रुसविरुद्ध जंगल, मैदान र समुद्री तटबाट आक्रमण जारी राख्ने बताएका छन् । बेलायतको तल्लो सदन (हाउस अफ कमन्स)मा सम्बोधन गर्दै जेलेन्स्क...	onlinekhabar.com	१ घण्टा अघि	https://l.hamropatro.com/r/https://www.onlinekhabar.com/2022/03/1090992	popular
रुसविरुद्ध जंगल, मैदान र समुद्री किनारामासमेत लड्न तयार छौँ : जेलेन्स्की	युक्रेनका राष्ट्रपति भोलोदिमिर जेलेन्स्कीले आफ्नो देशले रुसविरुद्धको लडाइ नछोड्ने बताएका छन् । बेलायतको संसद हाउस अफ कमन्सलाई सम्बोधन गर्दै जेलेन्स्कीले युद्ध अन्त्य नहुने बेलासम्म युक्रेन रुसविरुद...	ratopati.com	३ घण्टा अघि	https://l.hamropatro.com/r/https://ratopati.com/story/225314/2022/3/9/volodymyr-jelensky-	popular
युक्रेनका ११ वर्षीय बालक : जसले युद्धबाट जोगिन एक्लै १२,०० किलोमिटर यात्रा गरे	किभ । एकजना बालक युद्धबाट जोगिन एक्लै पूर्वी युक्रेनबाट करिब १,२०० किलोमिटर लामो यात्रा तय गरेर सुरक्षित ढंगले स्लोभाकिया आइपुगेका छन् । एघार वर्षीय हसन नाम गरेका ती बालकले आफ्नो साथमा दुईवटा साना ...	baahrakhari.com	१२ घण्टा अघि	https://l.hamropatro.com/r/https://baahrakhari.com/news-details/343686	popular
ऋण तिर्न नसकेपछि विष सेवन	काठमाडौं । सोमबार साँझ नागार्जुन नगरपालिका–६, डाडापौवामा एकै परिवारका पाँच जनाले विष सेवन गरे । विष सेवन गर्नेमध्येका एक जनाको मृत्यु भएको छ भने चार जनाको अवस्था गम्भीर छ । प्रहरीले घटनाको अनुसन्धा...	rajdhanidaily.com	२ घण्टा अघि	https://l.hamropatro.com/r/https://rajdhanidaily.com/id/57801/	popular
पाकिस्तानका प्रधानमन्त्री इमरान खानविरुद्ध अविश्वासको प्रस्ताव पेस	२५ फागुन, काठमाडौं । पाकिस्तानका प्रधानमन्त्री इमरान खानविरुद्ध अविश्वासको प्रस्ताव पेस भएको छ । विपक्षी दलहरुको गठबन्धन पाकिस्तान डेमोक्रेटिक मुभमेन्ट (पीडीएम)ले प्रधानमन्त्री खानविरुद्ध अविश्वास ...	onlinekhabar.com	३ घण्टा अघि	https://l.hamropatro.com/r/https://www.onlinekhabar.com/2022/03/1090979	popular
इमरान खानविरुद्ध अविश्वासको प्रस्ताव	पाकिस्तानका विपक्षी दलहरूले इमरान सरकारविरुद्ध अविश्वासको प्रस्ताव पेश गरेका छन् । अविश्वासको प्रस्ताव ल्याउनमा विपक्षी दलहरूको गठबन्धन पाकिस्तान डेमोक्रेटिक मुभमेन्ट (पीडीएम)को महत्वपूर्ण भूमिका र...	ratopati.com	३ घण्टा अघि	https://l.hamropatro.com/r/https://ratopati.com/story/225318/2022/3/9/imran-khan-	popular
चीन भन्छ– रुससँगको मित्रता चट्टान सरह बलियो 	बेइजिङ । रुससँग चीनको मित्रता चट्टान सरह बलियो अवस्थामा रहेको चिनियाँ विदेश मन्त्री वाङ यिले बताएका छन् । यससँगै उनले आफूहरुबीच सहकारिताको सम्भाव्यता पनि विस्तृत रहेको उल्लेख गरेका छन् ।  दुई देशब...	baahrakhari.com	२ घण्टा अघि	https://l.hamropatro.com/r/https://baahrakhari.com/news-details/343697	popular
रुसको आक्रमक कारबाही सुस्त बन्दैछः युक्रेन	किभले  पछिल्लो २४ घण्टामा शत्रुले आफ्नो आक्रामक कारवाहीको गतिलाई सुस्त बनाएको दाबी गरेको छ । रुसी सेनामाथि सशक्त प्रतिकार गरेको बताइरहेका बेला युक्रेनको पछिल्लो भनाई आएको हो । रुसी सेनाले मिसाइल र ...	ratopati.com	३ घण्टा अघि	https://l.hamropatro.com/r/https://ratopati.com/story/225317/2022/3/9/russia-ukrine-war	popular
विश्व बैङ्क बाहिरिए पनि हेटौँडा–ढल्केबर–इनरुवा प्रसारण लाइन बन्ने	ऋण लगानी सम्झौता भङ्ग गर्दै विश्व बैङ्क बाहिरिए पनि निर्माणाधीन हेटौँडा–ढल्केबर–इनरुवा ४०० केभी डबल सर्किट प्रसारण लाइन आयोजनाको काम नरोकिने भएको छ । देशभित्रको विद्युत् प्रसारण प्रणाली सुदृढीकरण र...	ratopati.com	४ घण्टा अघि	https://l.hamropatro.com/r/https://ratopati.com/story/225312/2022/3/9/transmission-line-	popular
भूमि आयोगले माग्यो ठूलो संख्यामा कर्मचारी, कसरी दिने आवेदन ? [सूचनासहित]	राष्ट्रिय भूमि आयोगले विभिन्न २ पदमा १ सय ९९ जना कर्मचारी माग गरेको छ । आयोगले सर्भेक्षक र अमिन पदमा करारमा काम गर्नका लागि सो संख्यामा कर्मचारी माग गरेको हो ।  इच्छुक उम्मेदवारहरूले ७ दिन भित्रम...	lokaantar.com	२ घण्टा अघि	https://l.hamropatro.com/r/https://lokaantar.com/story/174992/2022/3/9/government_job_vacancy/bhumi-aayog-	popular
चिनियाँ विदेश मन्त्री नेपाल आउँदै	उत्तरी छिमेकी चीनका विदेश मन्त्री वाङ यी नेपाल आउने भएका छन्। परराष्ट्र मन्त्रालय स्रोतका अनुसार अहिले वाङको भ्रमणको तयारी भइरहेको छ। 'दुबैतिर तयारी भइरहेको छ। मिति तोक्न बाँकी छ। छिट्टै हुने सम्भ...	setopati.com	३ घण्टा अघि	https://l.hamropatro.com/r/https://www.setopati.com/politics/264134	popular
सुन्दरबजारमा अनिश्चितकालीन निषेधाज्ञा	लमजुङको सुन्दरबजार नगरपालिकास्थित सिउँडीबार क्षेत्रमा आज बिहान ६ बजेदेखि अनिश्चितकालीन निषेधाज्ञा (कफ्र्यू) जारी गरिएको छ । सुन्दरबजार–९ स्थित मस्र्याङ्दी नदीमा पौडी खेल्ने क्रममा फ्युचर स्टार आवा...	lokaantar.com	२ घण्टा अघि	https://l.hamropatro.com/r/https://lokaantar.com/story/174993/2022/3/9/current-affairs/news-	popular
प्रहरीले उद्धार गरेका आन्दोलनकारी अस्पतालबाट डिस्चार्ज	एमसिसीको विरोधमा आन्दोलनमा जाँदा घाइते भएपछि प्रहरीले उद्धार गरेका एक जना प्रदर्शनकारी अस्पतालबाट डिस्चार्ज भएका छन्। डडेल्धुरा नवदुर्गा गाउँपालिका-५ सिरोला घर भई हाल ललितपुर टिकाथली बस्ने ३० वर्ष...	setopati.com	१२ घण्टा अघि	https://l.hamropatro.com/r/https://www.setopati.com/social/264123	popular
अमेरिकाले रुसी इन्धनमा लगायो प्रतिबन्ध, बेलायतले पनि रुसी इन्धन ‘फेज आउट’ गर्ने	Created with sketchtool. सम्बन्धित रुसको आक्रामक गतिविधि केही कमजोर : युक्रेन अमेरिका र बेलायतले रुसी इन्धन (पेट्रोलियम पदार्थ) माथि प्रतिबन्ध लगाउने र फेज आउट गर्ने घोषणा गरेका छन्। अमेरिका र ब...	deshsanchar.com	४ घण्टा अघि	https://l.hamropatro.com/r/https://deshsanchar.com/2022/03/09/622099/	popular
