ललितपुरमा एकै परिवारका ५ जनाको मृत्यु हुनुको कारण के हो ?	ललितपुरको कोन्ज्योसोम गाउँपालिका–४ स्थित नल्लुमा २ दिनअघि शिशुको जन्म भएपछि स्याङ्तान परिवारमा खुसी छाएको थियो तर त्यो खुसी लामो समयसम्म टिक्न सकेन । स्याङ्तान परिवारमा खुसी छर्ने शिशु र खुसी मनाउ...	lokaantar.com	७ घण्टा अघि	https://l.hamropatro.com/r/https://lokaantar.com/story/174855/2022/3/8/press/death	popular
युक्रेन-रुस युद्धः रुसको चेतावनीअनुसार तेलको मूल्य कति पुग्न सक्छ	पश्चिमा देशहरूले रुसी तेलमाथि प्रतिबन्ध लगाए तेलको मूल्यमा व्यापक वृद्धि हुने मस्कोले चेतावनी दिएको छ। अन्तर्राष्ट्रिय बजारमा प्रतिब्यारल तेलको मूल्य तीन सय डलरसम्म पुग्न सक्ने उसको चेतावनी छ। प्...	bbc.com	६ घण्टा अघि	https://l.hamropatro.com/r/https://www.bbc.com/nepali/news-60657087?xtor=AL-73-[partner]-[hamro.patro]-[headline]-[nepali]-[bizdev]-[isapi]	popular
सोनाक्षीविरुद्ध पक्राउ पुर्जी	मुम्बई । ‘आर्थिक लेनदेनमा धोका दिएको’ भन्दै बलिउड अभिनेतृ सोनाक्षी सिन्हाविरुद्ध प्रहरीले पक्राउ पुर्जी जारी गरेको छ । दिल्लीमा एक कार्यक्रमका लागि ३७ लाख लिएर पनि सहभागी नभएको आरोपमा आयोजकले उनीव...	rajdhanidaily.com	७ घण्टा अघि	https://l.hamropatro.com/r/https://rajdhanidaily.com/id/57723/	popular
११ वर्षीय बालिकालाई पनि ‘विष’ खुवाएर किन गरे परिवारका सबै सदस्यले आत्महत्या प्रयास ?	काठमाडौं । ‘सुसाइड’ नोट लखेर आत्महत्याको प्रयास गर्ने काठमाडौंमा एकै परिवारका पाँचजनाबारे प्रहरी अनुसन्धान जारी छ । पाँचमध्ये एकजनाको मृत्यु भएको छ । चारजनाको अचेत अवस्थामा स्वयम्भूस्थित मनमोहन मेम...	baahrakhari.com	३ घण्टा अघि	https://l.hamropatro.com/r/https://baahrakhari.com/news-details/343622	popular
थप इन्धन किन्न नसक्ने अवस्थामा आयल निगम	अन्तर्राष्ट्रिय बजारमा कच्चा तेलको मूल्य नयाँ रेकर्ड कायम गरेर १ सय ३० डलर प्रतिब्यारल पुगेको छ। युक्रेन र रुसबीचको युद्धका कारण अन्तर्राष्ट्रिय बजारमा कच्चा तेलको मूल्य बढेर १४ वर्षयताकै उच्च बिन्...	ratopati.com	६ घण्टा अघि	https://l.hamropatro.com/r/https://ratopati.com/story/225130/2022/3/8/oil-corporation-	popular
भक्तपुरमा अर्धनग्न अवस्थामा मृत भेटिएकी महिला गर्थिन् मजदुरी, पहिचान खुल्यो	काठमाडौं । भक्तपुरमा मृतावस्थामा फेलापरेकी महिलाको पहिचान खुलेको छ । गए राति चाँगुनारायण नगरपालिका–७, बागरेस्थित तरकारी खेती हुँदै आएको जग्गामा टिनको कच्ची टहराभित्र महिलाको शव फेलापरेको थियो । मृ...	baahrakhari.com	२ घण्टा अघि	https://l.hamropatro.com/r/https://baahrakhari.com/news-details/343624	popular
‘सुसाइड’ नोट लेखेर आत्महत्या प्रयास गरेका चारजना अझै अचेत, एकको मृत्यु	काठमाडौं । ‘सुसाइड’ नोट लखेर आत्महत्याको प्रयास गर्ने काठमाडौंमा एकै परिवारका पाँच जनाको पहिचान खुलेको छ । जसमध्ये एकजनाको मृत्यु भएको छ । काठमाडौंको नागर्जुन नगरपालिका–६, रामकोटमा हिजो साँझ एकै प...	baahrakhari.com	५ घण्टा अघि	https://l.hamropatro.com/r/https://baahrakhari.com/news-details/343607	popular
युक्रेनसँग रुसका 'पूरा गर्नै नसकिने' माग, दुई देशबीच तेस्रो चरणको वार्ता हुँदै	मस्को । रुसी फौजले सोमबार आफूले युद्ध विराम गर्ने र मानवीय उद्धार मार्गहरू खोलिदिने बताउँदै युक्रेनका सहरहरूका आवासीय क्षेत्रहरूमा व्यापक बमबारी र रकेट प्रहार कार्यलाई निरन्तरता दिइरहेको छ । रुस र ...	baahrakhari.com	१३ घण्टा अघि	https://l.hamropatro.com/r/https://baahrakhari.com/news-details/343602	popular
काठमाडौंको रामकोटमा एकै परिवारका ५ जना बेहोस भेटिए, एक जनाको मृत्यु	काठमाडौं : काठमाडौंको नागार्जुन नगरपालिकास्थित रामकोटमा एकै परिवारका ५ जना बेहोस अवस्थामा भेटिएका छन्। तीमध्ये एक जनाको मृत्यु भएको महानगरीय प्रहरी परिसर काठमाडौंका एसएसपी सुदिप गिरीले जानकारी दिए।...	annapurnapost.com	१३ घण्टा अघि	https://l.hamropatro.com/r/https://annapurnapost.com/news/197940	popular
रामकोट घटनाका परिवारले लेखेको नोट फेला, घटनाको कारण खोतल्दै प्रहरी	काठमाडौंको नागार्जुन नगरपालिका–६ रामकोटस्थित डाँडापौवामा सोमबार राति विष पिएको परिवारका ५ जनामध्ये ४ जनाको गम्भीर अवस्थमा उपचार भइरहेको छ । ६२ वर्षीया इन्दिरामाया प्रधान सहित विष पिएका ४ जनाको स्वय...	ratopati.com	४ घण्टा अघि	https://l.hamropatro.com/r/https://ratopati.com/story/225163/2022/3/8/ramkot-ghatana-	popular
के साँच्चै घाइते थिए रोनाल्डो ?	क्रिस्टियानो रोनाल्डो अर्को सिजन म्यानचेस्टर युनाइटेडका लागि खेल्ने छैनन् । त्यो अब लगभग निश्चित देखिन्छ। इतिहादमा आइतबारको म्यानचेस्टर डर्बीमा रोनाल्डोको नाम बेन्चमा पनि थिएन। रोनाल्डो घाइते भएको...	ratopati.com	६ घण्टा अघि	https://l.hamropatro.com/r/https://ratopati.com/story/225142/2022/3/8/cristiano-ronaldo-	popular
छोरी, ज्वाइँ अटाउँदा चित्रबहादुरहरु अटेनन्	२२ फागुन, काठमाडौं । नेकपा माओवादी केन्द्रको केन्द्रीय समितिको सोमबारको बैठकमा अध्यक्ष पुष्पकमल दाहाल प्रचण्डले केन्द्रीय सदस्यका लागि ९७ जनाको नाम प्रस्ताव गरे । उनले पढेको सूचीको ३२ औं नम्बरमा छो...	onlinekhabar.com	१४ घण्टा अघि	https://l.hamropatro.com/r/https://www.onlinekhabar.com/2022/03/1090467	popular
काठमाडौंमा ५ जनाद्वारा सामूहिक विष सेवन : १ जनाको मृत्यु, ४ जना बोल्न नसक्ने अवस्थामा	काठमाडौंको नागार्जुन नगरपालिका–६ डाडापौवामा ५ जनाले सामूहिक विष सेवन गरेका छन्, जसमध्ये १ जनाको मृत्यु भइसकेको छ । स्थानीय उद्धवराज पुरीको २ तल्ले पक्की घरको दोस्रो तलामा फ्ल्याट भाडामा लिई बस्ने ...	lokaantar.com	६ घण्टा अघि	https://l.hamropatro.com/r/https://lokaantar.com/story/174863/2022/3/8/current-affairs/poison	popular
अण्डा खाने सही तरिका	अण्डालाई पौष्टिक खानेकुराको श्रेणीमा समावेश गरिएको छ । अण्डालाई प्रोटिनको उत्कृष्ट स्रोत मानिन्छ। प्रोटिनका अलावा अण्डामा भिटामिन बी १२, भिटामिन ए, एमिनो एसिड, आइरन, फोलेट, बायोटिन, भिटामिन डी, सोड...	ratopati.com	५ घण्टा अघि	https://l.hamropatro.com/r/https://ratopati.com/story/225153/2022/3/8/egg-	popular
‘सुसाइट नोट’ लेखेर एकै परिवारका पाँचजनाले गरे विष सेवन, एकको मृत्यु	काठमाडौं, फागुन २४। काठमाडौंको नागार्जुन नगरपालिका वडा नम्बर ६ डाडापौवामा एकै परिवारका पाँच जनाले विष सेवन सामूहिक आत्महत्याको प्रयास गरेका छन् । सुसाइट नोट लेखेर विष सेवन गरेका पाँच जना मध्ये एक ज...	reportersnepal.com	३ घण्टा अघि	https://l.hamropatro.com/r/https://www.reportersnepal.com/2022/03/657322	popular
बैंकमा निक्षेप संकलन बढ्यो, कर्जा प्रवाह सहज हुँदै	आर्थिक वर्ष शुरू भएयता लगातार रूपमा भइरहेको लगानीयोग्य पुँजीको अभाव अर्थात् तरलताको समस्या समाधान हुने संकेत देखिन थालेको छ । फागुनको तेस्रो हप्तामा आएर वाणिज्य बैंकहरूमा निक्षेप संकलन बढेपछि तरलत...	lokaantar.com	७ घण्टा अघि	https://l.hamropatro.com/r/https://lokaantar.com/story/174853/2022/3/7/press/bank	popular
युक्रेनको पक्षमा नेपाल	परराष्ट्रमन्त्री डा. नारायण खड्काले युक्रेनको सार्वभौमसत्ताको पक्षमा नेपाल उभिएको बताएका छन्  । सोमबार आयोजित पत्रकार सम्मेलनमा परराष्ट्रमन्त्री डा. खड्काले युक्रेनको पक्ष लिनु भनेको युद्धको पक्ष ल...	ratopati.com	७ घण्टा अघि	https://l.hamropatro.com/r/https://ratopati.com/story/225127/2022/3/8/ukraine-nepal-	popular
गृहयुद्धको बीचमा यमन पुगिन् एन्जेलिना जोली	हलिउड स्टार एन्जेलिना जोली हालै यमनमा जारी गृहयुद्धको बीचमा मध्यपूर्वमा शरणार्थीहरूलाई सहयोग गर्न देशको भ्रमण गरेकी छिन् । शरणार्थीका लागि संयुक्त राष्ट्रसङ्घीय उच्चायुक्तसँग करिब दुई दशक काम गरिसक...	ratopati.com	५ घण्टा अघि	https://l.hamropatro.com/r/https://ratopati.com/story/225158/2022/3/8/angelina-jolie-	popular
आईपीएल : डु प्लेसिस आरसीबीको नयाँ कप्तान बन्ने, कोहलीको पनि सहमति	रोहित शर्माको कप्तानीमा टेस्ट खेलेपछि विराट कोहलीले इन्डियन प्रिमियर लिग (आईपीएल) मा फाफ डु प्लेसिसको कप्तानीमा खेल्ने भएका छन् । रोयल च्यालेन्जर्स बैंग्लोर (आरसीबी) ले आफ्नो नयाँ कप्तान चयन गरेको ...	ratopati.com	६ घण्टा अघि	https://l.hamropatro.com/r/https://ratopati.com/story/225145/2022/3/8/faf-du-plessis-rcb	popular
घाटा न्यूनीकरण गर्दै निगम : पम्पको कमिसन घट्यो, कर्मचारीको पोसाक खर्च हट्यो	नेपाल आयल निगमले विश्व बजारमा मूल्य निरन्तर उकालो लागिरहेको पेट्रोलियम पदार्थ बिक्रीबाट बेहोरिरहेको घाटा न्यूनीकरण गर्ने नीति लिएको छ । पेट्रोलियम पदार्थ बिक्रीबाट हुने बढ्दो घाटा न्यूनीकरण गर्न नि...	ratopati.com	६ घण्टा अघि	https://l.hamropatro.com/r/https://ratopati.com/story/225139/2022/3/8/nepal-oil-corporation-	popular
अर्धनग्न अवस्थामा भेटियो महिलाको शव	भक्तपुर : चागुँनारायण नगरपालिकाको बागरेमा अर्धनग्न अवस्थामा महिलाको शव फेला परेको छ। परालले छोपेको अवस्थमा शव फेला परेको भक्तपुर प्रहरीले जनाएको छ। महिलाको घाँटी र अन्य भागमा गम्भीर चोट लागेको छ। ...	annapurnapost.com	२ घण्टा अघि	https://l.hamropatro.com/r/https://annapurnapost.com/news/197956	popular
पुटिन निक्सन होइनन् 	रसियन राष्ट्रपति भ्यादिमिर पुटिन गत फरबरी ४ मा चीनका राष्ट्रपति सी जिनपिङसँग गठबन्धन देखिने सम्झौतामा हस्ताक्षर गरेपछि आफूले सन् १९७२ मा भएकाे अमेरिकन राष्ट्रपति रिचर्ड निक्सनकाे ऐतिहासिक बेइजिङ भ्...	baahrakhari.com	३ घण्टा अघि	https://l.hamropatro.com/r/https://baahrakhari.com/news-details/343619	popular
‘चीनबाट आएको ९ करोड छाता कहाँ गयो ?’	२४ फागुन, विराटनगर । विराटनगरका उद्योगी महेश जाजुले सुपारी आयात खुला गर्दा नेपाललाई नै फाइदा हुने बताएका छन् । पछिल्लो समय सरकारले २५ हजार टन सुपारी आयातको लाइसेन्स खुला गर्ने तयारी गरेपछि जाजुले ...	onlinekhabar.com	३ घण्टा अघि	https://l.hamropatro.com/r/https://www.onlinekhabar.com/2022/03/1090518	popular
युक्रेनको दाबी : रुसी सेनाका एक ठूला अधिकारी खारकिभको लडाईँमा मारिए	युक्रेनी सेनाको सैन्य गुप्तचर सेवाले खारकिभको नजिकै भएको लडाईंका बेला एक रुसी सेनाका शीर्ष कमान्डरको मृत्यु भएको दाबी गरेको छ । बीबीसीले यो दाबीलाई स्वतन्त्र रुपमा पुष्टि नगरेको बतायो । रुसी अधिका...	ratopati.com	३ घण्टा अघि	https://l.hamropatro.com/r/https://ratopati.com/story/225169/2022/3/8/ukraine-russia	popular
इन्धन खरिद गर्न नसक्ने अवस्थामा निगम	अन्तर्राष्ट्रिय बजारमा कच्चा तेलको मूल्य नयाँ रेकर्ड कायम गरेर १ सय ३० डलर प्रतिब्यारल पुगेको छ । युक्रेन र रुसबीचको युद्धका कारण अन्तर्राष्ट्रिय बजारमा कच्चा तेलको मूल्य बढेर १४ वर्षयताकै उच्च बिन...	karobardaily.com	५ घण्टा अघि	https://l.hamropatro.com/r/https://www.karobardaily.com/news/177153	popular
युक्रेन युद्धः 'न साइरन न बम, यहाँ सबै कुरा राम्रो छ' - पोल्यान्डमा युक्रेनी शरणार्थी	युक्रेनमा रुसले आक्रमण थालेपछि भागेर एउटा परिवारका केही सदस्यहरू छिमेकी देश पोल्यान्ड पुगेका छन्। बम पड्किरहेको र साइरन बजिरहेको ठाउँबाट त्यहाँ पुग्दा फरक अनुभूति भएको उनीहरूको भनाइ छ। युक्रेनबाट ...	bbc.com	२ घण्टा अघि	https://l.hamropatro.com/r/https://www.bbc.com/nepali/news-60657807?xtor=AL-73-[partner]-[hamro.patro]-[headline]-[nepali]-[bizdev]-[isapi]	popular
आज कति पुग्यो डलरको भाउ ? हेर्नुहोस् विदेशी मुद्राको विनिमयदर	मंगलबार डलरको भाउ ११२ रुपैयाँ ८४ पैसा पुगेको छ । अघिल्लो दिन डलर खरिददर १२१ रुपैयाँ ५६ पैसा तथा विक्रीदर १२२ रुपैयाँ १६ पैसा थियो ।  आइतबार भने बढेर खरिददर ११२ रुपैयाँ ८४ पैसा र बिक्रीदर १२३ रुपैया...	ratopati.com	६ घण्टा अघि	https://l.hamropatro.com/r/https://ratopati.com/story/225136/2022/3/8/forex-	popular
उपेन्द्र यादवको अधिकार कटौती	काठमाडौं । जनता समाजवादी पार्टीको कार्यकारिणी समितिका अध्यक्ष उपेन्द्र यादवको अधिकार कटौती गरिएको छ। फागुन १३, १४ र १५ गते बसेको कार्यकारिणी समितिको बैठकपछि यादवको अधिकार कटौती गरिएको हो। यो निर्णय...	news24nepal.tv	६ घण्टा अघि	https://l.hamropatro.com/r/https://www.news24nepal.tv/2022/03/08/861930	popular
एम्बाप्पेले रियलविरुद्धको खेल गुमाउन सक्ने	प्रशिक्षणका क्रममा चोट लागेपछि किलियान एमबाप्पेले च्याम्पियन्स लिगमा पेरिस सेन्ट-जर्मेनको रियल म्याड्रिडसँगको खेल खेल्नेमा शंका उत्पन्न भएको छ । २३ वर्षीय खेलाडीले पार्क डेस प्रिन्सेसमा राउण्ड अफ १...	ratopati.com	५ घण्टा अघि	https://l.hamropatro.com/r/https://ratopati.com/story/225149/2022/3/8/mbappe-	popular
केन्द्रीय सदस्य चयनले माओवादीमा असन्तुष्टि, नेताहरुले छाड्न थाले पार्टी	अध्यक्ष पुष्पकमल दाहालले केन्द्रीय समितिमा गरेको मनोनयनलाई लिएर माओवादी केन्द्रमा तीव्र असन्तुष्टि देखिएको छ।  अध्यक्ष प्रचण्डले आफ्नो परिवारका सदस्य र निकटहरुलाई प्राथमकिता दिएर केन्द्रीय सदस्य  ...	nepalkhabar.com	१४ घण्टा अघि	https://l.hamropatro.com/r/https://nepalkhabar.com/politics/122920-2022-3-7-22-16-31	popular
फ्रान्स र जर्मनीका नेताले चिनियाँ राष्ट्रपति सीसँग संयुक्त वार्ता गर्दै, युक्रेन युद्ध प्रमुख मुद्दा	Created with sketchtool. सम्बन्धित रुसी सैनिकका उच्च कमाण्डर मारिएको युक्रेनको दाबी फ्रान्सका राष्ट्रपति इम्यानुएल म्याक्रोँ र जर्मन चान्स्लर ओलाफ स्कोल्जले चिनियाँ राष्ट्रपति सी जिनपिङसँग संयुक...	deshsanchar.com	५ घण्टा अघि	https://l.hamropatro.com/r/https://deshsanchar.com/2022/03/08/621766/	popular
