पाकिस्तानी प्रधानमन्त्री इमरान खानविरुद्ध अविश्वासको प्रस्ताव, पारित होला?	काठमाडौं- पाकिस्तानी प्रधानमन्त्री इमराख खानविरुद्ध विपक्षी दलले संसदमा अविश्वासको प्रस्ताव लगेका छन्। उनीहरुले इमरानको दिनगन्ती सुरु भइसकेको दाबी गरेका छन्।  अविश्वासको प्रस्तावलाई लिएर पाकिस्तान...	nepallive.com	१ घण्टा अघि	https://l.hamropatro.com/r/https://nepallive.com/story/274872	international
संसारभरी पुनः बढिरहेको छ कोरोना संक्रमण, चौथो लहरबारे कस्तो छ विज्ञको धारणा ?	संसारभरी कोरोना संक्रमितको संख्यामा पुनः वृद्धि देखिन थालेको छ । पछिल्लो २४ घण्टामा संसारभरी कोरोनाभाइरसका १६.०३ लाख संक्रमित भेटिएका छन् । यतिमात्रै होइन ८ मार्चमा ६,८१८ जनाले आफ्नो ज्यान गुमाएका ...	ratopati.com	१ घण्टा अघि	https://l.hamropatro.com/r/https://ratopati.com/story/225395/2022/3/9/no-fourth-wave-of-coronavirus-will-occur-in-india-says-virologist-t	international
पूर्व इन्टेलिजेन्स ब्यूरो अफिसरमाथि १७ वर्षीया किशोरीलाई बलात्कार गरेको आरोप	काठमाडौं । भरतको राजधानी दिल्लीमा एउटा लज्जास्पद घटना बाहिर आएको छ । दिल्लीमा एक नाबालिगलाई जबर्जस्ती करणी गरेको आरोपमा ६० वर्षीय अधिकृतविरुद्ध मुद्दा दर्ता भएको छ । घटनाको अनुसन्धानमा प्रहरी जुटेक...	lokpath.com	१ घण्टा अघि	https://l.hamropatro.com/r/https://www.lokpath.com/story/507215	international
खडेरीले इथियोपियाबाट आठ लाख ४५ हजार मानिस विस्थापित : १५ लाखभन्दा बढी पशु मरे	सिन्ह्वा : इथियोपियामा खडेरीका कारण ठूलो संख्याका नागरिक विस्थापित भएका छन्। साथै यहाँका लाखौँ पशु चौपाया पनि मरेको संयुक्त राष्ट्रसंघले जानकारी दिएको छ।  संयुक्त राष्ट्रसंघका अनुसार यहाँका ८ लाख ...	annapurnapost.com	२ घण्टा अघि	https://l.hamropatro.com/r/https://annapurnapost.com/news/198037	international
रुसमा प्रतिबन्ध लगाउना साथ अमेरिकामा बढ्यो तेलको मूल्य, राष्ट्रपति बाइडेन आलोचनाको शिकार	294 Shares वासिङ्टन। अमेरिकाले रुसी तेल–ग्यास र अन्य उर्जा आपूर्ति तत्काल बन्द गर्ने निर्णय गरेको छ। युक्रेनमा आक्रमण गरिरहेकाले रुसमाथि कडा प्रतिबन्धहरु लगाउने क्रममा अमेरिकाले रुसको तेल र ग्या...	dainikonline.com	२ घण्टा अघि	https://l.hamropatro.com/r/https://www.dainikonline.com/story/193565/2022/03/09/	international
युद्धग्रस्त क्षेत्रबाट ठूलो संख्यामा नागरिकलाई सुरक्षित स्थानमा सारिएको युक्रेनको घोषणा	युक्रेनमाथि रुसले आक्रमण गरको १४ दिन भइसकेको छ । संघर्ष जारी रहेकाले युक्रेनमै बस्न सर्वसाधारणका लागि कठिन भइरहेको छ । यसै सिलसिलामा युक्रेनले आफ्नो मुलुकबाट ठूलो संख्यामा नागरिकहरुलाई सुरक्षित स्थ...	ratopati.com	२ घण्टा अघि	https://l.hamropatro.com/r/https://ratopati.com/story/225384/2022/3/9/ukraine-	international
पाँच हजार मानिस सुरक्षितसाथ निस्किए युद्धप्रभावित सुमी शहरबाट	एजेन्सीः युक्रेनको युद्धप्रभावित सुमी शहरबाट पाँच हजार मानिसलाई सुरक्षितसाथ शहरबाहिर निकालिएको छ। युक्रेनी अधिकारीका अनुसार यो नै पहिलो सफल 'मास इभाक्युएशन' हो।	ukeraa.com	२ घण्टा अघि	https://l.hamropatro.com/r/https://www.ukeraa.com/news/2022/03/09/15856	international
चिनियाँ र पाकिस्तानी विदेशमन्त्री फोनवार्ता	काठमाडौं- चिनियाँ र पाकिस्तानी विदेशमन्त्रीबीच फोनवार्ता भएको छ। चिनियाँ विदेशमन्त्री वाङ यी र पाकिस्तानी विदेशमन्त्री साश मोहमद कुरेसीबीच फोनवार्ता भएको बताइएको छ। उनीहरुका बीचमा मंगलबार फोनमा कु...	nepallive.com	२ घण्टा अघि	https://l.hamropatro.com/r/https://nepallive.com/story/274867	international
आफ्ना नागरिकलाई तत्काल युक्रेन छाड्न बाइडनको आह्वान	काठमाडौं– अमेरिकी राष्ट्रपति जो बाइडनले युक्रेनमा बसोबास गरिरहेका आफ्ना नागरिकलाई तत्काल देश छाड्न आह्वान गरेका छन् । रुसले युक्रेनमाथि आक्रमण जारी राखेका बेला बाइडनले यस्तो आह्वान गरेका हुन् ।	khabarhub.com	२ घण्टा अघि	https://l.hamropatro.com/r/https://www.khabarhub.com/2022/09/359229/	international
किएभमा आक्रमण गर्न रुसी सेना तयार, लगभग सुरक्षित पारिसक्यो अन्य क्षेत्र	युक्रेनमा रुसी सैनिकहरूको कारवाहीका विषयमा जारी गरिएका नक्सा हेर्दा रुसले निर्णायक विजय पाउनै लागेको देखिएको छ ।  राजधानी किएभको उत्तरपूर्वी भागमा रुसी सेनाले दुईवटा पकेट एरिया तयार पारेको छ । त्य...	lokaantar.com	२ घण्टा अघि	https://l.hamropatro.com/r/https://lokaantar.com/story/175013/2022/3/9/international/ukraine-invasion	international
पुटिनले युक्रेन कहिल्यै जित्ने छैनन्ः राष्ट्रपति बाइडेन	एजेन्सी, २५ फागुन । रुस र युक्रेनबीचको युद्धको आज १४ औं दिन हो । रुसले युद्धमा फसेका मानिसहरूको उद्धार गर्न बुधबार युद्धविराम घोषणा गरेको छ । कीभ, खार्किभ, सुमी, मारिउपोल, चेर्निहाइभ सहरहरूमा युद्ध...	reportersnepal.com	२ घण्टा अघि	https://l.hamropatro.com/r/https://www.reportersnepal.com/2022/03/657992	international
युक्रेन युद्धः रुस र चीनबीच कति ठूलो व्यापार छ, के प्रतिबन्ध सामना गर्न चीनले सघाउन सक्छ	रुसले युक्रेनमा आक्रमण गरेपछि उसलाई एक्लो पार्न अमेरिका, ईयू र ब्रिटेनले जस्तै प्रतिबन्धहरू लागु गर्नका निम्ति अस्ट्रेलियाले चीनलाई आग्रह गरेको छ। प्रधानमन्त्री स्कट मरिसनले रुसबाट थप गहुँ किन्न च...	bbc.com	२ घण्टा अघि	https://l.hamropatro.com/r/https://www.bbc.com/nepali/news-60658935?xtor=AL-73-[partner]-[hamro.patro]-[headline]-[nepali]-[bizdev]-[isapi]	international
China’s Xi calls for ‘maximum restraint’ in Ukraine	China, which has refused to condemn Russia’s actions in Ukraine or to call them an invasion, has repeatedly expressed its opposition to what it describes as illegal sanctions on Russia. Chinese Pr...	kathmandupost.com	३ घण्टा अघि	https://l.hamropatro.com/r/https://kathmandupost.com/world/2022/03/09/china-s-xi-calls-for-maximum-restraint-in-ukraine	international
रुसबाट हुने सम्पूर्ण तेल र ग्यासको आयातमा प्रतिबन्ध लगाउने बाइडेनको घोषणा	नेपाली पैसा   काठमाडौं : अमेरिकी राष्ट्रपति जो बाइडेनले अमेरिकामा रुसबाट हुने सबै प्रकारका तेल र ग्यासको आयातमा प्रतिबन्ध लगाउने घोषणा गरेका छन् । युक्रेन युद्ध अन्त्य गर्न रुसी राष्ट्रपति भ्लादि...	nepalipaisa.com	३ घण्टा अघि	http://l.hamropatro.com/r/http://www.nepalipaisa.com/NewsDetail.aspx/id/46671	international
युक्रेनलाई लडाकू विमान दिने सवालमा अमेरिका र पोल्यान्डबीच मतभिन्नता	पोल्यान्डले आफ्नो मिग–२९ लडाकू विमान अमेरिकालाई दिने अनि अमेरिकाले त्यो विमान युक्रेनलाई दिने भनी राखेको प्रस्तावलाई अमेरिकाले लत्याएको छ ।  अमेरिकाको रक्षा मन्त्रालय पेन्टागनका प्रेस सचिव जोन कर्...	lokaantar.com	३ घण्टा अघि	https://l.hamropatro.com/r/https://lokaantar.com/story/175008/2022/3/9/international/weapons-to-Ukraine	international
बेलायती संसदमा युक्रेनी राष्ट्रपतिको सम्बोधन, रसियालाई 'आतंकवादी राज्य' को संज्ञा	युक्रेनका राष्ट्रपति भोलोदिमिर जेलेनक्सीले रसियालाई ‘आतंकवादी राज्य’ घोषणा गर्न माग गरेका छन्। बेलायती संसदमा सम्बोधन गर्दै उनले बेलायतलाई रसियामाथि थप प्रतिबन्ध लगाउन आग्रह पनि गरेका छन्। ‘आतंकवा...	pahilopost.com	३ घण्टा अघि	https://l.hamropatro.com/r/https://pahilopost.com/content/20220309113311.html	international
किभमा फेरि विस्फोट	युक्रेनको राजधानी किभमा फेरि विस्फोट भएको छ । त्यस वरपरको क्षेत्रमा पनि केही मिनेटअघि विस्फोटन भएको सुनिएको हो । त्यहाँबाट पत्रकारहरूले शृङ्खलाबद्ध विस्फोट भएको जानकारी दिएको बीबीसीले जनाएको छ । ...	ekagaj.com	३ घण्टा अघि	https://l.hamropatro.com/r/https://ekagaj.com/article//article/world/90697/	international
युक्रेनकी प्रथम महिलाले विश्वभरीका मिडियालाई लेखेको खुला पत्रमा के-के लेखेकी छिन् ?	काठमाडौं । युक्रेनकी प्रथम महिलाले “युक्रेनी नागरिकको नरसंहार”को निन्दा गर्दै खुलापत्र लेखेकी छन्। ओलिना जेलेन्स्काले लेखेकी छन्,“रुसले अतिक्रमण गर्ला भन्ने कुरा पत्याउन असम्भव थियो। रुसी आक्रमणले ...	dcnepal.com	३ घण्टा अघि	https://l.hamropatro.com/r/https://www.dcnepal.com/2022/03/337556/	international
११ वर्षका बालक एक्लै १२०० किलोमिटर यात्रा गरेर पुगे स्लोभाकिया	रुसको हमलापछि लाखौं मानिस युक्रेनबाट भागेर आसपासको देशमा शरण लिइरहेका छन् । अझै पनि पोल्याण्ड, रोमानिया, स्लोभाकिया जस्ता देशमा लगातार युक्रेनी शरणार्थी पुग्ने क्रम जारी छ । यसैक्रममा  एक शरणार्थी ...	ratopati.com	३ घण्टा अघि	https://l.hamropatro.com/r/https://ratopati.com/story/225368/2022/3/9/child	international
यो वर्षको अन्तर्राष्ट्रिय साहसी महिला अवार्ड भूमिकालाई	काठमाडौं- अमेरीकी सरकारले प्रदान गर्ने अन्तर्राष्ट्रिय साहसी महिला अवार्डबाट यौनिक तथा लैंगिक अल्पसंख्यक अभियानकर्मी भूमिका श्रेष्ठ सम्मानित भएकी छन्।  यौनिक तथा लैंगितक अल्पसंख्यक समुदायको अधिका...	nepalsamaya.com	६ मिनेट अघि	https://l.hamropatro.com/r/https://nepalsamaya.com/samaj/2022-03-09-134000	entertainment
लक्ष्मणको ‘बुलाकी’मा सुरक्षाको ‘मार्मिक’ लुक्स	काठमाडौं– लक्ष्मण सुनारको निर्देशनमा बनेको फिल्म ‘बुलाकी’को फर्स्ट लुक सार्वजनिक भएको छ। फिल्मको पोस्टर मंगलबार अन्तर्राष्ट्रिय महिला दिवसको अवसरमा सार्वजनिक भएको हो।  फिल्मको पोस्टरमा अभिनेत्री स...	nepallive.com	१८ मिनेट अघि	https://l.hamropatro.com/r/https://nepallive.com/story/274880	entertainment
ऋषि कपुरको अन्तिम चलचित्र ‘शर्माजी नमकिन’ रिलिज हुँदै	काठमाडौं । बलिउडका दिवंगत अभिनेता ऋषि कपुरको अन्तिम चलचित्र ‘शर्माजी नमकिन’ रिलिज हुने भएको छ । चलचित्र यही मार्च ३१ मा अमेजोन प्राइम भिडियोमार्फत विश्वव्यापी रिलिज हुँदै छ । यसमा ऋषि र परेश रावल ...	baahrakhari.com	२२ मिनेट अघि	https://l.hamropatro.com/r/https://baahrakhari.com/news-details/343727	entertainment
परदेशी–२ को पोस्टर सार्वजनिक	काठमाडौं– नारायण रायमाझीको निर्देशनमा बनेको फिल्म ‘परदेशी– २’को फर्स्ट लुक सार्वजनिक भएको छ। सामाजिक सञ्जालमार्फत फिल्मको निर्माण पक्षले फिल्मको पोस्टर सार्वजनिक गरेको हो।  ‘परदेशी– २’ सन् २०१५ मा...	nepallive.com	३१ मिनेट अघि	https://l.hamropatro.com/r/https://nepallive.com/story/274879	entertainment
छायाँ सेन्टरमा मेरो स्कूलको ‘सेल्फी पोइन्ट’	काठमाडौँ । काठमाडौँको ठमेलस्थित छायाँ सेन्टरमा मेरो स्कूलको ‘सेल्फी पोइन्ट’ स्थापना भएको छ । अन्तरराष्ट्रिय नारी दिवसको अवसरमा एक कार्यक्रमका बीच सो पोइन्ट स्थापना गरिएको हो । सो सेल्फी पोइन्टको उ...	makalukhabar.com	३१ मिनेट अघि	https://l.hamropatro.com/r/https://www.makalukhabar.com/2022/03/99977172060/	entertainment
अस्ट्रेलियाकी २२ वर्षीय गायिका लिल बो वीपको निधन	अष्ट्रेलियन गायिका तथा युट्युव स्टार लिल बो वीपको निधन भएको छ । २२ वर्षीय गायिकाको निधनको खबर सामाजिक सञ्जालमार्फत उनका बुबा म्याथ्यु स्कोफिल्डले सार्वजनिक गरेका हुन् । उनको मृत्युको कारण भने खुल्न...	ratopati.com	४२ मिनेट अघि	https://l.hamropatro.com/r/https://ratopati.com/story/225405/2022/3/9/death	entertainment
पाटन ढोकामा परम्परागत र समकालीन चित्रको मेलाका दृश्यहरु	काठमाडौं : ललितपुरको ढोकैमा क्याफेमा अहिले परम्परागत र समकालीन चित्रकला प्रदर्शनी चलिरहेको छ। काठमाडौं त्रिनालेसँगको सहकार्यमा टुलिका कलाले ‘खोला २⁵, ३२ साइकल अफ लाइफ’ (Kholo 2⁵) प्रदर्शनी आयोजना ...	pahilopost.com	४२ मिनेट अघि	https://l.hamropatro.com/r/https://pahilopost.com/content/20220309132326.html	entertainment
कलाकार पल्पसा डंगोल ‘चम्सुरी’को मिर्गौला प्रत्यारोपण गरिंदै	काठमाडौं । ‘चम्सुरी’ नामले चर्चित हास्य कलाकार पल्पसा डंगोलको बुधबार मिर्गौला प्रत्यारोपण हुँदैछ । त्रिवि शिक्षण अस्पताल महाराजगञ्जमा उनको एउटा मिर्गौला प्रत्यारोपण गर्न लागिएको हो । नेपाल चलचित्र...	onlinekhabar.com	४९ मिनेट अघि	https://l.hamropatro.com/r/https://www.onlinekhabar.com/2022/03/1091131	entertainment
फिल्म ‘वर एण्ड बधु’मा आँचल र विवेकको जोडी पक्का	काठमाडौं : फिल्म ‘वर एण्ड बधु’मा नव-कलाकार विवेक कर्मचार्य अनुबन्धित भएका छन्। विवेकलाई यस फिल्ममा मुख्य अभिनेताको भूमिकामा फाइनल गरिएको हो। यसअघि फिल्ममा अभिनेत्री आँचल शर्मा मुख्य अभिनेत्रीको ला...	pahilopost.com	१ घण्टा अघि	https://l.hamropatro.com/r/https://pahilopost.com/content/20220309125518.html	entertainment
दशैंमा ‘परदेशी-२’ रिलिज हुने	काठमाडौं: ‘परदेशी २' आगामी दशैंमा प्रदर्शन हुने पक्का भएको छ। बुधबार फिल्मको फष्टलुक पोष्टर सार्वजनिक गर्दै दशैंमा फिल्म प्रदर्शन गर्ने घोषणा गरिएको हो। सार्वजनिक पोष्टरमा फिल्ममा मुख्य भूमिकामा र...	pahilopost.com	१ घण्टा अघि	https://l.hamropatro.com/r/https://pahilopost.com/content/20220309121206.html	entertainment
ओबामा र नेटफ्लिक्सले हात झिकेपछि ‘तेन्जिङ’को निर्माण डिज्नीले गर्दै	२५ फागुन, काठमाडौं । २०७७ सालको माघ तेस्रो साता अमेरिकी पूर्वराष्ट्रपति बाराक ओबामाले हलिउड कम्पनी हाइअर ग्राउन्ड प्रोडक्सन र नेटफ्लिक्ससँग मिलेर एकैसाथ ६ फिल्म निर्माणको घोषणा गरे । जसमा तीन फिल्म...	onlinekhabar.com	२ घण्टा अघि	https://l.hamropatro.com/r/https://www.onlinekhabar.com/2022/03/1091078	entertainment
ऋषि कपूरको अन्तिम फिल्म ‘शर्माजी नमकीन’ मार्च ३१ रिलिज हुने	एजेन्सी, २५ फागुन । दिवंगत अभिनेता ऋषि कपूरको अन्तिम फिल्म ‘शर्माजी नमकीन’ को रिलिज मिति घोषणा गरिएको छ । निर्माताले फिल्मको २ नयाँ पोस्टर सामाजिक सञ्जालमा सेयर गरेका छन् । पोस्टरमा फिल्म मार्च ३१...	reportersnepal.com	२ घण्टा अघि	https://l.hamropatro.com/r/https://www.reportersnepal.com/2022/03/658032	entertainment
