रुस र युक्रेनबीच दोस्रो चरणको वार्ता सकियो, मानवीय सहायताको व्यवस्था गर्ने सहमित	२० फागुन, काठमाडौं । रुस र युक्रेनका प्रतिनिधिबीच भएको दोस्रो चरणको वार्ता सकिएको छ । दुवै पक्षले मानवीय सहायताका लागि सुरक्षित क्षेत्रको व्यवस्था गर्ने सहमित गर्दै दोस्रो चरणको वार्ता टुङ्गिएको हो...	onlinekhabar.com	९ घण्टा अघि	https://l.hamropatro.com/r/https://www.onlinekhabar.com/2022/03/1088712	popular
कमजोरी समीक्षा कि समाजको ?	काठमाडौं । सानो उमेरमै सांगीतिक क्षेत्रमा आफूलाई स्थापित गरेकी गायिका समीक्षा अधिकारीको स्वर पहिचान गर्ने संगीतकर्मीको श्रेय वसन्त सापकोटालाई जान्छ । छायाकार पुरुषोत्तम प्रधानले आफ्नो क्यामेरामा पो...	baahrakhari.com	९ घण्टा अघि	https://l.hamropatro.com/r/https://baahrakhari.com/news-details/343241	popular
युक्रेन-रुस युद्धः रुससँग कतिवटा परमाणुअस्त्र छन्?	रुसी राष्ट्रपति भ्लादिमिर पुटिनले सेनालाई परमाणुअस्त्र 'विशेष सतर्क अवस्थामा' राख्ने आदेश दिएपछि विश्वभरि त्यसबारे चासो व्यक्त भएको छ। विश्लेषकहरू त्यसलाई रुसले परमाणुअस्त्र प्रयोग गरिहाल्ला भनेरभ...	bbc.com	८ घण्टा अघि	https://l.hamropatro.com/r/https://www.bbc.com/nepali/news-60598392?xtor=AL-73-[partner]-[hamro.patro]-[headline]-[nepali]-[bizdev]-[isapi]	popular
ठेकेदार भाग्ने डरले 'गोठालो' राखेरै हुन्छ सडक निर्माणको काम !	गाउँठाउँमा चौपायाले बालीनाली खाइदिने भएर गोठालो गर्ने गरिन्छ तर काठमाडौं उपत्यकामै भने सडक नबनाउन ठेकदारले आलटाल गर्लान् भनेर स्थानीयहरू वस्तुभाउको जस्तै गोठालो लाग्दै आएका छन् । पासाङल्हामु राजमा...	lokaantar.com	११ घण्टा अघि	https://l.hamropatro.com/r/https://lokaantar.com/story/174389/2022/3/3/press/news-	popular
युक्रेनका राष्ट्रपति जेलेन्स्कीको बिलौना– नो फ्लाई जोन नभए लडाकू विमान त देओ	युक्रेनका राष्ट्रपति भोलोदीमीर जेलेन्सकीले पश्चिमी सैन्य संगठन नेटोलाई युक्रेनको आकाशमा नो फ्लाई जोन घोषणा गर्न पुनः आह्वान गरेका छन् ।  बिहीवार उनले सम्बोधन गर्दै भने, ‘तिमीहरूलाई अझै कति समय चाह...	lokaantar.com	२ घण्टा अघि	https://l.hamropatro.com/r/https://lokaantar.com/story/174472/2022/3/4/international/zelensky	popular
किन रोकिएको छ किएभ हिँडेको रूसी सैनिक गाडीको लावालस्कर?	रूसले छिमेकी युक्रेनमाथि आक्रमण गरेको आज (शुक्रबार) नवौं दिन हो। यो युद्धमार्फत् रूसी राष्ट्रपति भ्लादिमिर पुटिन युक्रेनको सत्ता ढाल्न चाहन्छन् र आफूले भनेको मान्ने मान्छेलाई युक्रेनको राष्ट्रपति ब...	setopati.com	४ घण्टा अघि	https://l.hamropatro.com/r/https://www.setopati.com/politics/263709	popular
युक्रेन हमला चर्किँदै गएपछि अमेरिकी र रुसी सेनाबीच हटलाइन सुरु	२० फागुन, काठमाडौं । अमेरिकी र रुसी रक्षा मन्त्रालयबीच नयाँ हटलाइन सेवा सुरु भएको छ । युक्रेनमा रुसी हमला जारी रहेका बेला ‘गलत कदम, सैन्य घटना एवं तनाव’ रोक्न भन्दै दुवै मुलुकले हटलाइन सेवा सुरु गर...	onlinekhabar.com	३ घण्टा अघि	https://l.hamropatro.com/r/https://www.onlinekhabar.com/2022/03/1088899	popular
विश्वकै सबैभन्दा ठूलो परमाणु केन्द्रमा रुसी आक्रमण, तत्काल कदम चाल्न विश्वलाई युक्रेनी राष्ट्रपतिको आग्रह	काठमाडौं- रुसले युक्रेनमा रहेको विश्वकै सबैभन्दा ठूलो परमाणु केन्द्रमा आक्रमण गरेको छ। युक्रेनका विदेशमन्त्री दिमेत्रो कुलेबाले रुसी सेनाले युरोपकै सबैभन्दा ठूलो जापोरिज्या परमाणु केन्द्रमा ‘सबै द...	nepallive.com	६ घण्टा अघि	https://l.hamropatro.com/r/https://nepallive.com/story/274444	popular
युक्रेनको परमाणु प्लान्टमा आगलागी : जेलेन्स्कीले भने, ‘चेर्नोबिलभन्दा पनि खतरनाक हुने’	युक्रेनका राष्ट्रपति वोलोदिमिर जेलेन्स्कीले रुसी बलले युरोपको सबैभन्दा ठूलो परमाणु प्लान्टमा हमला गरेको जानकारी दिएका छन् । उनले संसारभरीका देशसँग मद्दतको अपिल गरेका छन् । ट्वीटरमा पोस्ट गरिएको एक...	ratopati.com	६ घण्टा अघि	https://l.hamropatro.com/r/https://ratopati.com/story/224401/2022/3/4/ukraine-plant	popular
युरोपको सबैभन्दा ठूलो न्यूक्लियर प्लान्टमा आगलागी : के हुन्छ यसको असर?	किभ : युरोपको सबैभन्दा ठूलो आणविक उर्जा केन्द्र जापोरिजियाको छवटा रिएक्टरमा आगलागी भएको छ। यो पावर प्लान्ट दक्षिण पूर्वी युक्रेनमा छ। रुसको लगातारको आक्रमणले आगलागी भएको र आगो निभाउन कठिन भएको युक्...	annapurnapost.com	५ घण्टा अघि	https://l.hamropatro.com/r/https://annapurnapost.com/news/197669	popular
अमेरिकाका पूर्व सैनिक भन्छन्– युक्रेनमा रुसी सेना हार्दैछ भन्ने पश्चिमको भाष्य गलत	किएभको प्रतिरक्षा गरिरहेका मानिसहरूप्रतिको सहानुभूतिले रुस हार्दैछ भन्ने अतिशयोक्ति जन्माइरहेको छ । यसले गर्दा रुसी रणनीतिलाई बुझ्न सकिएको छैन । अनि सिकारु मनोविश्लेषकहरूले पुटिनको मानसिक असन्तुलन ...	lokaantar.com	३ घण्टा अघि	https://l.hamropatro.com/r/https://lokaantar.com/story/174467/2022/3/4/tippani/ukraine-invasion	popular
पेट्रोलियम पदार्थमा उपभोक्तालाई थरी थरीका कर, के–मा कति ?	भारतीय आयल निगम (आईओसी)ले पेट्रोल प्रतिलिटर ९० रुपैयाँ ९४ पैसामा दिन्छ। तर, नेपाल आयल निगमले बिहीबार मध्यरातदेखि पुनः भाउ बढाएर १ सय ५० रुपैयाँ पुर्याएको छ। तापनि, निगम भन्छ, 'प्रतिलिटर १६ रुपैयाँ...	lokaantar.com	९ घण्टा अघि	https://l.hamropatro.com/r/https://lokaantar.com/story/174416/2022/3/4/press/petrol-	popular
न्यूरोडबाट फकाएर लगेर नयाँ बसपार्कमा १४ वर्षीया बालिकालाई बलात्कार	काठमाडौंको न्यूरोडबाट फकाएर लगेर एकजना युवकले १४ वर्षीया बालिकालाई बलात्कार गरेका छन् । फागुन १७ मा बालिकालाई बलात्कार गरेको आरोपमा महानगरीय अपराध महाशाखाले सिन्धुली घर भएका रोहित विकलाई शुक्रबार प...	ratopati.com	२ घण्टा अघि	https://l.hamropatro.com/r/https://ratopati.com/story/224454/2022/3/4/arrest	popular
राष्ट्रियसभाका २० सांसदको पदावधि आजबाट सकिने, कोमल वलीदेखि रामनारायण विडारीसम्म बिदा हुँदै	२०७४ सालमा निर्वाचित भएर गोलाप्रथावाट चार वर्षे कार्यकालमा परेका २० सांसदको पदावधि आजबाट सकिँदैछ । रिक्त पदका लागि निर्वाचित भइसकेका सन्दर्भमा चार वर्षे पदावधि भएका २० राष्ट्रियसभा सदस्यको पद आजबाट...	ratopati.com	८ घण्टा अघि	https://l.hamropatro.com/r/https://ratopati.com/story/224385/2022/3/4/rastri-sabha	popular
नेपाल बैंकमा ठूलो संख्यामा जागिर खुल्यो	नेपाल बैंक लिमिटेडले रिक्त रहेको स्थानमा ठूलो संख्यामा आवेदन मागेको छ।   लोक सेवा आयोगको सहमति अनुसार आर्थिक वर्ष २०७८-७९ को लागि स्वीकृत दरबन्दीका आधारमा रिक्त रहेको स्थानमा आवेदन मागेको हो।  इच...	setopati.com	९ घण्टा अघि	https://l.hamropatro.com/r/https://www.setopati.com/kinmel/employment/263698	popular
जहाँ गिरिजाप्रसादको हत्या प्रयास भयो, देउवालाई ढुंगाले लाग्यो	ठीक ३८ वर्षअघि आजकै दिन नेपाली कांग्रेसले एउटा कहालीलाग्दो घटना सामना गर्नुपरेको थियो। अर्थात् २०४०  फागुन २० गते रुपन्देहीको सुरजपुरामा गिरिजाप्रसाद कोइरालालाई लक्ष्य गरी आक्रमण गरिएको थियो। घटनाम...	nepalkhabar.com	६ घण्टा अघि	https://l.hamropatro.com/r/https://nepalkhabar.com/politics/122554-2022-3-4-9-48-3	popular
पुटिनलाई गिरफ्तार गर्नेलाई रुसी व्यवसायीले १० लाख डलर पुरस्कार दिने 	मस्को । एक रुसी व्यवसायीले रुसका राष्ट्रपति भ्लादिमिर पुटिनलाई पक्राउ गर्ने ‘अफिसर’लाई पुरस्कारस्वरूप १० लाख अमेरिकी डलर प्रदान गर्ने घोषणा गरेका छन् । त्यस्तो घोषणा गर्ने रुसका नागरिक एलेक्स कोना...	baahrakhari.com	३ घण्टा अघि	https://l.hamropatro.com/r/https://baahrakhari.com/news-details/343267	popular
मागेर देश चलाउने भन्नेका छोराछोरी अमेरिका गइसके: महामन्त्री थापा	नेपाली कांग्रेसका महामन्त्री गगन थापाले विदेशी अनुदान स्वीकार गर्दा मागेर देश चलाएको भन्नेहरूका छोराछोरी पहिले नै अमेरिकालगायत देश गइसकेको टिप्पणी गरेका छन्। गत आइतबार प्रतिनिधि सभाबाट एमसिसी पारि...	setopati.com	२ घण्टा अघि	https://l.hamropatro.com/r/https://www.setopati.com/politics/263730	popular
युक्रेनमा रहेको युरोपकै ठूलो परमाणु प्लान्टमा आगलागी: युरोपका मानिसहरु अब त उठ्नुहोस् – राष्ट्रपति जेलेन्स्की	युरोपको सबैभन्दा ठूलो पावर प्लान्ट जेपोरजियाको छ रेक्टरको नजिक आगलागी भएको छ। यो पावर प्लान्ट दक्षिण पूर्व युक्रेनमा छ। युक्रेनका अनुसार रुसको लगातार हमलापछि आगो लागेको हो र गोलाबारीको कारण आगो नि...	deshsanchar.com	७ घण्टा अघि	https://l.hamropatro.com/r/https://deshsanchar.com/2022/03/04/620454/	popular
विमानस्थल बन्ने हल्लाले जग्गाको मूल्य पाँच गुणाले वृद्धि, तर बनेन विमानस्थल	काभ्रे। बनेपाको नागीडाँडामा विमानस्थल निर्माणको अत्तोपत्तो नभए पनि  भएको छ । त्रिभुवन अन्तर्राष्ट्रिय विमानस्थलको आन्तरिक विमानस्थलमा चाप बढेपछि काभ्रेको बनेपा नगरपालिका–११ स्थित नागीडाँडामा विमानस...	news24nepal.tv	१० घण्टा अघि	https://l.hamropatro.com/r/https://www.news24nepal.tv/2022/03/04/861010	popular
‘सुपरस्टार’को विरासत हस्तान्तरणको बाटोमा शिव श्रेष्ठ	१९ फागुन, काठमाडौं । ‘सुपरस्टार’ हुनु भनेको के हो ? के कुराले औसत अभिनेतालाई ‘सुपरस्टार’ तुल्याउँछ ? नेपाली कला क्षेत्रमा वर्षौंदेखि चल्दै आएको यो प्रश्नलाई हामीले अभिनेता शिव श्रेष्ठसामु सोध्यौं ।...	onlinekhabar.com	८ घण्टा अघि	https://l.hamropatro.com/r/https://www.onlinekhabar.com/2022/03/1088579	popular
पल शाह प्रकरणमा बाबुरामको टिप्पणी : न्यायिक फैसला सबैले मानौं	२० फागुन, काठमाडौं । पूर्वप्रधानमन्त्री डा. बाबुराम भट्टराईले पल शाह प्रकरणबारे टिप्पणी गर्दै न्यायिक फैसला सबैले मान्नुपर्ने बताएका छन् । उनले ‘मर्दकी दशवटी’ भन्ने मानसिकता बोकेर पीडकको पक्ष लिनु ...	onlinekhabar.com	५ घण्टा अघि	https://l.hamropatro.com/r/https://www.onlinekhabar.com/2022/03/1088787	popular
काठमाडौं महानगरको मेयरका लागि कांग्रेसमा को को छन् दाबेदार ?	काठमाडौं । सरकारले वैशाख ३० गते स्थानीय तह निर्वाचनको मिति घोषणा गरेको छ । घोषित मितिअनुसार निर्वाचन आउन करिब अढाई महिना बाँकी रहँदा निर्वाचन चुनावी सरगर्मी पनि सुरु भएको छ । निर्वाचन मिति नजिकिँद...	baahrakhari.com	६ घण्टा अघि	https://l.hamropatro.com/r/https://baahrakhari.com/news-details/343249	popular
सरकारले थप्यो नौ दिन सार्वजनिक बिदा	काठमाडौं– आगामी वर्षका लागि सरकारले चाडपर्व बिदा नौ दिन थप गरेको छ। बिहीबार बसेको मन्त्रिपरिषद् बैठकले गृह मन्त्रालयको प्रस्तावअनुसार विभिन्न पर्वमा बिदा थप्ने निर्णय गरेको हो। मन्त्रिपरिषद्को निर...	nepallive.com	५ घण्टा अघि	https://l.hamropatro.com/r/https://nepallive.com/story/274453	popular
रूसले फुटबलमाथि लगाएको प्रतिबन्धविरूद्ध अपिल गर्ने	रसियाली फुटबल संघले युक्रेनमाथि आक्रमण गरेपछि अन्तर्राष्ट्रिय प्रतियोगितामा लगाइएको प्रतिबन्धविरूद्ध अपिल गर्ने भएको छ। रसियाका पुरूष र महिला राष्ट्रिय टोलीलाई प्रतिस्पर्धा गर्न अनुमति दिनुपर्ने म...	setopati.com	९ घण्टा अघि	https://l.hamropatro.com/r/https://www.setopati.com/sports/football/263696	popular
पल शाह प्रकरणमा बाबुरामको टिप्पणी : पीडकको पक्ष लिनु लज्जास्पद	काठमाडौं : पूर्वप्रधानमन्त्री डा. बाबुराम भट्टराईले पल शाह प्रकरणबारे टिप्पणी गर्दै कानुनभन्दा माथि कोही नरहने बताएका छन्। उनले पीडितप्रति सहानुभूति/समर्थन हुनुपर्नेमा उल्टै 'मर्दकी दशओटी' मानसिकता...	annapurnapost.com	४ घण्टा अघि	https://l.hamropatro.com/r/https://annapurnapost.com/news/197670	popular
४० नेपाली परिवारले युक्रेन छोड्न नसक्ने	काठमाडौं । रुस–युक्रेन द्वन्द्वबाट प्रभावित अधिकांश नेपाली सुरक्षित स्थानमा पुगेका छन् । जर्मनीका लागि नेपाली राजदुत रामकाजी खड्काले हालसम्म युक्रेनबाट नेपाली सुरक्षित स्थानको खोजी गर्दै पोल्याण्ड,...	rajdhanidaily.com	५ घण्टा अघि	https://l.hamropatro.com/r/https://rajdhanidaily.com/id/57490/	popular
युक्रेनी सेनाले अहिलेसम्म कसरी थेगिरहेको छ रूसी आक्रमण?	रूसले छिमेकी युक्रेनमाथि आक्रमण गरेको शुक्रबार नौ दिन पुगेको छ। यी नौ दिनमा रूसी सेनाले एउटा शहर कब्जा गरेका छन् भने राजधानी किएभ घेरेका छन्। बुधबार रूसी रक्षा मन्त्रालयले आफ्ना ४९८ जना सैनिक मारि...	setopati.com	१ घण्टा अघि	https://l.hamropatro.com/r/https://www.setopati.com/politics/263731	popular
जब विवाहित पुरूषलाई सोधिन्छ- एक्लै बस्ने कि श्रीमतीसँग?	महिनावारीका कुरा- दोस्रो शृंखला सम्पादकीय नोट: 'महिनावारीका कुरा' को पहिलो शृंखला २०७६ जेठदेखि २०७७ चैतसम्म प्रकाशन भयो। पहिलो शृंखलामा हामीले सिनेमा, संगीत, खेल लगायत समाजका विभिन्न क्षेत्रमा कार...	setopati.com	६ घण्टा अघि	https://l.hamropatro.com/r/https://www.setopati.com/social/263663	popular
अन्तरिक्षमा हुत्तिरहेको रकेटको एउटा अंश केही घण्टामा चन्द्रमामा ठोक्किने	अन्तरिक्षमा रहेको एउटा रकेटको प्रयोगहीन अंश शुक्रवार चन्द्रमामा ठोक्किने वैज्ञानिकहरूले बताएका छन्। तीन टन तौलको सो अंश अन्तरिक्षमा ९,३३५ किलोमिटर प्रतिघण्टाको गतिमा हुत्तिरहेको छ र शुक्रवार जीएमट...	bbc.com	२ घण्टा अघि	https://l.hamropatro.com/r/https://www.bbc.com/nepali/news-60614451?xtor=AL-73-[partner]-[hamro.patro]-[headline]-[nepali]-[bizdev]-[isapi]	popular
