ललितपुरमा एकै परिवारका ५ जनाको मृत्यु हुनुको कारण के हो ?	ललितपुरको कोन्ज्योसोम गाउँपालिका–४ स्थित नल्लुमा २ दिनअघि शिशुको जन्म भएपछि स्याङ्तान परिवारमा खुसी छाएको थियो तर त्यो खुसी लामो समयसम्म टिक्न सकेन । स्याङ्तान परिवारमा खुसी छर्ने शिशु र खुसी मनाउ...	lokaantar.com	७ घण्टा अघि	https://l.hamropatro.com/r/https://lokaantar.com/story/174855/2022/3/8/press/death	popular
स्थानीय तहमा महिलाको विषय हेर्ने छुट्टै संरचना बनाउनुपर्नेमा जोड	काठमाडौं । महिला अधिकारका क्षेत्रमा क्रियाशिल अधिकारकर्मीहरुले स्थानीय तहमा महिलाको विषय हेर्ने छुट्टै संरचना नबनाउने हो भने महिलाका समस्यालाई समाधान गर्न नसकिने बताउन थालेका छन् । यससँगै स्थानीय ...	lokpath.com	३४ मिनेट अघि	https://l.hamropatro.com/r/https://www.lokpath.com/story/506824	national
एमालेबाट निर्वाचित गाउँपालिका अध्यक्ष कांग्रेस प्रवेश	सिन्धुपाल्चोकको बलेफी गाउँपालिकाका अध्यक्ष केदार क्षेत्री नेपाली कांग्रेस प्रवेश गरेका छन्। ०७४ को स्थानीय तह चुनावमा उनी नेकपा एमालेबाट उम्मेदवार बनेर जितेका थिए। अध्यक्ष क्षेत्री आज कांग्रेस के...	setopati.com	३५ मिनेट अघि	https://l.hamropatro.com/r/https://www.setopati.com/politics/264051	national
राष्ट्र गरिब छ भने सबैका लागि गरिब हुन्छ, महिलाका लागि मात्र किन? - कृष्णकुमारी पौडेल	महिला अधिकारका क्षेत्रमा क्रियाशिल अधिकारकर्मीले स्थानीय तहमा महिलाको विषय हेर्ने छुट्टै संरचना नबनाउने हो भने महिलाका समस्यालाई समाधान गर्न नसकिने बताउन थालेका छन्।  योसँगै स्थानीय तहमा रहेको न्य...	setopati.com	३५ मिनेट अघि	https://l.hamropatro.com/r/https://www.setopati.com/politics/264045	national
स्थानीय चुनावको घरदैलोका लागि कांग्रेसले खटायो केन्द्रीय प्रतिनिधि	नेपाली कांग्रेसले स्थानीय तह चुनावका लागि एक महिने घरदैलो अभियान सञ्चालन गर्ने भएको छ। 'घरघर जाऔं, कांग्रेस जिताऔं' नाम दिएको अभियान गर्न सञ्चालन गर्न कांग्रेसले केन्द्रीय प्रतिनिधिसमेत खटाएको छ। ...	setopati.com	३५ मिनेट अघि	https://l.hamropatro.com/r/https://www.setopati.com/politics/264048	national
रंगेलीका मेयर एमाले प्रवेश गर्दै, पदमुक्त गर्न माओवादीको सिफारिस	मोरङको रंगेली नगरपालिकाका मेयर दिलिप बगडिया (अग्रवाल) एमाले प्रवेश गर्ने निश्चित भएपछि नेकपा माओवादी केन्द्रले कारवाही गरेको घोषणा गरेको छ।  माओवादी केन्द्रबाट नगर प्रमुखमा निर्वाचित बगडिया बुधबार...	setopati.com	३५ मिनेट अघि	https://l.hamropatro.com/r/https://www.setopati.com/politics/264047	national
कांग्रेसले खटायो ७७ जिल्लामा घरदैलो कार्यक्रमका लागि प्रतिनिधि 	काठमाडौं । सत्तारूढ दल नेपाली कांग्रेसले स्थानीय तह निर्वाचनकेन्द्रित घरदैलो अभियान सञ्चालन गर्ने भएको छ । प्रधानमन्त्री समेत रहेका पार्टी सभापति शेरबहादुर देउवाले मंगलबार घरदैलो अभियान सञ्चालन गर...	baahrakhari.com	३७ मिनेट अघि	https://l.hamropatro.com/r/https://baahrakhari.com/news-details/343632	national
नियमित उडानको प्रतिक्षामा रेसुंगा विमानस्थल : निरिक्षणमा पुगेका प्रदिप ज्ञवाली भन्छन्- धावनमार्ग आहा भएन 	पूर्वमन्त्री तथा नेकपा एमालेका उपमहासचिव प्रदीप ज्ञवालीले रेसुंगा विमानस्थलको धावनमार्गको कालोपत्रेका विषयमा असन्तुष्टि जनाएका छन् । मंगलबार बिहान विमानस्थलको निरीक्षण गर्दै ज्ञवालीले कालोपत्रे सबै...	nayapatrikadaily.com	३९ मिनेट अघि	https://l.hamropatro.com/r/https://nayapatrikadaily.com/feed-detail.php?nid=82057	national
वडाध्यक्षले गरे सार्वजनिक सुनुवाइ	मुगु । मुगुको छायाँनाथ रारा नगरपालिका–४ का वडाध्यक्ष विष्णुकुमार भामले आफूले गरेका जनसेवामुखी कार्य सार्वजनिक गर्नुभएको छ । आफ्नो ५ वर्षे कार्यकालमा गरेका कार्यको पत्रकार सम्मेलन गर्दै उहाँले सार्...	newsofnepal.com	४१ मिनेट अघि	https://l.hamropatro.com/r/https://www.newsofnepal.com/2022/03/08/479635/	national
चाँगुनारायणमा टहराभित्र परालले छोपेको अवस्थामा महिलाको शव फेला	भक्तपुर । धारिलो हतियारले घाँटी काटेर परालले छोपेको अवस्थामा एक महिलाको शव फेला परेको छ । चाँगुनारायण नगरपालिका वडा नं ७ स्थित बागरेमा टहराभित्र उक्त शव फेला परेको हो । महानगरीय प्रहरी परिसर भक्तप...	news24nepal.tv	४२ मिनेट अघि	https://l.hamropatro.com/r/https://www.news24nepal.tv/2022/03/08/861970	national
बलेफी गाउँपालिकाका अध्यक्ष केदार क्षेत्री कांग्रेसमा प्रवेश, देउवाले गरे स्वागत	काठमाडौं : सिन्धुपाल्चोकको बलेफी गाउँपालिकाका अध्यक्ष केदार क्षेत्री नेपाली कांग्रेसमा प्रवेश गरेका छन्। नेकपा (एमाले) पार्टी त्यागेका अध्यक्ष क्षेत्री आज कांग्रेसमा प्रवेश गरेका हुन्। पार्टी प्रव...	pahilopost.com	४४ मिनेट अघि	https://l.hamropatro.com/r/https://pahilopost.com/content/20220308115531.html	national
प्रतिक्रिया माग्दा पत्रकारलाई ज्यान मार्ने धम्की	पेश्की रकमबारे प्रतिक्रिया लिन खोज्दा रौतहटका एक कर्मचारीले पत्रकारलाई ज्यान मार्ने धम्की दिएका छन् । स्वास्थ्य कार्यालय गौरका कोल्ड निरीक्षक अधिकृत पासपत राय यादवले नेपाल पत्रकार महासंघ मधेस प्रदे...	ratopati.com	४४ मिनेट अघि	https://l.hamropatro.com/r/https://ratopati.com/story/225186/2022/3/8/madhes-province	national
कांग्रेस केन्द्रीय समितिको बैठक सुरु	काठमाडौं, २४ फागुन । नेपाली कांग्रेस केन्द्रीय समितिको बैठक पार्टी केन्द्रीय कार्यालय सानेपामा सुरु भएको छ । बैठक आसन्न स्थानीय निर्वाचन केन्द्रित रहने बताइएको छ । काठमाडौंमा उपलब्ध केन्द्रीय सदस्...	reportersnepal.com	४४ मिनेट अघि	https://l.hamropatro.com/r/https://www.reportersnepal.com/2022/03/657406	national
मधेस प्रदेश सरकारले खरिद गरेका बस नचलाउने : विभिन्न संस्थान र सङ्घसंस्थालाई दिने तयारी	धनुषा - मधेस प्रदेश सरकारले खरिद गरेका बस नचलाउने भएको छ । वीरगञ्ज–सप्तरी चलाउन खरिद गरेका पाँच वटा बस मधेस प्रदेश मन्त्रिपरिषद् बैठकले नचलाउने निर्णय गरेको हो । ती बस विभिन्न संस्थानलाई दिने निर्...	Ujyaaloonline.com	४७ मिनेट अघि	https://l.hamropatro.com/r/https://ujyaaloonline.com/story/66165/2022/3/8/buses-purchased-by-madhes-state-government	national
सिन्धुपाल्चोक एमालेका दर्जनौं नेता कार्यकर्ता कांग्रेसमा प्रवेश, सभापति देउवाले दिए सदस्यता	काठमाडौं । सिन्धुपाल्चोकका नेकपा एमालेका दर्जनौं नेता तथा कार्यकर्ता नेपाली कांग्रेसमा प्रवेश गरेका छन् । आज नेपाली कांग्रेसका सभापति एवं प्रधानमन्त्री शेरबहादुर देउवाले उनीहरुलाई पार्टी मुख्यालय व...	hamrakura.com	४७ मिनेट अघि	https://l.hamropatro.com/r/https://hamrakura.com/news-details/118904/2022-03-08	national
सिरहा कांग्रेसको निर्वाचन : मतगणना हुँदै	नेपाली कांग्रेसकाे १४औँ महाधिवेशनअन्तर्गत सिराहा जिल्ला कार्यसमितिको सोमबार गोलबजारमा सम्पन्न निर्वाचनको मंगलबार बिहानदेखि मतगणना हुँदै छ । कांग्रेस जिल्ला निर्वाचन समितिका अधिकृत सञ्जीव लामाका अनु...	nayapatrikadaily.com	४७ मिनेट अघि	https://l.hamropatro.com/r/https://nayapatrikadaily.com/feed-detail.php?nid=82056	national
ध्रुवचन्द्रको ‘ह्याङ्गरमा झुण्डिएको आकाश’ विमोचन	काठमाडौँ — आख्यानकार ध्रुवचन्द्र गौतमको पहिलो कवितासंग्रह ‘ह्याङ्गरमा झुण्डिएको आकाश’को विमोचन गरिएको छ । आइतबार धनगढीमा आयोजित सुदूरपश्चिम साहित्य महोत्सवको अवसरमा कवितासंग्रह विमोचन गरिएको हो । ...	ekantipur.com	१ दिन अघि	https://l.hamropatro.com/r/https://ekantipur.com/literature/2022/03/07/164663105531323886.html	literature
कथाकार पौडेल पुरस्कृत	काठमाडौँ — कथाकार मधुवन पौडेलले लघुकथा समाजले प्रदान गर्ने सावित्री–केशर कथा सम्मान तथा सुरभि साहित्य प्रतिष्ठानले दिने ‘गुरुप्रसाद मैनाली सुरभि साहित्य सम्मान’ प्राप्त गरेका छन् । समाजको कथा सम्म...	ekantipur.com	१ दिन अघि	https://l.hamropatro.com/r/https://ekantipur.com/literature/2022/03/07/164662854878797927.html	literature
अभिवन्द्य : रोदनको रचनात्मक लेखनशैली	नेपाली निबन्ध, नियात्रा, लघुकथा विधालाई पृथक लेखनशैली र शिल्पले सिँगार्दै आएका श्रीओम श्रेष्ठ ‘रोदन’ व्यक्तिचित्र उतार्नमा पनि उत्तिकै दख्खल राख्छन्। यसको सप्रमाण उनको सद्यः प्रकाशित कृति ‘अभिवन्द्...	nepalviews.com	३ दिन अघि	https://l.hamropatro.com/r/https://www.nepalviews.com/2022/03/05/45065/	literature
सबैलाई सँगै घुमाउने ‘आँखाभरि देश मनभरि परिवेश’ 	साहित्यिक पत्रकार नवराज रिजालको नियात्रासंग्रह ‘आँखाभरि देश मनभरि परिवेश’ एउटा महत्त्वपूर्ण नियात्राकृति हो । साहित्यिक पत्रकारितामा निरन्तर क्रियाशील नवराजले साहित्यजगत्मा आफ्नो स्थान बनाउँदै आएका...	baahrakhari.com	३ दिन अघि	https://l.hamropatro.com/r/https://baahrakhari.com/news-details/343330	literature
यसरी बन्न सक्छौँ फूलमा आत्मनिर्भर	फूललाई विषय बनाएर यसको सौन्दर्यतामाथि धेरै कुराहरू लेखिएका छन् । चाहे त्यो गीतमा होस् वा साहित्यमा । यस मानेमा फूलको आयतन निकै फराकिलो देखिन्छ । आमनेपालीको जीवनशैलीमा फूलको साइनो जन्मदेखि मृत्युसम्...	merolifestyle.com	४ दिन अघि	https://l.hamropatro.com/r/https://www.merolifestyle.com/archives/30868	literature
कविताको चिठी	एक सुदूर गाउँबाट  अनपढ आमासँग शब्द सापटी मागेर प्रतियोगितामा पठाउँदै छु यो कविता।   सकभर यो कविता नपढ्नू पढिहाले भने नसम्झनू एक बालक जोतिरहेछ हलो मुखले बोलिरहेछ कविता लक्ष्य राखेको छ महान् ...	setopati.com	४ दिन अघि	https://l.hamropatro.com/r/https://www.setopati.com/literature/263733	literature
मेघराजको ‘दिग्भ्रम’ सार्वजनिक	काठमाडौँ — कवि मेघराज तिम्सिनाले ८० वर्षको उमेरमा पहिलो कविता कृति ‘दिग्भ्रम’ प्रकाशनमा ल्याएका छन् । कविता कृति दमक प्रज्ञा प्रतिष्ठानमा आयोजित एक समारोहमा नेपाल प्रज्ञा प्रतिष्ठानका उपकुलपति जगमा...	ekantipur.com	७ दिन अघि	https://l.hamropatro.com/r/https://ekantipur.com/literature/2022/03/01/164611625295127800.html	literature
उमङ्ग लघुकथा सङ्ग्रह विमोचन	सत्या अधिकारीद्वारा लिखित उमङ्ग लघुकथा सङ्ग्रह विमोचन गरिएको छ । अक्षर धाम नेपालले प्रकाशन गरेको यस कृतिको विमोचन लघुकथा समाज नेपालका केन्द्रीय अध्यक्ष तथा प्रमुख अतिथि श्रीओम श्रेष्ठ रोदन, वरिष्ठ ...	ratopati.com	७ दिन अघि	https://l.hamropatro.com/r/https://ratopati.com/story/223858/2022/3/1/umanga-	literature
लेखनाथ पोखरेलको हाँस्य-निबन्ध ‘चिबे नकटो’ बजारमा	काठमाडौं । स्रष्टा लेखनाथ पोखरेलको हाँस्य-निबन्ध ‘चिबे नकटो’ पाठकमाझ आएको छ । केही समयअघि नियात्रासंग्रह ‘फकलीको गाउँ’ र कथासंग्रह ‘मार्बल हाउसकी शालिनी’ पाठकमाझ ल्याउनुभएका पोखरेलको तेस्रो कृति ‘च...	nepalpress.com	८ दिन अघि	https://l.hamropatro.com/r/https://www.nepalpress.com/2022/02/28/161053/	literature
भीष्मराज फुलाराको उपन्यास ‘वासुदेव’ सार्वजनिक	१६ फागुन, काठमाडौं । कानुन व्यवसायी वासुदेव फुलाराको संघर्ष कथामा आधारित उपन्यास ‘वासुदेव’ सार्वजनिक गरिएको छ । उपन्यासलाई साहित्यकार भीष्मराज फुलाराले लेखेका हुन् । उनी वासुदेवका भाइसमेत हुन् । अ...	onlinekhabar.com	८ दिन अघि	https://l.hamropatro.com/r/https://www.onlinekhabar.com/2022/02/1086521	literature
Shree ३ launching ‘Rust In Dust’ on Shivaratri	KATHMANDU, Feb 27: Shree ३, a skull-busting trio, the brainchild of Sarad Shrestha, a veteran guitarist of the Nepali music realm, is officially launching their second album ‘Rust In Dust’ on March...	english.ratopati.com	९ दिन अघि	http://l.hamropatro.com/r/http://english.ratopati.com/story/23885	literature
तीन साहित्यिक स्रष्टालाई वडाको सम्मान	काठमाडौं । काठमाडौं महानगरपालिका, वडा नं. ४ ले सोही वडामा बसोबास गर्ने नेपाली भाषा, साहित्य, संस्कृतिमा योगदान दिने तीन स्रष्टालाई सम्मान गरेको छ । वडाले कवि बैरागी काँइला, आख्यानकार डा. ध्रुवचन्द्...	baahrakhari.com	९ दिन अघि	https://l.hamropatro.com/r/https://baahrakhari.com/news-details/342777	literature
निबन्ध संग्रह ‘आकाशमुखी’ सार्वजनिक	काठमाडौँ — विश्वका चर्चित निबन्धहरूको नेपालीमा अनुवादित संग्रह ‘आकाशमुखी’ सार्वजनिक भएको छ । पत्रकार तथा लेखक मोहन मैनालीले अनुवाद गरेको कृतिमा १५ वटा निबन्ध संग्रहित छन् । बुकर टी. वासिङ्टन, जर्ज ...	ekantipur.com	९ दिन अघि	https://l.hamropatro.com/r/https://ekantipur.com/news/2022/02/27/164592713956615828.html	literature
आकाशमुखी बजारमा	लेखक, पत्रकार एवम् अनुवादक मोहन मैनालीद्वारा अनूदित पुस्तक 'आकाशमुखी' लोकार्पण भएको छ। शनिबार राजधानीमा आयोजित समारोहमा अध्येताद्वय हरि शर्मा र सगुना शाहका साथमा मोहन मैनालीले पुस्तकको लोकार्पण गर...	setopati.com	९ दिन अघि	https://l.hamropatro.com/r/https://www.setopati.com/art/book/263223	literature
कविता सङ्ग्रह  ‘समयको कठघरा’ लोकार्पण	कविता सङ्ग्रह ‘समयको कठघरा’ सार्वजनिक गरिएको छ । कवि जुनु खड्काद्वारा लिखित कविता सङ्ग्रहको शनिबार लोकार्पण गरिएको हो । शुक्लागण्डकी नगरपालिका–१० ढोरमुलकोट दरबारको फेदीमा आयोजित कार्यक्रममा कवि भूप...	ratopati.com	१० दिन अघि	https://l.hamropatro.com/r/https://ratopati.com/story/223273/2022/2/26/poem	literature
पाभेल : प्रिय र अविस्मरणीय पात्र	रूसी साहित्यमा, विशेष गरी रूसी आख्यानमा अधिक प्रयोग हुने पात्रहरूका नाममध्ये एउटा हो- पाभेल। रूसका केही ठूला साहित्यकारहरूले ‘पाभेल’ नामको पात्रलाई आफ्ना रचनाको प्रमुख पात्र बनाएको पाइन्छ। कतिपयले ...	nepalviews.com	१० दिन अघि	https://l.hamropatro.com/r/https://www.nepalviews.com/2022/02/26/43175/	literature
