चिनियाँ विदेशमन्त्री आउने	काठमाडौं, फागुन २५ । चिनियाँ विदेशमन्त्री तथा स्टेट काउन्सिलर वाङ यी नेपाल आउने भएका छन्। विदेशमन्त्री वाङ मार्च महिनाभित्रै नेपाल आइपुग्ने परराष्ट्र मन्त्रालय स्रोतले जनाएको छ। उनी आउने मिति तय भ...	reportersnepal.com	१ घण्टा अघि	https://l.hamropatro.com/r/https://www.reportersnepal.com/2022/03/657842	international
रुसी तेलमाथि पूर्णरुपमा प्रतिबन्ध लगाउने अमेरिकाको निर्णय	अमेरिकी राष्ट्रपति जो बाइडेनले रुसबाट आउने तेलमाथि पूर्णरुपमा प्रतिबन्ध लगाउने निर्णय गरेका छन्।   रुसले युक्रेनमाथि गरेको आक्रमणमा आपत्ति जनाउँदै रुसलाई थप दबाब सिर्जना गर्नका लागि अमेरिकाले तत्क...	nepalkhabar.com	१ घण्टा अघि	https://l.hamropatro.com/r/https://nepalkhabar.com/global/123032-2022-3-9-8-46-26	international
राष्ट्रवादको ‘बुस्टर डोज’ !	अघिल्लो साता नेपालको संसदले नेपाल सरकार र मिलेनियम च्यालेन्ज कर्पोरेसन -एमसीसी)बीच भएको संयुक्त राज्य अमेरिकाबाट प्राप्त हुने ५०० मिलियन अमेरिकी डलर (करिब ६० अर्ब रुपैयाँ)को आर्थिक सहायता सम्बन्धी ...	onlinekhabar.com	१ घण्टा अघि	https://l.hamropatro.com/r/https://www.onlinekhabar.com/2022/03/1090965	international
रोजगारीमा व्यापक सुधार ल्याउन १ अप्रिलदेखि मलेसियाले अन्तर्राष्ट्रिय सिमाना पूर्णरूपमा खुलाउने	काठमाडौं - मलेसियाले आगामी अप्रिल पहिलो तारेखदेखि आफ्नो अन्तर्राष्ट्रिय सिमाना पूर्णरूपमा खुलाउने भएको छ । अन्तर्राष्ट्रिय नारी दिवसका अवसरमा आयोजित एक कार्यक्रममा मंगलबार मलेसियाका प्रधानमन्त्री इ...	ajakoartha.com	१ घण्टा अघि	http://l.hamropatro.com/r/http://ajakoartha.com/story/69088	international
किन विवादमा तानिए परराष्ट्रमन्त्री ?	युक्रेन र रूसको युद्धबाट विस्थापितको उद्धारमा भारत सरकारको सहयोग रहेको नेपालका परराष्ट्रमन्त्री नारायण खड्काको अभिव्यक्तिप्रति युरोपस्थित नेपाली समुदायले आपत्ति प्रकट गरेको छ । मन्त्री खड्काले सोम...	merolifestyle.com	१ घण्टा अघि	https://l.hamropatro.com/r/https://www.merolifestyle.com/archives/31849	international
युक्रेनका राष्ट्रपति भन्छन्- रुसविरुद्ध जंगल, मैदान र समुद्री किनारबाट आक्रमण जारी राख्छौं	२५ फागुन, काठमाडौं । युक्रेनका राष्ट्रपति भोलोदिमिर जेलेन्स्कीले रुसविरुद्ध जंगल, मैदान र समुद्री तटबाट आक्रमण जारी राख्ने बताएका छन् । बेलायतको तल्लो सदन (हाउस अफ कमन्स)मा सम्बोधन गर्दै जेलेन्स्क...	onlinekhabar.com	१ घण्टा अघि	https://l.hamropatro.com/r/https://www.onlinekhabar.com/2022/03/1090992	international
नुवाकोटको लामपाटी (दरबार)	काठमाडौं - नुवाकोटको विदुर नगरपालिका–२ स्थित नुवाकोट दरबार क्षेत्र परिसरमा रहेको लामपाटी (दरबार) ।  वि.सं. २०७२ वैशाख १२ गतेको भूकम्पले क्षतिग्रस्त लामपाटी (दरबार), नुवाकोट दरबारसहितका विभिन्न दश ...	ajakoartha.com	२ घण्टा अघि	http://l.hamropatro.com/r/http://ajakoartha.com/story/69085	international
अन्तर्राष्ट्रिय नारी दिवसमा ‘द ऐला लाउन्ज’द्वारा प्रेरणादायी महिला सम्मानित	११२ औँ अन्तर्राष्ट्रिय नारी दिवसका अवसरमा ल ऐला लाउन्ज कुमारीपाटीले समाजमा प्रेरणादायी काम गर्दै आएका चार महिलालाई सम्मानित गरेको छ ।  लाउन्जले विषम परिस्थितिमा पनि व्यक्तिगत जीवनभन्दा माथि उठेर स...	ratopati.com	२ घण्टा अघि	https://l.hamropatro.com/r/https://ratopati.com/story/225332/2022/3/9/ai-la-lounge-and-restaurant-	international
गर्मीयाम सुरु : डढेलो  र चट्याङको जोखिम	प्रि–मनसुन अर्थात् गर्मीयाम सुरु भएको छ । मार्च, अप्रिल र मेसम्म तीन महिना प्रि–मनसुनको अवधिमा सुक्खा हुने भएकाले चट्याङ र डढेलोको जोखिम हुने गर्छ । ‘प्रि–मनसुनमा दिनमा घाम लाग्ने र अपराह्न तथा साँ...	nayapatrikadaily.com	२ घण्टा अघि	https://l.hamropatro.com/r/https://nayapatrikadaily.com/feed-detail.php?nid=82116	international
साउदीमा जेल जीवन बिताएर स्वदेश फर्किए ३० नेपाली	दोहा – साउदी अरबमा जेल जीवन बिताएर ३० नेपाली स्वदेश फर्किएका छन् । उनीहरूलाई  गैर कानुनी रूपमा कार्यरत रहँदा साउदी प्रहरीले पक्राउ गरेको थियो ।	khabarhub.com	२ घण्टा अघि	https://l.hamropatro.com/r/https://www.khabarhub.com/2022/09/359169/	international
पेट्रोलियमको एउटा विकल्प हाइड्रोजन ऊर्जा	अधिकांश विकसित देशले पछिल्ला वर्षहरूमा हाइड्रोजनलाई इन्धनका रूपमा प्रयोग गरिरहेका छन् । सामान्यतः प्राकृतिक हाइड्रोजन स्वतन्त्र रूपमा पाइने तत्त्व होइन । यो कुनै अन्य तत्त्व, खास गरी अक्सिजन अणुसित...	ekantipur.com	२ घण्टा अघि	https://l.hamropatro.com/r/https://ekantipur.com/opinion/2022/03/09/164678923085376135.html	international
अमेरिका र बेलायतद्वारा रुसी तेल आयातमा प्रतिबन्ध	काठमाडौँ — युक्रेनमाथि रुसको आक्रमणको विरोधमा अमेरिका र बेलायतले रुसमा उत्पादन हुने तेल आयातमा प्रतिबन्ध लगाएका छन् । आफूले चालेको कदमले प्रतिबन्धले रुसको अर्थव्यवस्थामा ठूलो धक्का पुग्ने बताउँदै अ...	ekantipur.com	२ घण्टा अघि	https://l.hamropatro.com/r/https://ekantipur.com/world/2022/03/09/16467938776718752.html	international
रुस-युक्रेन युद्ध : युक्रेनका ३३ वर्षीय अभिनेता पाशाको मृत्यु	काठमाडौं- रुस र युक्रेनबीच युद्ध जारी छ। यस युद्धमा अहिलेसम्म युक्रेनका हजारौं सैनिक र आम नागरिकले ज्यान गुमाइसकेका छन्। यहीबीच युक्रेनका अभिनेता पाशा लीले पनि देशको रक्षा गर्दागर्दै ज्यान गुमाएक...	nepalsamaya.com	२ घण्टा अघि	https://l.hamropatro.com/r/https://nepalsamaya.com/abroad/2022-03-09-075125	international
युक्रेनका यी ११ वर्षीय बालक, जो एक्लै १२ सय किलोमिटर यात्रा गरेर स्लोभाकिया पुगे	रुसी आक्रमणपछि लाखौं मानिसले युक्रेन छाडेर छिमेकी देशमा शरण लिएका छन् । अझै पनि पोल्याण्ड, रोमानिया, स्लोभाकियालगायत देशहरूमा युक्रेनी शरणार्थीहरू निरन्तर आउने क्रम जारी छ । यी शरणार्थीमध्ये एक बाल...	farakdhar.com	२ घण्टा अघि	https://l.hamropatro.com/r/https://farakdhar.com/story/77671	international
रुसबाट बाहिरिए कोक र पेप्सी	Created with sketchtool. सम्बन्धित अमेरिकाले रुसी इन्धनमा लगायो प्रतिबन्ध, बेलायतले पनि रुसी इन्धन ‘फेज आउट’ गर्ने पेयपदार्थ उत्पादक अमेरिकी कम्पनी कोकाकोला र पेप्सीले रुसमा आफ्नो व्यवसाय बन्द ग...	deshsanchar.com	२ घण्टा अघि	https://l.hamropatro.com/r/https://deshsanchar.com/2022/03/09/622112/	international
उत्तर कोरियाले आणविक परीक्षण साइट मर्मत गरेको अमेरिकी स्याटेलाइटमा देखियो	उत्तर कोरियाले बन्द आणविक परीक्षण साइट मर्मत गर्न थालेको अमेरिकी स्याटेलाइट कम्पनी म्याक्सर टेक्नोलोजिले सार्वजनिक गरेका तस्बिरहरूमा देखिन्छ । उत्तर कोरियाली नेता किम जोङ उनले सम्पूर्ण आणविक परीक्ष...	ratopati.com	२ घण्टा अघि	https://l.hamropatro.com/r/https://ratopati.com/story/225327/2022/3/9/north-korea	international
चीन भन्छ– रुससँगको मित्रता चट्टान सरह बलियो 	बेइजिङ । रुससँग चीनको मित्रता चट्टान सरह बलियो अवस्थामा रहेको चिनियाँ विदेश मन्त्री वाङ यिले बताएका छन् । यससँगै उनले आफूहरुबीच सहकारिताको सम्भाव्यता पनि विस्तृत रहेको उल्लेख गरेका छन् ।  दुई देशब...	baahrakhari.com	२ घण्टा अघि	https://l.hamropatro.com/r/https://baahrakhari.com/news-details/343697	international
अन्तर्राष्ट्रिय महिला दिवसको अगाडि, पाकिस्तानमा ह्यासट्याग	सिन्ध प्रान्तको मेडिकल युनिभर्सिटीका दुई महिला विद्यार्थीहरूले भर्खरै गरेको आत्महत्याले पाकिस्तानमा शैक्षिक संस्था र कार्यस्थलहरू लगायत धेरै ठाउँमा महिला सुरक्षाका सम्बन्धमा गम्भीर त्रुटिहरूलाई औंल...	canadanepal.com	२ घण्टा अघि	https://l.hamropatro.com/r/https://canadanepal.com/content/46770	international
रूसविरुद्ध लड्न तयार छौँ : जेलेन्स्की	युक्रेनका राष्ट्रपति भोलोदिमिर जेलेन्स्कीले आफ्नो देशले रूसविरुद्धको लडाइँ नछोड्ने बताएका छन् । बेलायतको संसद् हाउस अफ कमन्सलाई सम्बोधन गर्दै जेलेन्स्कीले युद्ध अन्त्य नहुने बेलासम्म युक्रेन रूसविर...	merolifestyle.com	३ घण्टा अघि	https://l.hamropatro.com/r/https://www.merolifestyle.com/archives/31833	international
सात वर्षपछि बनेको 'चिसो एस्ट्रे' को भित्रीकथा : भूपिको फ्यान, ११ पटक पुनर्लेखन	काठमाडौं: सानैदेखि फिल्मप्रति खुब चासो थियो दिन्श (दिनेश) पाल्पालीको। उमेरले परिपक्वता हासिल गर्दै जाँदा फिल्म बनाउनेबारे सोच्न थाले। र, एक दिन त्यही सपना पूरा गर्न हुँदाखाँदाको एनजीओको जागिर छोडे।...	pahilopost.com	९ मिनेट अघि	https://l.hamropatro.com/r/https://pahilopost.com/content/20220309090439.html	entertainment
‘बुलाकी’मा कर्णलीको जनजीवन	चलचित्र ‘बुलाकी’को फस्र्टलुक पोस्टर सार्वजनीक गरिएको छ । सार्वजनिक पोस्टरमा अभिनेत्री सुरक्षा पन्तलाई मात्र प्रस्तुत गरिएको छ । लक्ष्मण सुनारको निर्देशन रहेको चलचित्रमा कर्णाली भेगको जनजीवन, रितिथ...	canadanepal.com	२३ मिनेट अघि	https://l.hamropatro.com/r/https://canadanepal.com/content/46784	entertainment
भूमिका श्रेष्ठ २०२२ को सहासिक महिला पुरस्कारबाट सम्मानित	काठमाडौं : यौनिक अल्पसंख्यकको अधिकारका लागि सक्रिय अभियानकर्मी भूमिका श्रेष्ठ अमेरिकी सरकारले प्रदान गर्ने अन्तर्राष्ट्रिय साहसी महिला अवार्डबाट सम्मानित भएकी छन्।  अमेरिकी विदेश मन्त्रालयले  सन् ...	thahakhabar.com	२४ मिनेट अघि	https://l.hamropatro.com/r/https://thahakhabar.com/news/147580	entertainment
‘बुलाकी’काे फर्स्टलुक सार्वजनिक, कर्णाली लुक्समा देखिइन् सुरक्षा	अन्तर्राष्ट्रिय नारी दिवसको अवसर पारेर फिल्म ‘बुलाकी’ को फर्स्टलुक सार्वजनिक भएको छ । फर्स्टलुकमा अभिनेत्री सुरक्षा पन्तलाई देख्न सकिन्छ। कर्णाली भेगको जनजीवन, रीतिथिति तथा संस्कृति समेटिएको फिल्म...	farakdhar.com	२७ मिनेट अघि	https://l.hamropatro.com/r/https://farakdhar.com/story/77678	entertainment
अब हलिउडमा पनि आलिया, गेलको अपोजिट भूमिकामा फिल्म खेल्ने	अभिनेत्री आलिया भट्ट बलिउडका उत्कृष्ट अभिनेत्रीमध्येमा पर्छिन् । हाल प्रदर्शनरत फिल्म ‘गंगुबाई काठियावाडी’बाट प्रशंसा पाइरहेकी यी अभिनेत्री चाँडै नै अन्तर्राष्ट्रियस्तरमा अर्थात् हलिउडमा पाइला चाल्...	ratopati.com	५१ मिनेट अघि	https://l.hamropatro.com/r/https://ratopati.com/story/225345/2022/3/9/alia-bhatt	entertainment
फष्टलुकमा यस्तो देखियो ‘बुलाकी’	फिल्म ‘बुलाकी’को फष्टलुक सार्वजनिक गरिएको छ । अन्तराष्ट्रिय नारी दिवसको अवसर पारेर निर्माण युनिटले मंगलबार एक पोष्टर फष्टलुकको रुपमा बाहिर ल्याएको हो । पोस्टरमा अभिनेत्री सुरक्षा पन्तलाई प्रस्तुत ग...	ratopati.com	१ घण्टा अघि	https://l.hamropatro.com/r/https://ratopati.com/story/225340/2022/3/9/bulaki-	entertainment
हलिउड स्टार लियोनार्डोद्वारा युक्रेनलाई १० मिलियन डलर सहयोग	एजेन्सीः हलिउड सुपरस्टार तथा अस्कर विजेता कलाकार लियोनार्डो डिक्याप्रियोले युक्रेनलाई १० मिलियन अमेरिकी डलर सहयोग गरेका छन्। रुसविरुद्ध युद्धमा सहयोग गर्न लियोनार्डोले १० मिलियन डलर (एक अर्ब २२ करो...	ukeraa.com	२ घण्टा अघि	https://l.hamropatro.com/r/https://www.ukeraa.com/news/2022/03/09/15848	entertainment
पाँचौ ‘ग्लोबल नेपाली फिल्म अवार्ड’ घोषणा	पाँचौ ‘ग्लोबल नेपाली फिल्म अवार्ड’ अमेरिकाको टेक्सस राज्यको ड्यालस शहरमा आयोजना हुने भएको छ । राजधानीमा आयोजित एक कार्यक्रममकाबीच अवार्डको जानकारी गराइयो । नेपाली फिल्मलाई विश्वस्तरमा पु¥याउने उद्द...	ratopati.com	२ घण्टा अघि	https://l.hamropatro.com/r/https://ratopati.com/story/225334/2022/3/9/global-nepali-film-award-	entertainment
फेन्सिङमा खेलाडी टिकाउनै मुस्किल	२५ फागुन, काठमाडौं । ग्रिसको एथेन्स शहरमा सन् १८९६ मा भएको पहिलो ओलम्पिकमा समावेश गरिएका ९ खेलमध्ये एक थियो– फेन्सिङ । यसअर्थमा फेन्सिङलाई ओलम्पिककै सबभन्दा पुरानो खेलभन्दा फरक पर्दैन । तर नेपालमा ...	onlinekhabar.com	२ घण्टा अघि	https://l.hamropatro.com/r/https://www.onlinekhabar.com/2022/03/1090986	entertainment
सगरमाथाको शिखरतर्फ अभिनेत्री दिया	काठमाडौं । चलचित्रको पर्दामा सुकुमारी भूमिकामा प्रस्तुत हुने अभिनेत्री दिया पुनका लागि जीवनकै सबैभन्दा संघर्षको समय अबको तीन महिना हुनेछ । उनी अदम्य साहस लिएर सगरमाथा शिखर आरोहणका लागि बुधबार सोलुख...	rajdhanidaily.com	३ घण्टा अघि	https://l.hamropatro.com/r/https://rajdhanidaily.com/id/57799/	entertainment
विद्यार्थी पास भएको रिजल्ट पाउँदा खुसी लाग्छ	धेरै कुरा सझिन सक्ने व्यक्ति ‘मेमोरी किङ’का रुपमा अर्पण शर्मा चिनिन्छन् । उनले सन् २०१५ मा धेरै कुरा सम्झेर देखाएपछि गिनिज बुकमा नाम दर्ता गराएका थिए । यसका साथै उनी नेश्नल युथ अवार्ड विजेता, हिमाल...	khabarhub.com	३ घण्टा अघि	https://l.hamropatro.com/r/https://www.khabarhub.com/2022/09/359159/	entertainment
सडकमा पाेखिए महिला हिंसाका वेदना	दाङ- सकमा मानिस ओहोरदाेहाेर गरिरहेका थिए । तर, त्यही सडक केहीबेरमा अर्कै माहौलमा परिणत भयाे । किशाेर किशाेरी अभिनयमा उत्रिए । महिलामाथि हुने हिंसा र अत्याचार बिरुद्ध सचेतना फैलाउन खाेजे । सडकमा हि...	deshsanchar.com	४ घण्टा अघि	https://l.hamropatro.com/r/https://deshsanchar.com/2022/03/08/622094/	entertainment
अन्तर्राष्ट्रिय साहसी महिलाको पुरस्कार भूमिका श्रेष्ठलाई	अमेरिकी विदेश मन्त्रालयले अन्तर्राष्ट्रिय साहसी महिलाको रूपमा अधिकारकर्मी भूमिका श्रेष्ठलाई पुरस्कार प्रदान गरेको छ । समुदायमा हक अधिकारको लागि गरेको योगदानका कारण भूमिले उक्त पुरस्कार पाएकी हुन् ।...	merolifestyle.com	११ घण्टा अघि	https://l.hamropatro.com/r/https://www.merolifestyle.com/archives/31807	entertainment
