Border with China has not been opened yet	KATHMANDU: MARCH. 9 – Rasuwagadhi and Tatopani, two important trade routes connecting Nepal and China, have been closed unilaterally. Since February 2020, one-way trade has been allowed at the Rasu...	english.makalukhabar.com	४७ मिनेट अघि	https://l.hamropatro.com/r/https://english.makalukhabar.com/2022/03/49147/	national
त्रिविमा प्राध्यापकमै राजनीतिक ध्रुवीकरण : तीन संगठनले मागे त्रिवि पदाधिकारीको राजीनामा 	त्रिभुवन विश्वविद्यालयमा यतिवेला राजनीतिक ध्रुवीकरण चुलिएको छ । त्रिभुवन विश्वविद्यालयका पदाधिकारीले आफ्ना कमजोरीलाई ढाकछोप गर्न विश्वविद्यालयका प्राध्यापक तथा कर्मचारीलाई अपमान गरेको आरोप लगाउँदै ...	nayapatrikadaily.com	५० मिनेट अघि	https://l.hamropatro.com/r/https://nayapatrikadaily.com/feed-detail.php?nid=82123	national
मदन–आश्रित मृत्यु रहस्यमै	काठमाडौं : एउटा चर्चित भनाइ छ–‘देखिने सबै कुरा सत्य हुँदैनन्, सत्य कुरा प्रायः देखिँदैनन्।’ यस्तै रहस्यको गर्भमा दबेको घटना हो, ‘दासढुंगा काण्ड’। एमालेका तत्कालीन महासचिव मदन भण्डारी र संगठन विभाग ...	annapurnapost.com	५० मिनेट अघि	https://l.hamropatro.com/r/https://annapurnapost.com/news/198017	national
माओवादी केन्द्र : निर्वाचनअघि पदाधिकारी चयन संभव छ ?	आठौं महाधिवेशन सकिएको २ महिना पूरा हुँदा पनि माओवादी केन्द्रले पदाधिकारी चयन गर्न सकेको छैन । गत पुस ११ देखि १८ सम्म राजधानीमा भएको महाधिवेशनले २४६ जना केन्द्रीय सदस्यको नाम पढेर सुनाएको थियो ।  प...	farakdhar.com	५० मिनेट अघि	https://l.hamropatro.com/r/https://farakdhar.com/story/77675	national
पत्रकार सम्मेलन गरेर स्थानीय चुनाव केन्द्रित अभियान घोषणा गर्दै देउवा	नेपाली कांग्रेसले स्थानीय चुनाव केन्द्रित घरदैलो अभियान सञ्चालन गर्ने भएको छ। फागुन २९ देखि चैत २९ सम्म एक महिने 'घरघर जाऔं कांग्रेस जिताऔं' अभियान घोषणा गर्ने तयारी छ। आज अपरान्ह ३ बजे पार्टी के...	setopati.com	५३ मिनेट अघि	https://l.hamropatro.com/r/https://www.setopati.com/politics/264141	national
पाकिस्तानी प्रधानमन्त्री इमरान खानविरूद्ध संसदमा अविश्वासको प्रस्ताव दर्ता	एजेन्सी- पाकिस्तानी प्रधानमन्त्री इमरान खानविरूद्ध संसदमा अविश्वासको प्रस्ताव पेस भएको छ । पाकिस्तान मुस्लिम लिग–एन (पीएमएलएन) ले १४० जना सांसदको हस्ताक्षरसहित अविश्वास प्रस्ताव पेस गरेको हो । खानव...	kathmandupati.com	५५ मिनेट अघि	https://l.hamropatro.com/r/https://www.kathmandupati.com/news/imaran-khan/217173/	national
महिला अधिकार सुनिश्चित गर्न  सबै प्रतिबद्ध हुनुपर्छ : प्रधानमन्त्री 	प्रधानमन्त्री शेरबहादुर देउवाले संविधानले प्रत्याभूत गरेका महिला अधिकार सुनिश्चित गर्न सबै प्रतिबद्ध हुनुपर्ने बताएका छन् । ११२औँ अन्तर्राष्ट्रिय श्रमिक महिला दिवसको अवसरमा मंगलबार आयोजित कार्यक्रम...	nayapatrikadaily.com	५५ मिनेट अघि	https://l.hamropatro.com/r/https://nayapatrikadaily.com/feed-detail.php?nid=82122	national
नदीमा पौडी खेल्ने क्रममा विद्यार्थीकाे ज्यान गएपछि सिउँडीबार क्षेत्रमा अनिश्चितकालीन निषेधाज्ञा	काठमाण्डाै – लमजुङको सुन्दरबजार नगरपालिका सिउँडीबार क्षेत्रमा अनिश्चितकालीन निषेधाज्ञा लगाइएको छ । आज बिहान ६ बजेदेखि निषेधाज्ञा लागू भएको हो । सुन्दरबजार–९ मर्स्याङ्दी नदीमा पौडी खेल्ने क्रममा फ्...	Ujyaaloonline.com	५७ मिनेट अघि	https://l.hamropatro.com/r/https://ujyaaloonline.com/story/66210/2022/3/9/injunction-in-sundarbazar-lamjung	national
डढेलोका कारण नाक्चुङ बस्ती जोखिममा,  हेलिकोप्टरले पनि आगो नियन्त्रणमा लिन सकेन	सोलुखुम्बुको खुम्बु पासाङल्हामु गाउँपालिका–२ मा पर्ने हरियाली सामुदायिक वनमा लागेको डढेलोका कारण बस्ती जोखिममा परेको छ । आइतबार रातिदेखि लागेको डढेलो नियन्त्रण बाहिर हुँदा सोही गाउँपालिका वडा नं २ ...	ratopati.com	५७ मिनेट अघि	https://l.hamropatro.com/r/https://ratopati.com/story/225343/2022/3/9/firing-on-jungle	national
पौडी खेल्ने क्रममा विद्यार्थीको मृत्यु : सुन्दरबजारमा अनिश्चितकालीन कर्फ्यु	लमजुङ । सुन्दरबजार नगरपालिकास्थित सिउँडीबार क्षेत्रमा आज बिहान ६ बजेदेखि अनिश्चितकालीन निषेधाज्ञा (कर्फ्यु) जारी गरिएको छ । सुन्दरबजार–९ स्थित मर्स्याङ्दी नदीमा पौडी खेल्ने क्रममा फ्युचर स्टार आवा...	baahrakhari.com	५८ मिनेट अघि	https://l.hamropatro.com/r/https://baahrakhari.com/news-details/343703	national
श्रमिक महिलाले पत्तो पाएनन् महिला दिवस	'दिनभरि काम नगरे बेलुका चुलोमा आगो बल्दैन, छोराछोरीको पेट भोकै हुन्छ, जे दिवस आए पनि हामीलाई के भो र ! दिवसले खान दिँदैन, पेट भरिँदैन । ' यो भनाइ हो स्थायी घर धादिङ भई कर्मथलो राजधानीलाई बनाउँदै आए...	lokaantar.com	१ घण्टा अघि	https://l.hamropatro.com/r/https://lokaantar.com/story/174998/2022/3/9/press/news-	national
यस्तो छ स्थानीय तहमा फेरि पहिलो दल बन्ने एमालेको रणनीति	२०७४ मा भएको स्थानीय तहको निर्वाचनमा नेकपा एमाले ४० प्रतिशतभन्दा बढी स्थान जितेर पहिलो दल बनेको थियो। त्यसबेला हालको मधेश प्रदेशबाहेक सबै स्थानमा एमाले निकै बलियो देखिएको थियो।  वैशाख ३० गते हुन ल...	nepalkhabar.com	१ घण्टा अघि	https://l.hamropatro.com/r/https://nepalkhabar.com/politics/123012-2022-3-9-8-44-38	national
कांग्रेस धनुषा सभापतिका लागि दोस्रो चरणको मतदान हुने	जनकपुरधाम ।  नेपाली कांग्रेस धनुषाको जिल्ला सभापतिका  लागि दोस्रो चरणको मतदान हुने भएको छ । पहिलो चरणको मतदानमा जिल्ला सभापतिका तीन जना उम्मेदवारमध्ये कुनै पनि उम्मेदवारले ५१ प्रतिशत मत ल्याउन नस...	newsofnepal.com	१ घण्टा अघि	https://l.hamropatro.com/r/https://www.newsofnepal.com/2022/03/09/479833/	national
युद्धकालमा साम्यवादी अभ्यास : ‘कम्युन घर’सँगै भत्किएको सपना	२० फागुन, दाङ । २०५८ सालमा रोल्पा थबाङको ठूलो गाउँमा नेपाली सेनाले आगो लगाउँदा राममाया रोकाको घर जल्यो । घर जलेपछि गाउँमा बस्न सुरक्षित भएन । उनका श्रीमान् ताराबहादुर रोकाले बाँकी बचेको घरसम्पत्ति ...	onlinekhabar.com	१ घण्टा अघि	https://l.hamropatro.com/r/https://www.onlinekhabar.com/2022/03/1090981	national
परिमार्जित जनप्रतिनिधि  : यी पाँच पदमा विशेष निर्वाचन गरौँ	काम गर्दै जाँदा धेरै कुराहरू सिकिँदै गइन्छ भन्नेमा हामी कसैको पनि दुई मत छैन होला । नेपाली जनताको बलिदानीपूर्ण जनआन्दोलनहरूको परिणाम नेपाल सङ्घीय लोकतान्त्रिक गणतन्त्रात्मक सार्वभौमसत्ता सम्पन्न मु...	ratopati.com	१ घण्टा अघि	https://l.hamropatro.com/r/https://ratopati.com/story/225342/2022/3/9/iran-rai-	national
महिला दिवसको अवशरमा सांग्रिला बुक्स र बुद्ध एयरको तर्फबाट २५ सय यात्रुलाई पुस्तर उपहार	काठमाडौँ– विश्वव्यापी मनाईरहिएको ११२ औँ अन्तराष्ट्रिय श्रमिक महिला दिवसका अवसरमा सांग्रिला बुक्स र बुद्ध एयरको सहकार्यमा काठमाडौंबाट बुद्ध एयरबाट यात्रा गर्ने पहिलो २५०० यात्रुलाई पुस्तक उपहार दिइए...	deshsanchar.com	१९ घण्टा अघि	https://l.hamropatro.com/r/https://deshsanchar.com/2022/03/08/621904/	literature
महिला दिवस : सांग्रिला बुक्स र बुद्ध एयरले २५०० यात्रुलाई दियो पुस्तक उपहार	काठमाडौं । अन्तर्राष्ट्रिय (श्रमिक) महिला दिवसका अवसरमा सांग्रिला बुक्स र बुद्ध एयरको सहकार्यमा काठमाडौँबाट बुद्ध एयरबाट यात्रा गर्ने पहिलो २५०० यात्रुलाई पुस्तक उपहार दिइएको छ ।  सांग्रिला बुक्सल...	hamrakura.com	१९ घण्टा अघि	https://l.hamropatro.com/r/https://hamrakura.com/news-details/118915/2022-03-08	literature
काठमाडौंबाट बुद्ध एयरमा यात्रा गर्ने पहिलो २५०० यात्रुलाई पुस्तक उपहार	काठमाडौं– अन्तर्राष्ट्रिय श्रमिक महिला दिवसका अवसरमा सांग्रिला बुक्स र बुद्ध एयरको सहकार्यमा काठमाडौंबाट बुद्ध एयरमा यात्रा गर्ने पहिलो २५०० यात्रुलाई पुस्तक उपहार दिइएको छ। सांग्रिला बुक्सले प्रक...	nepallive.com	२० घण्टा अघि	https://l.hamropatro.com/r/https://nepallive.com/story/274805	literature
कविता : धरती-आकाश	तिमी धरती म आकाश हामीलाई जोड्ने प्रेमको सेतु बीचको वायुमण्डल म वर्सन्छु निरन्तर, बोकेर प्रेमको जल घुलिन्छु तिमीमा सोसिन्छु तिमीमा जति जे छ मेरो, अर्पिन्छु तिमीमा । जीवन उम्रन्छ तिमीमा, हुर्कन...	onlinekhabar.com	२० घण्टा अघि	https://l.hamropatro.com/r/https://www.onlinekhabar.com/2022/03/1090701	literature
धरानले प्रकाशन गरेको कविता कृति ‘कचहरी’ माथि खोटामा विमर्श	रामधन राई, खोटाङ । धरान प्रज्ञा प्रतिष्ठान धरान उपमहानगरपालिकाले प्रकाशन गरेको कविता कृति ‘कचहरी’माथि खोटाङमा विमर्श गरिएको छ । दिक्तेल रुपाकोट मझुवागढी नगरपालिका–११ खार्मीमा जन्मनुभएका युवा साहित...	newsofnepal.com	२० घण्टा अघि	https://l.hamropatro.com/r/https://www.newsofnepal.com/2022/03/08/479676/	literature
ध्रुवचन्द्रको ‘ह्याङ्गरमा झुण्डिएको आकाश’ विमोचन	काठमाडौँ — आख्यानकार ध्रुवचन्द्र गौतमको पहिलो कवितासंग्रह ‘ह्याङ्गरमा झुण्डिएको आकाश’को विमोचन गरिएको छ । आइतबार धनगढीमा आयोजित सुदूरपश्चिम साहित्य महोत्सवको अवसरमा कवितासंग्रह विमोचन गरिएको हो । ...	ekantipur.com	२ दिन अघि	https://l.hamropatro.com/r/https://ekantipur.com/literature/2022/03/07/164663105531323886.html	literature
कथाकार पौडेल पुरस्कृत	काठमाडौँ — कथाकार मधुवन पौडेलले लघुकथा समाजले प्रदान गर्ने सावित्री–केशर कथा सम्मान तथा सुरभि साहित्य प्रतिष्ठानले दिने ‘गुरुप्रसाद मैनाली सुरभि साहित्य सम्मान’ प्राप्त गरेका छन् । समाजको कथा सम्म...	ekantipur.com	२ दिन अघि	https://l.hamropatro.com/r/https://ekantipur.com/literature/2022/03/07/164662854878797927.html	literature
अभिवन्द्य : रोदनको रचनात्मक लेखनशैली	नेपाली निबन्ध, नियात्रा, लघुकथा विधालाई पृथक लेखनशैली र शिल्पले सिँगार्दै आएका श्रीओम श्रेष्ठ ‘रोदन’ व्यक्तिचित्र उतार्नमा पनि उत्तिकै दख्खल राख्छन्। यसको सप्रमाण उनको सद्यः प्रकाशित कृति ‘अभिवन्द्...	nepalviews.com	४ दिन अघि	https://l.hamropatro.com/r/https://www.nepalviews.com/2022/03/05/45065/	literature
सबैलाई सँगै घुमाउने ‘आँखाभरि देश मनभरि परिवेश’ 	साहित्यिक पत्रकार नवराज रिजालको नियात्रासंग्रह ‘आँखाभरि देश मनभरि परिवेश’ एउटा महत्त्वपूर्ण नियात्राकृति हो । साहित्यिक पत्रकारितामा निरन्तर क्रियाशील नवराजले साहित्यजगत्मा आफ्नो स्थान बनाउँदै आएका...	baahrakhari.com	४ दिन अघि	https://l.hamropatro.com/r/https://baahrakhari.com/news-details/343330	literature
यसरी बन्न सक्छौँ फूलमा आत्मनिर्भर	फूललाई विषय बनाएर यसको सौन्दर्यतामाथि धेरै कुराहरू लेखिएका छन् । चाहे त्यो गीतमा होस् वा साहित्यमा । यस मानेमा फूलको आयतन निकै फराकिलो देखिन्छ । आमनेपालीको जीवनशैलीमा फूलको साइनो जन्मदेखि मृत्युसम्...	merolifestyle.com	५ दिन अघि	https://l.hamropatro.com/r/https://www.merolifestyle.com/archives/30868	literature
कविताको चिठी	एक सुदूर गाउँबाट  अनपढ आमासँग शब्द सापटी मागेर प्रतियोगितामा पठाउँदै छु यो कविता।   सकभर यो कविता नपढ्नू पढिहाले भने नसम्झनू एक बालक जोतिरहेछ हलो मुखले बोलिरहेछ कविता लक्ष्य राखेको छ महान् ...	setopati.com	५ दिन अघि	https://l.hamropatro.com/r/https://www.setopati.com/literature/263733	literature
मेघराजको ‘दिग्भ्रम’ सार्वजनिक	काठमाडौँ — कवि मेघराज तिम्सिनाले ८० वर्षको उमेरमा पहिलो कविता कृति ‘दिग्भ्रम’ प्रकाशनमा ल्याएका छन् । कविता कृति दमक प्रज्ञा प्रतिष्ठानमा आयोजित एक समारोहमा नेपाल प्रज्ञा प्रतिष्ठानका उपकुलपति जगमा...	ekantipur.com	८ दिन अघि	https://l.hamropatro.com/r/https://ekantipur.com/literature/2022/03/01/164611625295127800.html	literature
उमङ्ग लघुकथा सङ्ग्रह विमोचन	सत्या अधिकारीद्वारा लिखित उमङ्ग लघुकथा सङ्ग्रह विमोचन गरिएको छ । अक्षर धाम नेपालले प्रकाशन गरेको यस कृतिको विमोचन लघुकथा समाज नेपालका केन्द्रीय अध्यक्ष तथा प्रमुख अतिथि श्रीओम श्रेष्ठ रोदन, वरिष्ठ ...	ratopati.com	८ दिन अघि	https://l.hamropatro.com/r/https://ratopati.com/story/223858/2022/3/1/umanga-	literature
लेखनाथ पोखरेलको हाँस्य-निबन्ध ‘चिबे नकटो’ बजारमा	काठमाडौं । स्रष्टा लेखनाथ पोखरेलको हाँस्य-निबन्ध ‘चिबे नकटो’ पाठकमाझ आएको छ । केही समयअघि नियात्रासंग्रह ‘फकलीको गाउँ’ र कथासंग्रह ‘मार्बल हाउसकी शालिनी’ पाठकमाझ ल्याउनुभएका पोखरेलको तेस्रो कृति ‘च...	nepalpress.com	९ दिन अघि	https://l.hamropatro.com/r/https://www.nepalpress.com/2022/02/28/161053/	literature
भीष्मराज फुलाराको उपन्यास ‘वासुदेव’ सार्वजनिक	१६ फागुन, काठमाडौं । कानुन व्यवसायी वासुदेव फुलाराको संघर्ष कथामा आधारित उपन्यास ‘वासुदेव’ सार्वजनिक गरिएको छ । उपन्यासलाई साहित्यकार भीष्मराज फुलाराले लेखेका हुन् । उनी वासुदेवका भाइसमेत हुन् । अ...	onlinekhabar.com	९ दिन अघि	https://l.hamropatro.com/r/https://www.onlinekhabar.com/2022/02/1086521	literature
Shree ३ launching ‘Rust In Dust’ on Shivaratri	KATHMANDU, Feb 27: Shree ३, a skull-busting trio, the brainchild of Sarad Shrestha, a veteran guitarist of the Nepali music realm, is officially launching their second album ‘Rust In Dust’ on March...	english.ratopati.com	१० दिन अघि	http://l.hamropatro.com/r/http://english.ratopati.com/story/23885	literature
तीन साहित्यिक स्रष्टालाई वडाको सम्मान	काठमाडौं । काठमाडौं महानगरपालिका, वडा नं. ४ ले सोही वडामा बसोबास गर्ने नेपाली भाषा, साहित्य, संस्कृतिमा योगदान दिने तीन स्रष्टालाई सम्मान गरेको छ । वडाले कवि बैरागी काँइला, आख्यानकार डा. ध्रुवचन्द्...	baahrakhari.com	१० दिन अघि	https://l.hamropatro.com/r/https://baahrakhari.com/news-details/342777	literature
निबन्ध संग्रह ‘आकाशमुखी’ सार्वजनिक	काठमाडौँ — विश्वका चर्चित निबन्धहरूको नेपालीमा अनुवादित संग्रह ‘आकाशमुखी’ सार्वजनिक भएको छ । पत्रकार तथा लेखक मोहन मैनालीले अनुवाद गरेको कृतिमा १५ वटा निबन्ध संग्रहित छन् । बुकर टी. वासिङ्टन, जर्ज ...	ekantipur.com	१० दिन अघि	https://l.hamropatro.com/r/https://ekantipur.com/news/2022/02/27/164592713956615828.html	literature
