पाकिस्तानमा मिडिया विरुद्धको ‘कठोर’ कानूनको आलोचना	काठमाडौं । इमरान खान सरकारले अध्यादेशको रूपमा पारित गरेको कठोर मिडिया कानून संशोधनको पाकिस्तानमा व्यापक आलोचना भइरहेको छ । नागरिकहरूको संवैधानिक अधिकारहरूमा ब्रेक लगाउन खोजेपछि यो कानूनको आलोचना ह...	hamrakura.com	२० मिनेट अघि	https://l.hamropatro.com/r/https://hamrakura.com/news-details/118657/2022-03-04	national
घरभित्रै निसास्सिएर दैलेखमा आमा-छोराको मृत्यु	दैलेख : दैलेखमा निसास्सिएर दुईजनाको मृत्यु भएको छ । जिल्लाको पश्चिममा पर्ने ठाटीकाँध गाउँपालिका–१ ठाटीकाँध बजारमा बसोबास गर्दै आएका ४० वर्षीया हरिकला बादी र १८ वर्षीय रमेश बादीको मृत्यु भएको ठाटीका...	annapurnapost.com	२१ मिनेट अघि	https://l.hamropatro.com/r/https://annapurnapost.com/news/197697	national
अनुसन्धानलाई प्रभावित पर्ने गरी सामाजिक सञ्जालको दुरुपयोग नगर्न प्रहरीको आग्रह	प्रहरी प्रधान कार्यालय, साइबर ब्यूरोले युट्युब तथा टिकटकमा लगायतका सामाजिक सञ्जालमा जथाभावी भिडियो नहाल्न आग्रह गरेको छ । शुक्रबार सूचना जारी गर्दै ब्यूरोले गम्भीर प्रकृतिका अपराधको अनुसन्धानलाई प्...	ratopati.com	२२ मिनेट अघि	https://l.hamropatro.com/r/https://ratopati.com/story/224478/2022/3/4/police-headquarters	national
बाँके कांग्रेस सभापतिको दोस्रो चरणको मतदान सकियो, १४ सय ३९ मत खस्यो	नेपालगञ्ज । नेपाली कांग्रेस बाँकेको नयाँ नेतृत्व चुन्न भएको दोस्रो चरणको मतदान सकिएको छ । नयाँ नेतृत्व चुन्न आज बिहान १० बजेदेखि जिल्ला समन्वय समितिमा भएको मतदानमा १४ सय ३९ जनाले मतदान गरेका छन् । ...	hamrakura.com	२२ मिनेट अघि	https://l.hamropatro.com/r/https://hamrakura.com/news-details/118659/2022-03-04	national
पल प्रकरणलाई संकेत गर्दै प्रहरीले भन्यो- पीडितको गोपनीयता हनन गरे कारबाही	काठमाडौं- नाबालिग गायिकमाथि पटकपटक बलात्कार आरोपमा पक्राउ परेका पल शाह प्रकरणमा पीडितको गोपनीयता कायम गर्न प्रहरीले आग्रह गरेको छ। शुक्रबार प्रहरीको साइबर ब्यूरोले विज्ञप्ति जारी गर्दै यस्तो अनुरो...	nepalsamaya.com	२४ मिनेट अघि	https://l.hamropatro.com/r/https://nepalsamaya.com/samaj/2022-03-04-152139	national
झापामा १५ वर्षीया किशोरी बलात्कार गर्ने दुई जना पक्राउ	झापाः जिल्लाको गौरिगञ्ज गाउँपालिका-२ कोरोबारीमा एक १५ वर्षीया किशोरी बलात्कार गर्ने दुई जना पक्राउ परेका छन्। पक्राउ पर्नेमा २४ वर्षीय देवकुमार राजवंशी र २२ वर्षीय प्रमोद राजवंशी रहेका छन्।	ukeraa.com	२४ मिनेट अघि	https://l.hamropatro.com/r/https://www.ukeraa.com/news/2022/03/04/15689	national
जनताले चुनावमा चेतनाको राजनीति गर्नेलाई छान्नुपर्छ : गगन थापा	काठमाडौं । नेपाली कांग्रेसका महामन्त्री गगन थापाले जनताले चेतनाको राजनीति गर्नेलाई चुनावमा छान्नुपर्ने बताएका छन् । कास्कीमा आज कांग्रेसले आयोजना गरेको कार्यक्रममा बोल्दै यस्तो बताएका हुन् । उनले ...	lokpath.com	२४ मिनेट अघि	https://l.hamropatro.com/r/https://www.lokpath.com/story/505801	national
सत्ता गठबन्धनमै संसद विघटनको प्रस्ताव 	काठमाडौं । सत्ता गठबन्धनको बैठकमै प्रतिनिधिसभा संचालनको विधिलाई लिएर त्यसको औचित्वमा बहस सुरु भएको छ ।  प्रमुख प्रतिपक्षी दलले सदन अवरोध गरिरहने अनि प्रतिपक्षले अवरोधकैबीचमा कामकारवाही गर्ने गलत स...	baahrakhari.com	२७ मिनेट अघि	https://l.hamropatro.com/r/https://baahrakhari.com/news-details/343280	national
छिरिङ गुरुङलाई ३ लाख ५० हजार	छिरिङ गुरूङलाई ३ लाख ५० हजारमा पोखराले अनुबन्धन गरेको छ। पाँच क्लबले अन्तिम ३ लाख ५० हजारको विट लगाएपनि 'गोला प्रथा' मा छिरिङलाई पोखराले आफ्नो पक्षमा पार्न सफल भयो।	neplays.com	२८ मिनेट अघि	https://l.hamropatro.com/r/https://www.neplays.com/archives/128351	national
मानव अधिकारवादीलाई पक्षपाती नहुन मुख्यमन्त्री शाहीको आग्रह 	जुम्ला–कर्णाली प्रदेशका मुख्यमन्त्री जीवनबहादुर शाहीले मानव अधिकारवादी पक्षपाती हुन नहुने बताएका छन् । राष्ट्रिय मानव अधिकार आयोगले आयोजना गरेको २ दिने मानव अधिकार रक्षकको प्रादेशिक सम्मलेन उद्घाटन...	palikakhabar.com	२८ मिनेट अघि	https://l.hamropatro.com/r/https://palikakhabar.com/single-news/13899	national
पल शाहमाथिको अनुसन्धान प्रभावित पार्न सामाजिक सञ्जालमा लेख्नेलाई कारबाही गरिने	नाबालिका बलात्कारको आरोपमा प्रहरी हिरासतमा रहेका कलाकार पल शाहमाथिको अनुसन्धानलाई प्रभावित पार्ने गरी सामाजिक सञ्जालमा लेख्नेलाई प्रहरीले कारबाही गर्ने भएको छ। नाबालिका बलात्कारको आरोपमा कलाकार शा...	himalkhabar.com	२९ मिनेट अघि	https://l.hamropatro.com/r/https://www.himalkhabar.com/news/128672	national
एमसीसीमा समर्थन गर्ने निर्णयको बचाउँ गर्दै प्रचण्डले भने– नेतृत्वको कुशल निर्णयले गठबन्धन जोगियो, दुर्घटना टर्‍यो	काठमाडौँ– नेकपा माओवादी केन्द्रका अध्यक्ष पुष्पकमल दाहाल ‘प्रचण्ड’ ले एमसीसीको समर्थन गर्ने आफ्नो निर्णयको बचाउँ गर्दै एमसीसीको समर्थन गरेसँगै देशमा दुर्घटना टरेको र सत्तारुढ गठबन्धन सुरक्षित बनेको...	khabarhub.com	३० मिनेट अघि	https://l.hamropatro.com/r/https://www.khabarhub.com/2022/04/357109/	national
म्यादी प्रहरीको भूमिकामा खटिन तयार महानगर प्रहरी	आगामी वैशाखमा हुने स्थानीय तहको निर्वाचनमा महानगरपालिकाका प्रहरीले म्यादी प्रहरीको भूमिकामा काम गर्न तयार रहेको बताएका छन्। ललितपुर महानगरपालिकाको नगर प्रहरी प्रमुख सीताराम हाछेंथुले नगर प्रहरी परि...	nayapatrikadaily.com	३१ मिनेट अघि	https://l.hamropatro.com/r/https://nayapatrikadaily.com/feed-detail.php?nid=81804	national
प्रेस काउन्सिल अध्यक्ष हटाउन सोधिएको स्पष्टीकरणसम्बन्धी निर्णय कार्यान्वयन नगर्न सर्वोच्चको अन्तरिम आदेश	सर्वोच्च अदालतले प्रेस काउन्सिलका अध्यक्ष बालकृष्ण बस्नेतलाई सरकारले सोधेको स्पष्टीकरणसम्बन्धी निर्णय कार्यान्वयन नगर्न अन्तरिम आदेश दिएको छ । न्यायाधीश तेजबहादुर केसीको एकल इजलासले बस्नेतलाई स्पष...	lokaantar.com	३२ मिनेट अघि	https://l.hamropatro.com/r/https://lokaantar.com/story/174485/2022/3/4/main-news/balkrishna-banet	national
सुन चोरीको मुद्दा मिलापत्र गराउने महाशाखाका इन्स्पेक्टरलाई कारवाही	सुन चोरीको मुद्दामा मिलापत्र गराएको आरोप लागेका महानगरीय अपराध महाशाखाको ललितपुर शाखामा कार्यरत इन्स्पेक्टर सानुकान्छा रम्तेललाई कारवाही गरिएको छ । छानविन गर्दा त्रुटी गरेको भेटिएपछि उनलाई कारवाही ...	ratopati.com	३२ मिनेट अघि	https://l.hamropatro.com/r/https://ratopati.com/story/224476/2022/3/4/police	national
कांग्रेसको चुनावी रणनीति- मोटरसाइकल हुइँकाउँदै धेरै कार्यक्रममा जान नपाइने, टोलमै खट्नुपर्ने!	नेपाली कांग्रेस 'नयाँ रणनीति' लिएर स्थानीय तहको चुनावमा होमिने भएको छ। आउँदो वैशाख ३० मा हुने स्थानीय चुनावका लागि कांग्रेसले टोलका नेता/कार्यकर्ता कम्तिमा चुनावभर आफ्नै टोलमै खटिनुपर्ने बाध्यकारी...	setopati.com	३२ मिनेट अघि	https://l.hamropatro.com/r/https://www.setopati.com/politics/263735	national
प्रचण्डले भने- देशलाई ठूलो दुर्घटनाबाट जोगाइयो	नेकपा माओवादी केन्द्रका अध्यक्ष पुष्पकमल दाहालले मुलुकलाई ठूलो दुर्घटनाबाट जोगाएको बताएका छन्। केन्द्रीय कमिटी बैठकलाई शुक्रबार सम्बोधन गर्दै अध्यक्ष प्रचण्डले आफ्नो पार्टीले गरेको निर्णयले देशलाई...	setopati.com	३२ मिनेट अघि	https://l.hamropatro.com/r/https://www.setopati.com/politics/263737	national
हिजो दायाँबायाँ बस्नेले नै कटवाललाई कारवाही गर्न भने, अब त्यस्तो गल्ती हुँदैन : प्रचण्ड 	काठमाडौं । नेकपा माओवादी केन्द्रका अध्यक्ष पुष्पकमल दाहालले हिजो आफ्नो दायाँबायाँ बस्नेले प्रधानसेनापति रुक्मांगत कटवाललाई कारवाही गर्न उक्साएको बताएका छन् । केन्द्रीय कमिटीको बैठकलाई सम्बोधन गर्द...	baahrakhari.com	३२ मिनेट अघि	https://l.hamropatro.com/r/https://baahrakhari.com/news-details/343279	national
कविताको चिठी	एक सुदूर गाउँबाट  अनपढ आमासँग शब्द सापटी मागेर प्रतियोगितामा पठाउँदै छु यो कविता।   सकभर यो कविता नपढ्नू पढिहाले भने नसम्झनू एक बालक जोतिरहेछ हलो मुखले बोलिरहेछ कविता लक्ष्य राखेको छ महान् ...	setopati.com	१ घण्टा अघि	https://l.hamropatro.com/r/https://www.setopati.com/literature/263733	literature
मेघराजको ‘दिग्भ्रम’ सार्वजनिक	काठमाडौँ — कवि मेघराज तिम्सिनाले ८० वर्षको उमेरमा पहिलो कविता कृति ‘दिग्भ्रम’ प्रकाशनमा ल्याएका छन् । कविता कृति दमक प्रज्ञा प्रतिष्ठानमा आयोजित एक समारोहमा नेपाल प्रज्ञा प्रतिष्ठानका उपकुलपति जगमा...	ekantipur.com	३ दिन अघि	https://l.hamropatro.com/r/https://ekantipur.com/literature/2022/03/01/164611625295127800.html	literature
उमङ्ग लघुकथा सङ्ग्रह विमोचन	सत्या अधिकारीद्वारा लिखित उमङ्ग लघुकथा सङ्ग्रह विमोचन गरिएको छ । अक्षर धाम नेपालले प्रकाशन गरेको यस कृतिको विमोचन लघुकथा समाज नेपालका केन्द्रीय अध्यक्ष तथा प्रमुख अतिथि श्रीओम श्रेष्ठ रोदन, वरिष्ठ ...	ratopati.com	३ दिन अघि	https://l.hamropatro.com/r/https://ratopati.com/story/223858/2022/3/1/umanga-	literature
लेखनाथ पोखरेलको हाँस्य-निबन्ध ‘चिबे नकटो’ बजारमा	काठमाडौं । स्रष्टा लेखनाथ पोखरेलको हाँस्य-निबन्ध ‘चिबे नकटो’ पाठकमाझ आएको छ । केही समयअघि नियात्रासंग्रह ‘फकलीको गाउँ’ र कथासंग्रह ‘मार्बल हाउसकी शालिनी’ पाठकमाझ ल्याउनुभएका पोखरेलको तेस्रो कृति ‘च...	nepalpress.com	४ दिन अघि	https://l.hamropatro.com/r/https://www.nepalpress.com/2022/02/28/161053/	literature
भीष्मराज फुलाराको उपन्यास ‘वासुदेव’ सार्वजनिक	१६ फागुन, काठमाडौं । कानुन व्यवसायी वासुदेव फुलाराको संघर्ष कथामा आधारित उपन्यास ‘वासुदेव’ सार्वजनिक गरिएको छ । उपन्यासलाई साहित्यकार भीष्मराज फुलाराले लेखेका हुन् । उनी वासुदेवका भाइसमेत हुन् । अ...	onlinekhabar.com	४ दिन अघि	https://l.hamropatro.com/r/https://www.onlinekhabar.com/2022/02/1086521	literature
Shree ३ launching ‘Rust In Dust’ on Shivaratri	KATHMANDU, Feb 27: Shree ३, a skull-busting trio, the brainchild of Sarad Shrestha, a veteran guitarist of the Nepali music realm, is officially launching their second album ‘Rust In Dust’ on March...	english.ratopati.com	५ दिन अघि	http://l.hamropatro.com/r/http://english.ratopati.com/story/23885	literature
तीन साहित्यिक स्रष्टालाई वडाको सम्मान	काठमाडौं । काठमाडौं महानगरपालिका, वडा नं. ४ ले सोही वडामा बसोबास गर्ने नेपाली भाषा, साहित्य, संस्कृतिमा योगदान दिने तीन स्रष्टालाई सम्मान गरेको छ । वडाले कवि बैरागी काँइला, आख्यानकार डा. ध्रुवचन्द्...	baahrakhari.com	५ दिन अघि	https://l.hamropatro.com/r/https://baahrakhari.com/news-details/342777	literature
निबन्ध संग्रह ‘आकाशमुखी’ सार्वजनिक	काठमाडौँ — विश्वका चर्चित निबन्धहरूको नेपालीमा अनुवादित संग्रह ‘आकाशमुखी’ सार्वजनिक भएको छ । पत्रकार तथा लेखक मोहन मैनालीले अनुवाद गरेको कृतिमा १५ वटा निबन्ध संग्रहित छन् । बुकर टी. वासिङ्टन, जर्ज ...	ekantipur.com	५ दिन अघि	https://l.hamropatro.com/r/https://ekantipur.com/news/2022/02/27/164592713956615828.html	literature
आकाशमुखी बजारमा	लेखक, पत्रकार एवम् अनुवादक मोहन मैनालीद्वारा अनूदित पुस्तक 'आकाशमुखी' लोकार्पण भएको छ। शनिबार राजधानीमा आयोजित समारोहमा अध्येताद्वय हरि शर्मा र सगुना शाहका साथमा मोहन मैनालीले पुस्तकको लोकार्पण गर...	setopati.com	५ दिन अघि	https://l.hamropatro.com/r/https://www.setopati.com/art/book/263223	literature
कविता सङ्ग्रह  ‘समयको कठघरा’ लोकार्पण	कविता सङ्ग्रह ‘समयको कठघरा’ सार्वजनिक गरिएको छ । कवि जुनु खड्काद्वारा लिखित कविता सङ्ग्रहको शनिबार लोकार्पण गरिएको हो । शुक्लागण्डकी नगरपालिका–१० ढोरमुलकोट दरबारको फेदीमा आयोजित कार्यक्रममा कवि भूप...	ratopati.com	६ दिन अघि	https://l.hamropatro.com/r/https://ratopati.com/story/223273/2022/2/26/poem	literature
पाभेल : प्रिय र अविस्मरणीय पात्र	रूसी साहित्यमा, विशेष गरी रूसी आख्यानमा अधिक प्रयोग हुने पात्रहरूका नाममध्ये एउटा हो- पाभेल। रूसका केही ठूला साहित्यकारहरूले ‘पाभेल’ नामको पात्रलाई आफ्ना रचनाको प्रमुख पात्र बनाएको पाइन्छ। कतिपयले ...	nepalviews.com	६ दिन अघि	https://l.hamropatro.com/r/https://www.nepalviews.com/2022/02/26/43175/	literature
जोन्छेँका दुई पुस्तक विमोचित	भक्तपुर । अक्षरमार्ग प्रकाशन र सिर्जना अभियान समाजको संयुक्त आयोजनामा सम्पन्न कार्यक्रममा साहित्यकार ध्रुवनारायण जोन्छेँका दुई पुस्तक सार्वजनिक गरिएका छन् । जोन्छेँका ‘जीवन एक यात्रा अनेक’ (कवितासं...	baahrakhari.com	७ दिन अघि	https://l.hamropatro.com/r/https://baahrakhari.com/news-details/342701	literature
Actor Jaynanda Lama no more	KATHMANDU, Feb 23: Senior Actor and Folk Singer Jaynanda Lama breathed his last on Wednesday morning at Kausaltar, Bhaktapur. According to actor Krishna Malla, Lama fell from the vehicle earlier t...	english.ratopati.com	९ दिन अघि	http://l.hamropatro.com/r/http://english.ratopati.com/story/23854	literature
कलकत्ते काईंयो र टेबलमा ऐना छ, तर जयनन्द छैनन्	काठमाडौं–रत्नराज्य कलेजमा पंक्तिकार पत्रकारिता पढदै गर्दा छेउमै रहेको ललितकला क्याम्पसमा पढने मित्रहरु डेस्क ठटाउँदै एउटा गीत खुबै गाउँथे,	khabarhub.com	९ दिन अघि	https://l.hamropatro.com/r/https://www.khabarhub.com/2022/23/353793/	literature
फुलाराले ल्याए वासुदा	गीतकार तथा साहित्यकार भीष्मराज फुलाराको चौथो कृति वासुदा हालै राजधानीमा आयोजित एक कार्यक्रम बीच सार्वजनिक गरिएको छ। कार्यक्रममा प्रमुख अतिथि गीतकार तथा साहित्यकार डा. नवराज लम्साल, विशेष अतिथि एटर्...	newsofnepal.com	१० दिन अघि	https://l.hamropatro.com/r/https://www.newsofnepal.com/2022/02/22/475413/	literature
