उपत्यकामै ‘जब सेन्टर’ खोलेर ठगी, नौ जना  पक्राउ	काठमाडौं उपत्यकाका विभिन्न ठाउँमा केही व्यक्तिले ‘जब सेन्टर’ खोलेर ठगी गरेका छन् । उनीहरूले जब प्लेसमेन्ट कम्पनी दर्ता गर्ने र उक्त कम्पनीका सामाजिक सञ्जाल, पत्रपत्रिका, प्रचार पम्पलेटका माध्यमबाट ...	ratopati.com	२० घण्टा अघि	https://l.hamropatro.com/r/https://ratopati.com/story/225259/2022/3/8/arrested	health
अनुहार सुन्दर बनाउने केही घरेलु उपाय	हामी आफ्नो अनुहार लाई लिएर निकै चिन्तित हुने गर्दछौँ । क्रिम, पाउडर आदि लगाएर सधैँ प्रयास सुन्दर गोरो र चम्किलो अनुहार बनाउने प्रयास पनि गर्छौं । तर, अनुहार चम्किलो र सफा बनाउन सक्ने घरेलु उपाय...	merolifestyle.com	२१ घण्टा अघि	https://l.hamropatro.com/r/https://www.merolifestyle.com/archives/31715	health
थप १९४ जनामा कोरोनाभाइरस संक्रमण, ३४८ जना निको भए	पछिल्लो २४ घन्टामा नेपालमा थप एक सय ९४ जनामा कोरोना भाइरस संक्रमण पुष्टि भएको छ। ६ हजार तीन सय ९४ जनामा परीक्षण गर्दा सो संख्यामा संक्रमित थपिएका स्वास्थ्य तथा जनसंख्या मन्त्रालयले जनाएको छ। पिसिआर...	nayapatrikadaily.com	२१ घण्टा अघि	https://l.hamropatro.com/r/https://nayapatrikadaily.com/feed-detail.php?nid=82081	health
कोरोना अपडेटः थप १ सय ९४ जनामा सङ्क्रमण पुष्टि, एकको मृत्यु	काठमाडौँ / देशभर थप १९४ जनामा कोरोना भाइरसको संक्रमण पुष्टि भएको छ। स्वास्थ्य तथा जनसंख्या मन्त्रालयका अनुसार मंगलबार थप १९४ जनामा संक्रमण पुष्टि भएको हो।  स्वास्थ्य तथा जनसङ्ख्या मन्त्रालयको अनुस...	arthadabali.com	२१ घण्टा अघि	https://l.hamropatro.com/r/https://arthadabali.com/2022/03/08/21902	health
देशभर थपिए १९४ कोरोना संक्रमित, १ जनाको मृत्यु	नेपालमा पछिल्लो २४ घण्टाको अवधिमा थप १९४ जनामा कोरोना भाइरसको संक्रमण पुष्टि भएको छ।  स्वास्थ्य तथा जनसंख्या मन्त्रालयका अनुसार देशभर ६ हजार ३९४ नमुनाको एन्टिजेन र पीसीआर विधिबाट परीक्षण हुँदा सो ...	farakdhar.com	२१ घण्टा अघि	https://l.hamropatro.com/r/https://farakdhar.com/story/77629	health
१९४ संक्रमित थपिए, ३४८	काठमाडौं । नेपालमा थप १९४ जनामा कोरोना संक्रमण पुष्टि भएको छ । पछिल्लो २४ घण्टामा तीन हजार ६३८ वटा स्वाब नमुनाको पीसीआर परीक्षण गर्दा ७४ र दुई हजार ७५८ नमुनाको एन्टिजेन विधिबाट परीक्षण गर्दा १२० ज...	baahrakhari.com	२१ घण्टा अघि	https://l.hamropatro.com/r/https://baahrakhari.com/news-details/343666	health
स्वास्थ्य सेवा सक्षम बनाउन एक पायला फाउन्डेसनसँग सहकार्य	काठमाडौं । अन्तर्राष्ट्रिय महिला दिवसको अवसरमा जानकी टेक्नोलोजी SPARROW SMS ले आफ्नो संस्थागत सामाजिक उत्तरदायित्व CSR अन्तर्गत  गतिविधिहरुका लागि एक एक पाइला फाउन्डेसनसँग सम्झौता गरेको छ । एक एक प...	aarthiknews.com	२२ घण्टा अघि	http://l.hamropatro.com/r/http://aarthiknews.com/news/50934	health
थप १९४ जनामा कोरोना संक्रमण, १ जनाको मृत्‍यु	२४ फागुन, काठमाडौं । पछिल्लो २४ घण्टामा थप १९४ जनामा कोरोना भाइरस संक्रमण पुष्टि भएको छ भने १ जनाको मृत्‍यु भएको छ । स्वास्थ्य तथा जनसंख्या मन्त्रालयका अनुसार ३ हजार ६३८ जनाको पीसीआर परीक्षण गर्दा...	onlinekhabar.com	२२ घण्टा अघि	https://l.hamropatro.com/r/https://www.onlinekhabar.com/2022/03/1090784	health
थप १ सय ९४ जनामा सङ्क्रमण पुष्टि	देशभर थप १ सय ९४ जनामा कोरोनाभाइरसको सङ्क्रमण पुष्टि भएको छ । ६ हजार ३९४ जनाको कोरोना परीक्षण गर्दा पीसीआर विधिबाट ७४ तथा एन्टिजेन विधिबाट १२० जनामा सङ्क्रमण पुष्टि भएको स्वास्थ्य तथा जनसङ्ख्या मन्...	ratopati.com	२२ घण्टा अघि	https://l.hamropatro.com/r/https://ratopati.com/story/225243/2022/3/8/corona-update-	health
थप १९४ जनामा कोरोना संक्रमण, ३४८ जना निको	काठमाडौँ — नेपालमा २४ घण्टामा ६ हजार ३९४ परीक्षण हुँदा १९४ जनामा कोरोना संक्रमण देखिएको छ । स्वास्थ्य तथा जनसंख्या मन्त्रालयले मंगलबार दिएको जानकारीअनुसार देशभर ३ हजार ६३८ पीसीआर परीक्षणमा ७४ र २ ह...	ekantipur.com	२२ घण्टा अघि	https://l.hamropatro.com/r/https://ekantipur.com/news/2022/03/08/164673535765039703.html	health
२४ घण्टामा थपिए १९४ संक्रमित, एक जनाको मृत्यु	पछिल्लो २४ घण्टामा १९४ जनामा संक्रमण पुष्टि भएको छ ।  स्वास्थ्य तथा जनसंख्या मन्त्रालयका अनुसार ६ हजार ३९४ नमूना परीक्षणमध्ये ७४ पीसीआर र १२० जनामा एन्टिजेन पोजिटिभ देखिएको हो ।  यस्तै पछिल्लो २४...	lokaantar.com	२२ घण्टा अघि	https://l.hamropatro.com/r/https://lokaantar.com/story/174924/2022/3/8/main-news/corona-update-	health
ईसेवा मनी ट्रान्सफरको प्रयोग गरी शून्य शुल्कमा देशभरि रेमिट्यान्स पठाउन सकिने	काठमाडौं । ईसेवा मनी ट्रान्सफरको प्रयोग गरी ईसेवाबाट शून्य शुल्कमा नेपालभरि आन्तरिक रेमिट्यान्स पठाउन मिल्ने भएको छ । यो सुविधा यही मार्च १ देखि मे ३१ सम्म तीन महिनाका लागि रहेको  कम्पनीले जनाएको ...	baahrakhari.com	१० मिनेट अघि	https://l.hamropatro.com/r/https://baahrakhari.com/news-details/343730	technology
एपहरुलाई आर्काइभ गरेर स्पेस जोगाउन सकिने फिचर ल्याउँदै एन्ड्रोइड	एन्ड्रोइडले स्पेस बचाँउनका लागि एपहरुलाई आर्काइभ गर्न दिने भएको छ । अहिलेको स्मार्टफोनमा ६४ जिबी र १२८ जिबीको स्टोरेज हुने हुँदा धेरैलाई स्टोरेजको समस्या नहुने भएता पनि सबैले स्टोरेज अपग्रेड गर्न स...	ictsamachar.com	१७ मिनेट अघि	https://l.hamropatro.com/r/https://ictsamachar.com/news-details/10468/2022-03-09	technology
वैदेशिक रोजगारीमा जाने श्रमिकलाई ई –स्टिकर साथैमा बोक्न विभागको अनुरोध	काठमाण्डौ – श्रम स्वीकृति लिएर वैदेशिक रोजगारीमा जाने श्रमिकलाई एसएमएस वा इमेलमार्फत प्राप्त क्युआर कोडसहितको ई –स्टिकर साथैमा बोक्न वैदेशिक रोजगार विभागले अनुरोध गरेको छ ।  प्राप्त ई स्टिकर मोबाइ...	Ujyaaloonline.com	२७ मिनेट अघि	https://l.hamropatro.com/r/https://ujyaaloonline.com/story/66218/2022/3/9/foreign-employment-labor-approval	technology
Janaki Technology Collaborates with Ek Ek Paila Foundation for Enabling Health Services	On the occasion of International Women’s Day 2022, Janaki Technology has signed a contract with Ek Ek Paila Foundation as a part of its Corporate Social Responsibility (CSR) activities. Dr. Suman ...	techsathi.com	५४ मिनेट अघि	https://l.hamropatro.com/r/https://techsathi.com/janaki-technology-collaborates-with-ek-ek-paila	technology
यसरी अन्त्य भयो ‘सारथी’	काठमाडौं । एक समय काठमाडौं उपत्यकामा अनलाइन ट्याक्सी बुकिङका लागि लोकप्रिय बनेको सारथी क्याब कोरोना महामारीसँगै एकाएक गुमनाम बनेको छ । समय कोरोना महामारीको भए पनि कम्पनी बन्द हुनुको कारण भने अर्कै ...	techpana.com	५४ मिनेट अघि	https://l.hamropatro.com/r/https://www.techpana.com/2022/120911/	technology
स्क्रिनमा छिद्र नै नभएको स्मार्टफोन ल्याउँदै ह्वावे	काठमाडौं । चिनियाँ प्रविधि कम्पनी ह्वावेले स्क्रिनमा छिद्र (हाेल) नै नभएको स्मार्टफोन ल्याउने भएकाे छ । अमेरिका लगायत युरोपका केही देशले प्रतिबन्ध लगाएसँगै ह्वावे स्मार्टफोन उद्योगमा आफ्नो स्थान बन...	techpana.com	२ घण्टा अघि	https://l.hamropatro.com/r/https://www.techpana.com/2022/120903/	technology
छालामा छोएर नियन्त्रण गर्न सकिने स्मार्टवाच र एयरबड ल्याउँदै गुगल	काठमाडौं । गुगलले मान्छेको छालामा छोएर नियन्त्रण गर्न सकिने स्मार्टवाच र एयरबड निर्माण गर्ने भएको छ । स्मार्टवाच र एयरबडको बढ्दो प्रयोगका बीच कम्पनीले आफ्नो आगामी परियोजनाको रुपमा यसलाई अघि बढाएको ...	techpana.com	२ घण्टा अघि	https://l.hamropatro.com/r/https://www.techpana.com/2022/120894/	technology
Factbox: Apple upgrades iPhone SE and iPad Air, launches Mac Studio	At the event, titled “Peek Performance”, Apple also introduced its fastest chipset, a brand new high-performance computer and brought nearly all of its devices on the 5G bandwagon. Apple on Tuesda...	kathmandupost.com	२ घण्टा अघि	https://l.hamropatro.com/r/https://kathmandupost.com/world/2022/03/09/factbox-apple-upgrades-iphone-se-and-ipad-air-launches-mac-studio	technology
फेसबुकको डेस्कटप भर्सनमा नयाँ डिजाइन आउँदै	काठमाडौं । मेटाले फेसबुकको डेस्कटप भर्जनमा नयाँ लेआउट परीक्षण गर्दैछ । पहिलेभन्दा फरक डिजाइनमा परीक्षण गरिरहेको कम्पनीले नयाँ लेआउट केही प्रयोगकर्ताका लागि उपलब्ध समेत गराएको छ । फेसबुकले उपलब्ध ग...	techpana.com	४ घण्टा अघि	https://l.hamropatro.com/r/https://www.techpana.com/2022/120892/	technology
Spotify and Discord are back online after outages linked to Google Cloud!!!	Discord said a new issue caused a failure of its API after restarting its streaming service to remedy one issue, which they were still investigating as of roughly 30 minutes ago. The Spotify Statu...	ictsamachar.com	४ घण्टा अघि	https://l.hamropatro.com/r/https://ictsamachar.com/news-details/10466/2022-03-09	technology
Komaki EV scooters in Nepal: Is the new brand prepared for a tough race?	Komaki EV, an Indian brand has officially released two models of its electric scooters in Nepal. Unity Trading Concern Pvt Ltd, the official distributor of the brand for Nepal, has made the scoote...	english.onlinekhabar.com	५ घण्टा अघि	https://l.hamropatro.com/r/https://english.onlinekhabar.com/komaki-ev-scooters-nepal.html	technology
स्थानीय निर्वाचन : किन प्रयोगमा आउन सकेन विद्युतीय भोटिङ मसिन ?	काठमाडाैं । स्थानीय तह निर्वाचन, २०७९ मा कागजको मतपत्रमै मतदान हुने भएको छ । आयोगले विद्युतीय मतदान उपकरण (इलेक्ट्रोनिक भोटिङ मेसिन–ईभीएम) प्रयोगका लागि सम्भाव्य अध्ययन गरे पनि स्थानीय निर्वाचनमा प...	techpana.com	५ घण्टा अघि	https://l.hamropatro.com/r/https://www.techpana.com/2022/120870/	technology
TWITTER: Twitter to launch a Tor service for more secure and private tweeting!!!	Twitter is creating a Tor onion service, which will optimize the site for the privacy-protecting and censorship-avoiding network. Alec Muffett, a software programmer, shared the news on Twitter tod...	ictsamachar.com	६ घण्टा अघि	https://l.hamropatro.com/r/https://ictsamachar.com/news-details/10465/2022-03-09	technology
OnePlus Nord CE 2 5G Launched in Nepal: An Affordable All-Rounder Phone	OnePlus has recently launched its mid-range smartphone, OnePlus Nord CE 2. This smartphone is a combination of style and brings MediaTek Dimensity 9OO, an in-display fingerprint sensor, 65W fast ch...	techsathi.com	६ घण्टा अघि	https://l.hamropatro.com/r/https://techsathi.com/oneplus-nord-ce-2-price-in-nepal	technology
Universal Pension Scheme: Step towards inclusive welfare society	Bangladesh is currently enjoying the benefit of demographic dividend, which is accelerating the achievement of developed nation vision by 2041. By the time the country will achieve this status bas...	english.khabarhub.com	६ घण्टा अघि	https://l.hamropatro.com/r/https://english.khabarhub.com/2022/09/240683/	technology
Gyre Rider app goes public, features Gyre Pink that allows female users to call female riders	Gyre, a ride-sharing app, has gone public. The Gyre app was made public by hosting a program on the occasion of Women's Day on 8th of March, 2022. The Gyre app can be used to book taxis and motorcy...	ictsamachar.com	७ घण्टा अघि	https://l.hamropatro.com/r/https://ictsamachar.com/news-details/10464/2022-03-09	technology
युट्युबलाई नियमन कि अभिव्यक्ति स्वतन्त्रतामाथि डन्डा?	काठमाडौं– सरकारले इन्टरनेटको माध्यमबाट प्रसारण हुने 'अनलाइन टेलिभिजन'का लागि इजाजतपत्र अनिवार्य गरेको छ। सञ्चार तथा सूचना प्रविधि मन्त्रालयले राष्ट्रिय प्रसारण नियमावली २०४९ मा एघारौं संशोधन गर्दै ...	nepallive.com	१७ घण्टा अघि	https://l.hamropatro.com/r/https://nepallive.com/story/274825	technology
प्रविधिमार्फत समाज परिवर्तन गर्दैै महिलाहरु	२४ फागुन, काठमाडौं । सूचना प्रविधिले विश्वभर फड्को मारिरहँदा नेपाली महिलाले पनि आफूलाई यस क्षेत्रमा सफल मात्र होइन, अब्बल नै साबित गरिरहेका छन् । चाहे त्यो बैंक, वित्तीय क्षेत्रमा होस् वा सफ्टवेयर ...	onlinekhabar.com	१८ घण्टा अघि	https://l.hamropatro.com/r/https://www.onlinekhabar.com/2022/03/1090922	technology
Coal India chairman wants its operations to be net zero in 3-4 years	India has more than 170 coal-fired power stations, which together account for nearly three-quarters of electricity generation in the world’s third-biggest emitter of greenhouse gases after China an...	kathmandupost.com	१९ घण्टा अघि	https://l.hamropatro.com/r/https://kathmandupost.com/world/2022/03/08/coal-india-chairman-wants-its-operations-to-be-net-zero-in-3-4-years	technology
इन्फर्मेटिक्स कलेजले मनायो १२ औं वार्षिकोत्सव	इन्फर्मेटिक्स कलेज पोखराले आफ्नो १२औं वार्षिकोत्सव विभिन्न कार्यक्रम गरी मनाएको छ। उत्कृष्ट नतिजा र व्यवसायिक शिक्षा दिँदै आएको यो कलेजका विद्यार्थीले १२औं वार्षिकोत्सव एक भव्य समारोहबीच मनाएका हुन...	setopati.com	१९ घण्टा अघि	https://l.hamropatro.com/r/https://www.setopati.com/kinmel/others/264108	technology
एनएफटी बेचेर १२ वर्षे बालक बने १२ करोडको मालिक	काठमाडौं । एनएफटी अर्थात् नन-फन्जिबल टोकनबारे तपाईंलाई पक्कै थाहा होला । पछिल्लो समय विश्व बजारमा एनएफटीले तहल्का मच्चाइरहेको छ । यो प्रविधिलाई डिजिटल चित्रकारिता र कला क्षेत्रमा एउटा आमूल परिवर्तन...	techpana.com	२० घण्टा अघि	https://l.hamropatro.com/r/https://www.techpana.com/2022/120838/	technology
ईसेवा वालेटबाट अब शुन्य शुल्कमा रेमिट्यान्स पठाउन सकिने	काठमाडौं । ईसेवा मनी ट्रान्सफरको रेमिट्यान्स सेवा प्रयोग गर्दै आएका ग्राहकले अब ईसेवा वालेटबाट शुन्य शुल्कमा रेमिट्यान्स पठाउन सक्ने भएका छन् । यो सुविधाका लागि एफवान सफ्ट ग्रुप अन्तर्गतका यी दुई ...	techpana.com	२१ घण्टा अघि	https://l.hamropatro.com/r/https://www.techpana.com/2022/120835/	technology
रूसमा आईफोन बिक्री बन्द गर्दा दैनिक ३७ करोड गुमाउँदै एप्पल	काठमाडौं । एप्पलले रुसमा आईफोन बिक्री बन्द गर्ने निर्णय गरेको छ । यो निर्णयले कम्पनीलाई दैनिक ३७ करोडभन्दा बढी नोक्सान हुने एक अध्ययनले देखाएको छ । फोनका लागि कभर बनाउने कम्पनी ‘बुर्गा’ ले गरेको ए...	techpana.com	२२ घण्टा अघि	https://l.hamropatro.com/r/https://www.techpana.com/2022/120830/	technology
पब्जी मोबाइल र पब्जी न्यू स्टेटमा के छ फरक ?	गणेश सुवेदी /- काठमाडौं । अहिले मोबाइलका लागि धेरै ब्याटल रोयल गेम आइसकेका छन् । पब्जी, फ्री फायर, सीओडी यसका केही उदाहरण हुन् । ब्याटल रोयल गेममध्ये पब्जी मोबाइल सबैभन्दा चलेको गेम हो । २०१८ मा...	techpana.com	२२ घण्टा अघि	https://l.hamropatro.com/r/https://www.techpana.com/2022/120827/	technology
एनसेल वुमन आइकन २०२१ तथा नेपालको पहिलो महिला कम्प्युटर इन्जिनियर : गुण केशरी प्रधान	गुणकेशरी प्रधान मानन्धर नेपालको पहिलो महिला कम्प्युटर इन्जिनियर हुन् । नेपालको आईटी क्षेत्रमा ३५ वर्ष लामो योगदान गरेकी प्रधानसँग नेपाल टेलिकम र सरकारी संस्थामा मात्रै करिब ३१ वर्ष काम गरेको अनुभव ...	ictsamachar.com	२३ घण्टा अघि	https://l.hamropatro.com/r/https://ictsamachar.com/news-details/10459/2022-03-08	technology
