माधव नेपालको दाबी- निर्वाचनमा गठबन्धनका दलहरू मिल्ने सहमति भइसक्यो	सत्तासाझेदार नेकपा (एकीकृत समाजवादी)का अध्यक्ष माधवकुमार नेपालले सत्तारुढ दलहरूबीच स्थानीय तह निर्वाचनमा मिलेर जाने सहमति भइसकेको दाबी गरेका छन् ।  बुधवारबाट काठमाडौंमा शुरू भएको पार्टी केन्द्रीय ...	lokaantar.com	३१ मिनेट अघि	https://l.hamropatro.com/r/https://lokaantar.com/story/175022/2022/3/9/politics/madhav-nepal-	national
झलनाथ खनालको टिप्पणी– कांग्रेसको आकलन गठबन्धन गर्नुहुँदैन भन्ने छ, विचार गरौँ	काठमाडौं । नेकपा एकीकृत समाजवादीका वरिष्ठ नेता झलनाथ खनालले संसदबाट पारित भएको एमसीसी अब चुनावपछि मात्रै बहसमा ल्याउन अनुरोध गरेका छन् । केन्द्रीय कमिटीको बैठकलाई सम्बोधन गर्दै उनले यस्तो बताएका हु...	baahrakhari.com	३४ मिनेट अघि	https://l.hamropatro.com/r/https://baahrakhari.com/news-details/343726	national
पार्टीको पत्रकार सम्मेलनमा प्रधानमन्त्री देउवा नजाने	काठमाडौं :  नेपाली कांग्रेसले आयोजना गरेको पत्रकार सम्मेलनमा प्रधानमन्त्री शेरबहादुर देउवा नजाने भएका छन्।  स्थानीय तह केन्द्रित चुनावी अभियान घोषणा गर्न पार्टी कार्यालय सानेपामा आयोजित कार्यक्रममा...	annapurnapost.com	३६ मिनेट अघि	https://l.hamropatro.com/r/https://annapurnapost.com/news/198042	national
एमसीसीबारे चुनावपछि मात्रै बहस : झलनाथ 	काठमाडौं । सत्तासाझेदार दल नेकपा (एकीकृत समाजवादी)का सम्मानित नेता झलनाथ खनालले पार्टीमा मिलेर जाने बताएका छन् । यसअघि, अमेरिकी सहयोग परियोजना (एमसीसी)विरुद्ध खरो रूपमा उत्रिएका खनालले बुधबारदेखि ...	baahrakhari.com	३८ मिनेट अघि	https://l.hamropatro.com/r/https://baahrakhari.com/news-details/343725	national
एमसीसीको विषयलाई लिएर महोत्तरीमा ५ नेताले गरे माओवादी छाडेको घोषणा	२५ फागुन, जनकपुरधाम । अमेरिकी सहयोग परियोजना एमसीसी पारित गराउन नेतृत्वदायी भूमिका निर्वाह गरेको भन्दै महोत्तरीमा नेकपा माओवादी केन्द्रका पाँच जना नेताले पार्टी छाडेको घोषणा गरेका छन् । माओवादी के...	onlinekhabar.com	४० मिनेट अघि	https://l.hamropatro.com/r/https://www.onlinekhabar.com/2022/03/1091125	national
कांग्रेसको ‘घर–घर जाऔं, कांग्रेस जिताऔं’ अभियान, कसलाई कहाँ खटाइयाे (सूचीसहित) 	नेपाली कांग्रेसले स्थानीय तह निर्वाचन केन्द्रित ‘घर–घर जाऔं, कांग्रेस जिताऔं’ अभियान अन्तर्गत केन्द्रीय प्रतिनिधी तोकेको छ। मंगलबार सभापति शेरबहादुर देउवाले केन्द्रबाट खटिने प्रतिनिधिहरुको बैठक राख...	nayapatrikadaily.com	४१ मिनेट अघि	https://l.hamropatro.com/r/https://nayapatrikadaily.com/feed-detail.php?nid=82144	national
पाकिस्तानमा धर्मराउँदै खान सरकार : बेनजिर भुट्टोले जस्तै विपक्षीको अविश्वासको प्रस्तावलाई पार्लान त असफल?	काठमाडौं : पाकिस्तानका प्रधानमन्त्री इमरान खानविरुद्ध विपक्षी गठबन्धनका सांसदहरुले अविश्वासको प्रस्ताव दर्ता गराएका छन्। विपक्षी गठबन्धन पाकिस्तान डेमोक्रेटिक मुभमेन्टमा आवद्ध दलका सांसदहरुले प्रधा...	pahilopost.com	४३ मिनेट अघि	https://l.hamropatro.com/r/https://pahilopost.com/content/20220309131749.html	national
प्रचण्डको स्वीकारोक्ति - नेतृत्व निर्माणमा परम्पराबाट बाहिर निस्कन सकिएन, समीक्षाको विषय बन्यो	नेकपा माओवादी केन्द्रका अध्यक्ष पुष्पकमल दाहाल प्रचण्डले पार्टी र नेतृत्व निर्माणमा अझै पनि आफू परम्परागत मान्यताबाट बाहिर नआएको स्वीकार गरेका छन् । नेपाल उद्योग महासंघ (प्रस्तावित) केन्द्रीय तदर्थ...	farakdhar.com	४३ मिनेट अघि	https://l.hamropatro.com/r/https://farakdhar.com/story/77698	national
Fire kills 14-year-old in Bardiya	(Image for Representation) BARDIYA: A person has died after his house caught fire on Tuesday night. The deceased has been identified as 14-year-old Sanu Chaudhary of Barbardiya municipality-9, Kh...	english.khabarhub.com	४४ मिनेट अघि	https://l.hamropatro.com/r/https://english.khabarhub.com/2022/09/240719/	national
प्रचण्ड र चिनियाँ राजदूतबीच भेटवार्ता	काठमाडौं, २५ फागुन । नेपालका लागि चिनियाँ राजदूत होउ यान्छीले नेकपा (माओवादी केन्द्र) का अध्यक्ष तथा पूर्व प्रधानमन्त्री पुष्पकमल दाहाल ‘प्रचण्ड’ बीच भेटवार्ता भएको छ। आज (बुधबार) राजदूत यान्छीले प...	reportersnepal.com	४४ मिनेट अघि	https://l.hamropatro.com/r/https://www.reportersnepal.com/2022/03/658099	national
माधव नेपालको दावी : गठबन्धन दलबीच स्थानीय तह निर्वाचनमा मिलेर जाने सहमति भएको छ	सत्ता साझेदार नेकपा (एकीकृत समाजवादी)का अध्यक्ष माधवकुमार नेपालले सत्तारुढ दलहरूबीच स्थानीय तह निर्वाचनमा मिलेर जाने सहमति भइसकेको दाबी गरेका छन्।  बुधबारबाट काठमाडौंमा सुरु भएको पार्टी केन्द्रीय ...	nayapatrikadaily.com	४४ मिनेट अघि	https://l.hamropatro.com/r/https://nayapatrikadaily.com/feed-detail.php?nid=82143	national
ओली विराटनगरमा	विराटनगर । प्रमुख प्रतिपक्ष दल नेकपा (एमाले)का अध्यक्ष केपी शर्मा ओली विराटनगर आइपुगेका छन् । बुधबार मोरङको रंगेलीमा आयोजित तराई–मधेसकेन्द्रित सभालाई सम्बोधनका लागि उनी विराटनगर आएका हुन् । विराटन...	baahrakhari.com	४६ मिनेट अघि	https://l.hamropatro.com/r/https://baahrakhari.com/news-details/343724	national
कुखुरा पालनबाट मनग्य आम्दानी	बझाङ ।  कुखुरा पालन बाट मनग्ये आम्दानी गर्दै आएका छन् । बझाङको जयपृथ्वी नगरपालिका वडा नम्बर १० बस्ने वर्ष ३० का रोशन बि. क अहिले युवाहरूका प्रेरणाका स्रोत बन्दै गएका छन् । आफ्नै ठाउँमा केही न केही...	newsofnepal.com	४८ मिनेट अघि	https://l.hamropatro.com/r/https://www.newsofnepal.com/2022/03/09/479958/	national
काठमाडौंबाट फोहोर बोकेर गएका गाडी रोकेर आन्दोलन	सिसडोल तथा बञ्चरेडाँडास्थित ल्यान्डफिल साइटबाट प्रभावित धादिङ र नुवाकोटका बासिन्दा आन्दोलनमा उत्रिएका छन्। काठमाडौंबाट फोहोर बोकेर गएका गाडीलाई रोकेर उनीहरूले विरोध गरेका हुन्।  सरकारी पक्षले गरेक...	nepalkhabar.com	४८ मिनेट अघि	https://l.hamropatro.com/r/https://nepalkhabar.com/society/123055-2022-3-9-12-46-52	national
तानाशाहको जन्म	तानाशाह तेरो जन्मले नाजीवादको दुर्गन्ध फैलिँदा  विचरा आफ्नै गुँडमा ओथारा बसेका पंक्षीमाथि  अस्त्रले हैकम जमाउन खोज्दा  कलम र किबोर्ड माटो चुमेर सार्वभौम सत्ता, स्वाधीनता र मानवता  किनारमा सुनक...	setopati.com	१० मिनेट अघि	https://l.hamropatro.com/r/https://www.setopati.com/literature/264164	literature
महिला दिवसको अवशरमा सांग्रिला बुक्स र बुद्ध एयरको तर्फबाट २५ सय यात्रुलाई पुस्तर उपहार	काठमाडौँ– विश्वव्यापी मनाईरहिएको ११२ औँ अन्तराष्ट्रिय श्रमिक महिला दिवसका अवसरमा सांग्रिला बुक्स र बुद्ध एयरको सहकार्यमा काठमाडौंबाट बुद्ध एयरबाट यात्रा गर्ने पहिलो २५०० यात्रुलाई पुस्तक उपहार दिइए...	deshsanchar.com	२३ घण्टा अघि	https://l.hamropatro.com/r/https://deshsanchar.com/2022/03/08/621904/	literature
महिला दिवस : सांग्रिला बुक्स र बुद्ध एयरले २५०० यात्रुलाई दियो पुस्तक उपहार	काठमाडौं । अन्तर्राष्ट्रिय (श्रमिक) महिला दिवसका अवसरमा सांग्रिला बुक्स र बुद्ध एयरको सहकार्यमा काठमाडौँबाट बुद्ध एयरबाट यात्रा गर्ने पहिलो २५०० यात्रुलाई पुस्तक उपहार दिइएको छ ।  सांग्रिला बुक्सल...	hamrakura.com	२३ घण्टा अघि	https://l.hamropatro.com/r/https://hamrakura.com/news-details/118915/2022-03-08	literature
काठमाडौंबाट बुद्ध एयरमा यात्रा गर्ने पहिलो २५०० यात्रुलाई पुस्तक उपहार	काठमाडौं– अन्तर्राष्ट्रिय श्रमिक महिला दिवसका अवसरमा सांग्रिला बुक्स र बुद्ध एयरको सहकार्यमा काठमाडौंबाट बुद्ध एयरमा यात्रा गर्ने पहिलो २५०० यात्रुलाई पुस्तक उपहार दिइएको छ। सांग्रिला बुक्सले प्रक...	nepallive.com	२३ घण्टा अघि	https://l.hamropatro.com/r/https://nepallive.com/story/274805	literature
कविता : धरती-आकाश	तिमी धरती म आकाश हामीलाई जोड्ने प्रेमको सेतु बीचको वायुमण्डल म वर्सन्छु निरन्तर, बोकेर प्रेमको जल घुलिन्छु तिमीमा सोसिन्छु तिमीमा जति जे छ मेरो, अर्पिन्छु तिमीमा । जीवन उम्रन्छ तिमीमा, हुर्कन...	onlinekhabar.com	२४ घण्टा अघि	https://l.hamropatro.com/r/https://www.onlinekhabar.com/2022/03/1090701	literature
धरानले प्रकाशन गरेको कविता कृति ‘कचहरी’ माथि खोटामा विमर्श	रामधन राई, खोटाङ । धरान प्रज्ञा प्रतिष्ठान धरान उपमहानगरपालिकाले प्रकाशन गरेको कविता कृति ‘कचहरी’माथि खोटाङमा विमर्श गरिएको छ । दिक्तेल रुपाकोट मझुवागढी नगरपालिका–११ खार्मीमा जन्मनुभएका युवा साहित...	newsofnepal.com	२४ घण्टा अघि	https://l.hamropatro.com/r/https://www.newsofnepal.com/2022/03/08/479676/	literature
ध्रुवचन्द्रको ‘ह्याङ्गरमा झुण्डिएको आकाश’ विमोचन	काठमाडौँ — आख्यानकार ध्रुवचन्द्र गौतमको पहिलो कवितासंग्रह ‘ह्याङ्गरमा झुण्डिएको आकाश’को विमोचन गरिएको छ । आइतबार धनगढीमा आयोजित सुदूरपश्चिम साहित्य महोत्सवको अवसरमा कवितासंग्रह विमोचन गरिएको हो । ...	ekantipur.com	२ दिन अघि	https://l.hamropatro.com/r/https://ekantipur.com/literature/2022/03/07/164663105531323886.html	literature
कथाकार पौडेल पुरस्कृत	काठमाडौँ — कथाकार मधुवन पौडेलले लघुकथा समाजले प्रदान गर्ने सावित्री–केशर कथा सम्मान तथा सुरभि साहित्य प्रतिष्ठानले दिने ‘गुरुप्रसाद मैनाली सुरभि साहित्य सम्मान’ प्राप्त गरेका छन् । समाजको कथा सम्म...	ekantipur.com	२ दिन अघि	https://l.hamropatro.com/r/https://ekantipur.com/literature/2022/03/07/164662854878797927.html	literature
अभिवन्द्य : रोदनको रचनात्मक लेखनशैली	नेपाली निबन्ध, नियात्रा, लघुकथा विधालाई पृथक लेखनशैली र शिल्पले सिँगार्दै आएका श्रीओम श्रेष्ठ ‘रोदन’ व्यक्तिचित्र उतार्नमा पनि उत्तिकै दख्खल राख्छन्। यसको सप्रमाण उनको सद्यः प्रकाशित कृति ‘अभिवन्द्...	nepalviews.com	४ दिन अघि	https://l.hamropatro.com/r/https://www.nepalviews.com/2022/03/05/45065/	literature
सबैलाई सँगै घुमाउने ‘आँखाभरि देश मनभरि परिवेश’ 	साहित्यिक पत्रकार नवराज रिजालको नियात्रासंग्रह ‘आँखाभरि देश मनभरि परिवेश’ एउटा महत्त्वपूर्ण नियात्राकृति हो । साहित्यिक पत्रकारितामा निरन्तर क्रियाशील नवराजले साहित्यजगत्मा आफ्नो स्थान बनाउँदै आएका...	baahrakhari.com	४ दिन अघि	https://l.hamropatro.com/r/https://baahrakhari.com/news-details/343330	literature
यसरी बन्न सक्छौँ फूलमा आत्मनिर्भर	फूललाई विषय बनाएर यसको सौन्दर्यतामाथि धेरै कुराहरू लेखिएका छन् । चाहे त्यो गीतमा होस् वा साहित्यमा । यस मानेमा फूलको आयतन निकै फराकिलो देखिन्छ । आमनेपालीको जीवनशैलीमा फूलको साइनो जन्मदेखि मृत्युसम्...	merolifestyle.com	५ दिन अघि	https://l.hamropatro.com/r/https://www.merolifestyle.com/archives/30868	literature
कविताको चिठी	एक सुदूर गाउँबाट  अनपढ आमासँग शब्द सापटी मागेर प्रतियोगितामा पठाउँदै छु यो कविता।   सकभर यो कविता नपढ्नू पढिहाले भने नसम्झनू एक बालक जोतिरहेछ हलो मुखले बोलिरहेछ कविता लक्ष्य राखेको छ महान् ...	setopati.com	५ दिन अघि	https://l.hamropatro.com/r/https://www.setopati.com/literature/263733	literature
मेघराजको ‘दिग्भ्रम’ सार्वजनिक	काठमाडौँ — कवि मेघराज तिम्सिनाले ८० वर्षको उमेरमा पहिलो कविता कृति ‘दिग्भ्रम’ प्रकाशनमा ल्याएका छन् । कविता कृति दमक प्रज्ञा प्रतिष्ठानमा आयोजित एक समारोहमा नेपाल प्रज्ञा प्रतिष्ठानका उपकुलपति जगमा...	ekantipur.com	८ दिन अघि	https://l.hamropatro.com/r/https://ekantipur.com/literature/2022/03/01/164611625295127800.html	literature
उमङ्ग लघुकथा सङ्ग्रह विमोचन	सत्या अधिकारीद्वारा लिखित उमङ्ग लघुकथा सङ्ग्रह विमोचन गरिएको छ । अक्षर धाम नेपालले प्रकाशन गरेको यस कृतिको विमोचन लघुकथा समाज नेपालका केन्द्रीय अध्यक्ष तथा प्रमुख अतिथि श्रीओम श्रेष्ठ रोदन, वरिष्ठ ...	ratopati.com	८ दिन अघि	https://l.hamropatro.com/r/https://ratopati.com/story/223858/2022/3/1/umanga-	literature
लेखनाथ पोखरेलको हाँस्य-निबन्ध ‘चिबे नकटो’ बजारमा	काठमाडौं । स्रष्टा लेखनाथ पोखरेलको हाँस्य-निबन्ध ‘चिबे नकटो’ पाठकमाझ आएको छ । केही समयअघि नियात्रासंग्रह ‘फकलीको गाउँ’ र कथासंग्रह ‘मार्बल हाउसकी शालिनी’ पाठकमाझ ल्याउनुभएका पोखरेलको तेस्रो कृति ‘च...	nepalpress.com	९ दिन अघि	https://l.hamropatro.com/r/https://www.nepalpress.com/2022/02/28/161053/	literature
भीष्मराज फुलाराको उपन्यास ‘वासुदेव’ सार्वजनिक	१६ फागुन, काठमाडौं । कानुन व्यवसायी वासुदेव फुलाराको संघर्ष कथामा आधारित उपन्यास ‘वासुदेव’ सार्वजनिक गरिएको छ । उपन्यासलाई साहित्यकार भीष्मराज फुलाराले लेखेका हुन् । उनी वासुदेवका भाइसमेत हुन् । अ...	onlinekhabar.com	९ दिन अघि	https://l.hamropatro.com/r/https://www.onlinekhabar.com/2022/02/1086521	literature
Shree ३ launching ‘Rust In Dust’ on Shivaratri	KATHMANDU, Feb 27: Shree ३, a skull-busting trio, the brainchild of Sarad Shrestha, a veteran guitarist of the Nepali music realm, is officially launching their second album ‘Rust In Dust’ on March...	english.ratopati.com	१० दिन अघि	http://l.hamropatro.com/r/http://english.ratopati.com/story/23885	literature
तीन साहित्यिक स्रष्टालाई वडाको सम्मान	काठमाडौं । काठमाडौं महानगरपालिका, वडा नं. ४ ले सोही वडामा बसोबास गर्ने नेपाली भाषा, साहित्य, संस्कृतिमा योगदान दिने तीन स्रष्टालाई सम्मान गरेको छ । वडाले कवि बैरागी काँइला, आख्यानकार डा. ध्रुवचन्द्...	baahrakhari.com	१० दिन अघि	https://l.hamropatro.com/r/https://baahrakhari.com/news-details/342777	literature
निबन्ध संग्रह ‘आकाशमुखी’ सार्वजनिक	काठमाडौँ — विश्वका चर्चित निबन्धहरूको नेपालीमा अनुवादित संग्रह ‘आकाशमुखी’ सार्वजनिक भएको छ । पत्रकार तथा लेखक मोहन मैनालीले अनुवाद गरेको कृतिमा १५ वटा निबन्ध संग्रहित छन् । बुकर टी. वासिङ्टन, जर्ज ...	ekantipur.com	१० दिन अघि	https://l.hamropatro.com/r/https://ekantipur.com/news/2022/02/27/164592713956615828.html	literature
