ललितपुरमा एकै परिवारका ५ जनाको मृत्यु हुनुको कारण के हो ?	ललितपुरको कोन्ज्योसोम गाउँपालिका–४ स्थित नल्लुमा २ दिनअघि शिशुको जन्म भएपछि स्याङ्तान परिवारमा खुसी छाएको थियो तर त्यो खुसी लामो समयसम्म टिक्न सकेन । स्याङ्तान परिवारमा खुसी छर्ने शिशु र खुसी मनाउ...	lokaantar.com	७ घण्टा अघि	https://l.hamropatro.com/r/https://lokaantar.com/story/174855/2022/3/8/press/death	popular
यस्ता छन्, पल शाह प्रकरणमा जथाभावी समाचार लेख्दा प्रतिबन्धमा परेका १० वेबसाइट	काठमाडौं । एक १७ वर्षीय नाबालिका गायिकामाथि बलात्कार गरेको अभियोग लागेका अभिनेता पल शाह प्रकरणमा प्रेस काउन्सिल नेपालले १६ युट्युव च्यानलसहित १० ओटा वेबपोर्टललाई समेत कारबाही सिफारिस गरेको थियो । ग...	techpana.com	१८ घण्टा अघि	https://l.hamropatro.com/r/https://www.techpana.com/2022/120721/	technology
लाइसेन्स नलिए नेटफ्लिक्स, अमेजन प्राइम लगायतका ओटीटीमाथि सरकारले प्रतिबन्ध लगाउने 	काठमाडौं । सरकारले नेपालमा नेटफ्लिक्स र अमेजन प्राइमजस्ता ओटीटी (ओभर दी टप) माध्यम बन्द गर्ने कानून बनाएको छ । राष्ट्रिय प्रसारण नियमावली संसोधन गर्दै ओटीटी एपमाथि नियन्त्रण जमाउन खोजिएको हो । यही...	techpana.com	१८ घण्टा अघि	https://l.hamropatro.com/r/https://www.techpana.com/2022/120712/	technology
‘रगतका कथाहरु’ शीर्षकमा सिरिज बनाउँदै डिशहोम	काठमाडौं । ग्राहकका लागि आफ्नै एक्स्लुसिभ च्यानलहरुमार्फत मनोरञ्जनात्मक कार्यक्रम निर्माण तथा प्रसारण गर्दै आएको डिशहोमले ‘रगतका कथाहरु’ शीर्षकमा नयाँ सिरिज निर्माण गर्ने भएको छ । यो सिरिजको पहिलो...	techpana.com	१९ घण्टा अघि	https://l.hamropatro.com/r/https://www.techpana.com/2022/120714/	technology
ग्लोबल आइएमई बैंकको मोबाइल एप ग्लोबल ‘स्मार्ट प्लस’बाट नेपाल आइडलमा भोटिङ गर्न सकिने	ग्लोबल आइएमई बैंक लिमिटेडका ग्राहकहरुले गायन रियालिटी टेलिभिजन कार्यक्रम नेपाल आइडल सिजन–४ का आफूलाई मनपर्ने प्रतियोगीहरुलाई बैंकको मोबाइल एप “ग्लोबल स्मार्ट प्लस” प्रयोग गरी भोट गर्न सक्ने भएका छन...	lokaantar.com	१९ घण्टा अघि	https://l.hamropatro.com/r/https://lokaantar.com/story/174826/2022/3/7/bank-share/globle-ime-bank-	technology
५० बढी विद्यालयमा बेलायती आईटी कोर्ष ‘डिजी स्कुल’	काठमाडौं । विद्यालयमा अध्यनरत विद्यार्थीका लागि तयार गरिएको बेलायतको आईटी कोर्ष ‘डिजी स्कुल’ नेपालका ५० भन्दा बढी विद्यालयमा विस्तार भएको छ । बेलायत सरकार मातहतमा दर्ता भई विद्यालय र उच्च शिक्षा स...	techpana.com	१९ घण्टा अघि	https://l.hamropatro.com/r/https://www.techpana.com/2022/120709/	technology
बुढानिलकण्ठमा डिशहोम फाइबरनेटको सह–वितरण सोरुमको उद्घाटन	नेपालभर डीटीएच र इन्टरनेट सेवा विस्तार गरिरहेको डिशहोम फाइबरनेटले हात्तिगौडा, बुढानिलकण्ठमा पनि सह–वितरण सोरुम सुरु गरेको छ । लक्की ग्यालरीले विगत लामो समयदेखि डिश मिडिया नेटवर्कसँग सहकार्य गरी डि...	shilapatra.com	१९ घण्टा अघि	https://l.hamropatro.com/r/https://shilapatra.com/detail/79157	technology
रेखा थापाको उजुरीपछि युट्युवर पक्राउ	काठमाडौं । युट्युव च्यानलमार्फत व्यक्तिको मानमर्दन र चरित्र हत्या गर्ने गरी भ्रामक समाचार सम्प्रेषण गरेको भन्दै प्रहरीले एक युट्युवरलाई पक्राउ गरेको छ । पक्राउ पर्नेमा ‘सेलेब नेपाल’ नामक च्यानलका ...	techpana.com	२० घण्टा अघि	https://l.hamropatro.com/r/https://www.techpana.com/2022/120703/	technology
मोबाइलमा गेम खेल्न कुन प्रोसेसर राम्रो ?	गणेश सुवेदी /- काठमाडाैं । पछिल्ला केही वर्षलाई हेर्ने हो भने मोबाइल फोन हाम्रो जीवनको अत्यावश्यक वस्तु बनेको छ । कुराकानी गर्नेदेखि लिएर सञ्चार तथा मनोरञ्जनकाे साधन यही मोबाइल बनेकाे छ । त्यसैले...	techpana.com	२१ घण्टा अघि	https://l.hamropatro.com/r/https://www.techpana.com/2022/120686/	technology
फेसबुकमा कुन कुन भिडिओ हेर्नुभयो ? यस्तो छ थाहा पाउने तरिका	काठमाडौं । सामाजिक सञ्जाल फेसबुकका अनेक फिचरमध्ये भिडिओ शेयरिङ पनि एक हो । यसको माध्यमबाट हामी फेसबुकमा भिडिओ अपलोड गर्न सक्छौं । हाल फेसबुकमा ६० मिनेटभन्दा छोटो भिडिओ मात्र अपलोड गर्न सकिन्छ । कह...	techpana.com	२२ घण्टा अघि	https://l.hamropatro.com/r/https://www.techpana.com/2022/120684/	technology
रुसमा टिकटक भिडिओ बनाउन र लाइभमा बस्न प्रतिबन्ध, नेटफ्लिक्स पनि नचल्ने	काठमाडौं । रुस-युक्रेन युद्धले सूचना प्रविधिको बजारमा पनि तरङ्ग आइरहेको छ । हालसम्मको अवस्थालाई हेर्ने हो भने नाम चलेका सामाजिक सञ्जाल र प्रविधि कम्पनीहरु रुसविरुद्ध उभिएका छन् । हालै भिडिओ शेयरिङ...	techpana.com	२३ घण्टा अघि	https://l.hamropatro.com/r/https://www.techpana.com/2022/120677/	technology
पठाउनेलाई थाहै नदिइकन यसरी पढ्नुस् ह्वाट्सएप मेसेज	संसारमा सर्वाधिक लोकप्रिय मेसेजिङ एपको रुपमा रहेको ह्वाट्सएपले प्रयोगकर्ताका लागि निरन्तर नयाँ नयाँ फिचरहरू थप गर्ने गर्दछ । तर ह्वाट्सएपमा पहिलेदेखि नै यस्ता कतिपय गज्जबका फिचर छन् जसका बारेमा निक...	onlinekhabar.com	२३ घण्टा अघि	https://l.hamropatro.com/r/https://www.onlinekhabar.com/2022/03/1090221	technology
नेपाली स्टार्टअप कम्पनी डकसुमोले जुटायो ४३ करोडको ‘सीड फण्ड’, सयौंलाई रोजगारी दिने	काठमाडौं । डकुमेन्ट एआई स्टार्टअप कम्पनी डकसुमोले सीड फण्ड (बीउ पूँजी) को रुपमा ३५ लाख डलर (करिब ४३ करोड १९ लाख लाख रुपैयाँ) जुटाएको छ । वित्तीय सेवा प्रदान गर्ने कम्पनीहरुको काममा अटोमेसनको सेवा ...	techpana.com	२३ घण्टा अघि	https://l.hamropatro.com/r/https://www.techpana.com/2022/120668/	technology
गण्डकी प्रदेशमा पनि इम्बोस्ड नम्बर प्लेट जडान सुरु	पोखरा । गण्डकी प्रदेशमा पनि सवारी साधानमा इम्बोस्ड नम्बर प्लेट जडानको काम सुरु भएको छ । सबै किसिमका सवारीसाधनमा इम्बोस्ड नम्बर प्लेट अनिवार्य गर्दै जाने योजनाअनुसार गण्डकीमा पनि यो प्रणाली कार्यान्...	techpana.com	१ दिन अघि	https://l.hamropatro.com/r/https://www.techpana.com/2022/120664/	technology
CorporatePay Adds Online Registration Features on connectIPS	The CORPORATEPAY system has recently added a new feature in connectIPS where you can send registration requests directly online. Corporates and businesses can now quickly register for the system o...	techsathi.com	१ दिन अघि	https://l.hamropatro.com/r/https://techsathi.com/corporatepay-online-registration	technology
इन्जिनियरका चोटपटक !	औद्योगिक क्रान्ति खासगरी वाष्प इन्जिनको आविष्कारदेखि सुरु भएको यन्त्र तथा विद्युत, इन्टरनेट हुँदै आजको कृत्रिम बौद्धिकताको युगसम्म आइपुगेको छ। यो यात्रामा आधुनिक विज्ञानका सहस्र उपलब्धिहरू मान्छेको...	onlinekhabar.com	१ दिन अघि	https://l.hamropatro.com/r/https://www.onlinekhabar.com/2022/03/1090102	technology
Have you thought about your emotional hunger?	Many people have experienced emotional eating at some point in their lives. You don’t always eat to support what your physical body needs — you feed your emotions. Eating when feeling certain emoti...	english.makalukhabar.com	१ दिन अघि	https://l.hamropatro.com/r/https://english.makalukhabar.com/2022/03/48751/	technology
Realme Buds Air 3 coming to Nepal: Why this earbud heightens your expectation from the brand	Realme Buds Air 3 earbud was released alongside its flagship smartphone Realme GT 2 series recently. Realme Buds Air 3, as the successor of Realme’s Buds Air 2, is expected to arrive in Nepal withi...	english.onlinekhabar.com	१ दिन अघि	https://l.hamropatro.com/r/https://english.onlinekhabar.com/realme-buds-air-3-nepal.html	technology
वन प्लस नर्ड सीई २ फाइभजी नेपालमा सार्वजनिक	काठमाडौं । चिनियाँ मोबाइल कम्पनी वनप्लसले नेपाली बजारमा वनप्लसको नयाँ सिरिज सार्वजनिक गरेको छ । सामाजिक सञ्जाल फेसबुकबाट वनप्लसले वन प्लस नर्ड २ फाइभजी फोन नेपाली बजारमा सार्वजनिक भएको जानकारी दिए...	techpana.com	१ दिन अघि	https://l.hamropatro.com/r/https://www.techpana.com/2022/120648/	technology
ओटीटी एपमाथि सरकारी अङ्कुश, अब १ करोड तिरेर लाइसेन्स लिनुपर्ने	काठमाडौं । सरकारले राष्ट्रिय प्रसारण नियमावली संशोधन गर्दै ओभर दि टप (ओटीटी) सेवालाई नियमनको दायरामा ल्याएको छ । यससँगै अब नेपालमा ओटीटी र भिडिओ अन डिमान्ड (भीओडी) सेवा सञ्चालनका लागि इजाजतपत्र लिन...	techpana.com	१ दिन अघि	https://l.hamropatro.com/r/https://www.techpana.com/2022/120631/	technology
बजेट बाहिरबाट अन्धाधुन्ध खर्च, ७ महिनामा १६ अर्ब रकमान्तर	काठमाडौँ — सरकारले चालु आर्थिक वर्षको पहिलो ७ महिना अवधिमा १६ अर्ब रुपैयाँ भन्दा बढी रकमान्तर, स्राेतान्तर र थप निकासा गरेको छ । अर्थ मन्त्रालयका अनुसार माघ मसान्तसम्ममा १६ अर्ब ५ करोड ७६ लाख रुपैय...	ekantipur.com	१० मिनेट अघि	https://l.hamropatro.com/r/https://ekantipur.com/business/2022/03/08/164672188210742811.html	economics
१०.५२६३ प्रतिशत लाभांश पारित गर्न एनएलजी इन्स्योरेन्सले चैत्र १७ गते बोलायो साधारण सभा, बुकक्लोज कहिले ?	काठमाडौं -एनएलजी इन्स्योरेन्स कम्पनीले वार्षिक साधारण सभा बोलाएको छ । कम्पनीले चैत्र १७ गते बोलाएको हो ।  सभामा कम्पनीले हाल कायम चुक्ता पुँजीको १० प्रतिशत बोनस शेयर र कर प्रयोजनको लागि ०.५२६३ प्र...	ajakoartha.com	१८ मिनेट अघि	http://l.hamropatro.com/r/http://ajakoartha.com/story/69053	economics
फोहोर व्यवस्थापनमा अलमल	अछाम : साँफेबगर अछामको मुख्य व्यापारिक केन्द्र हो। राष्ट्रकै नमुना नगर बनाउने परिकल्पनाका साथ ‘सुन्दर र समृद्ध साँफेबगर बनाऔं’ नारा तय गरिएको छ। साँफेबगर नगरपालिकामा जनप्रतिनिधि आइसकेपछि परिकल्पना ...	annapurnapost.com	२३ मिनेट अघि	https://l.hamropatro.com/r/https://annapurnapost.com/news/197969	economics
कनकाईको अनुदानले कृषिमा आत्मनिर्भर हुँदै स्थानीय	पालिका रिभ्यू : कनकाई नगरपालिका झापा– कृषि क्षेत्र नेपालको अर्थतन्त्रको मेरुदण्ड हो । तीनै तहका सरकारले कृषि क्षेत्रलाई  प्राथमिकतामा राखेका छन् । झापाको कनकाई नगरपालिकाले पनि कृषि क्षेत्रको दिगो ...	palikakhabar.com	२६ मिनेट अघि	https://l.hamropatro.com/r/https://palikakhabar.com/single-news/13966	economics
नारी बचत खातामा सनराइज बैंकले अस्पतालामा डेलिभरी हुँदा १० हजार दिने 	काठमाडौं । सनराइज बैंकले नारी दिवसको अवसरमा पारेर आउँदो चैत १ गतेदेखि ‘नारी बचत खाता’ विशेष अफर ल्याउने भएको छ । बैंकले  महिलाहरूलाई लक्षित गर्दै ‘नारी बचत खाता’मा चैत १ देखि  घातक रोगको बिमा सुविध...	baahrakhari.com	३० मिनेट अघि	https://l.hamropatro.com/r/https://baahrakhari.com/news-details/343633	economics
माछापुच्छ्रे गाउँपालिकामा ७ करोड लगानीमा जेष्ठ नागरिक सेवा केन्द्र	माछापुच्छ्रे : कास्कीको माछापुच्छ्रे गाउँपालिका-१ देउपुजेमा ७ करोड ५३ लाख ७५ हजार लगानीमा जेष्ठ नागरिक सेवा केन्द्र संचालनमा आउने भएको छ। आमास्मृति प्रतिष्ठानको पहलमा सेवा केन्द्र बन्न लागेको हो। ६...	annapurnapost.com	३१ मिनेट अघि	https://l.hamropatro.com/r/https://annapurnapost.com/news/197967	economics
कुवेती दिनार एकको खरिददर ४०४ रुपैयाँ, बहराइन दिनारको ३२५	मंगलबार अमेरिकी डलर एकको खरिददर १२२ रुपैयाँ ८४ पैसा र बिक्रीदर १२३ रुपैयाँ ४४ पैसा कायम छ। युरोपियन युरो एकको खरिददर भने १३३ रुपैयाँ २२ पैसामा कारोबार भइरहेको छ। यसको बिक्रीदर १३३ रुपैयाँ ८७ पैसा प...	setopati.com	३५ मिनेट अघि	https://l.hamropatro.com/r/https://www.setopati.com/kinmel/banking/264052	economics
सुनको मूल्य स्थिर, चाँदीको घट्यो 	आज सुनको मूल्य स्थिर छ। सुनचाँदी व्यवसायी महासंघका अनुसार मंगलबार सुन प्रतितोला एक लाख ३ हजार रुपैयाँमा कारोबार भइरहेको छ।  त्यसैगरी, आज चाँदीको मूल्य प्रतितोला १४ सय १० रुपैयाँ पुगेको छ। अघिल्लो ...	setopati.com	३५ मिनेट अघि	https://l.hamropatro.com/r/https://www.setopati.com/kinmel/jewellery/264049	economics
मेगा म्युचुअल फण्डले नयाँ म्युुचुअल फण्ड सञ्चालनमा ल्याउने, धितोपत्र बोर्डमा दियो निवेदन 	फागुन २४, काठमाडौं । मेगा म्युचुअल फण्डले नयाँ म्युचुअल फण्ड सञ्चालनमा ल्याउने भएको छ । फण्डले मेगा म्युचुअल फण्ड- २ नामक म्युुचअल फण्ड सञ्चालनमा ल्याउन लागेको हो । फण्डले १० करोड इकाई निष्कासन गर...	abhiyandaily.com	३८ मिनेट अघि	https://l.hamropatro.com/r/https://abhiyandaily.com/newscategory-detail/404229	economics
आज बुद्ध एयरले २५ सय यात्रुलाई महिला लेखिकाका पुस्तक उपहार दिने	निजी क्षेत्रको हवाइ सेवा प्रदायक कम्पनी बुद्ध एयरले अन्तर्राष्ट्रिय महिला दिवसको अवसरमा यात्रुहरुलाई उपहारस्वरुप पुस्तक दिने भएको छ।  कम्पनीले काठमाडौं विमानस्थलबाट यात्रा गर्ने पहिलो २५ सय यात्रु...	nepalkhabar.com	३८ मिनेट अघि	https://l.hamropatro.com/r/https://nepalkhabar.com/economy/122954-2022-3-8-11-20-28	economics
आज प्रतितोला एक लाख ३ हजारमा कारोबार हुँदै सुन, चाँदी घट्यो	काठमाडौं - आज मंगलबार नेपाली बजारमा सुनको मूल्य स्थिर रहेको छ ।  हिजो सोमबार प्रतितोला एक लाख ३ हजार रुपैयाँमा कारोबार भएको सुनको मूल्य आज मंगलबार पनि प्रतितोला सोही मूल्यमा कारोबार हुने सुनचाँदी ...	ajakoartha.com	४० मिनेट अघि	http://l.hamropatro.com/r/http://ajakoartha.com/story/69051	economics
पुलुमा सधैं खाद्यान्न अभाव	मुगु — मुगुमकार्मारोङ गाउँपालिकास्थित पुलु खाद्य डिपो झन्डै ८ महिनादेखि रित्तै छ । आदिवासी जनजातिको बाहुल्य रहेको पालिकामा खाद्य डिपो रित्तो हुँदा स्थानीयले ल्होसारमा पनि चामल पाएनन् । पुलुमा बर्से...	ekantipur.com	४६ मिनेट अघि	https://l.hamropatro.com/r/https://ekantipur.com/pradesh-6/2022/03/08/164670723990637900.html	economics
नेपाल बैंकद्वारा महिला लक्षित इन्स्योरेन्स सुबिधासहितको नयाँ निक्षेप खाता संचालन	काठमाडौँ । नेपाल बैंकले अन्तराष्ट्रिय नारी दिवसका अवसरमा महिलालाई लक्षित गरि विभिन्न बैंकिङ तथा ईन्स्योरेन्स सुुविधा सहितको नयाँ निक्षेप खाता ‘समृद्व नारी रिकरि निक्षेप खाता’ संचालनमा ल्याएको छ ।  ...	corporatenepal.com	५३ मिनेट अघि	https://l.hamropatro.com/r/https://www.corporatenepal.com/news/detail/217021	economics
