ललितपुरमा एकै परिवारका ५ जनाको मृत्यु हुनुको कारण के हो ?	ललितपुरको कोन्ज्योसोम गाउँपालिका–४ स्थित नल्लुमा २ दिनअघि शिशुको जन्म भएपछि स्याङ्तान परिवारमा खुसी छाएको थियो तर त्यो खुसी लामो समयसम्म टिक्न सकेन । स्याङ्तान परिवारमा खुसी छर्ने शिशु र खुसी मनाउ...	lokaantar.com	७ घण्टा अघि	https://l.hamropatro.com/r/https://lokaantar.com/story/174855/2022/3/8/press/death	popular
‘२ नम्बरी’को छायांकनका लागि नेपाल आइन् भुटानी अभिनेत्री उगेन	२४ फागुन, काठमाडौं । फिल्म ‘२ नम्बरी’को छायांकनका लागि भुटानी अभिनेत्री उगेन छोदेन नेपाल आएकी छिन् । चैत १ गतेबाट छायांकन हुने यो फिल्मका लागि उनी नेपाल आएकी हुन् । दीपेन्द्र लामाको निर्देशनमा बन्...	onlinekhabar.com	४९ मिनेट अघि	https://l.hamropatro.com/r/https://www.onlinekhabar.com/2022/03/1090599	entertainment
‘हर्ट अफ स्टोन’बाट हलिउडमा डेब्यु गर्दै आलिया	२४ फागुन, काठमाडौं । बलिउड अभिनेत्री आलिया भट्ट फिल्म ‘गंगुबाई काठियावाडी’बाट थप चर्चामा छिन् । यो फिल्मले भारतीय बक्स अफिसमा १०० करोडको व्यापारिक आँकडा पार गरिसकेको छ । आलिया अब हिन्दी फिल्मका दर...	onlinekhabar.com	१ घण्टा अघि	https://l.hamropatro.com/r/https://www.onlinekhabar.com/2022/03/1090592	entertainment
२४ फिल्म छाडेकी भूमि	मुम्बई : सन् २०१५ मा ‘दम लगा के हइसा’बाट भूमि पेडनेकरले बलिउडको रंगीन पर्दामा पाइला राखेकी हुन्। यही चलचित्रबाट उनले उत्कृष्ट डेब्यु अभिनेत्रीको अवार्ड पनि पाएकी थिइन्। अभिनयमा हामफाल्नु अघि उनले य...	annapurnapost.com	१ घण्टा अघि	https://l.hamropatro.com/r/https://annapurnapost.com/news/197963	entertainment
महिला दिवसका दिन अभिनेत्री रेखा थापा भन्छिन् : पुरुषलाई पनि पीडा छ	आज ११२औं अन्तर्राष्ट्रिय महिला दिवस, विश्वभर महिला अधिकारको आवाज उठाउँदै मनाइँदै छ।   यस अवसरमा नेपालमा पनि महिलाविरुद्ध हुने भेदभाव, हिंसाको विरोध गर्दै विभिन्न कार्यक्रम गरिँदै छ।  यसै सन्दर्भम...	nepalkhabar.com	१ घण्टा अघि	https://l.hamropatro.com/r/https://nepalkhabar.com/society/122951-2022-3-8-10-50-43	entertainment
अन्तर्राष्ट्रिय नारी दिवसका अवसरमा साइकल र्‍याली (तस्बिरहरू)	काठमाडौं । ११२औँ अन्तर्राष्ट्रिय नारी दिवसका अवसरमा मंगलबार ललितपुरमा साइकल र्‍याली आयोजना गरिएको छ । ललितपुर महानगरपालिका, रोटरी क्लब र नेपाल साइकल सोसाइटीको संयुक्त आयोजनामा जावलाखेल चोकदेखि मंग...	baahrakhari.com	२ घण्टा अघि	https://l.hamropatro.com/r/https://baahrakhari.com/news-details/343625	entertainment
ऊ नारी	नारी सृष्टिको एक सुन्दर संरचना नारी मायाकी खानी, करुणाकी रानी नारी जान्दछिन् माया, ममता र स्नेह गर्न  दुःखमा चुहाउँछिन् दुई थोपा आँसु  क्षणभरको सुखमा पनि हुन्छिन् खुसी भुल्छिन् सबै दुःखकष्ट घ...	setopati.com	२ घण्टा अघि	https://l.hamropatro.com/r/https://www.setopati.com/literature/264041	entertainment
ढाका टोपीमा सजिए अमिताभ बच्चन	काठमाडौं– बलिउड अभिनेता अमिताभ बच्चनले आफ्नो आगामी फिल्मको छायांकनमा नेपाली ढाका टोपी लगाएको तस्बिर अहिले चर्चामा आएको छ। बच्चनले नेपालमा समेत छायांकन भएको मित्रताको कथा बोक्ने फिल्म ‘उचाईं’को छाया...	nepallive.com	२ घण्टा अघि	https://l.hamropatro.com/r/https://nepallive.com/story/274785	entertainment
निर्देशनमा फ्लप यी अभिनेता	काठमाडौं। बलिउडमा सफल कलाकारलाई निर्देशकको कुर्सीमा बस्ने ठूलो चाहना हुन्छ। गुरु दत्त र राज कपूरलाई आफ्नो ‘आइडल’ मान्नेवाला कलाकार जब अभिनेताका रुपमा सफलता हासिल गर्छन्, त्यतिबेला उनीहरु निर्देशनमा...	dcnepal.com	२ घण्टा अघि	https://l.hamropatro.com/r/https://www.dcnepal.com/2022/03/337206/	entertainment
‘कब्बड्डी ४ : द फाइनल म्याच’को गीत ‘केशरी’ सार्वजनिक	काठमाडौं– रामबाबु गुरुङको निर्देशनमा बनेको फिल्म ‘कब्बड्डी ४ : द फाइनल म्याच’को गीत ‘केशरी’ सार्वजनिक भएको छ। सोमबार उक्त फिल्मको गीत सार्वजनिक भएको हो।   गीतमा स्वर तथा संगीत एसडी योगीले गरेका छन...	nepallive.com	२ घण्टा अघि	https://l.hamropatro.com/r/https://nepallive.com/story/274786	entertainment
Tista Prasai Joshi: Becoming a role model that she sought in other women in childhood	Children aspire to be like their role models. But, Tista Prasai Joshi in her childhood could not find any role model. For girls to have a strong role model in their gender was so rare then. But, t...	english.onlinekhabar.com	३ घण्टा अघि	https://l.hamropatro.com/r/https://english.onlinekhabar.com/tista-prasai-joshi-nepal-women.html	entertainment
पुरुषहरूको दुःख घटाउन योद्धा छोरी जन्मिनुपर्छ : रेखा थापा	आज विश्वभर ११२ औँ अन्तर्राष्ट्रिय महिला दिवस विविध कार्यक्रम गरी मनाइँदैछ । यसपालि नेपालमा ‘सामाजिक न्याय र लैङ्गिक समानता : दिगो विकासको सुनिश्चितता’ भन्ने नाराका साथ दिवस मनाइँदैछ ।  महिला दिवसक...	farakdhar.com	३ घण्टा अघि	https://l.hamropatro.com/r/https://farakdhar.com/story/77600	entertainment
हलिउड फिल्म खेल्दै आलिया	काठमाडौँ — बलिउड अभिनेत्री आलिया भट्टले हलिउड फिल्म खेल्ने भएकी छन् । नेटफ्लिक्सको आगामी स्पाई थ्रिलरमा आलिया गल गडोट र जेमी डोर्रनानसँगै देखिनेछिन् । अन्तर्राष्ट्रिय सञ्चारमाध्यमहरुले जनाए अनुसार...	ekantipur.com	३ घण्टा अघि	https://l.hamropatro.com/r/https://ekantipur.com/entertainment/2022/03/08/164671056191059354.html	entertainment
हामीमाथि अझै लाञ्छना लाग्छ, तर बोल्न नछोडौं	हरेक साँझ प्रौढ शिक्षा पढाएर फर्किएपछि मेरी आमा लालटिनको धीमा उज्यालोमा केही न केही लेख्थिन् । आमाले लेखेका कुरा भोलि उठेर पढ्छु भनेर गम्दागम्दै आमाकै खोकिलोमा भुसुक्कै निदाउँथे म । तर भोलिपल्ट आमा...	onlinekhabar.com	५ घण्टा अघि	https://l.hamropatro.com/r/https://www.onlinekhabar.com/2022/03/1090481	entertainment
महिला प्रधान फिल्म किन बन्दैनन् ?	काठमाडौं – निर्देशक शिव रेग्मी(हाल दिवंगत) निर्देशित फिल्म हेर्न जाँदा ‘महिला दर्शक रुमाल बोकेर जान्थे’ भन्ने किस्सा कुनै बेला नेपाली फिल्म वृत्तमा खुबै चलेको थियो। किनकि आफैं फिल्म लेखक भएकाले पनि...	khabarhub.com	६ घण्टा अघि	https://l.hamropatro.com/r/https://www.khabarhub.com/2022/08/358743/	entertainment
नेपाललाई खेलकुदबाट चिनाउने पाँच महिला खेलाडी	काठमाडौं – आज मार्च आठ, अर्थात अन्तर्राष्ट्रिय नारी दिवस। आमाको काख, दिदी बहिनीको स्नेह अझ भनौं नारी पात्रको प्रगाढ माया भित्रनै एउटा पुरुषको अवयवहरु चलायमान हुन्छन्।	khabarhub.com	६ घण्टा अघि	https://l.hamropatro.com/r/https://www.khabarhub.com/2022/08/358737/	entertainment
सिनेमाले सिकायो सृष्टिलाई प्रतिस्थापन कला	काठमाडौं । अभिनेतृ सृष्टि श्रेष्ठलाई चित्रकला निकै मन पर्छ । पेन्टिङ गर्न भनेपछि बाल्यकालदेखि नै हुरुक्कै यी नायिकाले चलचित्रमै काम गर्दा चित्रकला सिक्न पाइन् । उनले तीन वर्षअघि रिलिज ‘रोमियो एन्ड ...	rajdhanidaily.com	७ घण्टा अघि	https://l.hamropatro.com/r/https://rajdhanidaily.com/id/57725/	entertainment
एकै थलोमा ४० युवाले लोपोन्मुख सिँगारु नाँचमा	सुर्खेत । स्थानीय ४० युवाले एकै थलोमा लोपोन्मुख सिँगारु नाच प्रशिक्षण लिएका छन् । नेपाल संगीत तथा नाट्य प्रज्ञा प्रतिष्ठान नृत्य विभागले सुर्खेत सिम्टामा आयोजना गरेको ‘चार दिवसीय सिँगारु नाच कार्यश...	rajdhanidaily.com	७ घण्टा अघि	https://l.hamropatro.com/r/https://rajdhanidaily.com/id/57720/	entertainment
‘केशरी’मा सौगात र मिरुनाको केमेस्ट्री	काठमाडौं । प्रदर्शनको तयारी रहेको चलचित्र ‘कबड्डी ४’को गीत सार्वजनिक भएको छ । सोमबार सार्वजनिक भएको ‘केशरी’ बोलको गीतमा चलचित्रमा मुख्य कलाकारद्वय सौगात मल्ल र मिरुना मगर र दयाहाङ राई फिचर्ड छन् । ...	baahrakhari.com	१४ घण्टा अघि	https://l.hamropatro.com/r/https://baahrakhari.com/news-details/343600	entertainment
हेटौंडामा नेपाली भाषा,साहित्यको बहस गर्दै सकियो बृहत् साहित्य महोत्सव	बागमती प्रदेशको राजधानी हेटौंडामा भएको दुईदिने बृहत् साहित्य महोत्सवको समापन भएको छ । मकवानपुरे महिला साहित्यकारको एकमात्र संस्था आँचल साहित्य कला पुञ्जले फागुन २० र २१ गते हेटौंडामा बृहत् साहित्य ...	farakdhar.com	१५ घण्टा अघि	https://l.hamropatro.com/r/https://farakdhar.com/story/77582	entertainment
(भिडियो) मिरुनालाई फकाउँदै सौगात भन्छन्- ‘तपाईं मेरो अन्तिम लभ’	रामबाबु गुरुङ निर्देशित फिल्म ‘कबड्डी ४: द फाइनल म्याच’को पहिलो गीत सार्वजनिक गरिएको छ । यसअघिका फिल्म ‘कबड्डी’का तीन सिक्वेल बक्सअफिसमा ब्लकबस्टर सावित भएका थिए । बहुप्रतिक्षित फिल्म ‘कबड्डी ४’ क...	nepalghatana.com	१६ घण्टा अघि	https://l.hamropatro.com/r/https://www.nepalghatana.com/news/94335/	entertainment
युट्युब च्यानलका लागि छुट्टै निर्देशिका बन्दै	‘युट्युब दर्ता गर्न पाँच लाख रुपैयाँ’ चाहिने खबरले बजार तताइरहेको छ । आगामी दिनमा पाँच लाख रुपैयाँ तिरेर युट्युब च्यानल दर्ता गर्नुपर्छ ? भन्ने जिज्ञासा धेरैले व्यक्त गरिरहेका छन् । युट्युब दर्ता ...	merolifestyle.com	१७ घण्टा अघि	https://l.hamropatro.com/r/https://www.merolifestyle.com/archives/31536	entertainment
दोश्रो लिस्तीकोट दुगुनागढी माउन्टेन ट्रेल रेस सम्पन्न	दोश्रो लिस्तीकोट दुगुनागढी माउन्टेन ट्रेल रेस सम्पन्न भएको छ । सेना दिवसको अवसरमा सिन्धुपाल्चोकको  तैनाथ श्री गोरख बक्स गणले आयोजना गरेको प्रतियोगिता शनिबार सम्पन्न भएको हो । प्रतियोगितामा १०१ जना...	ratopati.com	१७ घण्टा अघि	https://l.hamropatro.com/r/https://ratopati.com/story/225094/2022/3/7/race	entertainment
डाबर भाटिका नेचुरल्स सेम्पूको नयाँ रेन्ज सार्वजनिक	काठमाडौँ । डाबर नेपालले डाबर भाटिका नेचुरल्स सेम्पूको नयाँ रेन्ज हायाट प्लेस्, एक कार्यक्रममा सार्वजनिक गरेको छ । यो ब्राण्डको अनावरण डाबर भाटिका नेचुरल्स सेम्पूको सेलिब्रिटि ब्राण्ड एम्बासडर स्वस्...	kharibot.com	१७ घण्टा अघि	https://l.hamropatro.com/r/https://kharibot.com/news-details/101052/2022-03-07	entertainment
कबड्डीको ‘केशरी’ बोलको गीति रिलिज	काठमाडौ, फागुन २३ : कबड्डी ‘द फाइनल म्याच’ को पहिलो गीत रिलिज ‘केशरी’ भएको छ ।  सोमबार (आज) सुष्मा प्रोडक्सन ग्लोबल नामक युट्युब च्यानलमार्फत सार्वजनिक भएको हो । उक्त गीतमा शब्दराम अबिरल विष्टको र...	kathmandupress.com	१७ घण्टा अघि	https://l.hamropatro.com/r/https://kathmandupress.com/news/59771	entertainment
डाबर नेपालले सार्वजनिक गर्‍यो 'डाबर बाटिका न्याचुरल स्याम्पू'	डाबर नेपालले डाबर बाटिका न्याचुरल स्याम्पूको नयाँ रेन्ज सार्वजनिक गरेको छ। यो ब्रान्डको अनावरण डाबर बाटिका न्याचुरल स्याम्पूको सेलिब्रिटि सद्भावना दुत स्वस्तिमा खड्काको साथै डाबर नेपालका व्यापार प्...	setopati.com	१७ घण्टा अघि	https://l.hamropatro.com/r/https://www.setopati.com/kinmel/business/264011	entertainment
सुन्दर र स्टाइलिस देखिन चाहनुहुन्छ ? यस्तो पाइन्ट छान्नुहोस्	जिन्सको नाम सुन्दा आराम, स्टाइल र टिकाउ जस्ता शब्दहरू दिमागमा आउँछ । सबैको दराजमा एक जोडी वा त्योभन्दा बढी जिन्सहरू त हुन्छ नै । आज हामी केही जिन्सको बारेमा बताउन गइरहेका छौँ जुन लगाउँदा तपाईं एकदम...	merolifestyle.com	१७ घण्टा अघि	https://l.hamropatro.com/r/https://www.merolifestyle.com/archives/31515	entertainment
सुमनले छाडे नेपाल पुलिस क्लब	फरवार्ड सुमन लामाले विभागीय टोली नेपाल पुलिस क्लब छाडेका छन् । नेपाल राष्ट्रिय फुटबल टोलीका सदस्यसमेत रहेका सुमनले सहिद स्मारक ए डिभिजन लिगलगत्तै क्लब छाड्ने निर्णय गरेको र प्रक्रियासमेत पूरा भएको ...	ratopati.com	९ मिनेट अघि	https://l.hamropatro.com/r/https://ratopati.com/story/225192/2022/3/8/suman-	sports
ब्याटिङमा नेपालको निकै खराब सुरुवात	मंगलबार, फागुन २४, २०७८ काठमाडौं (हाम्रो खेलकुद) – श्रीलंका भ्रमणमा रहेको नेपालले दोस्रो अभ्यास खेलमा श्रीलंका नेभीविरुद्ध निकै खराब ब्याटिङ सुरुवात गरेको छ । टस हारेर ब्याटिङ थालेको नेपालले ११.४...	hamrokhelkud.com	३८ मिनेट अघि	https://l.hamropatro.com/r/https://www.hamrokhelkud.com/cricket/106439.html	sports
सूर्य नेपाल गल्फ आजदेखि	काठमाडौं : सूर्य नेपाल गल्फ टुरको चौथो प्रतियोगिता सूर्य नेपाल गल्फ मंगलबारदेखि सुरु हुने भएको छ। रोयल नेपाल गल्फ क्लबमा तीन दिनसम्म सञ्चालन हुने प्रतियोगितामा १६ व्यवसायिक गल्फरको सहभागिता रहने छ।...	annapurnapost.com	१ घण्टा अघि	https://l.hamropatro.com/r/https://annapurnapost.com/news/197964	sports
खप्तड गोल्डकपः आज मछिन्द्र र बागमती भिड्दै	धनगढी, २४ फागुन । खप्तड गोल्डकप फुटबल प्रतियोगितामा आज (मंगलबार) एक खेल हुँदैछ । धनगढी रंगशालामा हुने क्वाटरफाइनल खेलमा मछिन्द्र फुटबल क्लब र बागमती युथ क्लबबीच प्रतिस्पर्धा हुनेछ । खेल दिउँसो ३ ब...	reportersnepal.com	१ घण्टा अघि	https://l.hamropatro.com/r/https://www.reportersnepal.com/2022/03/657378	sports
एएसबिसी एसियन युथ च्याम्पियनसिपमा नेपालको चुनौती समाप्त	जोर्डनको अम्मानमा जारी एएसबिसी एसियन युथ बक्सिङ च्याम्पियनसिपमा नेपालका इन्द्रबहादुर सुनार पराजित भएका छन् । पुरुष ६० केजीतर्फ क्वार्टरफाइनलअन्तर्गत सोमबार राति भएको खेलमा इन्द्र कीर्गिस्तानका ओरो...	farakdhar.com	१ घण्टा अघि	https://l.hamropatro.com/r/https://farakdhar.com/story/77606	sports
टाइगर कप भलिबलको खर्च विवरण सार्वजनिक	कास्कीको पोखरामा भएको दोस्रो संकरणको टाइगर कप आमन्त्रि क्लब महिला तथा पुरुष भलिबल प्रतियोगितााको खर्च विवरण सार्वजनिक गरिएको छ ।  टाइगर ग्रुप अप पोखराको आयोजनामा भएको प्रतियोगिता पुस २६ गतेदेखि मा...	neplays.com	१ घण्टा अघि	https://l.hamropatro.com/r/https://www.neplays.com/archives/128443	sports
