श्रीलंकाका राष्ट्रपति राजापाक्षे देश छाडेर भागे	२९ असार, काठमाडौं । श्रीलंकाका राष्ट्रपति गोटाबाया राजपाक्षे देश छाडेर भागेका छन् । प्रदर्शनकारीले राष्ट्रपति निवास कब्जा गरेपछि राष्ट्रपति राजपक्षे केही दिनदेखि देश छाडेर भाग्न प्रयासरत थिए । देश ...	onlinekhabar.com	३ घण्टा अघि	https://l.hamropatro.com/r/https://www.onlinekhabar.com/2022/07/1156790	popular	0
साउथ चाइना सी : चीनलाई अमेरिकाको चेतावनी-फिलिपिन्सको जल क्षेत्रमा आक्रमण भए रक्षा गर्न बाध्य हुन्छौँ 	मनिला । अमेरिकी विदेशमन्त्री एन्टोनी ब्लिन्केनले साउथ चाइना सीका भूभागमाथि बेइजिङको दाबी अवैध ठहर गरिएको सन् २०१६ कोे मध्यस्थता निर्णय पालना गर्न चीनलाई आह्वान गरेका छन् ।  विदेशमन्त्री ब्लिन्केनल...	baahrakhari.com	९ घण्टा अघि	https://l.hamropatro.com/r/https://baahrakhari.com/news-details/357147	popular	0
केटी साथीलाई आँखा लगाएको भन्दै छुरा प्रहार	काठमाडौँको कागेश्वरी मनोहरा नगरपालिका–५ थलीमा युवकमाथि छुरा प्रहार भएको छ । असार २५ मा राति थली स्थित पिपलबोटमा सिन्धुपाल्चोकको साँगाचोकगढी नगरपालिका घर भएका राजन श्रेष्ठलाई छुरा प्रहार गरेको आरोपम...	ratopati.com	११ घण्टा अघि	https://l.hamropatro.com/r/https://ratopati.com/story/251212/2022/7/12/chura-prahar	popular	0
भारतको नयाँ संसद भवनमाथि ‘हिंस्रक सिंह’ !	नयाँ दिल्ली । भारतका प्रधानमन्त्री नरेन्द्र मोदीले एक समारोहबीच भारतको नयाँ संसद भवनको माथिल्लो भागमा राखिएको काँसबाट बनेको मुलुकको राष्ट्रिय प्रतीकको अनावरण गरेका छन् ।  साढे छ मिटर अग्लो यस प्रत...	baahrakhari.com	१० घण्टा अघि	https://l.hamropatro.com/r/https://baahrakhari.com/news-details/357145	popular	2
देशै छाडेर भाग्न खोज्ने राष्ट्रपतिको प्रयास असफल	कोलम्बो । राष्ट्रपति पदबाट बुधबार राजीनामा दिने बताउँदै आएका संकटग्रस्त श्रीलंकाका राष्ट्रपति गोताबाय राजापाक्षेले सोमबार राति नै देश छाडेर दुबई भाग्ने प्रयास गरेको खुलासा भएको छ । यद्यपि, उनको सो...	rajdhanidaily.com	४ घण्टा अघि	https://l.hamropatro.com/r/https://rajdhanidaily.com/id/65947/	popular	0
दुर्व्यवहारको आरोप लागेपछि राममणि क्याम्पसका शिक्षक निलम्बित	रुपन्देहीको तिलोत्तमा नगरपालिकास्थित राममणि बहुमुखी क्याम्पसका विज्ञान तथा प्रविधि सङ्कायमा अध्यापन गराउने शिक्षकलाई निलम्बन गरिएको छ । छात्रालाई दुर्व्यवहार गरेको आरोप लागेपछि शिक्षक केशव ढुङ्गाना...	ratopati.com	९ घण्टा अघि	https://l.hamropatro.com/r/https://ratopati.com/story/251223/2022/7/12/rammani-campus-	popular	0
जसपा फुटको संघारमाः वीरगंजमा उपेन्द्र पक्षको केन्द्रीय कमिटी, को को हुँदैछन् सहभागी?	वीरगंजः जनता समाजवादी पार्टी (जसपा) फुटको संघरमा पुगेको छ। पार्टी अध्यक्षद्वय उपेन्द्र यादव र बाबुराम भट्टराईबीच तालमेल नमिलेपछि पार्टी फुटको सघारमा पुगेको हो। भट्टराई पक्षले केन्द्रीय समिति बैठक म...	pahilopost.com	९ घण्टा अघि	https://l.hamropatro.com/r/https://pahilopost.com/content/20220712232444.html	popular	1
संसदमा बल्ल तात्यो एमाले	२८ असार, काठमाडौं । कार्यकाल सकिने बेलामा नेकपा एमालेले संसदमा आफ्नो उपस्थिति बलियो बनाउन थालेको छ । एमाले अध्यक्षसमेत रहेका तत्कालीन प्रधानमन्त्री केपी शर्मा ओलीले विघटन गरेको प्रतिनिधि सभा सर्वोच...	onlinekhabar.com	१२ घण्टा अघि	https://l.hamropatro.com/r/https://www.onlinekhabar.com/2022/07/1156738	popular	1
'काम गर्न देऊ' भनेर किन डिलिट गरे मेयर बालेन्द्रले?	काठमाडौं महानगरपालिकाका मेयर बालेन्द्र शाहले सामाजिक सञ्जालमा लेखेको एउटा स्टाटस हटाएका छन्। पछिल्लो समय अनक आलोचना खेपिरहेका मेयर बालेन्द्रले सोमबार राति फेसबुक पेजमा एउटा विचार समेटिएको स्टाटस ल...	nepalkhabar.com	९ घण्टा अघि	https://l.hamropatro.com/r/https://nepalkhabar.com/society/136886-2022-7-12-22-27-59	popular	0
प्रतिकिलो एक सय रूपैयाँभन्दा बढीले घट्यो कुखुराको मासु	कुखुराको मासु एक महिनाको बीचमा प्रतिकिलो एक सय रूपैयाँभन्दा बढीले घटेको छ। एक महिना अघि प्रतिकिलो चार सय ५० रूपैयाँमा बिक्री भएको मासु हाल तीन सय ४५ रूपैयाँमा बिक्री भइरहेको कुखुरा व्यवसायी संघका ...	setopati.com	१४ घण्टा अघि	https://l.hamropatro.com/r/https://www.setopati.com/kinmel/business/276658	popular	0
अर्थले कसरी दिन सक्ला सीसीटीभी फुटेज ?	काठमाडौं । निवर्तमान अर्थमन्त्री जनार्दन शर्माले बजेट निर्माण प्रक्रियामा अनधिकृत व्यक्तिको प्रवेश गराई करको दर हेरफेर गरेको विषयमा छानबिन गर्न गठित संसदीय विशेष समितिले अर्थ मन्त्रालयसँग सीसीटीभी ...	rajdhanidaily.com	४ घण्टा अघि	https://l.hamropatro.com/r/https://rajdhanidaily.com/id/65943/	popular	2
हतियार खरिद विवादमा प्रहरी भन्छ : जतिसुकै छानबिन गरे हुन्छ, तर खरिद नरोकियोस्	भीआईपीको सुरक्षामा १२ सय पेस्तोल, दंगा नियन्त्रणमा साढे ४५ करोड रुपैयाँ माग नेपाल प्रहरीको हतियार खरिद प्रक्रिया विवादमा तानिएको छ। प्रहरीको मानव स्रोत एवं प्रशासन विभागले (चलानी नं ३१५) २०७८ फागु...	nepalkhabar.com	९ घण्टा अघि	https://l.hamropatro.com/r/https://nepalkhabar.com/society/136887-2022-7-12-22-33-17	popular	0
उपेन्द्रमाथि बाबुरामको आरोपै आरोप	काठमाडौं । सत्तारूढ जनता समाजवादी पार्टी नेपाल (जसपा) संघीय परिषद्का अध्यक्ष डा. बाबुराम भट्टराईले केन्द्रीय समितिका अध्यक्ष उपेन्द्र यादवले एकलौटी र स्वेच्छाचारी प्रवृत्ति देखाएको आरोप लगाएका छन् ...	rajdhanidaily.com	३ घण्टा अघि	https://l.hamropatro.com/r/https://rajdhanidaily.com/id/65948/	popular	0
श्रीलंकाका राष्ट्रपति गोटाबाय राजापाक्षेले छाडे देश	श्रीलंकाका राष्ट्रपतिले देश छाडेका छन् । श्रीलंकाको आर्थिक संकटलाई लिएर व्यापक प्रदर्शन भइरहेका बेला राष्ट्रपति गोटाबाया राजापाक्षे बुधबार बिहान सेनाको एउटा विमानमा चढेर देश छाडेका छन् ।  ७३ वर्षी...	ratopati.com	२ घण्टा अघि	https://l.hamropatro.com/r/https://ratopati.com/story/251241/2022/7/13/srilanka	popular	0
भारतको राष्ट्रपतीय निर्वाचनमा शिव सेनाले मुर्मूलाई सघाउने	भारतमा हुन लागेको राष्ट्रपतीय निर्वाचनमा शिव सेनाले राष्ट्रपतिकी उम्मेदवार द्रौपदी मुर्मूलाई सघाउने भएको छ । प्रभावशाली राजनीतिज्ञ उद्धव ठाकरेले नेतृत्व गरेको पार्टीले भारतीय जनता पार्टी नेतृत्वको ...	ratopati.com	११ घण्टा अघि	https://l.hamropatro.com/r/https://ratopati.com/story/251218/2022/7/12/draupati-	popular	0
एमालेसँग जोेडिएको भन्दै विवादमा गभर्नर अधिकारी	काठमाडौँ – एमाले निकट रहेको दाबी गरिँदै आएका गभर्नर महाप्रसाद अधिकारी औपचारिक रुपमै पार्टीसँग आबद्ध रहेको भन्दै विवादमा तानिएका छन्। कुनै पनि सार्वजनिक पदमा रहँदा दलमा आबद्ध हुन र सक्रिय राजनीतिमा...	deshsanchar.com	१० घण्टा अघि	https://l.hamropatro.com/r/https://deshsanchar.com/2022/07/12/678411/	popular	0
राजस्व सचिवको विदेश सयर	आर्थिक वर्षको अन्तिम समयमा लक्षित राजस्व फेला पार्न दिनरात खटिनुपर्नेमा राजस्व सचिव कृष्णहरि पुस्कर एक साता लामो विदेश सयर गरेर फर्केका छन्। सरकारले चालु आर्थिक वर्षमा राखेको राजस्व असुलीको लक्ष्य ...	ratopati.com	३ घण्टा अघि	https://l.hamropatro.com/r/https://ratopati.com/story/251226/2022/7/13/krishna-hari-pushkar-	popular	0
सैन्य विमान चढेर श्रीलंकाका राष्ट्रपति राजापाक्षेले देश छोडे	श्रीलंकाका राष्ट्रपति गोटाबाया राजापाक्षेले देश छोडेका छन्।  कार्यालय र निवास समेत सर्वसाधारणले कब्जामा लिएपछि श्रीलंकामै लुकेर बसिरहेका राष्ट्रपति राजापाक्षे गएराति सैन्य विमानमा मुलुक छोडेर भागे...	setopati.com	२ घण्टा अघि	https://l.hamropatro.com/r/https://www.setopati.com/politics/276681	popular	0
एमालेको अर्थ विभागका एम अधिकारी को हुन् ?	२८ असार, काठमाडौं । मंगलबार नेकपा एमालेले जारी गरेको अन्तरपार्टी निर्देशन (अपनि) मा अर्थ तथा योजना विभाग सदस्यमा ‘एम. अधिकारी, खोटाङ’ को नाम देखेपछि नेपाल राष्ट्र बैंकभित्र खैलाबैला भयो । गभर्नर म...	onlinekhabar.com	११ घण्टा अघि	https://l.hamropatro.com/r/https://www.onlinekhabar.com/2022/07/1156755	popular	1
सडकदेखि सदनसम्मै मास्कविहीन, विज्ञ भन्छन्– अति गरे खती हुन्छ !	काठमाडौं । मास्कविहीन सदन । संसद भवनमा बिना मास्क प्रवेश अनुमति दिइँदैन, तर संसद बैठक चलिरहँदा अधिकांश सांसदको मुखमा मास्क देखिँदैन ।  कंग्रेस पार्टी कार्यालय सानेपामा सोमबार र मंगलबार दिनभर केन्द...	baahrakhari.com	३ घण्टा अघि	https://l.hamropatro.com/r/https://baahrakhari.com/news-details/357131	popular	0
भारतमा सिमेन्ट निर्यात गर्न तयार अर्घाखाँची उद्योग, पर्खाइ कार्यविधिको	उत्पादन मितिदेखि नै निर्यातको योजना बनाएको अर्घाखाँची सिमेन्ट अहिले निर्यात कार्यविधिको पर्खाइमा छ। सरकारले आर्थिक वर्ष २०७९/८० को बजेटमा निर्यात सम्भावना भएका स्टिल, सिमेन्ट, क्लिंकर, जुत्ता/चप्प...	setopati.com	२ घण्टा अघि	https://l.hamropatro.com/r/https://www.setopati.com/kinmel/business/276676	popular	2
श्रीलङ्का: राष्ट्रपति गोटाबय राजपक्ष सैन्य विमानमा देश छोडेर भागे	श्रीलङ्कामा चरम आर्थिक सङ्कटका कारण आक्रोशित मानिसहरूले विरोध प्रदर्शन गरिरहेका बेला श्रीलङ्काका राष्ट्रपति गोटाबय राजपक्ष देश छोडेर अन्यत्र गएका छन्। देश छोड्दा उनले सेनाको विमान प्रयोग गरेका छन्।...	bbc.com	५१ मिनेट अघि	https://l.hamropatro.com/r/https://www.bbc.com/nepali/news-62145391?xtor=AL-73-[partner]-[hamro.patro]-[headline]-[nepali]-[bizdev]-[isapi]	popular	0
ओली, प्रचण्ड र माधवलाई चीनको नरम दबाव : मिल्नोस् तर हस्तक्षेप गर्दैनौं	चीनले नेपाली कांग्रेससँग ‘रणनीतिक सञ्चार’ बढाउन चाहेको छ : लिउ चिनियाँ कम्युनिस्ट पार्टीका विदेश विभाग प्रमुख लिउ जियान्चाओले नेपालका प्रमुख वामपन्थी शक्तिहरु मिलेर अघि बढेको हेर्ने चीनको चाहना रह...	nepalkhabar.com	११ घण्टा अघि	https://l.hamropatro.com/r/https://nepalkhabar.com/politics/136882-2022-7-12-21-3-50	popular	0
श्रीलंकाको आर्थिक अवस्था कसरी यति खराब भयो ?	२९ असार, काठमाडौं । श्रीलंकाको राजधानी कोलम्बोमा रहेको आफ्नो निवासमा आक्रमण भएपछि श्रीलंकाका राष्ट्रपतिले पदबाट राजीनामा दिन तयार रहेको बताएका छन् । श्रीलंकामा मुद्रास्फीति र खाद्यान्न र तेलको अभा...	onlinekhabar.com	२ घण्टा अघि	https://l.hamropatro.com/r/https://www.onlinekhabar.com/2022/07/1156803	popular	0
हिमालयन र सिभिल बैंकबीच कुरा मिल्यो, बुधबार मर्जरको प्रारम्भिक सम्झौता	२८ असार, काठमाडौं । अन्ततः हिमालयन बैंक लिमिटेडमा सिभिल बैंक लिमिटेड गाभिने भएको छ । मर्जरका लागि गत शुक्रबार तय भएको प्रारम्भिक सम्झौता गर्ने कार्यक्रम भाँडिएपछि हिमालयन र सिभिल बैंक गाभिने सम्भाव...	onlinekhabar.com	१० घण्टा अघि	https://l.hamropatro.com/r/https://www.onlinekhabar.com/2022/07/1156782	popular	2
बालिका बलात्कार गर्ने बालकहरुलाई १२ वर्षसम्म कैदको फैसला	नुवाकोट : बालिका बलात्कार घटनामा नुवाकोटमा अदालतले चार जना बालक दोषी रहेको फैसला गरेको छ। १३ वर्षीया बालिकालाई बलात्कार गरेको कसुरमा विदुर नगरपालिका-१० का १६ वर्षीय,  १४ वर्षीय दुई जना र सूर्यगढी ग...	annapurnapost.com	१२ घण्टा अघि	https://l.hamropatro.com/r/https://annapurnapost.com/news/208296	popular	0
चोभार बन्दरगाहबाट सुरु भयो निर्यात	काठमाडौं । सरकारले औपचारिक उद्घाटन गरेर पनि पूर्ण क्षमतामा सञ्चालनमा ल्याउन नसकेको काठमाडौं उपत्यकामा अवस्थित चोभार सुख्खा बन्दरगाहबाट पहिलोपटक सामान विदेश निर्यात गरिएको छ । चोभार सुख्खा बन्दरगाह...	rajdhanidaily.com	४ घण्टा अघि	https://l.hamropatro.com/r/https://rajdhanidaily.com/id/65945/	popular	2
राजपक्षे परिवारका १८ जना श्रीलंका सरकारमा :  देशको बर्बादीमा कति जिम्मेवार? 	कोलोम्बो- श्रीलंकाको राजनीतिमा परिवारको वर्चस्वको कहानी कुनै नयाँ कुरा होइन। तर, राजपक्षे परिवारले यसलाई नयाँ उचाइमा पुर्‍याइदिए।  कुनै समय श्रीलंकामा भण्डारानायके परिवारको पकड थियो। यो परिवारमा स...	nepallive.com	१ घण्टा अघि	https://l.hamropatro.com/r/https://nepallive.com/story/286204	popular	0
ओइलाउँदै सहर, सम्भाव्यतामा फुल्दै गाउँघर	अचेल देशका सहरको वातावरण हेर्दा धेरै नै प्रदूषित देखिन्छ । देशको राजधानी काठमाडौं सहर विश्वका प्रदूषित सहरमध्ये चौथो नम्बरमा परिसकेको छ । घरबाट उत्पन्न फोहोरको समेत उचित तरिकाले व्यवस्थापन हुन नसक्...	rajdhanidaily.com	३ घण्टा अघि	https://l.hamropatro.com/r/https://rajdhanidaily.com/id/65953/	popular	0
को हुन् एमालेको अर्थ तथा योजना विभाग सदस्य एम.अधिकारी ?	नेकपा एमालेको केन्द्रीय अर्थ तथा योजना विभाग सदस्यमा खोटाङ घर भएका एम. अधिकारीको नाम छ । एमालेले आइतबार जारी गरेको अन्तरपार्टी निर्देशन (अपानि ४) मा नेता घनश्याम भुसाल प्रमुख रहेको ११ सदस्यीय सो वि...	ratopati.com	१२ घण्टा अघि	https://l.hamropatro.com/r/https://ratopati.com/story/251210/2022/7/12/m-adhikari-	popular	0
डा. शेखरको प्रतिवादमा उत्रियो संस्थापन	२८ असार, काठमाडौं । नेपाली कांग्रेसको केन्द्रीय कार्यसमितिमा संस्थापन समूहका नेताहरुले डा. शेखर कोइराला समूहको प्रतिवाद गरेका छन् । होटल–होटलमा भेला गरेर गुट चलाएको, सभापतिको बद्ख्वाइँ गरेको भन्दै ...	onlinekhabar.com	१२ घण्टा अघि	https://l.hamropatro.com/r/https://www.onlinekhabar.com/2022/07/1156741	popular	1
‘भानुभक्तको विवादित पाठ हो घाँसीसँगको भेट’	भानुभक्त आचार्य (१८७१ असार २९–१९२५ असोज ६) कसरी आदिकवि कसरी बने ? उनले नेपाली साहित्यमा दिएको विशिष्ट योगदान के हो ? आदिकवि बनाउनमा कसकसको योगदान छ भनेर खोज्नु भानुजयन्तीको अवसरमा सान्दर्भिक हुन्छ ...	ratopati.com	२ घण्टा अघि	https://l.hamropatro.com/r/https://ratopati.com/story/251242/2022/7/13/bhanubhakta-acharya	popular	2
