श्रीलंकाका राष्ट्रपति राजपक्षे देश छाडेर भागे, सेनाको विमान चढेर लागे पुगे माले	श्रीलंकका राष्ट्रपति गोटावाया राजपक्षे देश छाडेर भागेका छन्। उनी राजीनामा दिएर माध्यराति सेनाको विमानमार्फत माल्दिभ्स भागेको बीबीसीले जनाएको छ। बिहान ३ बजे उनी माल्दिभ्स् पुगेका थिए। उनको राजीनामा...	pahilopost.com	१ घण्टा अघि	https://l.hamropatro.com/r/https://pahilopost.com/content/20220713071728.html	international	0
अमेरिका भाग्न चाहन्थे राजापाक्षे, पाएनन् भीसा	काठमाडौं ।  श्रीलङ्काका राष्ट्रपति गोटाबाया राजापाक्षे मङ्गलवार राती देश छोडेर भागेका छन् ।  गोटाबाया राजपाक्षे श्रीलङ्का छोडेर अमेरिका भाग्न चाहन्थे तर अमेरिकाले उनलाई भीसा दिएन ।  राजापाक्षेसँग ...	hamrakura.com	१ घण्टा अघि	https://l.hamropatro.com/r/https://hamrakura.com/news-details/127968/2022-07-13	international	0
राजपक्षे परिवारका १८ जना श्रीलंका सरकारमा :  देशको बर्बादीमा कति जिम्मेवार? 	कोलोम्बो- श्रीलंकाको राजनीतिमा परिवारको वर्चस्वको कहानी कुनै नयाँ कुरा होइन। तर, राजपक्षे परिवारले यसलाई नयाँ उचाइमा पुर्‍याइदिए।  कुनै समय श्रीलंकामा भण्डारानायके परिवारको पकड थियो। यो परिवारमा स...	nepallive.com	१ घण्टा अघि	https://l.hamropatro.com/r/https://nepallive.com/story/286204	international	0
अन्ततः देश छाडेर भागे श्रीलंकाको राष्ट्रपति	श्रीलंकाका राष्ट्रपति गोटाबाया राजापाक्षले देश छोडेका छन्  । राजापाक्षे स्थानीय समयअनुसार बिहान ३ बजे माल्दिभ्सको राजधानी माले पुगेको बीबीसीले जनाएको छ ।  शनिवार राष्ट्रपति निवासमै पुगेर ठूलो संख...	lokaantar.com	२ घण्टा अघि	https://l.hamropatro.com/r/https://lokaantar.com/story/189772/2022/7/13/international/shreelanka-	international	0
श्रीलंकाका राष्ट्रपति गोटाबाया राजपक्षेले छाडे देश	काठमाडौं- श्रीलंकाका राष्ट्रपति गोटाबाया राजपक्षेले देश छाडेका छन्। उनी मंगलबार राति मालदिभ्स पुगेको बताइएको छ। बुधबार राजीनामा दिने घोषणा गरेका उनी अघिल्लो रात परिवारसहित बाहिरिएका हुन्। उनले  जु...	nepallive.com	२ घण्टा अघि	https://l.hamropatro.com/r/https://nepallive.com/story/286240	international	0
श्रीलंकाको आर्थिक अवस्था कसरी यति खराब भयो ?	२९ असार, काठमाडौं । श्रीलंकाको राजधानी कोलम्बोमा रहेको आफ्नो निवासमा आक्रमण भएपछि श्रीलंकाका राष्ट्रपतिले पदबाट राजीनामा दिन तयार रहेको बताएका छन् । श्रीलंकामा मुद्रास्फीति र खाद्यान्न र तेलको अभा...	onlinekhabar.com	२ घण्टा अघि	https://l.hamropatro.com/r/https://www.onlinekhabar.com/2022/07/1156803	international	0
सैन्य विमान चढेर श्रीलंकाका राष्ट्रपति राजापाक्षेले देश छोडे	श्रीलंकाका राष्ट्रपति गोटाबाया राजापाक्षेले देश छोडेका छन्।  कार्यालय र निवास समेत सर्वसाधारणले कब्जामा लिएपछि श्रीलंकामै लुकेर बसिरहेका राष्ट्रपति राजापाक्षे गएराति सैन्य विमानमा मुलुक छोडेर भागे...	setopati.com	२ घण्टा अघि	https://l.hamropatro.com/r/https://www.setopati.com/politics/276681	international	0
मध्यरातमा देश छोडेर भागे श्रीलंकाका राष्ट्रपति	काठमाडौं । आर्थिक सङ्कट झेलिरहेको श्रीलङ्काका राष्ट्रपति गोटाबाया राजापाक्षे देश छोडेर भागेका छन् । राजापाक्षे मङ्गलवार राती मालदिभ्स भागेको बताइएको छ । गोटाबाया राजापाक्षेले राजीनामा दिनुअघि आफूल...	hamrakura.com	२ घण्टा अघि	https://l.hamropatro.com/r/https://hamrakura.com/news-details/127966/2022-07-13	international	0
श्रीलंकाका राष्ट्रपति गोटाबाय राजापाक्षेले छाडे देश	श्रीलंकाका राष्ट्रपतिले देश छाडेका छन् । श्रीलंकाको आर्थिक संकटलाई लिएर व्यापक प्रदर्शन भइरहेका बेला राष्ट्रपति गोटाबाया राजापाक्षे बुधबार बिहान सेनाको एउटा विमानमा चढेर देश छाडेका छन् ।  ७३ वर्षी...	ratopati.com	२ घण्टा अघि	https://l.hamropatro.com/r/https://ratopati.com/story/251241/2022/7/13/srilanka	international	0
श्रीलंकाका राष्ट्रपति देश छोडेर भागे	काठमाडौँ — श्रीलंकाका राष्ट्रपति गोटाबाया राजापाक्षे देश छोडेर भागेका छन् ।राजापाक्षे परिवारको सत्ता महत्वाकांक्षा र कुशासनका कारण मुलुक आर्थिक टाट पल्टेपछि सरकारविरुद्ध सर्वसाधारण सडकमा उत्रेका छन...	ekantipur.com	२ घण्टा अघि	https://l.hamropatro.com/r/https://ekantipur.com/world/2022/07/13/165767178368898483.html	international	0
श्रीलंकाका राष्ट्रपति राजापाक्षे देश छाडेर भागे	२९ असार, काठमाडौं । श्रीलंकाका राष्ट्रपति गोटाबाया राजपाक्षे देश छाडेर भागेका छन् । प्रदर्शनकारीले राष्ट्रपति निवास कब्जा गरेपछि राष्ट्रपति राजपक्षे केही दिनदेखि देश छाडेर भाग्न प्रयासरत थिए । देश ...	onlinekhabar.com	३ घण्टा अघि	https://l.hamropatro.com/r/https://www.onlinekhabar.com/2022/07/1156790	international	0
ओइलाउँदै सहर, सम्भाव्यतामा फुल्दै गाउँघर	अचेल देशका सहरको वातावरण हेर्दा धेरै नै प्रदूषित देखिन्छ । देशको राजधानी काठमाडौं सहर विश्वका प्रदूषित सहरमध्ये चौथो नम्बरमा परिसकेको छ । घरबाट उत्पन्न फोहोरको समेत उचित तरिकाले व्यवस्थापन हुन नसक्...	rajdhanidaily.com	३ घण्टा अघि	https://l.hamropatro.com/r/https://rajdhanidaily.com/id/65953/	international	0
देशै छाडेर भाग्न खोज्ने राष्ट्रपतिको प्रयास असफल	कोलम्बो । राष्ट्रपति पदबाट बुधबार राजीनामा दिने बताउँदै आएका संकटग्रस्त श्रीलंकाका राष्ट्रपति गोताबाय राजापाक्षेले सोमबार राति नै देश छाडेर दुबई भाग्ने प्रयास गरेको खुलासा भएको छ । यद्यपि, उनको सो...	rajdhanidaily.com	४ घण्टा अघि	https://l.hamropatro.com/r/https://rajdhanidaily.com/id/65947/	international	0
साउथ चाइना सी : चीनलाई अमेरिकाको चेतावनी-फिलिपिन्सको जल क्षेत्रमा आक्रमण भए रक्षा गर्न बाध्य हुन्छौँ 	मनिला । अमेरिकी विदेशमन्त्री एन्टोनी ब्लिन्केनले साउथ चाइना सीका भूभागमाथि बेइजिङको दाबी अवैध ठहर गरिएको सन् २०१६ कोे मध्यस्थता निर्णय पालना गर्न चीनलाई आह्वान गरेका छन् ।  विदेशमन्त्री ब्लिन्केनल...	baahrakhari.com	९ घण्टा अघि	https://l.hamropatro.com/r/https://baahrakhari.com/news-details/357147	international	0
'काम गर्न देऊ' भनेर किन डिलिट गरे मेयर बालेन्द्रले?	काठमाडौं महानगरपालिकाका मेयर बालेन्द्र शाहले सामाजिक सञ्जालमा लेखेको एउटा स्टाटस हटाएका छन्। पछिल्लो समय अनक आलोचना खेपिरहेका मेयर बालेन्द्रले सोमबार राति फेसबुक पेजमा एउटा विचार समेटिएको स्टाटस ल...	nepalkhabar.com	९ घण्टा अघि	https://l.hamropatro.com/r/https://nepalkhabar.com/society/136886-2022-7-12-22-27-59	international	0
नासाले सार्वजनिक गर्‍यो ब्रह्माण्डका थप तस्बिर	काठमाडौँ — अमेरिकी अन्तरिक्ष एजेन्सी नासाले जेम्स वेब स्पेस टेलिस्कोपले खिचेको ब्रह्माण्डको गाढा चहकिलो र स्पष्ट थप तस्बिर मंगलबार सार्वजनिक गरेको छ । ह्वाइट हाउसमा सोमबार आयोजित कार्यक्रममा पहिलो ...	ekantipur.com	१० घण्टा अघि	https://l.hamropatro.com/r/https://ekantipur.com/news/2022/07/12/165764536630114640.html	international	1
आबेको अन्तिम बिदाइमा हजारौंको उपस्थिति	टोकियो — जापानी पूर्वप्रधानमन्त्री सिन्जो आबेको मंगलबार अन्त्येष्टि गरिएको छ । आबेको अन्तिम बिदाइका क्रममा हजारौं जापानी नागरिक राजधानी टोकियोस्थित सडकमा उत्रिएर श्रद्धाञ्जली दिएका छन् । जापानीमाझ ...	ekantipur.com	११ घण्टा अघि	https://l.hamropatro.com/r/https://ekantipur.com/world/2022/07/12/165764213427976958.html	international	1
श्रीलंकाले राष्ट्रपतिका भाइलाई बाहिर जानबाट रोक्यो	bibid श्रीलंकाले राष्ट्रपतिका भाइलाई बाहिर जानबाट रोक्यो Jul 12, 2022 श्रीलंकाका अध्यागमन अधिकारीहरूले मंगलबार उनीहरूले राष्ट्रपतिका भाइ र पूर्व अर्थमन्त्री बासिल राजापाक्षेलाई देशबाट बाहिर जानब...	laganisutra.com	११ घण्टा अघि	https://l.hamropatro.com/r/https://www.laganisutra.com/19924/	international	2
आईएसआईएसका सिरिया प्रमुख अमेरिकी आक्रमणमा मारिए	काठमाडौँ — सशस्त्र विद्रोही समूह स्लामिक स्टेट (आईआईएस)का सिरिया प्रमुख लडाकु नेता अमेरिकाको ड्रोन आक्रमणमा मारिएका छन् । आईआईएसका सिरिया प्रमुख महर अल अगल मंगलबार ड्रोन हमलामा मारिएको अमेरिकी रक्ष...	ekantipur.com	११ घण्टा अघि	https://l.hamropatro.com/r/https://ekantipur.com/world/2022/07/12/165763781436756640.html	international	0
नेपाल फर्काइयो चोरेर अमेरिका लगिएका ७०० वर्ष पुराना टुँडाल	२८ असार, काठमाडौं । काठमाडौंको टेकु नजिकै हृयुमत टोलस्थित नारायण मन्दिरबाट चोरी भएर अमेरिका पुगेका  करिब ७०० वर्ष  पुराना पुरातात्विक टुँडालहरू नेपालमा फर्काइएको छ । १९८०को दशकमा नारायण मन्दिरबाट ह...	onlinekhabar.com	१२ घण्टा अघि	https://l.hamropatro.com/r/https://www.onlinekhabar.com/2022/07/1156744	international	2
अमेरिकाले श्रीलङ्काका राष्ट्रपतिकाे भिसा अनुराेध ‘अस्वीकार गर्‍याे’	अमेरिकाले श्रीलङ्काका राष्ट्रपति गाेटाबाया राजापाक्षेकाे भिसा अनुराेधलाई अस्वीकार गरेकाे छ । देशमा विराेध प्रदर्शन चर्किँदै गएपछि पद छाेड्ने प्रतिबद्धता गरेर देशबाट भाग्ने प्रयास गरेकाे अनुमानका बी...	Ujyaaloonline.com	१२ घण्टा अघि	https://l.hamropatro.com/r/https://ujyaaloonline.com/story/72632/2022/7/12/us-rejects-Gotabaya-Rajapaksa-visa-request	international	0
जापानका पूर्व प्रधानमन्त्री आबेको अन्त्येष्टि	टोकियो, असार २८ : जापानका पूर्व प्रधानमन्त्री सिन्जो आबेको मङ्गलबार अन्त्येष्टि गरिएको छ।   जापानका लोकप्रिय नेता आबेको शुक्रबार चुनावी सभामा भाषण गरिरहेका बेला एक व्यक्तिले गोली प्रहार गरेपछि निध...	kathmandupress.com	१२ घण्टा अघि	https://l.hamropatro.com/r/https://kathmandupress.com/news/70118	international	0
सिंहको एकल चित्रकला प्रदर्शनी	काठमाडौँ, असार २९ गते  ।  कलाकार अक्षरा सिंहको ठमेलस्थित मिथिला यें आर्ट ग्यालरीमा ‘ब्युटी अफ नेचर’ शीर्षकमा पहिलो एकल चित्रकला प्रदर्शनी भइरहेको छ । नेपालका हिमाल, पहाड, रङ्गीबिरङ्गी चरा, मन्दिर...	gorkhapatraonline.com	३१ मिनेट अघि	https://l.hamropatro.com/r/https://gorkhapatraonline.com/news/18743	entertainment	2
४२ कलाकारका चार दर्जनभन्दा  बढी क्यारिकेचर एकै ठाउँमा	४२ जना कलाकारले बनाएका चार दर्जनभन्दा बढी क्यरिकेचरलाई नेपाल ललितकला प्रज्ञा प्रतिष्ठानले एकै ठाउँमा प्रदर्शनीको अवसर जुटाइदिएको छ । नेपाली क्यारिकेचर–०७९’ प्रदर्शनीका नाममा नक्सालस्थित प्रतिष्ठान ...	nayapatrikadaily.com	१ घण्टा अघि	https://l.hamropatro.com/r/https://nayapatrikadaily.com/feed-detail.php?nid=90941	entertainment	0
‘मै मोटी भएनी नाच्छु घुमेर’ सार्वजनिक	गीतकार वीरेन्द्र ढकालको लय तथा शब्द सिर्जनामा निर्माण गरिएको ‘मै मोटी भएनी नाच्छु घुमेर’ बोलको तीजको गीत सार्वजनिक भएको छ ।  तीज पर्व सुरु हुन केही समय बाँकी हुँदा गायिका सुनिता बुढा क्षेत्री र अम...	lokaantar.com	१ घण्टा अघि	https://l.hamropatro.com/r/https://lokaantar.com/story/189775/2022/7/13/music/moti-	entertainment	1
आदिकवि भानुभक्त सामाजिक र सांस्कृतिक जागरणका सशक्त धरोहर : प्रधानमन्त्री देउवा	काठमाडौं : प्रधानमन्त्री शेरबहादुर देउवाले आदिकवि भानुभक्त आचार्य आफ्ना साहित्यिक कृतिका माध्यमबाट नेपाली समाजलाई सत्य, दया, अहिंसा, न्याय, शान्ति र परोपकारका मार्गमा लाग्न तथा आदर्श चरित्र अपनाउन ...	pahilopost.com	२ घण्टा अघि	https://l.hamropatro.com/r/https://pahilopost.com/content/20220713065731.html	entertainment	1
भानुभक्त सामाजिक र सांस्कृतिक जागरणका धरोहर हुन् : प्रधानमन्त्री देउवा	काठमाडौँ – प्रधानमन्त्री शेरबहादुर देउवाले आदिकवि भानुभक्त आचार्य आफ्ना साहित्यिक कृतिका माध्यमबाट नेपाली समाजलाई सत्य, दया, अहिंसा, न्याय, शान्ति र परोपकारका मार्गमा लाग्न तथा आदर्श चरित्र अपनाउन ...	khabarhub.com	२ घण्टा अघि	https://l.hamropatro.com/r/https://www.khabarhub.com/2022/13/409871/	entertainment	1
फिल्म पानीफोटोको ट्रेलर सार्वजनिक	काठमाडौंः खगेन्द्र लामिछानेको डेब्यू निर्देशन रहेको फिल्म ‘पानीफोटो’को ट्रेलर सार्वजनिक भएको छ। मंगलबार काठमाडौंमा आयोजित कार्यक्रमबीच लामिछानेको जन्मदिनको अवसरमा ट्रेलर सार्वजनिक गरिएको हो। २ मिन...	pahilopost.com	११ घण्टा अघि	https://l.hamropatro.com/r/https://pahilopost.com/content/20220712213809.html	entertainment	1
‘चिठी’ को गीतमा शिव परियारको स्वर	काठमाडौं– पोष्ट प्रोडक्सनको अन्तिम चरणमा पुगेको नेपाली फिल्म ‘चिठी’ को एउटा गीतमा गायक शिव परियारले पाश्र्व गायन गरेका छन् । उक्त फिल्मको ‘टुटेको तारा’ बोलको गीत गायक परियारको स्वरमा रेकर्ड भएको छ...	kalakarmi.com	११ घण्टा अघि	https://l.hamropatro.com/r/https://www.kalakarmi.com/kollywood/80851/	entertainment	1
भानुभक्तको जीवनी विषयक भानुभक्तीय रचना वाचन	काठमाडाैं : नेपाल प्रज्ञा–प्रतिष्ठानद्वारा २०९ औँ भानुजयन्तीको अवसरमा ‘भानुभक्तको जीवनी विषयक प्रवचन तथा नयाँ पुस्ताबाट भानुभक्तीय रचना वाचन’ कार्यक्रम आयोजना गरिएकाे छ। प्रज्ञा भवनको देवकोटा सभाक...	thahakhabar.com	१२ घण्टा अघि	https://l.hamropatro.com/r/https://thahakhabar.com/news/157670	entertainment	1
शिव परियारले गाए ‘चिठी’ को गीत	गायक शिव परियारले फिल्म ‘चिठी’ का लागि गीत गाएका छन् । उनले फिल्मको ‘टुटेको तारा’ बोलको गीत सोमबार साँझ आफ्नो स्वरमा रेकर्ड गराएका हुन् । गीतमा डा. कृष्णहरि बरालको शब्द, गायक एवं संगीतकार सरोज कोइर...	ratopati.com	१४ घण्टा अघि	https://l.hamropatro.com/r/https://ratopati.com/story/251194/2022/7/12/shiv-pariyar-	entertainment	1
