सामुदायिक विद्यालयका विद्यार्थीलाई छात्रवृत्ति	शिक्षा, विज्ञान तथा प्रविधि मन्त्रालयले छात्रवृत्ति प्राप्त गरेका विद्यार्थीको नाम सार्वजनिक गरेको छ । शिक्षा तथा मानव स्रोत विकास केन्द्रले विपन्न लक्षित छात्रवृत्ति पाउन योग्य विद्यार्थीको नाम सा...	janaaastha.com	१५ घण्टा अघि	https://l.hamropatro.com/r/https://www.janaaastha.com/archives/107747	technology	0
भोलिदेखि अनलाइनबाटै मतदाता नामावली दर्ता गर्न सकिने, यस्तो छ व्यवस्था	काठमाडौं । बुधबारबाट मतदाता नामावली अनलाइनबाटै दर्ता गर्न सकिने भएको छ । निर्वाचन आयोगले ‘भोटर लिस्ट रजिस्ट्रेसन’ सिस्टम तयार पारी बुधबारबाट परीक्षणकालीन रूपमा यस्तो सेवा सुरु गर्न लागेको हो । निर...	techpana.com	१५ घण्टा अघि	https://l.hamropatro.com/r/https://www.techpana.com/2022/132481/	technology	1
अब प्रयोगकर्ताले आफूलाई ट्वीटरको थ्रेडबाट अनमेन्सन गर्न सक्ने	अब ट्विटर प्रयोगकर्ताले आफूलाई ट्वीटरको थ्रेडबाट अनमेन्सन गर्न सक्ने भएका छन् । अनमेन्सनले तपाईलाइै प्लेटफर्ममा भईरहेको नचाहिँदो कुराकानीबाट हट्ने अप्सन दिनेछ । अनमेन्सन गरेपछि सो ट्वीटरको थ्रेडमा...	ictsamachar.com	१५ घण्टा अघि	https://l.hamropatro.com/r/https://ictsamachar.com/news-details/11695/2022-07-12	technology	2
साओमीको २०० वाट चार्जर, ८ मिनेटमै फुल चार्ज हुने दावी	काठमाडौं । सन् २०२१ को मे महिनामा साओमीले आफ्नो २०० वाटको वायर चार्जर र १२० वाटको वायरलेस हाइपर चार्जरको घोषणा गरेको थियो । तर, हालसम्म १२० वाटको वायरलेस प्रविधिको बारेमा केही अपडेट भने आएका छैनन् ...	techpana.com	१६ घण्टा अघि	https://l.hamropatro.com/r/https://www.techpana.com/2022/132477/	technology	1
आईओएस १६, म्याकओएस भेन्चुरा र वाचओएस ९ को सार्वजनिक बेटा डाउनलोडका लागि उपलब्ध	एप्पलको आईओएस १६, म्याकओएस भेन्चुरा र वाचओएस ९ को सार्वजनिक बेटा डाउनलोडका लागि उपलब्ध भएको छ । एप्पलको वार्षिक कार्यक्रम विश्वव्यापी डेभलपर कन्फेरेन्स २०२२ मा कम्पनीले यस बारेमा जानकारी दिएको थियो...	ictsamachar.com	१७ घण्टा अघि	https://l.hamropatro.com/r/https://ictsamachar.com/news-details/11692/2022-07-12	technology	1
बढ्दो मोबाइल बैकिङ कारोबारले विस्थापित गर्ला त एटीएमको प्रयोग ?	काठमाडौं । नेपाली उपभोक्ता मोबाइल बैंकिङ कारोबारमा अभ्यस्त हुँदै गइरहेका छन् । कोरोना महामारी पछि ह्वात्तै बढेको मोबाइल बैंकिङ कारोबार हरेक वर्ष दुईदेखि चार गुणाले वृद्धि भइरहेको छ । नेपाल राष्ट्र...	techpana.com	१७ घण्टा अघि	https://l.hamropatro.com/r/https://www.techpana.com/2022/132474/	technology	2
सामसंगले ग्यालेक्सी बड्स टू प्रो वायरलेसमा केही समय देखि काम गर्दै आएको खुलासा	सामसंगले ग्यालेक्सी बड्स टू प्रो वायरलेसमा केही समय देखि काम गर्दै आएको पत्ता लागेको छ । आगामी ग्यालेक्सी बड्स टू प्रो सेतो, ग्रेफाईट र पर्पल रंगमा सार्वजनिक हुनेछ । ग्यालेक्सी बड्स टू प्रोको डिजा...	ictsamachar.com	१९ घण्टा अघि	https://l.hamropatro.com/r/https://ictsamachar.com/news-details/11690/2022-07-12	technology	2
टेलिकमको अन-नेट अनलिमिटेड भोइस कल अफर	काठमाडौं । पोस्टपेड ग्राहक पछि नेपाल टेलिकमले आफ्नो स्प्रिङ अफर अन्तर्गत प्रिपेड प्रयोगकर्ताको लागि पनि नयाँ अफर ल्याएको छ ।  ‘सजिलो अनलिमिटेड प्रिपेड प्याक’ नाम दिइएको यो अफर अन्तर्गत नेपाल टेलिक...	techpana.com	१९ घण्टा अघि	https://l.hamropatro.com/r/https://www.techpana.com/2022/132446/	technology	1
नीमा एकेडेमी ई-लर्निङ्ग एपद्वारा मनसुन अनलाइन एडुफेस्टको तयारी	गुरु पूर्णिमाको अवसर पारी नीमा एकेडेमी बुधबार ई-लर्निङ्ग एपले  शैक्षिक सत्र २०७९ को प्रारम्भिक चरणमा  डिजिटल सिकाईका  अफरहरू सहित  मनसुन अनलाइन एडुफेस्ट गर्ने भएको छ। उक्त ज्ञान मेला डिजिटल माध्यम...	ratopati.com	२० घण्टा अघि	https://l.hamropatro.com/r/https://ratopati.com/story/251106/2022/7/12/neema-academy-	technology	1
एकसाथ दुईवटा मोबाइलमा ह्वाट्सएप चल्ने	काठमाडौं । लोकप्रिय मेसेजिङ एप ह्वाट्सएपमा छिट्टै नै नयाँ फिचर आउने भएको छ । यो फिचर सुरु भएसँगै अब ह्वाट्सएप प्रयोगकर्ताले आफ्नो एउटै अकाउन्ट दुईवटा मोबाइल फोनबाट चलाउन सक्नेछन् । केही समय अगाडि ...	onlinekhabar.com	२० घण्टा अघि	https://l.hamropatro.com/r/https://www.onlinekhabar.com/2022/07/1156372	technology	2
विद्युतीय सवारीको बिक्री ७९ प्रतिशतले वृद्धि, टेस्ला सबैभन्दा अगाडि 	काठमाडौं । टेस्लाको बिक्री बढ्दा सन् २०२२ को पहिलो त्रैमासिकमा विद्युतीय सवारीको ढुवानी ७९ प्रतिशतले बढेर १९ लाख ५० हजार पुगेको छ । बजारको अध्ययन गर्ने कम्पनी ‘काउन्टरपोइन्ट’ का अनुसार बिक्री भएका ...	techpana.com	२० घण्टा अघि	https://l.hamropatro.com/r/https://www.techpana.com/2022/132443/	technology	0
ब्रह्माण्डको पहिलो रङ्गिन तस्बिर सार्वजनिक	काठमाडौं । पहिलोपटक ब्रह्माण्डको रङ्गिन तस्बिर सार्वजनिक भएको छ । अमेरिकी राष्ट्रपति जो बाइडेनलाई ह्वाइटहाउसमा गरिएको ब्रिफ्रिङको क्रममा यो तस्बिर सार्वजनिक गरिएको हो । यो जेम्स वेब स्पेस टेलिस्को...	techpana.com	२१ घण्टा अघि	https://l.hamropatro.com/r/https://www.techpana.com/2022/132439/	technology	1
हाम्रो घरसम्म कसरी आइपुग्छ इन्टरनेट ?	काठमाडौं । आज हामी मोबाइल, ल्यापटप, कम्प्युटरजस्ता डिभाइसमा इन्टरनेट जोडेर विभिन्न कन्टेन्ट हेरिरहेका हुन्छौं । युट्युबमा भिडिओ हेरिरहँदा भिडिओ कसरी तपाईंले प्रयोग गर्ने डिभाइसमा चलिरहेको छ त ? यो ...	techpana.com	२३ घण्टा अघि	https://l.hamropatro.com/r/https://www.techpana.com/2022/132436/	technology	2
सिक्सजी आएपछि स्मार्टफोन प्रयोग गर्नुपर्दैन: नोकिया सीईओ	काठमाडौं । नोकियाका प्रमुख कार्यकारी अधिकृत पेक्का लुन्डमार्कले सिक्सजी व्यावसायिक रूपमा सन् २०३० सम्ममा उपलब्ध भइसक्ने विश्वास गरेका छन् । विश्व आर्थिक फोरम (डब्लूईएफ) २०२२ मा बाेल्दै उनले याे दश...	techpana.com	१ दिन अघि	https://l.hamropatro.com/r/https://www.techpana.com/2022/132404/	technology	0
नेपाल आइपुग्यो टाटाको ‘डार्क एडिसन’ नेक्सन ईभी	काठमाडौं । भारतीय गाडी निर्माता कम्पनी टाटाको नेक्सन ईभीको ‘डार्क एडिसन’ नेपाल आइपुगेको छ । नेपालका लागि टाटा मोटर्सको आधिकारिक बिक्रेता सिप्रदी ट्रेडिङले टाटा नेक्सन ईभी डार्क एडिसनका दुई युनिट गा...	techpana.com	२ दिन अघि	https://l.hamropatro.com/r/https://www.techpana.com/2022/132399/	technology	2
सिभिल बैंक हिमालयनमा बिलय हुदै, मर्जरका लागि प्रारम्भिक सम्झौता आज	काठमाडौं -हिमालयन बैंकले तोकिएको टाइमलाइनमा जवाफ नपठाएपछि भाँडिएको ठानिएको सिभिल बैंकसँगको मर्जर पुनः ब्यूँतिएको छ । हिमालयन बैंकको बोर्ड बैठकले निर्णय गरी मंगलबारजवाफ पठाएसँगै अब सिभिलसँगको मर्जरक...	ajakoartha.com	३ मिनेट अघि	http://l.hamropatro.com/r/http://ajakoartha.com/story/74615	economics	2
आयोजना व्यवस्थापन र पुँजीगत खर्च	सरकार प्रत्येक वर्ष बजेट अनुशासन कायम गर्दै आयोजना व्यवस्थापन प्रणाली सुदृढ गर्ने उद्देश्यका साथ विकास आयोजनामा स्वच्छता, इमानदारी, जवाफदेही र विश्वसनियता अभिवृद्धि गर्न उदार बन्दै लामो समयदेखि कान...	ekantipur.com	४ मिनेट अघि	https://l.hamropatro.com/r/https://ekantipur.com/opinion/2022/07/13/165767588861658105.html	economics	2
रघुगंगाको पुँजीगत खर्च ६७ प्रतिशत	रघुगंगा गाउँपालिकाले आर्थिक वर्ष २०७८/०७९ मा पुँजीगत खर्च ६७ प्रतिशत भएको छ । पँुजीगत शिर्षकमा रहेको १७ करोड २७ लाख ७५ हजार ७०० रुपैयाँँ बजेटमध्ये ११ करोड ६१ लख २३ हजार ९४९ रुपैयाँँ अर्थात् ६७.२ प...	karobardaily.com	९ मिनेट अघि	https://l.hamropatro.com/r/https://www.karobardaily.com/news/193296	economics	0
६१ प्रतिशत मात्र खर्च	बागमती प्रदेशको यातायात तथा पूर्वाधार विकास मन्त्रालयअन्तर्गत रहेको   यातायात पूर्वाधार निर्देशनालय  हेटौँडाले  भौतिक पूर्वाधारको विकास तथा निमार्णको कार्यमा चालु आर्थिक वर्षमा ६१ प्रतिशत मात्र खर्...	lokaantar.com	१० मिनेट अघि	https://l.hamropatro.com/r/https://lokaantar.com/story/189784/2022/7/13/economy/budget-	economics	0
समितिले माग्यो सीसीटीभी फुटेज	काठमाडौँ, असार २९ गते ।   आर्थिक वर्ष २०७९/८० को वार्षिक बजेटमा करको दर हेरफेर गर्न अनधिकृत व्यक्तिको प्रयोग भएको सम्बन्धमा छानबिनका लागि गठित संसदीय विशेष समितिले आवश्यक कागजात अर्थ मन्त्रालयसँग...	gorkhapatraonline.com	१५ मिनेट अघि	https://l.hamropatro.com/r/https://gorkhapatraonline.com/news/18746	economics	1
गभर्नर अधिकारीको अबको बाटोः प्रतिवाद कि नैतिकताका आधारमा राजीनामा ?	नेपाल राष्ट्र बैंकका गभर्नर महाप्रसाद अधिकारी महाप्रसाद अधिकारी एमालेको अर्थ तथा योजना विभागको सदस्य रहेको पुष्टि भएको छ । एमालेको उक्त समितीको सदस्यमा रहेको नाम  एम. अधिकारी भन्ने व्यक्ति नेपाल रा...	arthasansar.com	१८ मिनेट अघि	https://l.hamropatro.com/r/https://arthasansar.com/news/41560	economics	2
बंगुर नबिक्दा किसान चिन्तित	मासुु र पाठापाठी बिक्री नभएपछि धनकुटाका बंगुुरपालक किसान समस्या परेका छन्् । १५ वर्ष वैदेशिक रोजगारीमा गएर गाउँ फर्किएसँगै बंगुर पालन सुरु गरेका धनकुटाको साँगुरीगढी गाउँपालिकाका कृषक देवेन्द्र लिम्...	karobardaily.com	२० मिनेट अघि	https://l.hamropatro.com/r/https://www.karobardaily.com/news/193282	economics	0
बजेटविहीन स्थानीय तहका चुनौती	पछिल्ला दिनहरूमा आम सञ्चारका माध्यम र सामाजिक सञ्जालहरूमा स्थानीय तहको नीति तथा कार्यक्रम र बजेटका विषयमा बाक्लै रूपमा चर्चा भइरहेको छ । असार महिना स्थानीय तहको बजेट पेस हुने र पारित हुनुपर्ने महिन...	karobardaily.com	३२ मिनेट अघि	https://l.hamropatro.com/r/https://www.karobardaily.com/news/193277	economics	1
सगरमाथा इन्स्योरेन्सको तीन अर्ब बीमाशुल्क आम्दानीको लक्ष्य पुरा	काठमाडौं - सगरमाथा इन्स्योरेन्स लिमिटेडले बीमाशुल्क आम्दानीमा करिब १५ प्रतिशतले वृद्धि गर्न सफल भएको छ । चालू आर्थिक वर्षको असार २८ गतेसम्ममा कम्पनीको बीमा शुल्क बापतको आम्दानी तीन अर्ब नाघेको छ । ...	ajakoartha.com	३३ मिनेट अघि	http://l.hamropatro.com/r/http://ajakoartha.com/story/74612	economics	1
१० वस्तुको आयात खुल्छ ?	काठमाडौँ — मुद्रा सञ्चिति घटेपछि सरकारले गत वैशाख १३ मा राजपत्रमा सूचना प्रकाशन गरी मदिरा, तास, मोबाइल, टीभी, मोटरसाइकललगायत १० वस्तुको आयातमा बन्देज लगायो । अर्बौं रुपैयाँबराबरका विलासिताका सामान ...	ekantipur.com	३७ मिनेट अघि	https://l.hamropatro.com/r/https://ekantipur.com/business/2022/07/13/165767642834594355.html	economics	1
सडक नपुगेको ठाउँमा सुरुङ !	काठमाडौँ — सडक पहुँच नै नपुगेको ठाउँमा सुरुङ निर्माण गर्न भन्दै सरकारले त्यसको अध्ययनका लागि बजेट छुट्याएको पाइएको छ । सुरुङ बनाउने भनिएका केही ठाउँमा प्रारम्भिक अध्ययनका लागि प्रयोग हुने मेसिन तथा...	ekantipur.com	३८ मिनेट अघि	https://l.hamropatro.com/r/https://ekantipur.com/business/2022/07/13/165767654009943381.html	economics	1
इन्द्रेणी मसरुम फामले आईपीओ निष्कासन गर्ने, बिक्रि प्रबन्धकमा मुक्तिनाथ क्यापिटल चयन	काठमाडौं - इन्द्रेणी मसरुम फाम पब्लिक लिमिटेड कम्पनीले आइपीओ निष्कासन गर्ने भएको छ । यससँगै कम्पनीले बिक्रि प्रबन्धकको रुपमा मुक्तिनाथ क्यापिटल लिमिटेडलाई चयन गरेको हो । कम्पनीले बिक्रि प्रबन्धक च...	ajakoartha.com	३९ मिनेट अघि	http://l.hamropatro.com/r/http://ajakoartha.com/story/74611	economics	1
‘विदेशी मुद्रामा नेपाली बैंकमा खाता’	काठमाडौं: ग्लोबल आईएमई बैंकले नेपाली बैंकमा विदेशी मुद्रामा खाता खोल्ने सुविधाका विषयमा बेलायतको लन्डनमा बृहत् अन्तरक्रिया गरेको छ। अन्तरक्रियामा नेपाल राष्ट्र बैंकले विदेशमा रहने नेपालीलाई लक्षित...	annapurnapost.com	४३ मिनेट अघि	https://l.hamropatro.com/r/https://annapurnapost.com/news/208306	economics	2
आजबाट निष्कासनमा आयो राप्ती हाइड्रोको आईपीओ, कति कित्ता ?	काठमाडौं - राप्ती हाइड्रो एण्ड जनरल कन्स्ट्रक्सन लिमिटेडले आजदेखि आईपीओ निष्काशन गर्ने भएको छ। कम्पनीले सर्वसाधारणका लागि आईपीओ निष्काशन गर्न लागेको हो । कम्पनीले आयोजना प्रभावित क्षेत्रका बासिन्द...	ajakoartha.com	५१ मिनेट अघि	http://l.hamropatro.com/r/http://ajakoartha.com/story/74610	economics	1
विगतको भन्दा ९.४२ प्रतिशत कम खर्च	बुटवल, असार २९ गते ।   लुम्बिनी प्रदेश सरकारले चालू आर्थिक वर्षमा ७४.५८ प्रतिशत मात्र बजेट खर्च गर्न सफल भएको छ । यो अघिल्लो आर्थिक वर्षभन्दा ९.४२ प्रतिशत कम खर्च हो ।  लुम्बिनी प्रदेश कोष तथा ल...	gorkhapatraonline.com	५२ मिनेट अघि	https://l.hamropatro.com/r/https://gorkhapatraonline.com/news/18739	economics	0
सर्वसाधारणका लागि राप्ती हाइड्रोको आइपीओ आजबाट जारी हुँदै	Hydro सर्वसाधारणका लागि राप्ती हाइड्रोको आइपीओ आजबाट जारी हुँदै Jul 13, 2022 राप्ती हाइड्रो एन्ड जनरल कन्स्ट्रक्सनको आइपीओ आज असार २९ गतेबाट निष्कासन हुँदै छ | यस कम्पनीले सर्वसाधारणका लागि २३ क...	laganisutra.com	१ घण्टा अघि	https://l.hamropatro.com/r/https://www.laganisutra.com/19930/	economics	0
हस्तकला निकासी ८० प्रतिशतले बढ्यो	कोभिड महामारीका कारण संकटमा परेको हस्तकला व्यवसाय विस्तारै लयमा फर्कन थालेको छ । हस्तकला व्यवसायीहरूका अनुसार काठमाडौं उपत्यकाभित्रका विभिन्न ‘हस्तकला हब’हरूमा पहिलेकै रौनक देख्न थालिएको छ । हस्तकल...	karobardaily.com	१ घण्टा अघि	https://l.hamropatro.com/r/https://www.karobardaily.com/news/193261	economics	0
