भानुकला केन्द्रले गर्याे स्रष्टा सम्मान	विराटनगरस्थित भानुकला केन्द्रले विभिन्न क्षेत्रमा योगदान पुर्याउने व्यक्तिहरुलाई सम्मान गरेको छ । आदिकवि भानुभक्त आचार्यको २०९औँ जन्मजयन्तीको अवसर पारेर भाषा, साहित्य, कला, संंस्कृति र पत्रकारिता क...	farakdhar.com	१४ घण्टा अघि	https://l.hamropatro.com/r/https://farakdhar.com/story/89810	literature	2
सिटौला आमाछोराको पुस्तक एकैपटक विमोचन	काठमाडौं । सिटौला आमाछोराको पुस्तक एकैपटक विमोचन भएको छ । आमा मनमाया सिटौलाले लेखेको ‘मैले बिताएको युग’ आत्मकथा र छोरा कवीन्द्र सिटौला ‘जिज्ञासु’ ले लेखेको पुस्तक ‘हृदयका स्पन्दनहरु’ कवितासङ्ग्रहको...	hamrakura.com	४ दिन अघि	https://l.hamropatro.com/r/https://hamrakura.com/news-details/127726/2022-07-09	literature	1
‘सामाजिक सञ्जालको साहित्य भन्न नमिल्ला’	कवि मोहित जोशी पछिल्लो पुस्ताका कवि हुन्। धनगढीमा जन्मेर काठमाडौँमा सिभिल इन्जिनियरिङ सकेका जोशीले कुनै पुस्तक प्रकाशन नगरे पनि उनी सामाजिक सञ्जालमा चर्चित छन्। राजधानी र राजधानी बाहिरका विभिन्न स...	nepalkhabar.com	४ दिन अघि	https://l.hamropatro.com/r/https://nepalkhabar.com/literature/136571-2022-7-9-12-46-37	literature	2
‘बसाइँ’ लाई पनि उपन्यास भनी पढ्यौं	पाँच दशकदेखि कथा, कविता, उपन्यास, निबन्ध र नाटकमा विशिष्ट उपस्थिति देखाउने राजव बीस वर्षयता अमेरिकामा छन् । र, नेपाली साहित्यलाई निरन्तर आख्यानका नयाँ–नयाँ पुस्तक दिइरहेका छन् । जहाँ जान्छन्, त्यही...	ekantipur.com	४ दिन अघि	https://l.hamropatro.com/r/https://ekantipur.com/koseli/2022/07/09/165734055140711679.html	literature	1
उपत्यकाकाे प्राचीन जल व्यवस्थापन प्रणाली : 'हिति प्रणाली' विमोचन	काठमाडाै‌ं : पब्लिकेशन नेपालयले प्राचीन हिति प्रणालीमाथि लेखिएको पद्मसुन्दर जोशीको बृहत् अनुसन्धनात्मक कृति ‘हिति प्रणाली’ प्रकाशित गरेको छ। ललितपुर महानगरपालिकाले आयोजना गरेको एक कार्यक्रममा काठमा...	thahakhabar.com	६ दिन अघि	https://l.hamropatro.com/r/https://thahakhabar.com/news/157307	literature	1
पद्मसुन्दर जोशीको अनुसन्धानात्मक पुस्तक ‘हिति प्रणाली’ सार्वजनिक	काठमाडौं । लेखक पद्मसुन्दर जोशीको अनुसन्धानात्मक कृति ‘हिति प्रणाली’ सार्वजनिक भएको छ । ललितपुर महानगरपालिकाले आयोजना गरेको कार्यक्रममा मेयर चिरीबाबु महर्जन र नेपाल विज्ञान तथा प्रविधि प्रतिष्ठानका...	onlinekhabar.com	६ दिन अघि	https://l.hamropatro.com/r/https://www.onlinekhabar.com/2022/07/1154049	literature	1
पद्मसुन्दर जोशीको ‘हिति प्रणाली’ प्रकाशित	काठमाडौँ- पद्मसुन्दर जोशीले प्राचीन हिति प्रणालीमाथि लेखिएको बृहत् अनुसन्धनात्मक कृति ‘हिति प्रणाली’ प्रकाशन भएको छ। ललितपुर महानगरपालिकाको आयोजनामा गरिएको एक कार्यक्रमबीच पुस्तक विमोचन गरिएको हो।...	deshsanchar.com	७ दिन अघि	https://l.hamropatro.com/r/https://deshsanchar.com/2022/07/06/675891/	literature	1
‘सार्दुलका सागर’ कविता संग्रह विमोचन	सूर्यकुमार पण्डितको ‘सार्दुलका सागर’ नामक कविता संग्रह हालै विमोचन भएको छ । अनुपम साहित्य सिर्जना प्रतिष्ठानद्वारा आयोजित कार्यक्रममा मन्जुश्री साहित्यिक समाजका अध्यक्ष डाबमबहादुर जितालीले पुस्तकको...	ratopati.com	७ दिन अघि	https://l.hamropatro.com/r/https://ratopati.com/story/249890/2022/7/6/book-lunch	literature	1
को हो लेखक ?	एउटा सानो रचना पूरा भयो, मानौं एउटा सन्तान पैदा भयो । प्रकाशित भयो, पाठक रम्यो, लेखक पनि रमायो । कसैले मन पराएन, सुन्दर मानेन या वास्तै गरेन भने पनि आप्mनो रचना आफूलाई प्यारो लाग्छ । अरूले असुन्दर ...	rajdhanidaily.com	७ दिन अघि	https://l.hamropatro.com/r/https://rajdhanidaily.com/id/65556/	literature	1
निर्दोष जीवनको ‘नोस्टाल्जिया’ सार्वजनिक	काठमाडौं । आख्यानकार निर्दोष जीवनको उपन्यास ‘नोस्टाल्जिया’ विमोचन भएको छ । वरिष्ठ कवि एवम् साहित्यकार गोविन्दराज विनोदी, एलबी क्षेत्री, नीलम कार्की निहारिका, सिर्जन अविरल र जयराज रेग्मी मगरले पुस्त...	lokpath.com	१० दिन अघि	https://l.hamropatro.com/r/https://www.lokpath.com/story/551584	literature	2
नेपाल समाचारपत्रकर्मी तिमल्सिना सम्मानित	काठमाडौं ।  सूचक प्रकाशनले आफ्नो १५ औं वार्षिकोत्सवको अवसरमा वरिष्ठ साहित्यकार मोहन दुवाल, साहित्यकार धु्रव अधिकर्मी, साहित्यकार हरि मञ्जुश्री, समाजसेवी शंकर खड्काका साथै नेपाल समाचारपत्रकर्मी भगव...	newsofnepal.com	१० दिन अघि	https://l.hamropatro.com/r/https://www.newsofnepal.com/2022/07/03/510911/	literature	2
ध्रुवचन्द्रको २८ औं उपन्यास ‘सातो’ सार्वजनिक	काठमाडौँ — उपन्यासकार ध्रुवचन्द्र गौतमको नयाँ उपन्यास ‘सातो’ प्रकाशनमा आएको छ । शुक्रबार नेपाल प्रज्ञा प्रतिष्ठानमा आयोजित समारोहमा उपकुलपति जगमान गुरुङले ‘सातो’ विमोचन गरेका थिए । लेखनमा ‘आविष्का...	ekantipur.com	११ दिन अघि	https://l.hamropatro.com/r/https://ekantipur.com/literature/2022/07/02/165674167540887565.html	literature	1
लीलाध्वज थापा साहित्य सम्मान तथा पुरस्कार प्राद्यापक शर्मालाई	काठमाडौँ– लीलाध्वज थापा साहित्य प्रतिष्ठानले यो वर्षको लीलाध्वज थापा साहित्य सम्मान तथा पुरस्कार प्राध्यापक गोपीकृष्ण शर्मालाई प्रदान गर्ने भएको छ ।	khabarhub.com	१३ दिन अघि	https://l.hamropatro.com/r/https://www.khabarhub.com/2022/29/404676/	literature	2
मालामा नउनिएका फूलहरू उन्दा	शिखा बुक्सले २०७८ सालमा डा. खगराज बरालको अनुभूति सङ्ग्रह ‘मालामा नउनिएका फूलहरू’ बजारमा ल्याएको थियो । यस कृतिमा लेखकका व्यक्तिगत अनुभव, भोगाइका सन्दर्भमा अटाएका विभिन्न विषयहरू बीसवटा शीर्षकमा सँग...	merolifestyle.com	१४ दिन अघि	https://l.hamropatro.com/r/https://www.merolifestyle.com/archives/47703	literature	2
चित्रपुस्तक ‘रमाइलो सपना’मा चलाख मुडुले केटोको कथा	मुस्तफा रुही सिरिनको लेखन र सेरप डेलिओर्मानको चित्रांकनमा रहेको पुस्तक 'रमाइलो सपना' प्रकाशित भएको छ ।  सिरिन टर्कीस लेखक तथा पत्रकार हुन् । उनको दुई चित्रकथा नेपाली भाषामा प्रकाशन गरिएको छ ।  चि...	lokaantar.com	१४ दिन अघि	https://l.hamropatro.com/r/https://lokaantar.com/story/188236/2022/6/29/literature/ramailo-sapana-	literature	2
पद्मश्री साहित्य पुरस्कार : १५ कृतिको विस्तारित सूची सार्वजनिक	काठमाडौँ — खेमलाल हरिकला लामिछाने समाज कल्याण प्रतिष्ठानले २०७८ सालको पद्मश्री साहित्य पुरस्कारका लागि १५ कृतिहरु छनोट गरेको छ ।  प्रतिष्ठानले मंगलबार विज्ञप्ति जारी गर्दै २०७८ को वर्षभरीमा प्रकाश...	ekantipur.com	१४ दिन अघि	https://l.hamropatro.com/r/https://ekantipur.com/literature/2022/06/29/165647959156589815.html	literature	2
लोकराज भट्टको ‘छाइल’ पद्मश्री पुरस्कारको उत्कृष्ट १५ भित्र अटाउन सफल	युवा कवि लोकराज भट्टको उपन्यास ‘छाइल’ पद्मश्री साहित्य पुरस्कारका लागि उत्कृष्ट १५ भित्र अटाउन सफल भएको छ । खेमलाल हरिकला लामिछाने समाज कल्याण प्रतिष्ठानले ०७८ मा प्रकाशित पुस्तकमध्ये प्रतिष्ठानलाई...	farakdhar.com	१४ दिन अघि	https://l.hamropatro.com/r/https://farakdhar.com/story/88517	literature	2
पद्मश्री साहित्य पुरस्कारका लागि १५ पुस्तक	काठमाडौं । पद्मश्री साहित्य पुरस्कारका लागि १५ पुस्तक छनोटमा परेको खेमलाल–हरिकला समाज कल्याण प्रतिष्ठानले जनाएको छ । प्रतिष्ठानले वि सं २०६३ देखि नेपाली साहित्यमा वर्षभरि प्रकाशित पुस्तकहरुमध्ये नि...	rajdhanidaily.com	१४ दिन अघि	https://l.hamropatro.com/r/https://rajdhanidaily.com/id/65146/	literature	2
राजेन्द्रभक्तको ‘स्मृतिका बाछिटाहरू’ लोकार्पण	काठमाडौं । राजेन्द्रभक्त जोन्छेको ‘स्मृतिका बाछिटाहरू’ शीर्षकको कविता सङ्ग्रह एक कार्यक्रमबीच लोकार्पण गरिएको छ । प्रमुख अतिथि वरिष्ठ साहित्यकार तथा राजनीतिज्ञ तिलक प्रकाशले कृति लोकार्पण गर्दै क...	newsofnepal.com	१५ दिन अघि	https://l.hamropatro.com/r/https://www.newsofnepal.com/2022/06/28/509736/	literature	2
कवि धामीको ‘एटलान्टिक’ एमेजनबाट प्रकाशित	काठमाडौँ — दार्चुलामा जन्मे-हुर्केका कवि किसनसिंह धामीको अंग्रेजी कविता संग्रह ‘एटलान्टिक’ अमेरिकी प्रकाशन गृह एमेजनबाट प्रकाशित भएको छ । कवि धामीको कृतिको हालै काठमाडौंमा विमोचन भएको छ । एक दशकयत...	ekantipur.com	१६ दिन अघि	https://l.hamropatro.com/r/https://ekantipur.com/literature/2022/06/27/165631476012134708.html	literature	1
विशिष्ठ ९ व्यक्तिका जीवन कथा समेटिएको ‘कर्मठ नेपाली’ सार्वजनिक	काठमाडौं । वी रिड प्रकाशनले विविध क्षेत्रमा योगदान पुर्याएका व्यक्तित्वहरूको जीवनी समेटेको पुस्तक ‘कर्मठ नेपाली’ सार्वजनिक गरेको छ ।  विगत केही वर्षदेखि निरन्त रुपमा साहित्यिक कृतिहरु प्रकाशन गर्द...	hamrakura.com	१७ दिन अघि	https://l.hamropatro.com/r/https://hamrakura.com/news-details/126832/2022-06-26	literature	2
कवि मुक्तान थेबाको कविताकृति ‘मासिन्या’ सार्वजनिक	काठमाडौं- कवि मुक्तान थेबाको कविताकृति ‘मासिन्या’ सार्वजनिक भएको छ। काठमाडौं खुसिबुमा भएको कार्यक्रममा तामाङ संस्कृतिअनुसार ‘ठोङ्सेङ’ गरेर कृतिको विमोचन गरिएको थियो। त्यसअघि ताम्बाहरूले स्वागत गरे...	nepallive.com	१७ दिन अघि	https://l.hamropatro.com/r/https://nepallive.com/story/284879	literature	1
नारी पुरस्कार तथा सम्मान प्रदान	नारी साहित्य प्रतिष्ठान नेपालद्वारा प्रदान गरिने ‘गोमा स्मृति सम्मान’ यस वर्षका लागि साहित्यकार डा बेञ्जु शर्मालाई प्रदान गरिएको छ । नारी साहित्य प्रतिष्ठानको वार्षिकोत्सवका अवसरमा सो प्रतिष्ठानद्व...	ratopati.com	१७ दिन अघि	https://l.hamropatro.com/r/https://ratopati.com/story/247798/2022/6/26/news-	literature	2
किताब नपढी  निदाउनै सक्दिनँ 	मैले पछिल्लो समय पढेको किताब ‘भोल्गादेखि गङ्गासम्म’ हो । लेखकको नाम ठ्याक्कै याद भएन । यो विदेशी किताब हो, जसलाई हेमराज अधिकारीले नेपालीमा अनुवाद गर्नुभएको हो । किताबमा मानवजातिको उत्पत्ति र सभ्यता...	nayapatrikadaily.com	१७ दिन अघि	https://l.hamropatro.com/r/https://nayapatrikadaily.com/feed-detail.php?nid=89486	literature	0
एपेन्डिसाइटिसको बढ्दो समस्या, जोखिम र उपचार विधि	पछिल्लो समय एपेन्डिसाइटिसको समस्या बढ्दै गएको छ। एकपछि अर्को गरेर बढ्दै गएको एपेन्डिसाइटिसको समस्या भित्रभित्रै मानिसको स्वास्थ्यको लागि जोखिम निम्त्याउने विषय पनि हो। तर, आम मानिसमा एपेन्डिसाइटिसब...	khabarhub.com	१ घण्टा अघि	https://l.hamropatro.com/r/https://www.khabarhub.com/2022/13/409842/	health	0
कोभिड संक्रमणदर पाँच प्रतिशतमाथि, अर्को लहरको जोखिम 	कोभिडले घटायो मान्छेको आयु  १ असारमा ०.६४ प्रतिशत रहेको कोभिडको दैनिक संक्रमणदर बढेर पाँच प्रतिशतभन्दा माथि पुगेको छ । सोमबार ५.५६ प्रतिशत रहेको संक्रमणदर मंगलबार बढेर ५.६६ प्रतिशत पुगेको छ । स्व...	nayapatrikadaily.com	२ घण्टा अघि	https://l.hamropatro.com/r/https://nayapatrikadaily.com/feed-detail.php?nid=90938	health	0
प्रादेशिक अस्पतालमा प्लास्टिक सर्जरी	बुटवल, असार २९ गते ।   बुटवलस्थित प्रादेशिक अस्पताल लुम्बिनीले प्लास्टिक सर्जरी सेवा सुरु गरेको छ । यो अस्पतालमा अबदेखि आगोले पोलेको, अनुहारको दाग, खत, कोठी, गिर्खा, ओठ फाटेको, अनुहार र हातखुट्टा...	gorkhapatraonline.com	२ घण्टा अघि	https://l.hamropatro.com/r/https://gorkhapatraonline.com/news/18731	health	0
क्यान्सर र मानव अङ्ग अस्पताललाई गुणस्तरीय सेवा दिन स्वास्थ्य राज्यमन्त्रीको केसीको निर्देशन	भक्तपुर– स्वास्थ्य तथा जनसङ्ख्या राज्यमन्त्री हीराचन्द्र केसीले बिरामीमैत्री वातावरणमा सेवा प्रवाह गर्न भक्तपुरका अस्पतालहरुलाई निर्देशन दिएका छन् ।	khabarhub.com	३ घण्टा अघि	https://l.hamropatro.com/r/https://www.khabarhub.com/2022/12/409830/	health	2
झण्डै ८ प्रतिशत पुग्यो कोरोना संक्रमणदर, अस्पतालमा बिरामीको चाप	काठमाडौंको वीर अस्पतालमा ४ दिन अघिसम्म कोरोनाका बिरामी नभएर कोभिड वार्ड बन्द जस्तै थियो । तर अहिले यहाँ २ जनालाइ एचडीयुमा भर्ना गरिएको छ । अस्पतालमा कोभिड परीक्षण गर्न आउने मध्ये धेरैलाई संक्रमण दे...	nepalghatana.com	१० घण्टा अघि	https://l.hamropatro.com/r/https://www.nepalghatana.com/news/108339/	health	0
नेपालमा एकैदिन थपिए १७७ जना कोरोना संक्रमित	काठमाडौं । नेपालमा पछिल्लो २४ घण्टामा १ सय ७७ जनामा कोरोना संक्रमण पुष्टि भएको छ । देशभर १ हजार ८ सय ५ पिसिआर परीक्षण गर्दा १ सय ४४ जना र १ हजार ३ सय २१ एन्टीजेन परीक्षणका क्रममा ३३ जनामा कोरोना स...	rajdhanidaily.com	१३ घण्टा अघि	https://l.hamropatro.com/r/https://rajdhanidaily.com/id/65935/	health	0
सनराइज बैंकको निःशुल्क स्तन तथा पाठेघर चेकजाँच शिविर सम्पन्न	सनराइज बैंकको भक्तपुर शाखाले स्तन क्यान्सर तथा पाठेघरको मुखको क्यान्सरबारे जनचेतना अभिवृद्धि कार्यक्रम र निःशुल्क स्वास्थ्य परीक्षण शिविर आयोजना गरेको छ। बैंकले आफ्नो संस्थागत सामाजिक उत्तरदायित्व...	setopati.com	१४ घण्टा अघि	https://l.hamropatro.com/r/https://www.setopati.com/kinmel/banking/276663	health	2
२४ घण्टामा थप १७७ जनामा कोरोना पुष्टि	काठमाडौं । नेपालमा पछिल्लो २४ घण्टामा थप १ सय ७७ जनामा कोरोना संक्रमण पुष्टि भएको छ । देशभर गरिएको १ हजार ८ सय ५ पीसीआर परीक्षणका क्रममा १ सय ४४ जना र १ हजार ३ सय २१ एन्टीजेन परिक्षणका क्रममा ३३ ज...	nepalpress.com	१४ घण्टा अघि	https://l.hamropatro.com/r/https://www.nepalpress.com/2022/07/12/211872/	health	0
समाजका संवेदनशील मुद्दाहरु छुटिरहेका छन्	काठमाडौँ — म पनि मधेशी महिला हुँ । म ब्राहमण समुदायको भए पनि बसोबास गर्ने ठाउँमा दलित महिला हुनुहुन्छ, जनजाति, मुस्लिम पनि हुनुहुन्छ । विगतमा सबै महिलाको समस्या उस्तै थियो, सबैले घुम्टो राख्थे । खु...	ekantipur.com	१५ घण्टा अघि	https://l.hamropatro.com/r/https://ekantipur.com/madhesh-manthan/2022/07/12/165761158242343976.html	health	0
